filename,county,relevant_date,date,year,document_type_clean,primary_topic_clean,secondary_topics_clean,ideology,is_progressive,is_traditional,ideology_score,ideological_orientation_clean,confidence_level_clean,progressive_indicators_clean,traditional_indicators_clean,extensive_margin_impact_clean,extensive_margin_direction_clean,extensive_lenient,extensive_punitive,intensive_margin_impact_clean,intensive_margin_direction_clean,intensive_lenient,intensive_punitive,supports_diversion_clean,supports_alternatives_clean,position_on_enhancements_clean,position_on_three_strikes_clean,position_on_bail_clean,position_on_juvenile_transfer_clean,racial_justice_emphasis_clean,da_administration_clean,office_wide_policy_clean,policy_change_clean,mandates_vs_guidance_clean,summary,key_quotes
2021_Calaveras County_Defense Attorney Report.pdf,Calaveras County,01/01/2021,2021-01-01,2021.0,other,administrative,['case_management'],unclear,0,0,,unclear,high,[],[],not_applicable,not_applicable,0,0,not_applicable,not_applicable,0,0,not_addressed,not_addressed,not_addressed,not_addressed,not_addressed,not_addressed,not_addressed,not_mentioned,no,unclear,informational,"This document is a Defense Attorney Report from Calaveras County dated October 1, 2021, covering cases from February 22 to September 7, 2021. It is purely administrative, listing defense attorney assignments to specific cases with file numbers, cause numbers, and issue dates. The document contains no prosecutorial policy content, ideological positions, or guidance that would inform analysis of prosecutorial orientation or criminal justice policy positions.","['This document contains only administrative data with case numbers, attorney names, and dates - no policy content to quote.']"
2020.09.08_Los Angeles County_Parole Periods and Prison Closures (with CDCR Demographics Data).pdf,Los Angeles County,09/08/2020,2020-09-08,2020.0,policy_memo,sentencing,"['enhancements', 'juvenile', 'racial_justice', 'case_law_update']",clearly_progressive,1,0,2.0,clearly_progressive,high,"['Comprehensive resentencing for 20,000-30,000 cases', 'Elimination of sentence enhancements', 'Support for early parole release', ""Explicit racial justice focus - '93% of people sent to prison from Los Angeles County are Black people and people of color'"", ""Use of humanizing language - avoiding 'dehumanizing language such as inmate, prisoner, criminal'"", 'Opposition to juvenile transfer to adult court', 'Restorative justice emphasis', 'Critique of mass incarceration as racist system']","['Maintains victim notification requirements', ""Allows opposition in cases with 'compelling and imminent public safety concerns'""]",low_impact,neutral,0,0,high_impact,more_lenient,1,0,not_addressed,yes,minimize,reform_oriented,not_addressed,opposes_transfer,high,George Gascón,yes,clearly_new_policy,mandatory,"This document contains two memos: an informational memo about state law changes to parole periods, and a comprehensive policy directive from DA George Gascón mandating dramatic reforms to resentencing practices. The Gascón memo establishes a clearly progressive agenda, calling for resentencing review of 20,000-30,000 cases, elimination of sentence enhancements, support for early parole, and explicit focus on addressing racial disparities in the criminal justice system. The directive represents a fundamental shift from traditional prosecutorial approaches, framing mass incarceration as a racist system requiring comprehensive reform.","[{'quote': 'Justice demands that the thousands of people currently serving prison terms imposed in Los Angeles County under earlier, outdated policies, are also entitled to the benefit of these new policies.', 'margin_type': 'intensive', 'significance': 'Establishes rationale for comprehensive resentencing'}, {'quote': 'Almost 93% of people sent to prison from Los Angeles County are Black people and people of color... We can no longer deny that our system of hyper-criminalization and incarceration is anything other than racist.', 'margin_type': 'intensive', 'significance': 'Explicit racial justice framing of criminal justice system'}, {'quote': 'The sentences we impose in this country, in this state, and in Los Angeles County are far too long... sentences that are longer than those of any comparable nation.', 'margin_type': 'intensive', 'significance': 'Fundamental critique of current sentencing practices'}]"
2017.03.28_Siskiyou County_SCDA Parole Hearing recommendations.pdf,Siskiyou County,03/28/2017,2017-03-28,2017.0,case_guidance,sentencing,"['parole_opposition', 'victim_services', 'public_safety']",clearly_traditional,0,1,-2.0,clearly_traditional,high,[],"['consistent opposition to parole releases', 'emphasis on public safety over rehabilitation', ""tough-on-crime rhetoric about 'unreasonable risk of danger'"", 'victim-centered focus', 'skepticism of inmate rehabilitation claims', 'emphasis on severity of original crimes', 'calls for maximum incarceration periods']",not_applicable,not_applicable,0,0,high_impact,more_punitive,0,1,not_addressed,no,not_addressed,not_addressed,not_addressed,not_addressed,not_addressed,J. Kirk Andrus,yes,continuation,strong_guidance,"These documents consist of multiple letters from the Siskiyou County District Attorney's office to parole boards opposing the release of various life inmates. The DA's office consistently argues that inmates pose unreasonable risks to public safety, questions the authenticity of their rehabilitation efforts, and emphasizes the severity of their original crimes. The approach reflects a traditional prosecutorial philosophy prioritizing public safety and punishment over rehabilitation, with systematic opposition to parole releases regardless of individual circumstances or institutional progress.","[{'quote': 'The Siskiyou County Office of District Attorney opposes the grant of parole to inmate William Broderick on the ground that he continues to pose an unreasonable risk of danger to society.', 'margin_type': 'intensive', 'significance': 'Demonstrates consistent opposition to parole based on public safety concerns'}, {'quote': 'He has become institutionalized, not transformed. All that has changed is that time has gone by, and the inmate has learned to conform some of his answers to the criticisms made by the commissioners at his last hearing.', 'margin_type': 'intensive', 'significance': 'Shows skepticism toward rehabilitation and inmate change'}, {'quote': ""If we are to believe that he has made the massive transformation that he must to earn a place outside the prison's walls, his achievements during the time of incarceration must be equally massive. They have not."", 'margin_type': 'intensive', 'significance': 'Sets extremely high bar for demonstrating rehabilitation and earning release'}]"
2015.01.12_Alameda County_NEW LAWS FOR 2015.pdf,Alameda County,01/12/2015,2015-01-12,2015.0,training_material,case_law_update,"['sentencing', 'enhancements', 'victim_services', 'charging_decisions']",leans_progressive,1,0,1.0,leans_progressive,medium,"['Supportive framing of immigration-friendly sentencing reductions', 'Positive presentation of crack/powder cocaine sentencing equalization', 'Elimination of discriminatory panic defense', 'Removal of mandatory minimum jail time for drug possession', 'Expanded protections for vulnerable victims and witnesses']","['Detailed technical focus on maintaining prosecutorial tools', 'Emphasis on expanded revenge porn prosecutions', 'Focus on protective orders and victim services', 'Neutral presentation without advocating for further reforms']",moderate_impact,more_lenient,1,0,high_impact,more_lenient,1,0,not_addressed,unclear,not_addressed,not_addressed,not_addressed,not_addressed,moderate,not_mentioned,yes,clearly_new_policy,informational,"This training document provides technical guidance on twelve new criminal laws effective in 2015, covering sentencing reforms, victim protections, and procedural changes. The document presents reform-oriented legislation in a neutral-to-positive manner, focusing on practical implementation rather than resistance. Key changes include immigration-friendly sentence reductions, elimination of crack/powder cocaine sentencing disparities, removal of mandatory minimums for drug possession, and expanded protections for vulnerable victims, suggesting an office that adapts pragmatically to progressive legislative reforms.","[{'quote': ""According to the bill's author, this bill was needed because, for immigration purposes, the federal government defines a misdemeanor as a crime punishable for 364 days or less. Thus, noncitizens could suffer immigration consequences attendant to a 'felony' conviction under certain circumstances."", 'margin_type': 'intensive_margin', 'significance': 'Shows supportive framing of reform designed to reduce immigration consequences'}, {'quote': 'AB 2492 eliminated all the language requiring service of 90 days in county jail, either as a complete term or condition of probation.', 'margin_type': 'intensive_margin', 'significance': 'Neutral presentation of elimination of mandatory minimum sentences'}, {'quote': ""AB 2501 amended section 192 to eliminate the possibility that a defendant's 'discovery of, knowledge about, or potential disclosure of the victim's actual or perceived gender, gender identity, gender expression, or sexual orientation' could be viewed as sufficient provocation to reduce a murder charge to voluntary manslaughter."", 'margin_type': 'intensive_margin', 'significance': 'Supportive presentation of law eliminating discriminatory panic defense'}]"
2015.01.20_Alameda County_2015 Laws Competency.pdf,Alameda County,01/20/2015,2015-01-20,2015.0,training_material,case_law_update,"['juvenile', 'mental_health', 'human_trafficking']",leans_progressive,1,0,1.0,leans_progressive,medium,"['Automatic sealing of juvenile records for non-707(b) offenses', 'Relief provisions for human trafficking victims convicted of prostitution', 'Emphasis on mental health treatment over punishment for incompetent defendants', 'Restrictions on detaining minors in secure facilities for truancy violations', 'Expanded diversion and treatment options']","['Increased penalties for soliciting minors (minimum 2 days jail)', 'Expanded wiretap authority for human trafficking cases', 'Continued prosecution focus and procedural guidance']",moderate_impact,more_lenient,1,0,moderate_impact,mixed,0,0,yes,yes,selective,not_addressed,not_addressed,not_addressed,not_addressed,Alameda County District Attorney's Office,unclear,informational,informational,"This document is a training material from the Alameda County DA's Office covering 2015 legislative changes in mental competency, juvenile proceedings, and human trafficking laws. The content reflects a moderately progressive approach, emphasizing treatment over punishment for mentally incompetent defendants, automatic juvenile record sealing for non-serious offenses, and relief mechanisms for human trafficking victims. While maintaining traditional enforcement tools like enhanced penalties for crimes against minors, the overall emphasis is on rehabilitation, treatment, and reducing long-term consequences for certain vulnerable populations.","[{'quote': ""This legislation was sponsored by the Alameda County District Attorney's Office"", 'margin_type': 'extensive_margin', 'relevance': 'Shows office initiative in human trafficking prosecution tools'}, {'quote': 'If the defendant can establish by clear and convincing evidence that that conviction was the result of his or her status as a victim of human trafficking, the court may issue an order that... provides for dismissal and relief from other penalties', 'margin_type': 'extensive_margin', 'relevance': 'Demonstrates support for relief mechanisms for trafficking victims'}, {'quote': 'It requires the court to order a petition dismissed and to seal all records in the custody of the juvenile court pertaining to the dismissed petition if a minor... completes probation under W&I 725... for any offense not listed in W&I 707(b)', 'margin_type': 'extensive_margin', 'relevance': 'Shows support for automatic juvenile record sealing for non-serious offenses'}]"
2015.02.16_Alameda County_VEHICULAR MANSLAUGHTER_GBI.pdf,Alameda County,02/16/2015,2015-02-16,2015.0,training_material,case_law_update,"['enhancements', 'juvenile', 'sentencing']",neutral,0,0,0.0,neutral,high,"['Detailed explanation of enhanced protections for juvenile defendants', 'Emphasis on proper Miranda procedures for minors', 'Recognition that juvenile age must be considered in legal analysis']","['Neutral presentation of Supreme Court ruling limiting prosecutor tools', 'Focus on proper legal procedures rather than policy advocacy', 'Educational format without ideological commentary']",low_impact,neutral,0,0,high_impact,more_lenient,1,0,not_addressed,not_addressed,not_addressed,not_addressed,not_addressed,not_addressed,not_addressed,not_mentioned,yes,informational,informational,"This is a legal training document from the Alameda County DA's office explaining two significant court decisions: People v. Cook, which eliminates great bodily injury enhancements for vehicular manslaughter convictions, and In re Art T., which strengthens Miranda protections for juvenile defendants. The document serves as neutral legal education for prosecutors, explaining how these rulings limit certain prosecutorial tools while requiring enhanced procedural protections for minors. The presentation is objective and focused on legal compliance rather than advocating for any particular prosecutorial philosophy.","[{'quote': 'Subdivision (g) means what it says—great bodily injury enhancements simply do not apply to murder or manslaughter.', 'margin_type': 'intensive_margin', 'significance': 'Establishes mandatory reduction in available sentence enhancements'}, {'quote': ""We find that, as in the custody context addressed in J.D.B., a court should consider a juvenile's age for purposes of analyzing whether the juvenile has unambiguously invoked his or her right to counsel."", 'margin_type': 'extensive_margin', 'significance': 'Provides enhanced protections for juvenile defendants during interrogation'}, {'quote': ""the Legislature's purpose is not to maximize the punishment under any pleading artifice imaginable, but to impose the punishments it established by statute."", 'margin_type': 'intensive_margin', 'significance': 'Supreme Court rejection of maximizing punishment through creative legal interpretations'}]"
2015.03.02_Alameda County_GUN BATTLES II.pdf,Alameda County,03/02/2015,2015-03-02,2015.0,training_material,enhancements,"['charging_decisions', 'case_law_update']",clearly_traditional,0,1,-2.0,clearly_traditional,high,[],"['Enhancement maximization strategies', 'Aggressive charging of all gun battle participants', 'Focus on ensuring maximum penalties cannot be reduced', ""Emphasis on holding all participants 'equally responsible'"", 'Detailed instruction on applying harshest available enhancements']",moderate_impact,more_punitive,0,1,high_impact,more_punitive,0,1,not_addressed,not_addressed,maximize,not_addressed,not_addressed,not_addressed,not_addressed,not_mentioned,yes,unclear,strong_guidance,"This training document instructs Alameda County prosecutors on maximizing criminal liability and enhancements in gun violence cases. It teaches strategies for charging all participants in gun battles with homicide regardless of who fired the fatal shot, and extensively details how to apply the most severe firearm enhancements available under California law. The document represents a traditional tough-on-crime prosecutorial approach focused on ensuring maximum punishment with no discussion of alternatives or mitigation.","[{'quote': 'Because all participants in these gun battles bear some level of responsibility, this P&A series reviews the different theories and principles of homicide that allow assignment of liability to all involved in a manner both legally sound and morally just.', 'margin_type': 'extensive_margin', 'significance': 'Shows aggressive charging philosophy to include all participants'}, {'quote': 'With gun battle cases, prosecutors will want to charge Penal Code section 12022.5 [little use] or section 12022.53 [big use]. Also gun battle cases will usually have death or serious bodily injury, requiring the charging of GBI or serious bodily injury enhancements.', 'margin_type': 'intensive_margin', 'significance': 'Demonstrates enhancement maximization strategy'}, {'quote': ""The court may not strike or dismiss a finding of use. (§ 12022.53(h).) Simple use of a firearm adds ten years to the defendant's sentence. Intentional discharge causing great bodily injury adds 25 years to life."", 'margin_type': 'intensive_margin', 'significance': 'Emphasizes the harshest available penalties that cannot be reduced'}]"
2015.06.01_Alameda County_290 REG CRIMES AGAINST MINORS.pdf,Alameda County,06/01/2015,2015-06-01,2015.0,training_material,case_law_update,"['enhancements', 'juvenile', 'sentencing']",leans_traditional,0,1,-1.0,leans_traditional,medium,['mentions risk-based classification system under consideration'],"['favorable presentation of expanded sex offender registration', 'emphasis on community safety through registration', 'detailed analysis supporting punitive registration requirements', 'focus on enforcement of existing enhancement statutes']",low_impact,neutral,0,0,moderate_impact,more_punitive,0,1,not_addressed,not_addressed,selective,not_addressed,not_addressed,not_addressed,not_addressed,Nancy O'Malley,yes,continuation,informational,"This training document provides legal updates on three California Supreme Court cases affecting sex offender registration, juvenile competency, and prior conviction procedures. The primary focus is on the Johnson decision, which the office presents favorably as it expands mandatory sex offender registration requirements by overturning previous precedent. While the document mentions potential future reforms toward risk-based classification systems, the current emphasis remains on proper enforcement of existing punitive registration and enhancement statutes, reflecting a traditional prosecutorial approach to public safety.","[{'quote': 'Among issues currently being examined is a registration structure that would enable law enforcement to identify and concentrate resources on the most dangerous offenders. Thus, those with the highest risk of re-offending would remain subject to a lifetime sex offender registration, consistent with the goal of ensuring community safety.', 'margin_type': 'intensive_margin', 'relevance': 'Shows consideration of reform but maintains punitive framework'}, {'quote': 'The Johnson court concluded that in light of the legitimate purposes of sex offender registration, and the plausible and actual legislative concerns it discussed above, it cannot be said that the differentiated treatment of section 261.5 and section 288a offenders lacks such rationality', 'margin_type': 'intensive_margin', 'relevance': 'Demonstrates support for maintaining punitive registration requirements'}, {'quote': ""If the trial judge fails to give the Boykin-Tahl advisement, remind the judge to do it. If the trial judge gives an incomplete Boykin-Tahl advisement, tell the judge. Act to avoid the problem in the first place, because the trial judge's error, if reversible on appeal, is ultimately the prosecutor's problem."", 'margin_type': 'intensive_margin', 'relevance': 'Shows focus on ensuring proper implementation of enhancement procedures'}]"
2015.06.29_Alameda County_(SCOTT- WHEELER BATSON PART I).pdf,Alameda County,06/29/2015,2015-06-29,2015.0,training_material,case_law_update,"['racial_justice', 'death_penalty']",neutral,0,0,0.0,neutral,high,"['racial_justice', 'anti_discrimination_focus', 'constitutional_compliance']","['death_penalty_prosecution', 'detailed_procedural_guidance_for_prosecutors']",low_impact,neutral,0,0,moderate_impact,neutral,0,0,not_addressed,not_addressed,not_addressed,not_addressed,not_addressed,not_addressed,moderate,not_mentioned,yes,continuation,strong_guidance,"This document is a prosecutor training material from Alameda County DA's office providing detailed legal guidance on Batson/Wheeler jury selection procedures following recent California and U.S. Supreme Court decisions. The training focuses on constitutional compliance to avoid discrimination in jury selection while maintaining effective death penalty prosecutions. The document represents neutral, technical legal education rather than ideological policy guidance, emphasizing procedural correctness over prosecutorial philosophy.","[{'quote': 'The Batson/Wheeler framework is designed to enforce the constitutional prohibition on exclusion of persons from jury service on account of their membership in a cognizable group.', 'margin_type': 'intensive', 'relevance': 'Shows focus on constitutional compliance and anti-discrimination'}, {'quote': ""NEXT WEEK: We continue with Part II in our discussion of the California Supreme Court's decision in People v. Scott with advice on what to do generally when you are the subject of a Batson/Wheeler motion"", 'margin_type': 'intensive', 'relevance': 'Indicates prosecutor-focused training on defending against discrimination challenges'}, {'quote': 'In a capital case, it is not surprising for prospective jurors to express varying degrees of hesitancy about voting for a death verdict... both the prosecution and the defense may be required to make fine judgment calls about which jurors are more or less willing to vote for the ultimate punishment.', 'margin_type': 'intensive', 'relevance': 'Demonstrates continued engagement with death penalty prosecution'}]"
2015.07.06_Alameda County_SCOTT- WHEELER BATSON PART II_Redacted.pdf,Alameda County,07/06/2015,2015-07-06,2015.0,training_material,case_law_update,"['racial_justice', 'administrative']",neutral,0,0,0.0,neutral,high,"['elimination of bias training', 'emphasis on fair jury selection', 'acknowledgment of discrimination concerns']","['prosecutor-focused training', 'emphasis on conviction integrity', 'detailed guidance on defending prosecutorial strikes']",low_impact,neutral,0,0,moderate_impact,neutral,0,0,not_addressed,not_addressed,not_addressed,not_addressed,not_addressed,not_addressed,moderate,not_mentioned,yes,continuation,strong_guidance,"This document is a prosecutorial training material focused on proper compliance with Batson/Wheeler jury selection procedures following a California Supreme Court decision in People v. Scott. It provides detailed guidance to prosecutors on how to handle challenges to peremptory strikes while maintaining the ability to effectively select juries. The document emphasizes legal compliance, thorough record-making, and professional conduct rather than advocating for particular ideological positions on criminal justice policy.","[{'quote': 'As a prosecutor, take charge of the proceedings surrounding the motion. Know the law that governs Batson/Wheeler.', 'margin_type': 'intensive', 'relevance': 'Shows prosecutor-focused approach to managing bias challenges'}, {'quote': ""We have the opportunity to show the system is fair. So without apology, I'll explain my reasons."", 'margin_type': 'intensive', 'relevance': 'Emphasizes fairness while maintaining prosecutorial authority'}, {'quote': ""There's much at stake ultimately if the appellate court finds a Batson/Wheeler violation, including the integrity of the conviction, and -- for the prosecutor personally -- reputation and status in the state bar."", 'margin_type': 'intensive', 'relevance': 'Highlights both systemic and personal stakes in proper compliance'}]"
2015.08.31_Alameda County_(BRADY EVIDENCE _ JOHNSON).pdf,Alameda County,08/31/2015,2015-08-31,2015.0,training_material,case_law_update,"['discovery', 'administrative']",neutral,0,0,0.0,neutral,high,"['emphasis_on_due_process_rights', 'ensuring_defendants_receive_exculpatory_evidence']","['focus_on_procedural_compliance', 'protection_of_police_officer_privacy_interests']",low_impact,neutral,0,0,moderate_impact,neutral,0,0,not_addressed,not_addressed,not_addressed,not_addressed,not_addressed,not_addressed,not_addressed,not_mentioned,yes,continuation,informational,"This document is a training material from the Alameda County District Attorney's Office explaining the California Supreme Court's decision in People v. Superior Court (Johnson) regarding Brady disclosure obligations and Pitchess motion procedures for accessing police officer personnel records. The document provides neutral, procedural guidance on how prosecutors must comply with constitutional disclosure requirements while respecting officer privacy rights. It emphasizes that prosecutors must inform defendants of potential Brady material in officer files but are not required to conduct the defendant's investigation for them, as both parties have equal access to Pitchess procedures.","[{'quote': 'The prosecution satisfies its Brady duty by disclosing to the defense any information it has regarding whether the personnel records contain Brady material. Beyond that, the prosecution has no Brady obligation to do what the defense can do for itself.', 'margin_type': 'intensive', 'relevance': 'Establishes procedural requirements for Brady compliance'}, {'quote': 'The purpose behind the Brady rule is avoidance of an unfair trial to the accused.', 'margin_type': 'intensive', 'relevance': 'Emphasizes due process protections'}, {'quote': ""permitting prosecutors routine access to personnel records is not necessary to protect defendants' due process right to obtain potentially exculpatory evidence"", 'margin_type': 'intensive', 'relevance': 'Balances defendant rights with officer privacy'}]"
2015.10.05_Alameda County_(WARRANTLESS SEARCHES).pdf,Alameda County,10/05/2015,2015-10-05,2015.0,training_material,case_law_update,"['discovery', 'administrative']",leans_traditional,0,1,-1.0,leans_traditional,medium,[],"['Detailed training on overcoming defense suppression motions', 'Focus on maintaining prosecutorial advantage in warrantless search cases', 'Emphasis on proper evidence presentation to sustain searches', 'No discussion of civil liberties concerns or search limitations']",moderate_impact,more_punitive,0,1,low_impact,neutral,0,0,not_addressed,not_addressed,not_addressed,not_addressed,not_addressed,not_addressed,not_addressed,Alameda County District Attorney's Office,yes,continuation,strong_guidance,"This document is a training material from the Alameda County DA's Office providing prosecutors with detailed guidance on defending warrantless searches of probationers and parolees against suppression motions. It analyzes two recent court cases to extract practical lessons about what evidence prosecutors must present to justify searches and overcome defense challenges. The training focuses entirely on maintaining prosecutorial advantages and ensuring evidence obtained through warrantless searches can be used at trial, reflecting a traditional law enforcement-oriented approach to criminal prosecution.","[{'quote': 'The lesson from the Romeo case is that the People must prove two things at the 1538.5 hearing: First, the officer who did the warrantless search had knowledge not only that the defendant was on probation, but also had knowledge of the areas the officer was entitled to search pursuant to the probationary search terms.', 'margin_type': 'extensive_margin', 'relevance': 'Shows focus on maintaining prosecutorial ability to use evidence from warrantless searches'}, {'quote': 'prosecutors must be aware of what they need to prove up at the 1538.5 that involves a warrantless probation search, and get those items in advance to that they are ready to go when the 1538.5 is held', 'margin_type': 'extensive_margin', 'relevance': 'Emphasizes preparation to overcome defense suppression motions'}, {'quote': ""These cases discuss what the People must 'prove up' in challenges to warrantless searches"", 'margin_type': 'extensive_margin', 'relevance': 'Frames the training around prosecutorial success in defending searches'}]"
2016.02.01_Alameda County_GBI with DUI_JUV. GRAND JURY.pdf,Alameda County,02/01/2016,2016-02-01,2016.0,training_material,case_law_update,"['juvenile', 'enhancements', 'charging_decisions']",leans_traditional,0,1,-1.0,leans_traditional,medium,[],"['expanded juvenile transfer authority', 'grand jury indictment procedures for juveniles', 'enhancement charging guidance', 'focus on prosecutorial tools and authority']",moderate_impact,more_punitive,0,1,moderate_impact,neutral,0,0,not_addressed,not_addressed,selective,not_addressed,not_addressed,supports_transfer,not_addressed,not_mentioned,yes,unclear,strong_guidance,"This training document provides legal guidance on three key areas: expanded authority to charge juveniles in adult court via grand jury indictment, admissibility of evidence from dismissed charges under Evidence Code 1101(b), and proper application of great bodily injury enhancements in vehicular manslaughter cases. The document emphasizes prosecutorial tools and authority, particularly regarding juvenile transfers to adult court, reflecting a focus on utilizing available charging mechanisms rather than alternatives to prosecution.","[{'quote': 'Proposition 21, approved by the voters at the March 7, 2000 primary election, expanded prosecutorial authority to file charges against minors in adult court.', 'margin_type': 'extensive', 'relevance': 'Shows focus on expanded charging authority for juveniles'}, {'quote': 'Welfare and Institutions Code section 707, subdivision (d) allows prosecutors the discretionary authority to file charges against minors directly in criminal court for specified offenses and under specified circumstances.', 'margin_type': 'extensive', 'relevance': 'Emphasizes prosecutorial discretion to bypass juvenile court'}, {'quote': 'The Supreme Court agreed with the People that Proposition 21 was intended to expand, not revoke, the authority of courts of criminal jurisdiction (i.e. adult courts) over juveniles', 'margin_type': 'extensive', 'relevance': 'Reinforces expanded prosecutorial authority over juvenile cases'}]"
2016.02.29_Alameda County_TORTURE.pdf,Alameda County,02/29/2016,2016-02-29,2016.0,training_material,case_law_update,"['charging_decisions', 'enhancements']",clearly_traditional,0,1,-2.0,clearly_traditional,high,[],"['Comprehensive training on securing maximum penalties including life imprisonment', 'Detailed guidance on death penalty eligible special circumstances', 'Emphasis on prosecuting extremely violent crimes to fullest extent', 'Focus on punishment rather than alternatives', 'Training designed to facilitate conviction on serious charges']",moderate_impact,more_punitive,0,1,high_impact,more_punitive,0,1,not_addressed,no,maximize,not_addressed,not_addressed,not_addressed,not_addressed,not_mentioned,yes,continuation,strong_guidance,"This document is a comprehensive training material for prosecutors on torture charges, murder by torture, and torture-murder special circumstances. It provides detailed legal guidance on proving the elements of these serious offenses, including case examples and jury instructions. The training reflects a traditional prosecutorial approach focused on securing maximum penalties including life imprisonment and death penalty eligibility for violent crimes. The document serves as an educational tool to enhance prosecutors' ability to successfully charge and convict defendants on the most serious available charges.","[{'quote': 'Torture is punishable by imprisonment in the state prison for a term of life. As a result, torture has no statute of limitations.', 'margin_type': 'intensive_margin', 'relevance': 'Emphasizes maximum penalty approach'}, {'quote': 'One of the purposes of Proposition 115, among others, was to assure that violent criminals receive just punishment.', 'margin_type': 'intensive_margin', 'relevance': 'Reflects traditional tough-on-crime philosophy'}, {'quote': 'This is exactly the type of nightmarish situation the torture statute, section 206, was intended to address.', 'margin_type': 'extensive_margin', 'relevance': 'Encourages aggressive use of torture charges'}]"
2016.03.14_Alameda County_MULTIPLE BURGLARIES .pdf,Alameda County,03/14/2016,2016-03-14,2016.0,training_material,case_law_update,"['charging_decisions', 'discovery']",neutral,0,0,0.0,neutral,high,"['emphasis on Brady compliance', 'detailed discussion of constitutional violations', 'focus on proper discovery procedures']","['case involves serious violent crimes including rape', 'detailed analysis of burglary charging standards', 'focus on proper prosecution techniques']",moderate_impact,more_lenient,1,0,low_impact,neutral,0,0,not_addressed,not_addressed,not_addressed,not_addressed,not_addressed,not_addressed,not_addressed,not_mentioned,yes,informational,strong_guidance,"This training document provides legal education on two recent court decisions: People v. Garcia regarding when multiple burglary charges are appropriate, and Wearry v. Cain concerning Brady violations. The Garcia analysis offers specific guidance that may limit charging decisions by requiring stricter criteria for multiple burglary convictions. The Brady discussion emphasizes constitutional discovery obligations and the consequences of withholding evidence. Overall, the document serves as neutral legal education focused on compliance with court rulings rather than promoting any particular prosecutorial ideology.","[{'quote': 'A burglary does not result from every felonious entry into a room preceded by a burglary of an enclosing structure. Rather, the subsequent entry will constitute a burglary only when the invaded room provides an objectively reasonable expectation of privacy and security, distinct from that the enclosing structure itself provides', 'margin_type': 'extensive_margin', 'relevance': 'Provides specific guidance limiting when multiple burglary charges can be filed'}, {'quote': ""Beyond doubt, the newly revealed evidence suffices to undermine confidence in Wearry's conviction. The State's trial evidence resembles a house of cards, built on the jury crediting Scott's account rather than Wearry's alibi"", 'margin_type': 'intensive_margin', 'relevance': 'Emphasizes importance of Brady compliance and proper discovery'}, {'quote': 'There is no question in my mind that the prosecution should have disclosed the information', 'margin_type': 'intensive_margin', 'relevance': 'Reinforces prosecutorial obligation for proper discovery practices'}]"
2016.03.28_Alameda Count_BASIC FELONY SENTENCING.pdf,Alameda County,03/28/2016,2016-03-28,2016.0,training_material,sentencing,['case_law_update'],unclear,0,0,,unclear,low,[],[],not_applicable,not_applicable,0,0,low_impact,neutral,0,0,not_addressed,not_addressed,not_addressed,not_addressed,not_addressed,not_addressed,not_addressed,not_mentioned,unclear,unclear,informational,"This document is an administrative notice about a continuing legal education training video series on basic felony sentencing principles presented by the Alameda County District Attorney's Office in March 2016. The document primarily serves as a program description and notes that the materials have been superseded due to Proposition 57 changes. It provides no substantive policy content or ideological indicators, functioning solely as informational material about prosecutor training rather than policy guidance.","['This P&A handout has been superseded because of Pope 57 changes. Please use the P&A handout for September 25, 2017', 'This Points and Authorities is a two-part episode explaining principles of basic felony sentencing. The video includes a discussion of problems to illustrate these principles', ""The P&A handout and accompanying attachment 'Penalty Terms for Selected Felonies' is the same for both episodes""]"
2016.04.04_Alameda County_Basic Felony Sentencing II).pdf,Alameda County,04/04/2016,2016-04-04,2016.0,training_material,sentencing,"['case_law_update', 'administrative']",unclear,0,0,,unclear,low,[],[],not_applicable,not_applicable,0,0,low_impact,neutral,0,0,not_addressed,not_addressed,not_addressed,not_addressed,not_addressed,not_addressed,not_addressed,not_mentioned,unclear,unclear,informational,"This document is an administrative notice for a continuing legal education training video on basic felony sentencing principles presented by the Alameda County District Attorney's Office. The document primarily serves to inform that the original handout has been superseded due to changes from Proposition 57 and directs users to updated materials from October 2017. It provides no substantive policy guidance or ideological content, functioning solely as educational administrative material for prosecutor training.","['This P&A handout has been superseded because of changes resulting from Prop 57. Please use the P&A handout for October 27, 2017, in which we repeated the original show but updated the handout.', 'This Points and Authorities is a two-part episode explaining principles of basic felony sentencing. The video includes a discussion of problems to illustrate these principles.', ""The Alameda County District Attorney's Office is a State Bar of California Approved MCLE Provider.""]"
2016.04.18_Alameda County_ATT BURG_ IMPLIED CONSENT.pdf,Alameda County,04/18/2016,2016-04-18,2016.0,training_material,case_law_update,"['charging_decisions', 'discovery']",clearly_traditional,0,1,-2.0,clearly_traditional,high,[],"['aggressive prosecution strategies', 'maximizing charging opportunities', 'overcoming defendant protections', 'maintaining harsh consequences', 'prosecution-favorable legal interpretations']",moderate_impact,more_punitive,0,1,moderate_impact,more_punitive,0,1,not_addressed,not_addressed,not_addressed,not_addressed,not_addressed,not_addressed,not_addressed,Alameda County District Attorney's Office,yes,continuation,strong_guidance,"This training document provides prosecutors with legal strategies to maximize convictions in attempted burglary and DUI cases, while ensuring defendants on probation continue to face felony-level consequences under Proposition 47. The material focuses on overcoming evidentiary challenges and constitutional protections through aggressive legal interpretations and procedural tactics. The overall approach reflects a traditional prosecutorial philosophy emphasizing conviction maximization and punishment maintenance rather than reform-oriented alternatives.","[{'quote': ""Here, the evidence amply supported the jury's finding that defendants had completed their planning and preparation to commit burglaries when they traveled from the southern part of Los Angeles to the San Fernando Valley with tools in the car to aid in the commission of those burglaries."", 'margin_type': 'extensive_margin', 'relevance': 'Shows aggressive interpretation of minimal evidence to support attempted burglary charges'}, {'quote': 'While it may be too late for your motion, remind the officer: if the defendant will not or cannot consent, always get a warrant! And get it promptly.', 'margin_type': 'intensive_margin', 'relevance': 'Provides tactical advice to prosecutors on securing evidence for stronger cases'}, {'quote': ""A person on probation for a crime that was reduced from a felony to a misdemeanor by Prop 47 is a person 'serving a sentence' and therefore must petition for recall of sentence under section 1170.18, subd. (a). Under Prop 47, he continues to be subject to the ban on firearms possession applicable to felons."", 'margin_type': 'intensive_margin', 'relevance': 'Ensures probationers face continued felony-level consequences rather than receiving full benefits of criminal justice reform'}]"
2016.05.02_Alameda County_Major Participant Special Circumstance.pdf,Alameda County,05/02/2016,2016-05-02,2016.0,training_material,case_law_update,"['enhancements', 'sentencing']",clearly_traditional,0,1,-2.0,clearly_traditional,high,[],"['Detailed guidance on applying death penalty eligibility', 'Focus on maximizing life without parole sentences', 'Emphasis on preventing defendants from using intoxication defenses to avoid enhancements', 'No discussion of alternatives to harsh sentences', 'Technical focus on ensuring maximum penalties can be applied']",low_impact,not_applicable,0,0,high_impact,more_punitive,0,1,not_addressed,not_addressed,maximize,not_addressed,not_addressed,not_addressed,not_addressed,Alameda County District Attorney's Office,yes,continuation,strong_guidance,"This training document provides Alameda County prosecutors with detailed legal guidance on applying special circumstances enhancements that make defendants eligible for death penalty or life without parole sentences in felony murder cases. The document analyzes recent case law to help prosecutors successfully argue that defendants qualify as 'major participants' with 'reckless indifference to human life.' It also clarifies that voluntary intoxication cannot be used as a defense against serious firearm enhancements, reflecting a traditional prosecutorial approach focused on maximizing the most severe penalties available under law.","[{'quote': 'Major participation in the felony committed, combined with reckless indifference to human life, is sufficient to satisfy the Enmund culpability requirement... In other words, sufficient for a sentence of death or life without possibility of parole', 'margin_type': 'intensive', 'significance': ""Emphasizes the office's focus on securing maximum penalties including death sentences""}, {'quote': ""Therefore, the trial court properly instructed the jury that it was not to consider evidence of the defendant's voluntary intoxication in determining the truth of the section 12022.53 firearm enhancement allegations"", 'margin_type': 'intensive', 'significance': 'Shows commitment to preventing defendants from avoiding serious enhancements through intoxication defenses'}, {'quote': 'substantial evidence supported the special circumstance finding', 'margin_type': 'intensive', 'significance': ""Demonstrates the office's approach to ensuring special circumstances that enable death penalty or life without parole are successfully applied""}]"
2016.05.23_Alameda County_YOUTHFUL OFFENDERS.pdf,Alameda County,05/23/2016,2016-05-23,2016.0,training_material,juvenile,"['sentencing', 'case_law_update']",neutral,0,0,0.0,neutral,high,"['Detailed coverage of constitutional protections for juveniles', 'Emphasis on rehabilitation potential as sentencing factor', 'Guidance on mitigating evidence and expert assistance', 'Recognition of diminished culpability of youth']","['Maintains that LWOP statute is constitutional', 'Provides guidance on arguing Miller factors from prosecution perspective', 'Focuses on legal compliance rather than advocating for reform', 'Includes guidance on firearm possession enforcement']",low_impact,neutral,0,0,high_impact,more_lenient,1,0,not_addressed,unclear,not_addressed,not_addressed,not_addressed,not_addressed,not_addressed,not_mentioned,yes,informational,informational,"This training document provides prosecutors with legal guidance on handling juvenile and youthful offender cases following recent Supreme Court decisions and statutory changes. It comprehensively covers Miller v. Alabama requirements, Penal Code section 3051 parole provisions, and related constitutional protections that significantly reduce effective sentences for young offenders. The document emphasizes practical implications for case negotiations and family discussions, noting that many traditional lengthy sentences now have much earlier parole eligibility. While legally neutral in tone, the content reflects a criminal justice system moving toward more lenient treatment of juvenile offenders through constitutional and statutory protections.","[{'quote': 'This awareness is IMPORTANT for discussions with families and in negotiating cases. In reality, 50 to life now means 25 to life.', 'margin_type': 'intensive_margin', 'significance': 'Shows practical impact of legal changes on sentencing negotiations'}, {'quote': 'Even if you get LWOP, the defendant still can petition to be parole eligible under 1170(d)(2) unless he is excluded by exceptions. He can make this petition three times. Thus his possibility for parole eligibility is an important consideration when dealing the case and talking to families.', 'margin_type': 'intensive_margin', 'significance': 'Demonstrates how new laws provide multiple opportunities for sentence reduction'}, {'quote': 'Court must allow (and pay for) an expert to help the defendant develop mitigating evidence.', 'margin_type': 'intensive_margin', 'significance': 'Shows constitutional requirements that favor defendants in juvenile cases'}]"
2016.08.01_Alameda County_UPDATE YOUTHFUL OFFENDERS.pdf,Alameda County,08/01/2016,2016-08-01,2016.0,training_material,case_law_update,"['juvenile', 'sentencing']",neutral,0,0,0.0,neutral,medium,"['Detailed coverage of youth-focused sentencing reforms', 'Emphasis on rehabilitation possibilities for juvenile offenders', ""Recognition of 'diminished culpability of juveniles'"", 'Discussion of parole opportunities as constitutional requirement']","['Guidance on using juvenile murder convictions as special circumstances for death penalty', ""Instructions on preserving evidence of 'culpability or cognitive maturity' against defendants"", 'Focus on proper prosecution procedures rather than questioning prosecutorial approach']",low_impact,neutral,0,0,moderate_impact,more_lenient,1,0,not_addressed,unclear,not_addressed,not_addressed,not_addressed,not_addressed,not_addressed,not_mentioned,yes,modification,strong_guidance,"This document is a legal training material that updates prosecutors on three recent court cases, with primary focus on People v. Franklin regarding youthful offender sentencing reforms. It provides detailed guidance on implementing new requirements for juvenile parole hearings and preserving relevant evidence for future proceedings. The document takes a neutral, compliance-focused approach to recent legal developments that generally provide more lenient treatment for juvenile offenders, while also covering traditional prosecutorial tools like using juvenile murder convictions for death penalty cases.","[{'quote': ""It is in everyone's interest to have an assessment of the features identified in Penal Code section 4801 at a time closer to the commission of the offense, when the most accurate assessment will necessarily occur."", 'margin_type': 'intensive_margin', 'relevance': 'Shows practical approach to implementing youth sentencing reforms'}, {'quote': ""the prosecution likewise may put on the record any evidence that demonstrates the juvenile offender's culpability or cognitive maturity, or otherwise bears on the influence of youth-related factors"", 'margin_type': 'intensive_margin', 'relevance': 'Indicates traditional prosecutorial approach of preserving evidence against defendants'}, {'quote': ""It is important to know the potential exposure the juvenile is facing so that you can properly negotiate the case and talk to the victim's family, making them aware of parole possibilities."", 'margin_type': 'intensive_margin', 'relevance': 'Emphasizes practical case management and victim communication'}]"
2016.09.26_Alameda County_Special Circumstance and First Degree Murder.pdf,Alameda County,09/26/2016,2016-09-26,2016.0,training_material,case_law_update,"['death_penalty', 'charging_decisions', 'sentencing']",clearly_traditional,0,1,-2.0,clearly_traditional,high,[],"['Death penalty advocacy and training', 'Detailed guidance on securing maximum sentences', 'Focus on special circumstances that enhance punishment', 'Emphasis on constitutional justification for death penalty', 'No mention of alternatives or mitigation strategies']",moderate_impact,more_punitive,0,1,high_impact,more_punitive,0,1,not_addressed,not_addressed,maximize,not_addressed,not_addressed,not_addressed,not_addressed,not_mentioned,yes,continuation,strong_guidance,"This document is a comprehensive training material for prosecutors on pursuing lying in wait special circumstances in murder cases, which can result in death penalty or life without parole sentences. It provides detailed legal requirements, case law analysis, and practical examples to help prosecutors successfully argue for these enhanced charges. The document reflects a traditional prosecutorial approach focused on securing maximum punishment, with extensive guidance on death penalty cases and no discussion of alternatives or mitigation strategies. This represents continuing education to maintain the office's capability to pursue the most severe penalties available under California law.","[{'quote': ""The penalty for murder in the first degree is death or imprisonment without the possibility of parole if '[t]he defendant intentionally killed the victim by means of lying in wait.'"", 'margin_type': 'intensive_margin', 'relevance': 'Shows focus on securing maximum penalties including death penalty'}, {'quote': ""the murderer who kills by lying in wait acts surreptitiously, concealing himself or his purpose and making a surprise attack on his victim from a position of advantage, thereby denying the victim any chance of escape, aid, or self-defense... a murder committed by lying in wait historically has been viewed as 'a particularly heinous and repugnant crime.'"", 'margin_type': 'intensive_margin', 'relevance': 'Demonstrates traditional tough-on-crime rhetoric justifying death penalty'}, {'quote': ""That a crime historically has been considered more reprehensible than other murders provides 'a rational basis for distinguishing those murderers who deserve to be considered for the death penalty from those who do not.'"", 'margin_type': 'intensive_margin', 'relevance': 'Shows clear advocacy for death penalty as appropriate punishment'}]"
2017.02.21_Alameda County_PROVING GBI.pdf,Alameda County,02/21/2017,2017-02-21,2017.0,training_material,enhancements,"['charging_decisions', 'case_law_update']",clearly_traditional,0,1,-2.0,clearly_traditional,high,[],"['Enhancement maximization focus', 'Emphasis on converting cases to strike offenses', 'Detailed guidance on increasing sentence severity', 'Encouragement to upgrade charges when possible', 'Focus on preventing dismissals through 995 motions']",moderate_impact,more_punitive,0,1,high_impact,more_punitive,0,1,not_addressed,not_addressed,maximize,strict_enforcement,not_addressed,not_addressed,not_addressed,not_mentioned,yes,continuation,strong_guidance,"This training document instructs Alameda County prosecutors on how to effectively prove great bodily injury (GBI) enhancements in assault cases at preliminary hearings. The training emphasizes the importance of GBI enhancements because they convert simple felonies into strike offenses and add 3-5 years to sentences. The document provides detailed technical guidance on evidence gathering, witness preparation, and charging decisions, all oriented toward maximizing the likelihood of securing these sentence-enhancing allegations. The overall approach reflects a traditional prosecutorial philosophy focused on obtaining the most serious charges and longest sentences possible.","[{'quote': 'A GBI enhancement is important because it makes a simple felony a strike, so that the offense becomes a serious or violent felony and can add three to five years to the sentence.', 'margin_type': 'intensive', 'significance': 'Explicitly emphasizes the punitive value of enhancements'}, {'quote': ""Just because GBI was not charged does not mean there is no GBI... contact the victim to determine if the victim suffered any injuries and get as much detail as possible about the injuries. It's very important to talk with the victim in the early stages to make certain no GBI charges were missed."", 'margin_type': 'extensive', 'significance': 'Encourages prosecutors to actively seek ways to upgrade charges'}, {'quote': 'If charging deputies have an assaultive crime with an injury that qualifies as serious bodily injury, consider charging Penal Code section 245(a)(4) with GBI instead of section 243(d). The sentencing implications are greater.', 'margin_type': 'intensive', 'significance': 'Explicitly recommends choosing charges based on maximizing sentence severity'}]"
2017.07.17_Alameda County_PROP 57 EARLY RELEASE.pdf,Alameda County,07/17/2017,2017-07-17,2017.0,training_material,sentencing,"['case_law_update', 'enhancements', 'three_strikes']",neutral,0,0,0.0,neutral,high,"['educational_programming_emphasis', 'rehabilitation_credit_systems', 'alternatives_to_full_incarceration']","['victim_notification_requirements', 'focus_on_maintaining_sentences_for_violent_crimes', 'emphasis_on_public_safety_screening']",low_impact,neutral,0,0,high_impact,more_lenient,1,0,not_addressed,unclear,not_addressed,not_addressed,not_addressed,not_addressed,not_addressed,not_mentioned,yes,continuation,informational,"This document is a comprehensive training material for prosecutors explaining the practical applications of California's Proposition 57, which allows early parole consideration for nonviolent felons and increases conduct credits. The document provides detailed technical guidance on how the new law will significantly reduce actual time served by inmates, with extensive examples showing potential sentence reductions. While the content describes more lenient outcomes, the document maintains a neutral, educational tone focused on legal compliance rather than advocating for any particular prosecutorial philosophy.","[{'quote': ""As you'll see, the sentence you worked so hard to craft is unlikely to be the sentence the defendant will actually serve."", 'margin_type': 'intensive', 'significance': ""Illustrates the document's focus on how existing sentences will be reduced""}, {'quote': ""Pop quiz: A defendant is sentenced to 17 years in state prison for a first degree burglary with a strike prior. How much time will he actually serve? If you said 13.6 years (80 % of 17), you're wrong. The answer: The defendant will serve a sentence of 6 to 17 years in state prison. Probably closer to 6."", 'margin_type': 'intensive', 'significance': 'Demonstrates the significant reduction in actual time served under Prop 57'}, {'quote': 'It is not wise to advise a defendant about the likelihood of early release under prop. 57. Release on parole is not a direct consequence of the plea.', 'margin_type': 'intensive', 'significance': 'Shows practical guidance for prosecutors on managing expectations while maintaining legal compliance'}]"
2017.07.31_Alameda County_Brady Alerts and Pitchess.pdf,Alameda County,07/31/2017,2017-07-31,2017.0,training_material,discovery,"['case_law_update', 'administrative']",neutral,0,0,0.0,neutral,high,"['emphasis on constitutional due process obligations', 'detailed guidance on Brady disclosure requirements']","['focus on maintaining prosecutorial effectiveness', 'concern about officer credibility protecting prosecution interests']",moderate_impact,more_punitive,0,1,high_impact,neutral,0,0,not_addressed,not_addressed,not_addressed,not_addressed,not_addressed,not_addressed,not_addressed,not_mentioned,yes,unclear,strong_guidance,"This document is a legal training material analyzing the ALADS court decision regarding Brady disclosure obligations and Pitchess motion requirements for accessing police officer personnel records. It provides detailed procedural guidance on how prosecutors should handle situations where law enforcement agencies want to provide 'Brady tips' about officers with potential credibility issues. The document is primarily technical and educational, focusing on legal compliance rather than reflecting a particular prosecutorial ideology, though it balances constitutional due process requirements with practical prosecutorial concerns.","[{'quote': ""The crux of the majority's reasoning rested upon three assumptions: (i) disclosure of the deputies' names violated the Pitchess statutes; (ii) disclosure could only be justified if the ruling in Brady required disclosure; and (iii) if disclosure was required, the Pitchess statutes had to be invalidated as unconstitutional."", 'margin_type': 'intensive_margin', 'relevance': 'Shows the complex legal balancing between officer privacy and prosecutorial disclosure obligations'}, {'quote': 'Once prosecutors have been provided information about an officer that constitutes favorable material evidence for the defendant in a criminal case, prosecutors cannot divest themselves of it... Knowledge of intangible information is possession of intangible information.', 'margin_type': 'intensive_margin', 'relevance': ""Emphasizes prosecutors' ongoing Brady obligations once they have knowledge of potentially exculpatory evidence""}, {'quote': 'There are several reasons why a law enforcement agency may want to continue to provide Brady tips notwithstanding the holding in ALADS... not providing Brady tips also presents the possibility that the department will be successfully sued in a section 1983 civil suit', 'margin_type': 'extensive_margin', 'relevance': 'Discusses practical considerations that could affect case filing decisions and prosecutorial strategy'}]"
"2017.08.21_Alameda County_Prop 36, Sealed Juvenile Files.pdf",Alameda County,08/21/2017,2017-08-21,2017.0,training_material,case_law_update,"['juvenile', 'three_strikes', 'sentencing']",leans_traditional,0,1,-1.0,leans_traditional,high,['protective charging of juvenile victim rather than purely punitive'],"['strict three strikes enforcement', 'opposition to expanded resentencing', 'support for using dismissed charges in sentencing decisions', 'emphasis on public safety over rehabilitation']",moderate_impact,mixed,0,0,high_impact,more_punitive,0,1,unclear,no,maximize,strict_enforcement,not_addressed,not_addressed,not_addressed,not_mentioned,yes,continuation,informational,"This training document provides legal analysis of recent court decisions affecting juvenile record access and Three Strikes sentencing. It strongly supports strict enforcement of Three Strikes law, opposing reforms that would make resentencing easier for repeat offenders, while showing some protective instincts toward juvenile victims. The document reflects a traditional prosecutorial approach that prioritizes public safety and maintaining tough sentences over rehabilitation or second chances for serious repeat offenders.","[{'quote': ""The parties agree that the application of Proposition 47's definition of an 'unreasonable risk of danger to public safety' to the resentencing proceedings of three strike inmates would ease the burden for recidivist serious or violent offenders to have their life sentences vacated, and render them more likely to be released."", 'margin_type': 'intensive_margin', 'significance': 'Shows opposition to reforms that would make resentencing easier'}, {'quote': 'By entering into a plea agreement that resulted in the dismissal of the robbery count and firearm use allegation, Estrada did not bargain for immunity from all consequences associated with the facts underlying those counts.', 'margin_type': 'intensive_margin', 'significance': 'Supports using dismissed charges to maintain harsher sentences'}, {'quote': 'The prosecutor said his purpose in charging S.V. was to bring her back to the county so that she could be protected.', 'margin_type': 'extensive_margin', 'significance': 'Shows protective rather than purely punitive charging approach for juvenile victims'}]"
"2017.09.18_Alameda County_Aranda Bruton, Batson Wheeler.pdf",Alameda County,09/18/2017,2017-09-18,2017.0,training_material,case_law_update,"['discovery', 'jury_selection', 'victim_services']",leans_traditional,0,1,-1.0,leans_traditional,medium,"[""recognition of trafficking victims' vulnerability"", 'acknowledgment of prosecutorial immunity protections for victims']","['focus on successful prosecution techniques', 'emphasis on admitting incriminating evidence', 'treating trafficking victims as uncharged coconspirators', 'detailed guidance on overcoming defense challenges']",low_impact,neutral,0,0,moderate_impact,more_punitive,0,1,not_addressed,not_addressed,not_addressed,not_addressed,not_addressed,not_addressed,low,not_mentioned,yes,informational,strong_guidance,"This training document provides Alameda County prosecutors with legal updates on three key areas: admitting codefendant statements under Crawford/Aranda-Bruton rules, challenging young jurors while avoiding age discrimination, and treating trafficking victims as uncharged coconspirators. The document emphasizes successful prosecution techniques and provides tactical guidance for overcoming common defense challenges, reflecting a traditional prosecutorial approach focused on securing convictions.","[{'quote': ""D. was properly treated as an uncharged coconspirator for purposes of the coconspirator exception to the hearsay rule, and evidence of her statements was admissible to show defendant's liability"", 'margin_type': 'intensive', 'significance': 'Shows traditional prosecutorial approach to using victim statements against defendants'}, {'quote': 'that result advances the purpose of Proposition 35 by facilitating prosecution of traffickers, rather than giving them the benefit of an evidentiary exclusion designed for their minor victims', 'margin_type': 'intensive', 'significance': 'Frames victim protections in terms of prosecutorial advantage rather than victim welfare'}, {'quote': 'limited life experience remains a valid and non-protected class, which means to justify challenging a youthful person, prosecutors should first get into the record both the characteristics of such details', 'margin_type': 'intensive', 'significance': 'Provides tactical guidance for excluding certain jurors while avoiding discrimination claims'}]"
2017.09.25_Alameda County_Felony Sentencing Pt.I.pdf,Alameda County,09/25/2017,2017-09-25,2017.0,training_material,sentencing,"['enhancements', 'three_strikes', 'charging_decisions']",neutral,0,0,0.0,neutral,high,"['Mentions diversion programs including Prop 36 drug diversion', 'References military combat veteran diversion programs', 'Acknowledges recent legislative changes reducing sentence lengths']","['Comprehensive instruction on enhancement maximization', 'Detailed guidance on mandatory no-probation clauses', 'Extensive coverage of three strikes sentencing', 'Focus on technical aspects of sentence calculation rather than alternatives']",low_impact,neutral,0,0,moderate_impact,neutral,0,0,unclear,unclear,not_addressed,not_addressed,not_addressed,not_addressed,not_addressed,not_mentioned,unclear,informational,informational,"This document is a technical training manual for prosecutors on California felony sentencing law, covering determinate and indeterminate sentencing, enhancements, three strikes, and sentence calculations. It serves as a comprehensive reference guide explaining existing legal requirements and options without advocating for particular prosecutorial approaches. While it acknowledges recent legislative reforms that have reduced sentences and mentions diversion programs, the primary focus is on providing neutral, technical instruction on how to calculate and impose sentences under current law. The document reflects a traditional educational approach to prosecutor training, emphasizing legal competency rather than policy advocacy.","[{'quote': ""It has become increasingly difficult to know the actual length of a sentence of imprisonment, even when a specific term of years is negotiated with the defendant, due to the California Legislature's recent trend to retroactive changes in felony sentencing law."", 'margin_type': 'intensive_margin', 'significance': 'Acknowledges legislative trend toward reducing sentence lengths'}, {'quote': 'Many existing or proposed laws reduce the length of current sentences - Prop 36 (§ 1170.126) reduced prison sentences for most non-violent three-strike offenders. - Realignment (§ 1170(h)) made specified non-violent felonies punishable only in county jail, and not in state prison. - Prop 47 reduced many theft and drug-related felonies to misdemeanors.', 'margin_type': 'both_margins', 'significance': 'Neutral acknowledgment of recent criminal justice reforms'}, {'quote': 'Court may impose reasonable conditions to rehabilitate defendant and protect the public.', 'margin_type': 'intensive_margin', 'significance': 'Presents rehabilitation and public safety as dual goals of sentencing'}]"
2017.10.02_Alameda County_Felony Sentencing Pt.II.pdf,Alameda County,10/02/2017,2017-10-02,2017.0,training_material,sentencing,"['enhancements', 'three_strikes', 'charging_decisions']",neutral,0,0,0.0,neutral,high,"['Mentions diversion programs including Prop 36 drug diversion', 'References military combat veteran diversion programs', 'Acknowledges recent legislative changes reducing sentence lengths']","['Comprehensive instruction on enhancement maximization', 'Detailed guidance on mandatory no-probation clauses', 'Extensive coverage of three strikes sentencing', 'Focus on technical aspects of sentence calculation rather than alternatives']",low_impact,neutral,0,0,moderate_impact,neutral,0,0,unclear,unclear,not_addressed,not_addressed,not_addressed,not_addressed,not_addressed,not_mentioned,unclear,informational,informational,"This document is a technical training manual for prosecutors on California felony sentencing law, covering determinate and indeterminate sentencing, enhancements, three strikes, and sentence calculation. It serves as a comprehensive educational resource explaining existing legal frameworks rather than advocating for particular prosecutorial approaches. While it acknowledges recent legislative reforms that have reduced sentences and mentions diversion options, the primary focus is on providing neutral, technical instruction on how to properly calculate and impose sentences under current law. The document reflects a traditional prosecutorial training approach focused on legal mechanics rather than policy advocacy.","[{'quote': ""It has become increasingly difficult to know the actual length of a sentence of imprisonment, even when a specific term of years is negotiated with the defendant, due to the California Legislature's recent trend to retroactive changes in felony sentencing law."", 'margin_type': 'intensive_margin', 'significance': 'Acknowledges legislative trend toward sentence reduction'}, {'quote': 'Many existing or proposed laws reduce the length of current sentences - Prop 36 (§ 1170.126) reduced prison sentences for most non-violent three-strike offenders. - Realignment (§ 1170(h)) made specified non-violent felonies punishable only in county jail, and not in state prison. - Prop 47 reduced many theft and drug-related felonies to misdemeanors.', 'margin_type': 'both_margins', 'significance': 'Neutral acknowledgment of recent criminal justice reforms'}, {'quote': 'Court may impose reasonable conditions to rehabilitate defendant and protect the public.', 'margin_type': 'intensive_margin', 'significance': 'Presents dual purpose of rehabilitation and public safety in probation'}]"
2018.01.08_Alameda County_VC 10851_ Interrogating Juveniles.pdf,Alameda County,01/08/2018,2018-01-08,2018.0,training_material,case_law_update,"['juvenile', 'charging_decisions']",neutral,0,0,0.0,neutral,high,"['Provides detailed guidance on implementing Proposition 47 sentence reductions', 'Acknowledges new juvenile consultation rights with counsel']","['Emphasizes prosecutor strategies to limit Proposition 47 eligibility', 'Suggests establishing vehicle values to prevent reductions', 'Presents arguments against suppression of juvenile statements']",moderate_impact,more_lenient,1,0,high_impact,more_lenient,1,0,not_addressed,unclear,not_addressed,not_addressed,not_addressed,not_addressed,not_addressed,not_mentioned,yes,informational,informational,"This training document provides legal analysis of two significant developments: the California Supreme Court's decision in People v. Page regarding Proposition 47 resentencing eligibility for Vehicle Code 10851 violations, and the new Welfare & Institutions Code section 625.6 requiring attorney consultation before interrogating juveniles 15 and under. The document offers practical guidance to prosecutors on implementing these changes while suggesting strategies to limit their impact, such as establishing vehicle values to prevent sentence reductions and constitutional arguments against evidence suppression. Overall, it serves as neutral educational material helping prosecutors navigate new legal requirements while maintaining prosecutorial effectiveness.","[{'quote': 'If possible, establish the value of the automobile at the time of plea, preliminary hearing, or trial, etc. Even if the Vehicle Code section 10851 conduct is determined to be a theft, it cannot be reduced to a misdemeanor if the value of the property was more than $950.', 'margin_type': 'intensive_margin', 'significance': 'Shows prosecutorial strategy to limit sentence reduction eligibility'}, {'quote': 'The consultation is mandatory and cannot be waived... it appears the obligation is on law enforcement to locate and ensure that an attorney is available to the minor.', 'margin_type': 'extensive_margin', 'significance': 'Describes new procedural protections for juveniles that may affect case outcomes'}, {'quote': 'California Constitution Article I, Section 28(f)(2) provides that relevant evidence shall not be excluded in any criminal proceeding... except where 2/3 of the members of both houses of the Legislature enact a statute to provide for exclusion. Here, that did not happen.', 'margin_type': 'extensive_margin', 'significance': 'Presents constitutional argument against suppressing juvenile statements'}]"
"2018.01.16_Alameda County_New Laws 2018, Pt.1.pdf",Alameda County,01/16/2018,2018-01-16,2018.0,training_material,case_law_update,"['juvenile', 'sentencing', 'victim_services', 'discovery']",neutral,0,0,0.0,neutral,high,"['youth offender parole expansion', 'tiered sex offender registry allowing termination', 'military diversion for DUI', 'mandatory attorney consultation for minors']","['expanded sex offender registration requirements', 'new aggravating factors for violent crimes', 'sexual extortion criminalization', 'emphasis on victim notification rights']",moderate_impact,mixed,0,0,high_impact,mixed,0,0,yes,unclear,not_addressed,not_addressed,not_addressed,not_addressed,not_addressed,Nancy O'Malley,yes,informational,informational,"This document is an educational training material from the Alameda County DA's Office providing prosecutors with an overview of selected new California laws effective in 2018. It covers a range of topics including expanded youth offender parole, sex offender registry reform, victim rights, and new requirements for juvenile interrogations. The document maintains a neutral, informational tone focused on practical implementation rather than advocating for particular prosecutorial policies. The content reflects both progressive reforms (youth-focused changes) and traditional law enforcement measures (expanded registration requirements), suggesting a balanced approach to criminal justice policy.","[{'quote': 'If you have a serious case, always check the age of your defendant at the time of the crime. Since the age is now under 26, youth parole will encompass a large number of defendants in our most serious cases. Prosecutors need to be aware when a defendant will be eligible for parole in order to accurately make offers and explain the ramifications of any crime to victims.', 'margin_type': 'intensive_margin', 'significance': 'Shows practical guidance on how expanded youth parole affects plea negotiations and victim communications'}, {'quote': 'The uncertainty of how lower courts will apply subdivision (b) of section 625.6 and whether/when the California Supreme Court will be called upon to resolve the issue makes it imperative that law enforcement officers are aware of this new law and that officers ensure that minors 15 years of age or younger are given the opportunity to consult with legal counsel', 'margin_type': 'extensive_margin', 'significance': ""Demonstrates office's commitment to compliance with new juvenile consultation requirements despite legal uncertainty""}, {'quote': ""Some wise advice noted by CDAA in its Legislative Digest: Since these changes creating the three-tier registry will not be implemented until January 1, 2021, it's possible that additional changes could be added. Presently, however, registration remains a lifetime obligation."", 'margin_type': 'intensive_margin', 'significance': 'Shows cautious approach to advising defendants about potential future registry relief'}]"
"2018.01.22_Alameda County_New Laws 2018, Pt. 2.pdf",Alameda County,01/22/2018,2018-01-22,2018.0,training_material,case_law_update,"['juvenile', 'sentencing', 'victim_services', 'discovery']",neutral,0,0,0.0,neutral,high,"['Expanded juvenile record sealing provisions', 'Automatic sealing of dismissed juvenile cases', 'Elderly parole program codification', 'Therapy dog provisions for child witnesses and victims', 'Mental health evaluation release provisions']","['Prosecutor access to sealed juvenile records for charging decisions', 'Extended restraining order authority for gang cases', 'Expanded search warrant authority for privacy crimes', 'Restitution expansion provisions', 'Venue expansion for serious crimes']",moderate_impact,more_lenient,1,0,moderate_impact,mixed,0,0,not_addressed,unclear,not_addressed,not_addressed,not_addressed,not_addressed,not_addressed,not_mentioned,no,informational,informational,"This document is an educational training material that objectively presents new California laws effective January 2018, focusing heavily on juvenile justice reforms including expanded record sealing provisions. It covers a range of topics from elderly parole programs to expanded prosecutor tools, maintaining a neutral, informational tone throughout. The document serves as legal compliance guidance rather than policy advocacy, helping prosecutors understand new statutory requirements and opportunities without promoting any particular ideological approach.","[{'quote': 'Prosecutors should be cautious about representations made to victims and their families about the amount of time the incarcerated defendant will actually serve.', 'margin_type': 'intensive_margin', 'relevance': 'Shows practical guidance on managing expectations around sentencing outcomes'}, {'quote': 'The newly enacted amendment to W&I 781 modifies the lifetime ban of Proposition 21 and replaces it with language permitting, in certain circumstances, the person to petition for sealing of the records', 'margin_type': 'extensive_margin', 'relevance': 'Describes expansion of juvenile record sealing opportunities'}, {'quote': ""a record relating to a §707(b) offense committed after 14 years of age that has been sealed under section 781 may be 'accessed, inspected or utilized [by prosecutors] in a subsequent proceeding'"", 'margin_type': 'intensive_margin', 'relevance': 'Shows continued prosecutor access to sealed records for charging and sentencing decisions'}]"
2018.02.13_Alameda County_Prop 57 Retroactivity.pdf,Alameda County,02/13/2018,2018-02-13,2018.0,training_material,case_law_update,"['juvenile', 'victim_services']",neutral,0,0,0.0,neutral,high,"['emphasis on juvenile rehabilitation over punishment', 'support for victim rights enforcement']","['strong victim rights advocacy', 'detailed procedural compliance focus', 'opposition to Proposition 57 through writ petitions']",high_impact,more_lenient,1,0,moderate_impact,more_lenient,1,0,not_addressed,unclear,not_addressed,not_addressed,not_addressed,supports_transfer,not_addressed,not_mentioned,yes,continuation,informational,"This training document provides legal education on two key cases: People v. Lara regarding Proposition 57's retroactive application to juvenile transfer procedures, and Perez v. Superior Court regarding victim notification requirements under Marsy's Law. The document explains how Proposition 57 limits prosecutors' ability to directly file juvenile cases in adult court and emphasizes the DA office's obligation to ensure victim participation rights. While primarily informational, it reveals the office's initial opposition to Proposition 57's retroactive application and strong commitment to victim rights enforcement.","[{'quote': 'The possibility of being treated as a juvenile in juvenile court—where rehabilitation is the goal—rather than being tried and sentenced as an adult can result in dramatically different and more lenient treatment.', 'margin_type': 'intensive_margin', 'relevance': 'Shows recognition of more lenient treatment in juvenile system'}, {'quote': ""It is critical to reflect on what happened in this case... the prosecutor had a constitutional duty under Marsy's Law to contact the victim, advise the victim of the court's offer and the relevant court date."", 'margin_type': 'intensive_margin', 'relevance': 'Demonstrates strong commitment to victim rights enforcement'}, {'quote': ""This right is no less important than the defendant's right to counsel or any of the other rights of the defendant that we uphold every day."", 'margin_type': 'intensive_margin', 'relevance': 'Emphasizes equal importance of victim rights with defendant rights'}]"
2018.02.20_Alameda County_Humphrey Bail.pdf,Alameda County,02/20/2018,2018-02-20,2018.0,training_material,bail,"['case_law_update', 'constitutional_rights', 'due_process']",leans_progressive,1,0,1.0,leans_progressive,medium,"['Extensive coverage of constitutional protections against wealth-based detention', 'Emphasis on individualized assessments over standardized bail schedules', 'Discussion of alternatives to monetary bail', 'Focus on preventing detention based solely on poverty', 'Favorable discussion of federal bail reform principles']","['Acknowledgment of public safety concerns in bail decisions', 'Recognition of victim safety rights in bail considerations', ""Discussion of prosecutor's role in opposing bail reduction""]",high_impact,more_lenient,1,0,low_impact,not_applicable,0,0,unclear,yes,not_addressed,not_addressed,reform_oriented,not_addressed,low,not_mentioned,unclear,clearly_new_policy,informational,"This training document provides detailed analysis of the Humphrey decision, which requires California courts to consider defendants' ability to pay bail and explore less restrictive alternatives before ordering pre-trial detention. The document emphasizes constitutional due process and equal protection requirements that prevent wealth-based detention, while also covering procedural requirements for individualized bail determinations. Though presented as legal education, the extensive coverage of reforms limiting monetary bail suggests alignment with progressive bail reform principles.","[{'quote': 'A defendant may be not be imprisoned solely due to poverty.', 'margin_type': 'extensive', 'significance': 'Core principle establishing that wealth cannot determine pre-trial detention'}, {'quote': 'Money bail will protect the public only as an incidental effect of the defendant being detained due to his or her inability to pay, and this effect will not consistently serve a protective purpose, as a wealthy defendant will be released despite his or her dangerousness while an indigent defendant who poses minimal risk of harm to others will be jailed.', 'margin_type': 'extensive', 'significance': ""Critique of wealth-based bail system's effectiveness and fairness""}, {'quote': 'Bail schedules represent the antithesis of the individualized inquiry required before a court can order pretrial detention.', 'margin_type': 'extensive', 'significance': 'Strong criticism of standardized bail schedules in favor of individualized assessments'}]"
2018.04.16_Alameda County_Intoxication Evidence I.pdf,Alameda County,04/16/2018,2018-04-16,2018.0,training_material,case_law_update,"['charging_decisions', 'sentencing']",neutral,0,0,0.0,neutral,high,[],[],moderate_impact,neutral,0,0,high_impact,neutral,0,0,not_addressed,not_addressed,not_addressed,not_addressed,not_addressed,not_addressed,not_addressed,not_mentioned,unclear,unclear,informational,"This document is a legal training material from the Alameda County District Attorney's Office that provides comprehensive instruction on California law regarding voluntary intoxication evidence in criminal cases. It objectively explains statutory requirements, case law distinctions between general and specific intent crimes, and procedural rules for jury instructions. The document serves as educational content for prosecutors to understand existing legal frameworks rather than advocating for any particular prosecutorial philosophy or policy approach.","[{'quote': 'Evidence of voluntary intoxication shall not be admitted to negate the capacity to form any mental states for the crimes charged, including, but not limited to, purpose, intent, knowledge, premeditation, deliberation, or malice aforethought', 'margin_type': 'intensive_margin', 'relevance': 'Explains legal limitations on intoxication defenses that affect sentencing outcomes'}, {'quote': 'Evidence of voluntary intoxication is admissible solely on the issue of whether or not the defendant actually formed a required specific intent', 'margin_type': 'both_margins', 'relevance': 'Key legal principle affecting both charging decisions and trial strategy'}, {'quote': ""The trial court has no sua sponte duty to instruct on voluntary intoxication. An instruction on the significance of voluntary intoxication is a 'pinpoint' instruction that the trial court is not required to give unless requested by the defendant"", 'margin_type': 'intensive_margin', 'relevance': 'Procedural guidance affecting trial outcomes and sentencing'}]"
2018.05.14_Alameda County_Voluntary Intoxication and Imperfect Self-Defense#2.pdf,Alameda County,05/14/2018,2018-05-14,2018.0,training_material,case_law_update,"['charging_decisions', 'sentencing']",clearly_traditional,0,1,-2.0,clearly_traditional,high,[],"['Supports limiting defendant defenses', ""Endorses 'tough on crime' approach to voluntary intoxication"", 'Emphasizes personal responsibility over mitigating circumstances', 'Supports maintaining higher murder charges rather than allowing reductions']",moderate_impact,more_punitive,0,1,high_impact,more_punitive,0,1,not_addressed,not_addressed,not_addressed,not_addressed,not_addressed,not_addressed,not_addressed,not_mentioned,yes,continuation,informational,"This training document presents the California Supreme Court's decision in People v. Soto, which limits defendants' ability to use voluntary intoxication evidence in imperfect self-defense claims. The Alameda County DA's office uses this as educational material, approvingly presenting the court's reasoning that voluntary intoxication should not excuse poor judgment in killing situations. The document reflects a traditional prosecutorial approach that prioritizes personal responsibility and maintaining serious charges against defendants who kill while intoxicated, rather than allowing mitigating circumstances to reduce murder charges to manslaughter.","[{'quote': 'If you voluntarily choose to become intoxicated and then kill someone, you may not claim that you were so intoxicated you were unaware your actions exhibited a conscious disregard for life when you killed', 'margin_type': 'intensive_margin', 'significance': 'Illustrates traditional approach emphasizing personal responsibility over mitigating circumstances'}, {'quote': ""voluntary 'intoxication naturally lends itself to the crime's commission because it impairs the sound judgment or lowers the inhibitions that might stop a sober individual' from killing a perceived assailant"", 'margin_type': 'intensive_margin', 'significance': 'Shows support for limiting intoxication as mitigation, maintaining higher charges'}, {'quote': 'Evidence of voluntary intoxication is not admissible on the question of whether a defendant believed it was necessary to act in self-defense', 'margin_type': 'extensive_margin', 'significance': 'Demonstrates support for limiting defendant defenses that could reduce charges'}]"
2018.07.30_Alameda County_Mental Health Diversion Law.pdf,Alameda County,07/30/2018,2018-07-30,2018.0,training_material,diversion,"['case_law_update', 'mental_health', 'competency']",leans_progressive,1,0,1.0,leans_progressive,high,"['comprehensive mental health diversion program', 'treatment-focused approach over punishment', 'charge dismissal upon successful completion', 'record sealing provisions', 'emphasis on addressing underlying mental health issues', 'broad eligibility covering all felonies and misdemeanors']","['public safety risk assessment requirements', 'exclusion of certain personality disorders', 'termination provisions for new criminal conduct', 'consideration of violence and criminal history', 'prosecution input in treatment program selection']",high_impact,more_lenient,1,0,moderate_impact,more_lenient,1,0,yes,yes,not_addressed,not_addressed,not_addressed,not_addressed,not_addressed,not_mentioned,yes,clearly_new_policy,informational,"This training document provides comprehensive guidance to prosecutors on implementing California's new mental health diversion law (Penal Code 1001.36), which allows defendants with qualifying mental disorders to receive treatment instead of prosecution. The document thoroughly explains eligibility requirements, treatment protocols, and procedures for both successful completion and termination of diversion. While maintaining public safety considerations, the overall framework represents a significant shift toward therapeutic justice, offering complete charge dismissal and record sealing for successful participants across all types of felonies and misdemeanors.","[{'quote': ""The purpose of the program is to offer treatment for the underlying mental disorder that contributed to the defendant's involvement in the offense, and thus mitigate reentry into the criminal justice system."", 'margin_type': 'extensive_margin', 'significance': 'Establishes therapeutic rather than punitive purpose'}, {'quote': ""If the defendant has performed satisfactorily in diversion at the end of the period of diversion, the court shall dismiss the defendant's criminal charges... the arrest upon which the diversion was based shall be deemed never to have occurred"", 'margin_type': 'extensive_margin', 'significance': 'Shows complete elimination of criminal consequences for successful participants'}, {'quote': 'The diversion covers any felony or misdemeanor. No exception is made for serious or violent felonies.', 'margin_type': 'extensive_margin', 'significance': 'Demonstrates broad, inclusive approach to diversion eligibility'}]"
2018.08.20_Alameda County_FACEBOOK SUBPOENAS.pdf,Alameda County,08/20/2018,2018-08-20,2018.0,training_material,case_law_update,"['discovery', 'enhancements']",neutral,0,0,0.0,neutral,medium,"['Detailed explanation of Proposition 47 benefits for defendants', 'Emphasis on Brady obligations and broad discovery duties', 'Discussion of retroactive ameliorative effects reducing punishment']","['Focus on prosecutorial tools for obtaining social media evidence', ""Discussion of gang prosecution methods including 'cyber banging'"", 'Emphasis on prosecutorial authority under SCA exceptions']",low_impact,neutral,0,0,moderate_impact,more_lenient,1,0,not_addressed,not_addressed,not_addressed,not_addressed,not_addressed,not_addressed,not_addressed,not_mentioned,yes,informational,informational,"This document is a legal training material from Alameda County DA's office covering two major topics: recent California Supreme Court decisions on social media subpoenas and Proposition 47's retroactive effects on felony-based enhancements. It provides balanced legal analysis explaining both prosecutorial tools for obtaining social media evidence and defendant-favorable applications of Proposition 47 that can reduce previously imposed enhancement penalties. The document serves an educational function, helping prosecutors understand evolving legal standards rather than advocating for specific policy positions.","[{'quote': 'the prosecution is obligated to share with the defense any material exculpatory evidence in its possession—including that which is potentially exculpatory', 'margin_type': 'intensive_margin', 'relevance': 'Shows emphasis on broad discovery obligations favoring defendants'}, {'quote': 'section 1170.18, subdivision (k) can negate a previously imposed section 667.5, subdivision (b), enhancement when the underlying felony attached to that enhancement has been reduced to a misdemeanor under Prop 47', 'margin_type': 'intensive_margin', 'relevance': 'Explains how Proposition 47 retroactively reduces punishment severity'}, {'quote': 'prosecutors, through these procedures, may be able to obtain the communications from the provider', 'margin_type': 'intensive_margin', 'relevance': 'Highlights prosecutorial tools for evidence gathering'}]"
2018.09.04_Alameda County_SB 10 - Abolishing Cash Bail.pdf,Alameda County,09/04/2018,2018-09-04,2018.0,training_material,bail,"['case_law_update', 'administrative']",neutral,0,0,0.0,neutral,high,"['elimination of cash bail system', 'presumption of release for low/medium risk defendants', 'emphasis on least restrictive conditions', 'risk assessment tools rather than financial ability']","['extensive list of exclusions from release', 'preventative detention motions available to prosecution', 'rebuttable presumptions against release for violent crimes', 'victim input requirements']",high_impact,more_lenient,1,0,moderate_impact,mixed,0,0,not_addressed,unclear,not_addressed,not_addressed,not_addressed,not_addressed,not_addressed,not_mentioned,no,clearly_new_policy,informational,"This document is an educational overview of California's SB 10, which eliminated cash bail and replaced it with a risk-assessment system effective October 2019. The training material objectively explains the new procedures for pretrial detention and release decisions, including automatic release for low-risk defendants, judicial review for medium-risk defendants, and preventative detention motions for high-risk cases. The document serves as neutral legal education for prosecutors rather than advocating any particular ideological position on bail reform.","[{'quote': ""At arraignment, the court shall order a defendant released on his or her own recognizance or supervised own recognizance with the lease restrictive nonmonetary condition or combination of conditions that will reasonably assure public safety and the defendant's return to court unless the prosecution files a motion for preventative detention"", 'margin_type': 'extensive_margin'}, {'quote': 'As to low risk persons, the court shall release the person on his or her own recognizance, prior to arraignment, without review by the court, with the least restrictive nonmonetary condition or combination of conditions', 'margin_type': 'extensive_margin'}, {'quote': 'The prosecution may file a motion seeking the detention of the defendant pending trial, based on the following circumstances: The crime was committed with violence against the person, threatened violence against the person, or the likelihood of serious bodily injury', 'margin_type': 'extensive_margin'}]"
2019.01.07_Alameda County_New Laws Juveniles_ Butter Knife ADW.pdf,Alameda County,01/07/2019,2019-01-07,2019.0,training_material,case_law_update,"['juvenile', 'charging_decisions']",neutral,0,0,0.0,neutral,high,"['Discusses laws that raise minimum age for prosecution', 'Covers restrictions on juvenile transfers to adult court', 'Presents case law that makes convictions harder to obtain']","['Emphasizes importance of building strong prosecutorial records', 'Focuses on technical legal requirements for successful prosecutions', 'Presents information in prosecutor training context']",high_impact,more_lenient,1,0,moderate_impact,more_lenient,1,0,not_addressed,not_addressed,not_addressed,not_addressed,not_addressed,not_addressed,not_addressed,not_mentioned,unclear,informational,informational,"This is a prosecutor training document from Alameda County DA's office covering a California Supreme Court case that raised the evidentiary standard for deadly weapon charges and summarizing 2019 legislative changes affecting juvenile prosecutions. The document objectively presents legal developments that generally make prosecutions more difficult, including restrictions on prosecuting minors under 12, elimination of adult court transfers for 14-15 year olds, and higher standards for certain charges. The material is presented in a neutral, educational format focused on helping prosecutors understand and adapt to these legal changes.","[{'quote': ""Under any plausible interpretation of the term 'likely,' the evidence was insufficient to establish that B.M.'s use of a butter knife against her sister's blanketed legs was likely to produce death or great bodily injury."", 'margin_type': 'intensive_margin', 'relevance': 'Establishes higher standard for deadly weapon charges'}, {'quote': 'Therefore, a minor who is under the age of 12 at the time he or she commits any other crime, including serious or violent felonies, cannot be prosecuted in juvenile court.', 'margin_type': 'extensive_margin', 'relevance': 'Shows significant restriction on who can be prosecuted'}, {'quote': 'It is the responsibility of the prosecutor to elicit the testimony and other evidence that establish those facts.', 'margin_type': 'intensive_margin', 'relevance': 'Emphasizes prosecutorial responsibility for building strong cases'}]"
2019.01.07_Alameda Countyt_Points and Authorities-(New Laws Juveniles_Butter Knife ADW).pdf,Alameda County,01/07/2019,2019-01-07,2019.0,training_material,case_law_update,"['juvenile', 'charging_decisions']",neutral,0,0,0.0,neutral,high,"['Presents juvenile justice reforms neutrally', ""Acknowledges legislative intent to 'protect young children from negative impacts of formal justice system involvement'""]","['Notes controversy over reforms', 'Mentions anticipated constitutional challenges by DA offices', 'Emphasizes prosecutor responsibility to build strong evidentiary records']",high_impact,more_lenient,1,0,moderate_impact,more_lenient,1,0,not_addressed,not_addressed,not_addressed,not_addressed,not_addressed,neutral,not_addressed,not_mentioned,unclear,informational,informational,"This training document provides legal education on a Supreme Court case limiting assault with deadly weapon charges and new 2019 juvenile justice laws. It analyzes the In re B.M. case establishing stricter evidentiary standards for deadly weapon charges, while also explaining new laws that raise the minimum age for juvenile prosecution to 12 and eliminate adult court transfers for most 14-15 year olds. The document maintains a neutral, educational tone focused on legal compliance rather than advocating specific policy positions.","[{'quote': 'It is the responsibility of the prosecutor to elicit the testimony and other evidence that establish those facts.', 'margin_type': 'intensive_margin', 'relevance': ""Emphasizes prosecutor's duty to build strong cases""}, {'quote': 'This bill would protect young children from the negative impacts of formal justice system involvement, promote their rights, health, and well-being through alternative child-serving systems', 'margin_type': 'extensive_margin', 'relevance': 'Legislative intent behind juvenile justice reforms'}, {'quote': ""it is anticipated that the issue of the constitutionality of this amendment may be challenged by some district attorney's offices"", 'margin_type': 'extensive_margin', 'relevance': 'Notes prosecutorial resistance to juvenile transfer restrictions'}]"
"2019.04.08_Alameda County_Joinder-Defendants, Aranda-Bruton.pdf",Alameda County,04/08/2019,2019-04-08,2019.0,training_material,case_law_update,"['discovery', 'administrative']",neutral,0,0,0.0,neutral,high,['Update on Duenas case regarding ability to pay fines and fees'],"['Focus on prosecution-favorable evidence admission strategies', 'Detailed guidance on overcoming defense confrontation clause objections']",low_impact,neutral,0,0,moderate_impact,neutral,0,0,not_addressed,not_addressed,not_addressed,not_addressed,not_addressed,not_addressed,not_addressed,not_mentioned,yes,continuation,informational,"This document is a weekly legal training material from the Alameda County District Attorney's Office covering Aranda/Bruton rules for joint defendant trials and statement admissibility. It provides neutral legal analysis of Supreme Court cases and practical guidance on evidence redaction strategies. The document also includes an update on People v. Duenas regarding defendants' ability to pay court fees and fines. Overall, it serves as educational material for prosecutors rather than advocating for specific policy positions.","[{'quote': ""The prosecutor's choices if the statement cannot be adequately redacted to protect the interest of all defendants: A. Do Not Use the Statement B. Agree to Separate Trials"", 'margin_type': 'intensive_margin', 'relevance': 'Shows balanced approach considering both prosecution goals and defendant rights'}, {'quote': ""If the trial court determines a defendant is unable to pay, the fees and assessments cannot be imposed; and execution of any restitution fine imposed must be stayed until such time as the People can show that the defendant's ability to pay has been restored."", 'margin_type': 'intensive_margin', 'relevance': 'Reflects attention to defendant financial circumstances in line with Duenas ruling'}, {'quote': ""This P&A offers an overview of the law and observations on how statements can be redacted. For a thorough and much lengthier compilation on all issues related to Aranda/Bruton, readers should consult Jeff Rubin's Inquisitive Prosecutor's Guide"", 'margin_type': 'intensive_margin', 'relevance': 'Demonstrates educational rather than advocacy purpose of the document'}]"
2019.05.06_Alameda County_Partial Verdicts.pdf,Alameda County,05/06/2019,2019-05-06,2019.0,training_material,case_law_update,"['enhancements', 'sentencing']",neutral,0,0,0.0,neutral,high,"[""Discussion of judicial discretion to impose lesser enhancements as 'middle ground'"", 'Recognition of alternatives to maximum penalties']","['Focus on proper legal procedures for convictions', 'Detailed analysis of enhancement statutes', 'Educational format emphasizing legal compliance']",low_impact,neutral,0,0,moderate_impact,more_lenient,1,0,not_addressed,not_addressed,not_addressed,not_addressed,not_addressed,not_addressed,not_addressed,not_mentioned,no,unclear,informational,"This document is a continuing legal education training material that provides objective analysis of two recent California court decisions: People v. Aranda (regarding partial verdicts and double jeopardy) and People v. Morrison (regarding judicial discretion in firearm enhancements). The material explains legal procedures and requirements without advocating for particular prosecutorial policies, serving as neutral educational content for legal professionals. While the Morrison case creates more sentencing flexibility that could reduce punishment severity, the document presents this as legal information rather than policy guidance.","[{'quote': 'The court had the discretion to impose an enhancement under section 12022.53, subdivision (b) or (c) as a middle ground to a lifetime enhancement under section 12022.53, subdivision (d), if such an outcome was found to be in the interests of justice under section 1385.', 'margin_type': 'intensive_margin', 'relevance': 'Shows judicial discretion for lesser penalties'}, {'quote': ""Stone's reasoning supports the taking of partial verdicts regardless of how the prosecution charges the case."", 'margin_type': 'intensive_margin', 'relevance': 'Establishes procedural protections that can limit prosecution options'}, {'quote': ""A defendant's double jeopardy rights should not 'turn on the formality of whether he was charged in separate counts with the greater offense and the lesser included offense, or was charged in a single count with only the greater offense.'"", 'margin_type': 'intensive_margin', 'relevance': 'Emphasizes defendant protections in charging procedures'}]"
2019.09.03_Alameda County_Brady Alerts.pdf,Alameda County,09/03/2019,2019-09-03,2019.0,training_material,case_law_update,"['discovery', 'administrative']",neutral,0,0,0.0,neutral,high,"['Emphasis on Brady compliance and defense rights', 'Facilitating access to police misconduct evidence', 'Training prosecutors on constitutional obligations to defendants']","['Focus on proper legal procedures rather than reform', 'Maintaining prosecutorial effectiveness within legal bounds', 'Educational format suggests compliance-focused rather than reform-oriented approach']",moderate_impact,more_lenient,1,0,low_impact,neutral,0,0,not_addressed,not_addressed,not_addressed,not_addressed,not_addressed,not_addressed,not_addressed,not_mentioned,yes,unclear,informational,"This document is a legal training material that provides prosecutors with updates on two California Supreme Court cases affecting criminal procedure. The primary focus is on Brady alerts - a system allowing law enforcement to notify prosecutors when officers with potential credibility issues may testify in cases. The document emphasizes constitutional compliance obligations and proper discovery procedures, taking a neutral, educational approach to legal requirements rather than advocating for any particular prosecutorial philosophy or reform agenda.","[{'quote': ""A prosecutor in a criminal case must disclose to the defense certain evidence that is favorable to the accused. (Brady v. Maryland (1963) 373 U.S, 83.) This duty sometimes requires disclosure of evidence that will impeach a law enforcement officer's testimony."", 'margin_type': 'extensive_margin', 'relevance': 'Establishes constitutional obligation that can lead to case dismissals'}, {'quote': ""Brady imposes on prosecutors 'a duty to learn of any favorable evidence known to the others acting on the government's behalf in [a] case, including the police.'"", 'margin_type': 'extensive_margin', 'relevance': 'Emphasizes prosecutorial duty to seek out potentially exculpatory evidence'}, {'quote': 'construing the Pitchess statutes to cut off the flow of information from law enforcement personnel to prosecutors would be anathema to Brady compliance', 'margin_type': 'extensive_margin', 'relevance': 'Shows priority given to constitutional compliance over prosecutorial convenience'}]"
2019.10.07_Alameda County_Jane Doe Charging.pdf,Alameda County,10/07/2019,2019-10-07,2019.0,training_material,case_law_update,"['charging_decisions', 'victim_services', 'discovery']",neutral,0,0,0.0,neutral,high,"['victim privacy protections', 'detailed guidance on protecting vulnerable victims', 'emphasis on victim safety and security']","['focus on successful prosecution', 'detailed case law analysis for conviction purposes', 'emphasis on avoiding prejudice to prosecution']",moderate_impact,neutral,0,0,low_impact,not_applicable,0,0,not_addressed,not_addressed,not_addressed,not_addressed,not_addressed,not_addressed,not_addressed,not_mentioned,yes,unclear,strong_guidance,"This document is a legal training material covering Jane/John Doe charging procedures for victim protection and Miranda warning requirements in undercover operations. It provides technical guidance on when victim identities can be protected in charging documents, primarily for sex crimes but with some extension to domestic violence and other specified offenses. The material balances victim privacy concerns with prosecutorial effectiveness, offering practical guidance rather than ideological policy direction. The case law updates on Miranda requirements demonstrate standard prosecutorial training on evidence admissibility.","[{'quote': ""it would be appropriate to charge a victim as Jane/John Doe if: a. Publically disclosing the victim's name could cause safety or security threats"", 'margin_type': 'extensive_margin', 'significance': 'Shows consideration for victim safety in charging decisions'}, {'quote': 'we must be prepared to 1) show that the victim wants the protection, and 2) show that there would be no prejudice to the parties by listing the victims as John or Jane Doe', 'margin_type': 'extensive_margin', 'significance': 'Balances victim protection with prosecution interests'}, {'quote': 'it is important to charge confidentially only in cases where we are prepared to show a special need', 'margin_type': 'extensive_margin', 'significance': 'Emphasizes selective, justified use of protective procedures'}]"
2019.11_Alameda County_DA Pride and Professionalism.pdf,Alameda County,11/19/2025,2025-11-19,2025.0,procedure_manual,administrative,"['charging_decisions', 'discovery', 'victim_services', 'diversion', 'bail']",neutral,0,0,0.0,neutral,medium,"['Support for diversion programs and collaborative courts', 'Emphasis on bail reform through Pre-Trial Release Pilot Program', 'Recognition that detention decisions should not depend on inability to afford bail', 'Consideration of defendant characteristics and circumstances in charging decisions']","[""Strong emphasis on victim rights under Marsy's Law"", 'Public safety as primary consideration in bail decisions', 'High charging standards requiring personal satisfaction of guilt', 'Emphasis on holding perpetrators accountable', 'Truth-seeking and justice-oriented prosecutorial role']",high_impact,more_punitive,0,1,moderate_impact,neutral,0,0,yes,yes,not_addressed,not_addressed,reform_oriented,not_addressed,low,not_mentioned,yes,continuation,mandatory,"This is a comprehensive prosecutorial handbook for Alameda County that establishes professional standards, ethical guidelines, and operational procedures for prosecutors. The document emphasizes prosecutorial integrity, truth-seeking, and high charging standards while also supporting diversion programs and bail reform initiatives. It balances traditional prosecutorial values of accountability and victim protection with some progressive elements, creating a professional framework that prioritizes justice over purely punitive approaches.","[{'quote': 'No prosecutor should charge or handle a case at any stage of its progress through the system unless he or she is personally satisfied that the defendant is guilty... while the prosecutor is legally justified in charging on mere probable cause, he serves no useful, legitimate purpose in doing so.', 'margin_type': 'extensive_margin', 'significance': 'Establishes restrictive charging standards'}, {'quote': ""Detention decisions and outcomes should be made without unnecessary delay, and depend on an accurate and unbiased risk assessment and appropriate supervision, not on the individual's inability to afford bail."", 'margin_type': 'extensive_margin', 'significance': 'Shows support for bail reform'}, {'quote': 'A prosecutor may divert individuals from the criminal justice system when he or she considers it to be in the interest of justice and beneficial both to the community and to the individual.', 'margin_type': 'extensive_margin', 'significance': 'Supports diversion as alternative to prosecution'}]"
2020.03.26_Alameda County_Immigration Guidelines.pdf,Alameda County,03/26/2020,2020-03-26,2020.0,policy_memo,charging_decisions,"['sentencing', 'case_guidance', 'victim_services']",clearly_progressive,1,0,2.0,clearly_progressive,high,"['Explicit consideration of collateral consequences in charging decisions', 'Emphasis on equity and proportionality over strict enforcement', 'Collaborative approach with defense counsel', 'Post-conviction relief mechanisms', 'Protection of immigrant defendants from federal immigration officials', 'Victim services for undocumented immigrants']","['Maintains exceptions for serious crimes involving firearms', 'Emphasizes victim impact and public safety considerations']",high_impact,more_lenient,1,0,high_impact,more_lenient,1,0,yes,yes,selective,not_addressed,not_addressed,not_addressed,moderate,not_mentioned,yes,modification,mandatory,"This policy document establishes comprehensive guidelines for Alameda County prosecutors to consider immigration consequences at all stages of criminal proceedings, from charging decisions through post-conviction review. The policy mandates a collaborative approach with defense counsel to craft dispositions that avoid disproportionate immigration consequences while maintaining considerations for public safety and victim impact. It represents a progressive prosecutorial approach that prioritizes equity and proportionality, going beyond legal requirements to protect immigrant defendants from harsh collateral consequences.","[{'quote': 'If the immigration consequences are disproportionate to the crime and sentence under the law, it is generally considered appropriate and just to consider a negotiated offer and disposition.', 'margin_type': 'intensive_margin'}, {'quote': 'However, if the immigration status is known to the prosecutor, that status shall be taken into consideration when evaluating if charges will be filed. The prosecutor shall consider if there are alternatives to filing charges to which the individual can be referred.', 'margin_type': 'extensive_margin'}, {'quote': 'Any information received from defense counsel or the defendant will not be shared with federal immigration officials.', 'margin_type': 'both_margins'}]"
2020.08.24_Alameda County_Electronic Search Conditions.pdf,Alameda County,08/24/2020,2020-08-24,2020.0,training_material,case_law_update,"['sentencing', 'juvenile']",neutral,0,0,0.0,neutral,high,"['Emphasis on proportionality between privacy burdens and legitimate interests', 'Requirement for individualized assessment rather than blanket conditions', 'Recognition of substantial privacy burdens imposed by electronic searches']","['Focus on enabling law enforcement surveillance capabilities', 'Detailed guidance on how to successfully impose search conditions', 'Emphasis on protecting public safety through monitoring']",low_impact,not_applicable,0,0,moderate_impact,neutral,0,0,not_addressed,not_addressed,not_addressed,not_addressed,not_addressed,not_addressed,not_addressed,Alameda County District Attorney's Office,yes,modification,strong_guidance,"This training document provides prosecutors with legal guidance on when electronic device search conditions can be validly imposed on probationers following the California Supreme Court's decision in Ricardo P. The document emphasizes the need for proportionality between privacy burdens and legitimate supervision interests, requiring individualized assessments rather than blanket conditions. It serves as technical legal guidance to ensure compliance with constitutional requirements while maintaining law enforcement capabilities for appropriate cases.","[{'quote': ""Lent's requirement that a probation condition be reasonably related to future criminality contemplates a degree of proportionality between the burden imposed by a probation condition and the legitimate interests served by that condition."", 'margin_type': 'intensive_margin', 'relevance': 'Shows emphasis on balancing law enforcement needs with individual rights'}, {'quote': ""Is the electronic search condition connected to the defendant's criminal conduct or personal history, as opposed to relying on generalities? In other words, focus on the defendant specifically and provide those facts to the court."", 'margin_type': 'intensive_margin', 'relevance': 'Emphasizes individualized assessment rather than blanket approaches'}, {'quote': ""Given the heavy burden an electronics search condition imposes on the probationer's privacy interests, the evidence supporting a finding under Lent's third prong must be related to the defendant or his or her crime rather than the type of generic evidence presented here."", 'margin_type': 'intensive_margin', 'relevance': 'Acknowledges substantial privacy concerns and requires specific justification'}]"
"2020.10.05_Alameda County_Social Media Evidence, Pt I.pdf",Alameda County,10/05/2020,2020-10-05,2020.0,training_material,case_law_update,"['discovery', 'administrative']",unclear,0,0,,unclear,high,[],[],low_impact,neutral,0,0,low_impact,neutral,0,0,not_addressed,not_addressed,not_addressed,not_addressed,not_addressed,not_addressed,not_addressed,not_mentioned,unclear,unclear,informational,"This document announces a continuing legal education training session for prosecutors on social media evidence, covering sources, requirements for obtaining such evidence, and future discussion of admissibility standards. It is part of a weekly video series approved for California Criminal Law Specialization credit. The document is purely administrative and educational, providing no insight into prosecutorial policy positions or ideological orientation. It represents routine professional development rather than policy guidance or reform initiatives.","[""This week's P&A is Part I of a two-part series on the Use of Social Media Evidence in Court."", 'Part I covers the following topics: • An Explanation of Social Media Evidence • The Sources of Social Media Evidence • The Requirements for Obtaining Social Media Evidence', ""Next Week's P&A, Part II, will discuss how to get Social Media Evidence Admitted in Court""]"
"2020.10.19_Alameda County_Social Media Evidence, Pt.2.pdf",Alameda County,10/19/2020,2020-10-19,2020.0,training_material,case_law_update,"['discovery', 'administrative']",leans_traditional,0,1,-1.0,leans_traditional,medium,[],"['emphasis on maximizing evidence collection', 'focus on prosecution success', 'detailed guidance on overcoming legal hurdles to admit evidence', 'characterization of social media as prosecution tools']",moderate_impact,more_punitive,0,1,moderate_impact,more_punitive,0,1,not_addressed,not_addressed,not_addressed,not_addressed,not_addressed,not_addressed,not_addressed,Alameda County District Attorney's Office,yes,continuation,strong_guidance,"This document is a prosecutorial training material on obtaining and admitting social media evidence in court proceedings. It provides detailed technical and legal guidance to deputy district attorneys on authentication requirements, legal processes for obtaining digital evidence, and strategies for overcoming hearsay and other evidentiary obstacles. The training reflects a traditional prosecutorial approach focused on maximizing the state's ability to use digital evidence against defendants, with no consideration of privacy rights or civil liberties concerns. The document represents part of an ongoing educational series for prosecutors in Alameda County.","[{'quote': 'Virtual Treasure Troves of Evidence!', 'margin_type': 'both extensive and intensive', 'significance': 'Repeated phrase characterizing social media evidence as highly valuable prosecution tools'}, {'quote': 'The primary hurdle for the proponent of SME to overcome is typically Authentication. >The SM communication came from a specific person.', 'margin_type': 'both extensive and intensive', 'significance': 'Focus on overcoming legal obstacles to use evidence against defendants'}, {'quote': 'Be creative and think broadly! Nothing in this article shall be construed to limit the means by which a writing may be authenticated or proved.', 'margin_type': 'both extensive and intensive', 'significance': 'Encourages aggressive and creative approaches to evidence admission'}]"
"2020.12.07_Alameda County_New Laws 2021, Pt.1.pdf",Alameda County,12/07/2020,2020-12-07,2020.0,training_material,case_law_update,"['racial_justice', 'juvenile', 'sentencing', 'administrative']",clearly_progressive,1,0,2.0,clearly_progressive,high,"['California Racial Justice Act implementation allowing challenges to prosecutions based on racial bias', 'Shortened probation periods reducing supervision time', 'Tiered sex offender registration system replacing lifetime registration', 'Enhanced juvenile protections requiring legal counsel consultation', 'Elimination of numerous criminal justice fees', 'Expanded peremptory challenge restrictions to prevent discriminatory jury selection']",['Informational presentation of new laws without advocacy for or against'],moderate_impact,more_lenient,1,0,high_impact,more_lenient,1,0,not_addressed,unclear,not_addressed,not_addressed,not_addressed,not_addressed,high,not_mentioned,yes,clearly_new_policy,informational,"This training document provides prosecutors with an overview of new California laws effective January 1, 2021, focusing primarily on criminal justice reforms. The laws covered include the landmark California Racial Justice Act allowing challenges to prosecutions based on racial bias, significantly shortened probation periods, a tiered sex offender registration system replacing lifetime registration, enhanced juvenile protections requiring legal counsel consultation, and elimination of numerous criminal justice fees. While presented in a neutral, informational format for prosecutor training, the substance represents a comprehensive set of progressive criminal justice reforms aimed at reducing punishment severity and addressing systemic inequities.","[{'quote': ""A violation is established if 'the judge, an attorney in the case, a law enforcement office involved in the case, an expert witness, or the juror exhibited bias or animus towards the defendant because of the defendant's race, ethnicity or a national origin.'"", 'margin_type': 'extensive_margin', 'relevance': 'Shows implementation of racial justice protections that can challenge prosecutions'}, {'quote': 'The new probation period for most misdemeanors is one year and for felonies is two years', 'margin_type': 'intensive_margin', 'relevance': 'Demonstrates significant reduction in supervision periods'}, {'quote': 'Many fees that criminal defendants were required to pay have been eliminated... no attorneys fees can be assessed... eliminated other fees including city and jail booking fees, drug diversion progress report fees, home detention and electronic monitoring fees', 'margin_type': 'intensive_margin', 'relevance': 'Shows elimination of financial burdens on defendants'}]"
"2020.12.14_Alameda County_New Laws 2021, Pt.2.pdf",Alameda County,12/14/2020,2020-12-14,2020.0,training_material,case_law_update,"['diversion', 'juvenile', 'sentencing', 'victim_services']",neutral,0,0,0.0,neutral,high,"['expanded diversion programs', 'limitations on death penalty', 'enhanced protections for juvenile defendants', 'expungement opportunities', 'use immunity for sexual assault witnesses']","['expanded domestic violence enforcement tools', 'price gouging enhancements', 'informational tone without advocacy']",high_impact,more_lenient,1,0,moderate_impact,more_lenient,1,0,not_addressed,not_addressed,not_addressed,not_addressed,not_addressed,not_addressed,not_addressed,not_mentioned,unclear,informational,informational,"This document is a legal training presentation for prosecutors covering new California laws effective January 1, 2021. It provides detailed, neutral explanations of statutory changes including expanded diversion programs, enhanced juvenile protections, modified domestic violence laws, and various procedural updates. The document serves an educational function to ensure prosecutors understand new legal requirements they must follow, without advocating for particular policy positions or revealing office ideology.","[{'quote': 'These new Penal Code sections authorizes a judge, at his or her discretion, to offer diversion to a misdemeanor defendant, over the objection of the prosecutor.', 'margin_type': 'extensive', 'significance': 'Shows significant expansion of diversion authority beyond prosecutor control'}, {'quote': 'Upon successful completion of the terms, conditions, or programs ordered by the court pursuant to Section 1001.95, the arrest upon which diversion was imposed shall be deemed to have never occurred.', 'margin_type': 'extensive', 'significance': 'Demonstrates complete erasure of criminal justice contact for successful diversion participants'}, {'quote': 'Now the statute has been amended to raise the age of the minor from 15 to 17. The result is that this statute now applies to all minors, and no minor may undergo custodial interrogation or waive Miranda rights without first consulting with legal counsel.', 'margin_type': 'extensive', 'significance': 'Shows enhanced protections for juveniles that may limit prosecutorial ability to obtain statements'}]"
2021.02.01_Alameda County_Probation Retroactivty and the Williamson Rule.pdf,Alameda County,02/01/2021,2021-02-01,2021.0,training_material,case_law_update,"['sentencing', 'charging_decisions']",neutral,0,0,0.0,neutral,high,"['Detailed coverage of retroactive application of sentence reductions', 'Emphasis on rehabilitative rather than punitive aspects of probation', 'Recognition that shorter probation terms reduce incarceration risk']","['Neutral legal analysis without advocacy', 'Focus on proper legal procedures and charging decisions', 'Educational rather than reform-oriented framing']",moderate_impact,more_lenient,1,0,high_impact,more_lenient,1,0,not_addressed,unclear,not_addressed,not_addressed,not_addressed,not_addressed,not_addressed,not_mentioned,yes,informational,informational,"This document is a legal training material that provides prosecutors with updates on two key areas of criminal law: the retroactive application of AB 1950's reduced probation terms and the Williamson Rule governing charging decisions. The material takes a neutral, educational approach to explaining how recent court decisions require shorter probation periods and how the Williamson Rule constrains prosecutors to use specific rather than general statutes when both apply. While the content covers reforms that benefit defendants, the document's purpose is informational compliance rather than ideological advocacy.","[{'quote': 'Assembly Bill 1950 ensures that at least some probationers who otherwise would have been imprisoned for probation violations will remain violation-free and avoid incarceration.', 'margin_type': 'intensive_margin', 'relevance': 'Shows recognition of how reduced probation terms benefit those in the system'}, {'quote': 'Under the Williamson rule, if a general statute includes the same conduct as a special statute, the court infers that the Legislature intended that conduct to be prosecuted exclusively under the special statute.', 'margin_type': 'extensive_margin', 'relevance': 'Demonstrates constraints on charging decisions that typically favor less severe charges'}, {'quote': 'The longer a person is on probation, the potential for the person to be incarcerated due to a violation increases accordingly.', 'margin_type': 'intensive_margin', 'relevance': 'Acknowledges the punitive aspects of extended probation supervision'}]"
2021.03.22_Alameda County_Surveillance Video Suppression.pdf,Alameda County,03/22/2021,2021-03-22,2021.0,training_material,case_law_update,"['discovery', 'charging_decisions']",leans_traditional,0,1,-1.0,leans_traditional,medium,[],"['focus on maintaining arrests and prosecutions', 'detailed guidance on overcoming defense suppression motions', 'emphasis on law enforcement testimony and evidence']",moderate_impact,more_punitive,0,1,low_impact,not_applicable,0,0,not_addressed,not_addressed,not_addressed,not_addressed,not_addressed,not_addressed,not_addressed,not_mentioned,yes,continuation,strong_guidance,"This document is a training material from the Alameda County DA's office that provides detailed legal guidance on using surveillance video evidence to establish probable cause and overcome defense suppression motions. It analyzes the People v. Alexander case to teach prosecutors how to authenticate video evidence and support officer identification testimony, even when officers lack personal knowledge of the crimes. The document reflects a traditional prosecutorial approach focused on maintaining arrests and prosecutions through effective evidence presentation and legal argumentation.","[{'quote': ""The case of People v. Alexander concerns the use of photographs and video evidence at motions to suppress for the purpose of establishing probable cause for a defendant's arrest."", 'margin_type': 'extensive_margin', 'relevance': 'Shows focus on maintaining arrests through evidence preservation'}, {'quote': ""his testimony was a sufficient 'prima facie' showing of authenticity for purposes of the hearing on the motion to suppress"", 'margin_type': 'extensive_margin', 'relevance': 'Demonstrates guidance on meeting evidentiary standards to prevent case dismissal'}, {'quote': 'Because the surveillance videos viewed by Sergeant Maguire bore indicia of reliability and because those videos provided a sufficient basis for him to recognize appellants, the warrantless arrest of appellants was objectively reasonable under the Fourth Amendment', 'margin_type': 'extensive_margin', 'relevance': 'Illustrates successful prosecution strategy for maintaining arrests'}]"
2021.04.19_Alameda County_Humphrey Bail.pdf,Alameda County,04/19/2021,2021-04-19,2021.0,training_material,bail,"['case_law_update', 'racial_justice']",leans_progressive,1,0,1.0,leans_progressive,medium,"['Acknowledges racial disparities in pretrial detention', 'Presents bail reform favorably', 'Emphasizes constitutional problems with wealth-based detention', 'Highlights negative consequences of pretrial detention', 'Discusses alternatives to money bail positively']","['Emphasizes victim safety as primary consideration', 'Notes public safety concerns', 'Maintains that detention may be necessary in some cases', 'References Proposition 9 victim rights provisions']",high_impact,more_lenient,1,0,low_impact,not_applicable,0,0,not_addressed,yes,not_addressed,not_addressed,reform_oriented,not_addressed,moderate,not_mentioned,unclear,clearly_new_policy,informational,"This training document educates prosecutors about the California Supreme Court's unanimous decision in In re Humphrey, which declared wealth-based bail unconstitutional and established new requirements for individualized bail determinations. The document presents the decision's requirements for considering ability to pay and exploring non-financial alternatives to detention in a neutral-to-positive educational framework. While acknowledging traditional concerns about victim and public safety, the overall presentation suggests acceptance of bail reform as constitutionally required and potentially beneficial for addressing racial disparities and ineffective public safety outcomes in the current system.","[{'quote': 'The common practice of conditioning freedom solely on whether an arrestee can afford bail is unconstitutional.', 'margin_type': 'extensive', 'significance': 'Establishes the core constitutional principle driving bail reform'}, {'quote': 'Black adults in San Francisco are 11 times more likely as White adults to be booked into County Jail prior to trial.', 'margin_type': 'extensive', 'significance': 'Highlights racial disparities in pretrial detention that the reform addresses'}, {'quote': 'some people currently in California jails who are safe to be released are held in custody solely because they lack the financial resources for a commercial bail bond, and other people who may pose a threat to public safety have been able to secure their release from jail simply because they could afford to post a commercial bond.', 'margin_type': 'extensive', 'significance': 'Illustrates the fundamental unfairness and public safety problems with wealth-based bail systems'}]"
2021.08.23_Alameda County_DUI Diversion.pdf,Alameda County,08/23/2021,2021-08-23,2021.0,training_material,case_law_update,"['diversion', 'prosecutorial_conduct', 'criminal_procedure']",leans_progressive,1,0,1.0,leans_progressive,medium,"['Detailed analysis of expanded diversion eligibility', ""Recognition that legislative intent shifted from punishment to 'treat, restore and rehabilitate'"", 'Educational focus on procedural protections and prosecutorial misconduct', 'Neutral presentation of court decisions favoring diversion expansion']","['Presents both sides of DUI diversion debate without clear advocacy', 'Includes prosecutorial arguments against diversion expansion', 'Focus on proper legal procedures and case law analysis']",high_impact,more_lenient,1,0,low_impact,neutral,0,0,unclear,unclear,not_addressed,not_addressed,not_addressed,not_addressed,moderate,not_mentioned,unclear,informational,informational,"This training document provides legal education on recent case law, focusing heavily on new misdemeanor diversion options under Penal Code section 1001.95 and their potential application to DUI cases. The document presents a detailed analysis of conflicting court decisions about whether DUI offenses are eligible for court-initiated diversion over prosecutorial objection. Additionally, it covers prosecutorial misconduct issues and procedural requirements from People v. Roberts, emphasizing proper legal procedures and constitutional protections. The overall tone is educational and analytical rather than directive, suggesting a focus on legal compliance and awareness of expanding diversion options.","[{'quote': ""In the present day, however, it is just as clear that the Legislature's purpose in enacting section 1001.95 was to treat, restore and rehabilitate."", 'margin_type': 'extensive_margin', 'significance': 'Shows recognition of shift from punitive to rehabilitative approach in diversion policy'}, {'quote': 'These new Penal Code sections authorize a judge, at his or her discretion, to offer diversion to a misdemeanor defendant, over the objection of the prosecutor.', 'margin_type': 'extensive_margin', 'significance': 'Highlights expansion of judicial discretion in diversion decisions, reducing prosecutorial control'}, {'quote': ""It is 'well settled' that it is misconduct to base argument on facts not in evidence."", 'margin_type': 'intensive_margin', 'significance': 'Educational emphasis on proper prosecutorial conduct and procedural fairness'}]"
2021.09.22_Alameda County_Certificate of Rehabilitation of Pardons.pdf,Alameda County,09/22/2021,2021-09-22,2021.0,procedure_manual,administrative,"['rehabilitation', 'clemency']",leans_progressive,1,0,1.0,leans_progressive,medium,"['rehabilitation focus', 'reintegration support', 'post-conviction relief facilitation', 'comprehensive assessment of life changes']","['thorough background investigation', 'detailed scrutiny of past conduct', 'emphasis on accountability']",high_impact,more_lenient,1,0,not_applicable,not_applicable,0,0,not_addressed,unclear,not_addressed,not_addressed,not_addressed,not_addressed,not_addressed,not_mentioned,yes,unclear,mandatory,"This document is a comprehensive personal history questionnaire for individuals seeking certificates of rehabilitation and pardons in Alameda County. It represents a structured approach to post-conviction relief that balances thorough investigation with accessibility to the rehabilitation process. The document facilitates reintegration by providing a clear pathway for individuals to restore their rights and reduce collateral consequences of past convictions. While maintaining accountability through detailed background checks, it demonstrates a commitment to second chances and criminal justice reform.","[{'quote': 'Explain why you want a certificate of rehabilitation and pardon', 'relevance': ""Shows the office's willingness to consider individual circumstances and motivations for rehabilitation"", 'margin_type': 'extensive'}, {'quote': 'You may submit any letters of recommendation you can obtain or any other information which may be of value to the court in arriving at a decision in your case', 'relevance': 'Demonstrates openness to community support and character evidence in rehabilitation decisions', 'margin_type': 'extensive'}, {'quote': ""SHOULD YOU HAVE ANY QUESTIONS REGARDING THIS PERSONAL HISTORY QUESTIONNAIRE, PLEASE CONTACT THE DISTRICT ATTORNEY'S OFFICE"", 'relevance': 'Shows accessibility and support for individuals navigating the rehabilitation process', 'margin_type': 'extensive'}]"
Alameda County_ACDA Parole Hearing Policy.pdf,Alameda County,,,,policy_memo,sentencing,"['racial_justice', 'administrative']",clearly_progressive,1,0,2.0,clearly_progressive,high,"['Presumptive non-opposition to parole for low-risk offenders', 'Explicit rejection of crime severity alone as basis for parole opposition', 'Focus on current dangerousness rather than punishment', 'Commitment to data collection on racial disparities', 'Policy evaluation based on mass incarceration impact', 'Resentencing consideration when parole is inappropriately denied']",['Maintains opposition when evidence shows current unreasonable risk'],low_impact,not_applicable,0,0,high_impact,more_lenient,1,0,not_addressed,yes,not_addressed,not_addressed,not_addressed,not_addressed,moderate,not_mentioned,yes,clearly_new_policy,mandatory,"This policy directive establishes a progressive framework for the Alameda County DA's participation in parole hearings, creating presumptions against opposing parole for low-risk offenders and explicitly rejecting crime severity alone as justification for continued incarceration. The policy prioritizes current dangerousness over retribution and commits to data collection on racial disparities and mass incarceration impacts. It represents a significant shift toward evidence-based, reform-oriented prosecution practices in post-conviction proceedings.","[{'quote': ""The Alameda County District Attorney's Office only opposes a grant of parole where the evidence indicates the person would pose a current unreasonable risk to the community if released. The facts of the crime, no matter how extreme, cannot alone be the basis of an opposition to parole."", 'margin_type': 'intensive', 'significance': 'Establishes progressive framework rejecting purely punitive approach'}, {'quote': ""It is the policy of the Alameda County District Attorney's Office to presumptively not oppose release in a parole hearing in the following categories of cases: People rated as a low risk on their Comprehensive Risk Assessment (CRA)"", 'margin_type': 'intensive', 'significance': 'Creates presumption favoring release based on evidence-based risk assessment'}, {'quote': ""The data will be analyzed to evaluate this policy's impact on public safety, mass incarceration and racial disparities. This policy will be periodically reevaluated based on these factors."", 'margin_type': 'intensive', 'significance': 'Demonstrates commitment to addressing systemic issues and evidence-based policy making'}]"
2013.06.10_Amador County_Batson-Wheeler Guide.pdf,Amador County,06/10/2013,2013-06-10,2013.0,training_material,case_law_update,"['racial_justice', 'procedure_manual']",neutral,0,0,0.0,neutral,high,"['Addresses racial discrimination in jury selection', 'Provides guidance on protecting cognizable groups including sexual orientation']","['Focuses on helping prosecutors defend their peremptory challenges', 'Provides extensive justifications for excluding jurors', 'Emphasizes that defense has burden of proof']",not_applicable,not_applicable,0,0,moderate_impact,neutral,0,0,not_addressed,not_addressed,not_addressed,not_addressed,not_addressed,not_addressed,moderate,not_mentioned,unclear,unclear,strong_guidance,"This is a technical training document on Batson-Wheeler jury selection procedures, created by an Orange County prosecutor for educational purposes. It provides comprehensive guidance on the three-prong test for challenging discriminatory jury selection, including legal standards, case law, and practical justifications for peremptory challenges. The document takes a neutral, procedural approach to addressing racial discrimination in jury selection while helping prosecutors defend their jury selection decisions within legal bounds.","[{'quote': 'Give your justifications even if prima facie showing is not made (necessary for appellate review)', 'margin_type': 'intensive_margin', 'significance': 'Shows focus on protecting prosecutorial decisions from appellate reversal'}, {'quote': ""Protected groups: 'race, color, religion, sex, national origin, sexual orientation, or similar grounds.' (CCP § 231.5)"", 'margin_type': 'intensive_margin', 'significance': 'Acknowledges broad protection against discrimination including sexual orientation'}, {'quote': 'Defense has ultimate burden of proof... Defense must show purposeful discrimination by a preponderance of the evidence', 'margin_type': 'intensive_margin', 'significance': 'Emphasizes legal standards that favor prosecution in discrimination challenges'}]"
2018.05_Amador County_Responding to Batson-Wheeler Presentation.pdf,Amador County,05/18/2025,2025-05-18,2025.0,training_material,case_law_update,"['racial_justice', 'administrative']",neutral,0,0,0.0,neutral,high,"['Acknowledges racial justice concerns in jury selection', 'Recognizes discriminatory potential in peremptory challenges', 'Discusses protection of cognizable groups including sexual orientation, disability, age']","['Focuses on helping prosecutors defend their jury selection practices', 'Provides strategies to overcome Batson challenges', ""Emphasizes prosecutor's ability to maintain peremptory challenges""]",not_applicable,not_applicable,0,0,moderate_impact,neutral,0,0,not_addressed,not_addressed,not_addressed,not_addressed,not_addressed,not_addressed,moderate,Tori Verber Salazar,yes,unclear,strong_guidance,"This training document provides San Joaquin County prosecutors with comprehensive guidance on responding to Batson/Wheeler challenges during jury selection. The material covers legal frameworks, strategic tips for defending peremptory challenges, and procedural requirements for avoiding discriminatory jury selection. While acknowledging anti-discrimination principles, the document's primary focus is helping prosecutors maintain their jury selection practices within legal bounds rather than promoting prosecutorial reform.","[{'quote': ""Group Bias: The presumption 'that certain jurors are biased merely because they are members of an identifiable group distinguished on racial, religious, ethnic, or similar grounds'"", 'margin_type': 'intensive', 'relevance': 'Acknowledges discriminatory potential in jury selection'}, {'quote': ""Don't wait for D; make your own Comp. Analysis argument, or App. Ct. will draw judgment on an artificially short record"", 'margin_type': 'intensive', 'relevance': 'Provides strategic guidance for prosecutors to defend jury selection'}, {'quote': ""We use the term 'prosecutorial error' rather than the at times misleading term 'prosecutorial misconduct,' because we are not concerned with the prosecutor's culpable mental state, but with the lawfulness of the reasons given"", 'margin_type': 'intensive', 'relevance': 'Frames discriminatory jury selection as technical error rather than misconduct'}]"
2018_Amador County_New Laws for 2018.pdf,Amador County,01/01/2018,2018-01-01,2018.0,training_material,case_law_update,"['juvenile', 'administrative']",neutral,0,0,0.0,neutral,medium,['Enhanced protections for juveniles requiring mandatory legal counsel consultation'],"['Expanded jurisdiction for serious sex crimes against children', 'Focus on procedural efficiency in prosecution']",moderate_impact,more_lenient,1,0,low_impact,neutral,0,0,not_addressed,not_addressed,not_addressed,not_addressed,not_addressed,not_addressed,not_addressed,not_mentioned,unclear,clearly_new_policy,informational,"This document is a legal reference compilation of new California criminal laws effective in 2018, prepared by an external legal publisher rather than the prosecutor's office itself. It covers three main areas: expanded multi-county jurisdiction for certain serious crimes including child sexual abuse, liberalized voir dire procedures for jury selection, and new protections for juveniles requiring mandatory legal counsel consultation before custodial interrogation for youth 15 and under. The document serves as an informational resource for legal practitioners rather than expressing prosecutorial policy preferences.","[{'quote': 'Prior to a custodial interrogation, and before the waiver of any Miranda rights, a youth 15 years of age or younger shall consult with legal counsel in person, by telephone, or by video conference. The consultation may not be waived.', 'margin_type': 'extensive_margin', 'significance': 'Mandatory juvenile protection that could impact charging decisions'}, {'quote': 'The trial judge shall permit liberal and probing examination calculated to discover bias or prejudice with regard to the circumstances of the particular case or the parties.', 'margin_type': 'intensive_margin', 'significance': 'Procedural change affecting trial conduct'}, {'quote': 'when more than one violation of [PC 273a, 273.5, or 646.9] occurs in more than one [county], jurisdiction [i.e., venue] for any of those offenses and any other properly joinable offenses may be in any jurisdiction where at least one of the offenses occurred', 'margin_type': 'extensive_margin', 'significance': 'Expanded prosecutorial options for serious crimes'}]"
2022_Amador County_New Jury Voir Dire and Wheeler-Batson Rules.pdf,Amador County,01/01/2022,2022-01-01,2022.0,training_material,racial_justice,"['case_law_update', 'discovery', 'charging_decisions', 'sentencing']",clearly_progressive,1,0,2.0,clearly_progressive,high,"['Comprehensive racial justice focus', 'Implicit bias recognition and training', 'Restrictions on prosecutorial language and conduct', 'Extensive post-conviction remedies', 'Statistical analysis requirements for disparate outcomes', 'People-first language advocacy']","['Concerns about constitutional due process violations', 'Emphasis on maintaining prosecutorial effectiveness', 'Warnings about defense exploitation of new rules']",high_impact,more_lenient,1,0,high_impact,more_lenient,1,0,not_addressed,unclear,not_addressed,not_addressed,not_addressed,not_addressed,high,not_mentioned,yes,clearly_new_policy,mandatory,"This comprehensive training document explains implementation of California's Racial Justice Act (AB 2542) and new jury selection rules (AB 3070), both effective January 1, 2022. The materials provide extensive guidance on avoiding racially biased language and conduct, implementing statistical analysis to identify disparate outcomes, and handling the new legal remedies available for racial bias claims. The document represents a significant shift toward progressive criminal justice reform with strong emphasis on addressing both explicit and implicit racial bias in prosecution.","[{'quote': 'The state shall not seek or obtain a criminal conviction or seek, obtain, or impose a sentence on the basis of race, ethnicity, or national origin.', 'margin_type': 'both_margins', 'significance': 'Core principle of the Racial Justice Act'}, {'quote': 'Learn to use PEOPLE FIRST language (Person with a conviction vs Felon)', 'margin_type': 'intensive_margin', 'significance': 'Progressive language reform emphasis'}, {'quote': 'Implicit bias may be unintentional and unconscious but still requires remedy', 'margin_type': 'both_margins', 'significance': 'Recognition of unconscious bias requiring intervention'}]"
Amador County_101 Cases Every Prosecutor Should Know.pdf,Amador County,10/16/2017,2017-10-16,2017.0,training_material,case_law_update,"['charging_decisions', 'discovery', 'administrative']",neutral,0,0,0.0,neutral,high,"['Recognition of defendant rights', 'Emphasis on proper legal procedures']","['Focus on successful prosecution techniques', 'Compiled for prosecutor training']",low_impact,neutral,0,0,moderate_impact,neutral,0,0,not_addressed,not_addressed,not_addressed,not_addressed,not_addressed,not_addressed,low,not_mentioned,unclear,unclear,informational,"This document is a legal reference compilation titled '101 Cases Every Prosecutor Should Know' that provides foundational case law precedents for prosecutor training. It covers essential legal principles including defendant rights, jury procedures, and trial conduct requirements. The document serves as an educational tool focused on legal compliance and proper prosecutorial practice rather than advocating for specific policy positions. The content is neutral and procedural, emphasizing the importance of understanding both prosecution tools and defendant protections within established legal frameworks.","[{'quote': ""MOST, IF NOT All, ARE 'BASE' CASES, I.E. THEY STARTED AN IDEA, SUCH AS GIVING A MIRANDA WAIVER BEFORE GETTING A STATEMENT. BECAUSE THEY ARE 'BASE' CASES, MOST, IF NOT ALL, HAVE LARGE AMOUNTS OF CITING CASES THAT CARVE OUT EXCEPTIONS OR MAKE DISTICTIONS."", 'margin_type': 'intensive_margin', 'relevance': 'Shows educational focus on fundamental legal principles'}, {'quote': ""Use of peremptory challenges to remove juror's based on a group bias is improper... Even the excusal of one juror for impermissible reasons can require reversal."", 'margin_type': 'intensive_margin', 'relevance': 'Demonstrates attention to procedural fairness and anti-discrimination principles'}, {'quote': 'Instructions on lesser included offenses are required whenever evidence that the defendant is guilty only of the lesser offense is substantial enough to merit consideration by the jury.', 'margin_type': 'intensive_margin', 'relevance': 'Shows neutral presentation of legal requirements that protect defendant rights'}]"
Amador County_Article re Batson-Wheeler Motions by Patrick Whalen.pdf,Amador County,03/30/2022,2022-03-30,2022.0,training_material,case_law_update,"['racial_justice', 'procedure_manual']",mixed,0,0,0.0,mixed,medium,"['Strong emphasis on constitutional compliance and civil rights', 'Explicit prohibition on racial discrimination in jury selection', 'Reference to Fourteenth Amendment and civil war context', 'Training on avoiding racial bias']","['Focus on winning cases and avoiding appellate reversals', 'Strategic advice on defending peremptory challenges', 'Emphasis on prosecutor credibility and professional standing', 'Tactical guidance for trial advocacy']",low_impact,neutral,0,0,moderate_impact,neutral,0,0,not_addressed,not_addressed,not_addressed,not_addressed,not_addressed,not_addressed,moderate,not_mentioned,yes,unclear,mandatory,"This training document provides prosecutors with detailed guidance on handling Batson/Wheeler motions regarding discriminatory jury selection. While it mandates constitutional compliance and explicitly prohibits racial discrimination in peremptory challenges, it approaches the issue primarily from a strategic litigation perspective focused on avoiding appellate reversals. The document reflects a mixed ideological approach that combines civil rights compliance with traditional prosecutorial trial advocacy tactics.","[{'quote': 'To be clear: Do not exercise peremptory challenges based on race, ethnicity or gender. Our country fought a civil war in which almost a million people died and resulted in the Fourteenth Amendment being added to the Constitution - the same Constitution that prosecutors, as attorneys, took an oath to uphold. Do not violate it.', 'margin_type': 'intensive_margin', 'significance': 'Shows strong constitutional compliance mandate with historical context'}, {'quote': ""A prosecutor simply cannot respond to a Batson challenge by saying, 'But your Honor, I believe that all blacks distrust the criminal justice system.' Even if he or she honestly believes that to be true, that is not a proper basis for the exercise of a peremptory challenge."", 'margin_type': 'intensive_margin', 'significance': 'Explicitly prohibits racial stereotyping in jury selection'}, {'quote': 'Finally, when making an argument, it can sometimes be effective to explain to the court that to find a Batson violation, the court must find that the prosecutor is not only a racist, but also that he or she is lying to the court, right then and there, about the true reasons for the challenge.', 'margin_type': 'intensive_margin', 'significance': 'Reveals strategic approach to defending against discrimination claims'}]"
Amador County_Training List.pdf,Amador County,03/15/2022,2022-03-15,2022.0,training_material,administrative,"['case_law_update', 'victim_services', 'discovery']",unclear,0,0,,unclear,low,"['Answering the Call - Avoiding Bias in Prosecution', 'Eliminating Bias in Immigration Relief Litigation', 'Understanding Trauma and Juvenile Justice-Involved Youth']","['Officer-Involved Shooting Summit', 'Annual Asset Forfeiture Update Course', 'Charging and Prosecuting under California Firearms Laws', 'Kill Zone Theory Webinar']",low_impact,not_applicable,0,0,low_impact,not_applicable,0,0,not_addressed,not_addressed,not_addressed,not_addressed,not_addressed,not_addressed,low,not_mentioned,unclear,unclear,informational,"This document is a comprehensive training log for Amador County prosecutor's office from 2015-2021, listing professional development activities covering legal updates, case-specific skills, and procedural training. The training topics span a broad range from traditional prosecutorial tools like asset forfeiture and firearms law to more contemporary concerns like bias avoidance and trauma-informed practices. As an administrative record, it does not establish policy positions but may reflect the office's commitment to continuing education across diverse prosecutorial functions. The mixed nature of training topics makes it difficult to discern clear ideological leanings from this document alone.","['Answering the Call - Avoiding Bias in Prosecution (12/18/2020) - suggests some attention to bias issues in prosecution', 'Understanding Trauma and Juvenile Justice-Involved Youth (1/19/2021) - indicates training on trauma-informed approaches to juvenile cases', 'Annual Asset Forfeiture Update Course (multiple dates) - shows continued emphasis on asset forfeiture as a prosecutorial tool']"
2015.05_Contra Costa County_Wheeler Update.pdf,Contra Costa County,05/15/2025,2025-05-15,2025.0,training_material,case_law_update,"['racial_justice', 'administrative']",neutral,0,0,0.0,neutral,high,"['Acknowledges racial bias concerns in jury selection', 'Provides detailed guidance on avoiding discriminatory practices', 'Recognizes constitutional protections for minority jurors']","['Focuses on defending prosecutorial peremptory challenges', 'Provides strategies to justify jury strikes', ""Emphasizes prosecutor's duty to 'select the best jury possible for this case'""]",low_impact,neutral,0,0,moderate_impact,neutral,0,0,not_addressed,not_addressed,not_addressed,not_addressed,not_addressed,not_addressed,moderate,not_mentioned,yes,continuation,strong_guidance,"This is a comprehensive training document on Wheeler motion procedures, which challenge discriminatory jury selection practices. The document provides detailed guidance to prosecutors on how to defend their peremptory challenges while complying with constitutional anti-discrimination requirements. It takes a procedurally neutral approach, emphasizing both legal compliance and prosecutorial effectiveness in jury selection, without advocating for broader criminal justice reforms or traditional tough-on-crime policies.","[{'quote': ""DO NOT Wheeler them just because they Wheeler'ed you – that is not constitutionally permissible"", 'margin_type': 'intensive_margin', 'significance': 'Shows commitment to constitutional compliance over retaliatory practices'}, {'quote': 'you have a duty to the People of the State to ensure we select the best jury possible for this case', 'margin_type': 'intensive_margin', 'significance': 'Emphasizes prosecutorial duty to be effective within legal bounds'}, {'quote': ""The purpose of a hearing on a Wheeler/Baston motion is not to test the prosecutor's memory but to determine whether the reasons given are genuine and race neutral"", 'margin_type': 'intensive_margin', 'significance': 'Acknowledges the anti-discrimination purpose of Wheeler procedures'}]"
2015.10.15_Contra Costa County_Panel Session re Juvenile Justice Materials.pdf,Contra Costa County,10/15/2015,2015-10-15,2015.0,training_material,juvenile,"['racial_justice', 'charging_decisions', 'diversion']",clearly_progressive,1,0,2.0,clearly_progressive,high,"['explicit focus on racial justice and addressing disparities', 'strong advocacy for diversion programs', 'emphasis on alternatives to prosecution', 'critique of criminalizing normal adolescent behavior', 'call for community-based alternatives', 'emphasis on implicit bias training and awareness', 'opposition to punitive responses to youth of color']","[""acknowledgment of legitimate prosecutorial concerns about victims' rights and public safety""]",high_impact,more_lenient,1,0,moderate_impact,more_lenient,1,0,yes,yes,not_addressed,not_addressed,not_addressed,opposes_transfer,high,not_mentioned,unclear,unclear,informational,"This document is training material for a juvenile justice panel session that includes an academic article advocating for progressive prosecutorial reform. The primary focus is on addressing racial disparities in juvenile charging decisions by encouraging prosecutors to divert youth of color from formal prosecution for behaviors that would typically be handled informally for white youth. The material emphasizes the importance of applying developmental psychology research equitably across racial lines and calls for community-based alternatives to prosecution, representing a clearly progressive approach to juvenile justice reform.","[{'quote': 'Professor Henning implores juvenile prosecutors to resist external pressures to respond punitively to exaggerated perceptions of threat by youth of color and envisions a path toward structured decision making at the charging phase', 'margin_type': 'extensive_margin'}, {'quote': 'prosecutors have a duty to evaluate and respond to that behavior with the same developmentally appropriate options that are so often available to white youth', 'margin_type': 'extensive_margin'}, {'quote': 'Part III seeks to improve prosecutorial decision making and reduce the prosecution of youth of color for low- to midlevel offenses that would likely be excused or handled informally if they were committed by white youth in middle-class communities', 'margin_type': 'extensive_margin'}]"
2015_Contra Costa County_DUI Filings.pdf,Contra Costa County,01/01/2015,2015-01-01,2015.0,training_material,charging_decisions,"['enhancements', 'case_law_update', 'procedure_manual']",leans_traditional,0,1,-1.0,leans_traditional,high,[],"['Emphasis on maximizing enhancements and charges', 'Strategic timing to achieve felony convictions', 'Detailed guidance on escalating charges based on priors', 'Focus on punishment escalation rather than alternatives', 'No mention of diversion or alternative programs']",moderate_impact,neutral,0,0,high_impact,more_punitive,0,1,not_addressed,not_addressed,maximize,not_addressed,not_addressed,not_addressed,not_addressed,not_mentioned,yes,unclear,mandatory,"This is a comprehensive DUI prosecution training manual that provides detailed technical guidance on charging decisions, enhancements, and strategic case management. The document emphasizes maximizing charges and penalties through careful attention to prior convictions, enhancements, and tactical timing of prosecutions. While it includes standard legal procedures, the overall approach reflects a traditional prosecutorial philosophy focused on achieving the highest possible charges and sentences within legal parameters, with no discussion of alternative approaches or mitigation strategies.","[{'quote': 'make sure it is not a felony! Look at priors closely!', 'margin_type': 'intensive_margin', 'significance': 'Emphasizes careful examination to maximize charging potential'}, {'quote': ""WATCH OUT FOR DEFENDANTS WITH MORE THAN ONE OPEN 'THIRD' In this situation, if one of them pleads, the remaining open case becomes the fourth dui and CAN BECOME A FELONY if we so file it."", 'margin_type': 'intensive_margin', 'significance': 'Strategic approach to timing prosecutions for maximum penalty enhancement'}, {'quote': 'you obviously can amend the fourth case to a felony ONCE THE DEFENDANT PLEADS to the pending third case', 'margin_type': 'intensive_margin', 'significance': 'Tactical guidance for escalating charges through strategic case management'}]"
2016_Contra Costa County_Filing Protocols.pdf,Contra Costa County,01/01/2016,2016-01-01,2016.0,procedure_manual,administrative,"['discovery', 'charging_decisions']",neutral,0,0,0.0,neutral,high,['mentions pre-plea diversion eligibility checklist'],"['emphasis on victim restitution', 'detailed evidence collection requirements', 'focus on successful prosecution']",low_impact,neutral,0,0,low_impact,neutral,0,0,yes,unclear,not_addressed,not_addressed,not_addressed,not_addressed,not_addressed,Mark A. Peterson,yes,modification,mandatory,"This document is a comprehensive procedural manual establishing filing protocols for felony cases in Contra Costa County. It mandates detailed evidence collection requirements, establishes timelines for prosecutorial decisions, and emphasizes victim restitution. While primarily administrative, it includes provisions for diversion programs and systematic case review processes, reflecting standard prosecutorial practices focused on thorough case preparation and timely decision-making.","[{'quote': 'Agencies must inquire during investigation about restitution owed to victims of ALL crime. The California Constitution guarantees victims restitution on all cases.', 'margin_type': 'intensive_margin', 'significance': 'Shows emphasis on victim compensation'}, {'quote': ""All attorneys are responsible for reviewing assigned cases within 30 days of login, and all cases must be filed, RTA'd, or NCF'd during that time period."", 'margin_type': 'extensive_margin', 'significance': 'Establishes timeline for charging decisions'}, {'quote': 'Completed Pre-Plea Diversion Eligibility Checklist [PC 1001 et seq.]', 'margin_type': 'extensive_margin', 'significance': 'Indicates consideration of diversion alternatives'}]"
2016_Contra Costa County_Misdemanor Domestic Violence Training.pdf,Contra Costa County,01/01/2016,2016-01-01,2016.0,training_material,charging_decisions,"['case_guidance', 'victim_services']",neutral,0,0,0.0,neutral,high,"['evidence-based prosecution methodology', 'systematic approach to case evaluation']","['emphasis on prosecution when evidence supports it', 'focus on overcoming presumption of innocence', 'detailed corroboration requirements']",high_impact,neutral,0,0,low_impact,not_applicable,0,0,not_addressed,not_addressed,not_addressed,not_addressed,not_addressed,not_addressed,not_addressed,Diana Becton,yes,unclear,mandatory,"This training document establishes evidence-based prosecution standards for domestic violence cases in Contra Costa County under DA Diana Becton. The policy requires sufficient admissible evidence to support conviction regardless of victim cooperation or preferences, emphasizing corroboration and systematic evidence evaluation. The approach represents a technocratic, legally-grounded methodology that prioritizes prosecutorial standards over ideological considerations, focusing on what can be proven rather than victim desires or defendant characteristics.","[{'quote': ""If evidence sufficiently supports prosecution, case is filed even if victim is uncooperative / doesn't want to 'press charges'. If evidence does not, no case filed – even if victim desires prosecution"", 'margin_type': 'extensive', 'significance': 'Establishes evidence-based rather than victim-preference based charging decisions'}, {'quote': ""We can't file criminal charges or permit such charges to remain pending in the absence of sufficient admissible evidence to support a conviction"", 'margin_type': 'extensive', 'significance': 'Sets high evidentiary standard for charging decisions'}, {'quote': ""'He-said' / 'She-said' cases can't get filed – Presumption of innocence requires not guilty verdict. Can't do 'bad guy' filings"", 'margin_type': 'extensive', 'significance': 'Emphasizes evidence requirements over prosecutorial discretion based on defendant characteristics'}]"
2016_Contra Costa County_Misdemanor Filings.pdf,Contra Costa County,01/01/2016,2016-01-01,2016.0,training_material,charging_decisions,"['diversion', 'enhancements', 'case_guidance', 'procedure_manual']",leans_traditional,0,1,-1.0,leans_traditional,high,"['Corrective Solutions pre-filing diversion program', 'Post-plea diversion eligibility considerations', 'Emphasis on restitution to victims', 'Consideration of defendant background and equities']","['Extensive enhancement filing guidance', 'Detailed prior conviction usage instructions', 'Multiple charge filing strategies', 'Strong emphasis on provability and conviction rates', 'Comprehensive guidance on maximizing available charges', 'Focus on accountability and deterrence']",high_impact,mixed,0,0,high_impact,more_punitive,0,1,yes,unclear,maximize,not_addressed,not_addressed,not_addressed,not_addressed,Mark Peterson,yes,continuation,mandatory,"This is a comprehensive training manual for misdemeanor prosecutors in Contra Costa County, providing detailed guidance on charging decisions, case evaluation, and filing procedures. The document emphasizes evidence-based charging decisions while providing extensive instruction on maximizing available charges and enhancements where legally supported. It includes both progressive elements like pre-filing diversion programs and traditional prosecutorial approaches focused on thorough case preparation and appropriate charge filing. The manual reflects a professional, systematic approach to prosecution that balances prosecutorial discretion with accountability for criminal conduct.","[{'quote': ""District Attorney's Filing Standard: Based on what is before you, can you prove this case to 12 members of the community beyond a reasonable doubt?"", 'margin_type': 'extensive', 'significance': 'Establishes the core charging standard'}, {'quote': ""No 'Bad Guy' Filings – don't file a bad case just because: Defendant's record shows he's a 'bad guy' / has lots of priors; The victim has significant injuries; The victim called and demanded filing"", 'margin_type': 'extensive', 'significance': 'Shows restraint in charging decisions based on evidence rather than external pressure'}, {'quote': 'Always order the police reports behind any prior theft offense. This has tremendous value as non-propensity evidence of intent, common plan or scheme, lack of mistake, ID, etc.', 'margin_type': 'intensive', 'significance': 'Demonstrates systematic approach to using prior convictions to strengthen cases'}]"
2017_Contra Costa County_Misdemanor Domestic Violence Training.pdf,Contra Costa County,01/01/2017,2017-01-01,2017.0,training_material,charging_decisions,"['case_guidance', 'victim_services']",neutral,0,0,0.0,neutral,high,"['evidence_based_prosecution_as_best_practice', 'systematic_approach_over_victim_preference']","['emphasis_on_prosecution_when_evidence_supports', 'detailed_corroboration_requirements', 'reference_to_prior_violence_evidence']",high_impact,neutral,0,0,low_impact,not_applicable,0,0,not_addressed,not_addressed,not_addressed,not_addressed,not_addressed,not_addressed,not_addressed,Diana Becton,yes,unclear,mandatory,"This training document establishes evidence-based prosecution standards for domestic violence cases in Contra Costa County under DA Diana Becton. The policy requires charging decisions to be based solely on evidence sufficiency rather than victim cooperation or preferences, representing a systematic approach to domestic violence prosecution. The document provides detailed guidance on corroboration requirements and evidence collection, emphasizing professional prosecutorial standards over discretionary considerations. While adopting evidence-based prosecution as a best practice, the overall approach appears neutral rather than clearly progressive or traditional in orientation.","[{'quote': ""If evidence sufficiently supports prosecution, case is filed even if victim is uncooperative / doesn't want to 'press charges'. If evidence does not, no case filed – even if victim desires prosecution"", 'margin_type': 'extensive', 'significance': 'Establishes evidence-based charging standard independent of victim preferences'}, {'quote': ""'He-said' / 'She-said' cases can't get filed – Presumption of innocence requires not guilty verdict. Can't do 'bad guy' filings"", 'margin_type': 'extensive', 'significance': 'Sets clear evidentiary threshold against filing weak cases'}, {'quote': ""We can't file criminal charges or permit such charges to remain pending in the absence of sufficient admissible evidence to support a conviction"", 'margin_type': 'extensive', 'significance': 'Establishes fundamental prosecutorial standard based on legal sufficiency'}]"
2018.10_Contra Costa County_Requirements Prior to Rotation.pdf,Contra Costa County,07/05/2025,2025-07-05,2025.0,procedure_manual,administrative,['case_management'],unclear,0,0,,unclear,high,[],[],not_applicable,not_applicable,0,0,not_applicable,not_applicable,0,0,not_addressed,not_addressed,not_addressed,not_addressed,not_addressed,not_addressed,not_addressed,"Phyllis Redmond, Chief Assistant District Attorney",yes,unclear,mandatory,"This document is an administrative procedure manual from the Contra Costa County District Attorney's office outlining required steps for attorney office rotations. It covers logistical matters including equipment transfers, file management, case reassignments, and office cleanup procedures. The document is purely operational and contains no substantive prosecutorial policy guidance or ideological content. It reflects standard administrative practices for managing attorney transitions within the office.","['Complete all assigned tasks prior to rotation and discuss with your supervisor if any outstanding tasks need re-assignment', 'New case logins will stop two weeks prior to rotation day', 'All filings must be completed and submitted to clerical before you rotate']"
2018_Contra Costa County_Building Security Policy.pdf,Contra Costa County,01/01/2018,2018-01-01,2018.0,procedure_manual,administrative,"['security', 'building_access']",neutral,0,0,0.0,neutral,high,[],[],not_applicable,not_applicable,0,0,not_applicable,not_applicable,0,0,not_addressed,not_addressed,not_addressed,not_addressed,not_addressed,not_addressed,not_addressed,not_mentioned,yes,clearly_new_policy,mandatory,"This document establishes comprehensive building security procedures for the Contra Costa County District Attorney's Office, effective January 8, 2018. It details visitor access protocols for three office locations, including badge systems, escort requirements, and different procedures for civilians, peace officers, contractors, and grand jury participants. The policy mandates strict security measures including visitor logging, badge display requirements, and continuous employee escort of visitors in secured areas. This is purely an administrative security document with no implications for prosecutorial ideology or criminal justice policy positions.","[""All visitors entering ANY secured employee area need to be issued a Visitor's badge which must be visibly displayed at all times. This includes DA employee family members who are not working at our office."", 'Visitors shall not be allowed to wander around the secured areas of the buildings on their own and must be escorted by an employee the entire time they are in the secured employee area.', 'We all need to have an increased awareness and accountability for security. If you observe a visitor not displaying a visitor badge, displaying a badge for a different floor than the one they are on, walking through the building unescorted, etc., please politely contact the person and advise them of our procedures.']"
2018_Contra Costa County_Policy Regarding Trailing of Cooperative Personal Serve Witnesses.pdf,Contra Costa County,01/01/2018,2018-01-01,2018.0,policy_memo,administrative,"['victim_services', 'case_management']",neutral,0,0,0.0,neutral,high,[],[],low_impact,neutral,0,0,low_impact,neutral,0,0,not_addressed,not_addressed,not_addressed,not_addressed,not_addressed,not_addressed,not_addressed,Diana Becton,yes,clearly_new_policy,mandatory,"This document establishes a new administrative policy authorizing clerical staff to trail cooperative personal serve witnesses upon request from investigative or attorney staff. The policy clarifies that clerical staff should not make determinations about witness cooperation levels but should rely on representations from legal and investigative personnel. This is a purely procedural memo focused on internal office efficiency and workflow management, with no substantive impact on prosecutorial decision-making or ideological orientation. The policy reflects routine administrative management rather than criminal justice reform or enforcement philosophy.","[{'quote': 'Effective immediately, clerical staff is authorized to trail cooperative personal serve witnesses at the request of investigative or attorney staff.', 'relevance': 'Establishes the core administrative procedure - extensive margin impact minimal'}, {'quote': 'Clerical staff are not tasked with the responsibility of determining the level of cooperation of a personal serve witness; instead, they should rely upon the representations of the investigative or attorney staff for this determination.', 'relevance': 'Clarifies decision-making hierarchy and responsibility allocation - administrative focus'}, {'quote': ""The mission of the Contra Costa County District Attorney's Office Is to seek justice and enhance public safety for all our residents by fairly, ethically, aggressively and efficiently prosecuting those who violate the law, and by working to prevent crime."", 'relevance': ""Standard mission statement with balanced language including both 'fairly, ethically' and 'aggressively' - ideologically neutral""}]"
2019.03.01_Contra Costa County_Adult File Retention Policy.pdf,Contra Costa County,03/01/2019,2019-03-01,2019.0,procedure_manual,administrative,"['case_management', 'record_keeping']",unclear,0,0,,unclear,low,[],[],not_applicable,not_applicable,0,0,not_applicable,not_applicable,0,0,not_addressed,not_addressed,not_addressed,not_addressed,not_addressed,not_addressed,not_addressed,Diana Becton,yes,unclear,mandatory,"This document establishes mandatory file retention schedules for the Contra Costa County District Attorney's office under Diana Becton's administration, effective March 1, 2019. It specifies retention periods ranging from permanent retention for serious crimes like homicide and sexual assault to shorter periods for minor offenses and administrative matters. The policy is purely administrative in nature, focusing on record management rather than prosecutorial decision-making or ideological positions. The document reflects standard office-wide procedures for case file management and legal compliance requirements.","['Adult File Retention Policy Effective: March 1, 2019 From: Diana Becton, District Attorney', 'Homicide (charged) Do Not Destroy', 'Sexual Assault (charged) * see criteria Do Not Destroy']"
2019.03.22__Contra Costa County_Media Policy.pdf,Contra Costa County,03/22/2019,2019-03-22,2019.0,policy_memo,administrative,['victim_services'],neutral,0,0,0.0,neutral,medium,"['victim privacy protection', 'transparency commitment', 'justice-seeking motto']","['structured media control', 'hierarchical approval process']",not_applicable,not_applicable,0,0,not_applicable,not_applicable,0,0,not_addressed,not_addressed,not_addressed,not_addressed,not_addressed,not_addressed,not_addressed,Diana Becton,yes,clearly_new_policy,mandatory,"This document establishes a comprehensive media relations policy for the Contra Costa County District Attorney's Office under Diana Becton, effective March 2019. The policy emphasizes transparency, victim privacy protection, and coordinated communication through a Public Information Officer. While the document does not reveal specific prosecutorial ideological positions, it reflects a commitment to public accountability and victim-centered approaches to media relations. The policy appears to represent a new, structured approach to managing the office's public communications.","[{'quote': ""Our motto remains to 'seek justice, serve justice and do justice,' and this can only occur if we make sure that our statements to the media do not thwart that pursuit."", 'relevance': ""Illustrates the office's stated commitment to justice as guiding principle for media relations"", 'margin_type': 'not_applicable'}, {'quote': 'With any release of information or interview, we must keep our victims in mind. We must respect the privacy of our victims and ensure we work with our Victim Advocates.', 'relevance': 'Shows prioritization of victim privacy and rights in media communications', 'margin_type': 'not_applicable'}, {'quote': ""We will avoid 'no comment' as much as possible when dealing with a reporter."", 'relevance': 'Demonstrates commitment to transparency and public information sharing', 'margin_type': 'not_applicable'}]"
2019.03_Contra Costa County_PRA Protocol.pdf,Contra Costa County,03/19/2025,2025-03-19,2025.0,procedure_manual,administrative,"['discovery', 'transparency']",leans_progressive,1,0,1.0,leans_progressive,medium,"['transparency emphasis', 'commitment to public access', 'proactive assistance to requestors', 'comprehensive documentation requirements']","['protection of investigative records', 'exemption procedures']",not_applicable,not_applicable,0,0,not_applicable,not_applicable,0,0,not_addressed,not_addressed,not_addressed,not_addressed,not_addressed,not_addressed,not_addressed,Diana Becton,yes,clearly_new_policy,mandatory,"This document establishes comprehensive procedures for handling California Public Records Act requests in the Contra Costa County District Attorney's Office under Diana Becton's administration. The protocol emphasizes facilitating public access to records, requires detailed documentation and tracking of all requests, and mandates assistance to requestors while appropriately protecting exempt materials. The document reflects a commitment to transparency and accountability that suggests progressive administrative values, though it does not address prosecutorial decision-making policies directly.","[{'quote': ""The District Attorney's Office is committed to the public's access to nonexempt records, and this protocol establishes the internal process to insure compliance with these laws"", 'relevance': 'Demonstrates commitment to transparency and public accountability', 'margin_type': 'administrative'}, {'quote': 'If the request is vague, the PIO/DDA should ask for clarification, and assist the requestor when possible to make a focused request for a reasonably identifiable set of records', 'relevance': 'Shows proactive approach to facilitating public access rather than creating barriers', 'margin_type': 'administrative'}, {'quote': 'A requestor is not required to provide their identity in order to inspect or obtain public records, and they are not required to provide a reason for the request', 'relevance': 'Emphasizes broad public access rights without barriers', 'margin_type': 'administrative'}]"
2019.04__Contra Costa County_Wiretap Protocol.pdf,Contra Costa County,04/19/2025,2025-04-19,2025.0,procedure_manual,administrative,"['case_guidance', 'discovery']",neutral,0,0,0.0,neutral,high,"['public_safety_procedures', 'legal_compliance_emphasis']","['law_enforcement_coordination', 'evidence_gathering_focus']",not_applicable,not_applicable,0,0,low_impact,neutral,0,0,not_addressed,not_addressed,not_addressed,not_addressed,not_addressed,not_addressed,not_addressed,not_mentioned,yes,modification,mandatory,"This document establishes detailed procedural protocols for wiretap operations in Contra Costa County, defining roles and responsibilities for prosecutors and law enforcement throughout the wiretap process from initial planning through post-operation litigation. The protocol emphasizes legal compliance, proper documentation, and coordination between multiple parties including prosecutors, judges, and law enforcement agencies. It is purely administrative in nature, focusing on ensuring statutory requirements are met and evidence is properly handled, without expressing any ideological positions on prosecutorial philosophy or criminal justice policy.","[{'quote': 'If, during the course of the wiretap operation, the investigative team becomes aware of an imminent threat to an identified person, that threat will be immediately communicated to the Case Agent, Task Force Supervisor, the First Chair, and the Second Chair.', 'relevance': 'Shows procedural emphasis on public safety considerations', 'margin_type': 'administrative'}, {'quote': 'It is the responsibility of the First Chair to ensure that all technical requirements are met in the affidavit and any other related documents.', 'relevance': 'Demonstrates focus on legal compliance and procedural accuracy', 'margin_type': 'administrative'}, {'quote': 'The Second Chair will be responsible for initial preparation of the Ten-Day Reports... Once the Reports are drafted, the First Chair will review them prior to their being provided to the Judge.', 'relevance': 'Illustrates systematic oversight and quality control procedures', 'margin_type': 'administrative'}]"
2019_Contra Costa County_ File Retention Policy.pdf,Contra Costa County,01/01/2019,2019-01-01,2019.0,procedure_manual,juvenile,"['administrative', 'case_guidance']",unclear,0,0,,unclear,low,"['Allows destruction of certain juvenile records', 'Shorter retention periods for factual innocence cases']","['Permanent retention of serious offenses like WI 707(b)', 'Permanent retention of gang cases and sexual assault cases']",low_impact,not_applicable,0,0,low_impact,not_applicable,0,0,not_addressed,not_addressed,not_addressed,not_addressed,not_addressed,not_addressed,not_addressed,Diana Becton,yes,clearly_new_policy,mandatory,"This document establishes mandatory file retention and destruction policies for juvenile cases in Contra Costa County under DA Diana Becton, effective March 2019. The policy creates a tiered system where serious offenses, gang cases, and sexual assault cases are permanently retained, while other cases may be destroyed at specified intervals based on sealing status and the minor's age. The policy balances administrative efficiency with maintaining records for serious crimes, representing a structured approach to juvenile record management.","['WI 781.5 Sealing for Factual Innocence - Destroy after 3 years from the date of arrest or citation', 'WI 707(b) Offense - Do Not Destroy', 'Gang Cases - Do Not Destroy']"
2019_Contra Costa County_Batson-Wheeler Guide.pdf,Contra Costa County,01/01/2019,2019-01-01,2019.0,training_material,case_law_update,"['racial_justice', 'administrative']",neutral,0,0,0.0,neutral,high,"['Emphasis on preventing discriminatory jury selection', 'Detailed guidance on protecting constitutional rights of defendants', 'Recognition of racial bias concerns in jury selection']","[""Focus on prosecutor's duty to select best jury for the People"", 'Guidance on defending prosecutorial peremptory challenges', 'Emphasis on maintaining prosecutorial prerogatives within legal bounds']",low_impact,neutral,0,0,moderate_impact,neutral,0,0,not_addressed,not_addressed,not_addressed,not_addressed,not_addressed,not_addressed,moderate,not_mentioned,yes,unclear,strong_guidance,"This document is a comprehensive training guide for prosecutors on Batson/Wheeler jury selection procedures, focusing on constitutional compliance and avoiding discriminatory peremptory challenges. It provides detailed tactical guidance for prosecutors to defend their jury selection decisions while respecting defendants' rights to representative juries. The document emphasizes legal requirements rather than ideological positions, reflecting a neutral approach that balances prosecutorial prerogatives with constitutional protections. The guidance appears designed to prevent legal challenges and reversals while maintaining prosecutors' ability to select favorable juries within constitutional bounds.","[{'quote': ""DO NOT Wheeler them just because they Wheeler'ed you! –That is not constitutionally permissible."", 'margin_type': 'intensive_margin', 'significance': 'Emphasizes constitutional compliance over tactical retaliation'}, {'quote': 'you have a duty to the People of the State to ensure we select the best jury possible for this case', 'margin_type': 'intensive_margin', 'significance': 'Balances fair selection with prosecutorial duty'}, {'quote': ""The purpose of a hearing on a Wheeler/Baston motion is not to test the prosecutor's memory but to determine whether the reasons given are genuine and race neutral."", 'margin_type': 'intensive_margin', 'significance': 'Focuses on preventing discriminatory practices while protecting legitimate prosecutorial discretion'}]"
2019_Contra Costa County_Petty Cash Funds Policy.pdf,Contra Costa County,01/01/2019,2019-01-01,2019.0,procedure_manual,administrative,['victim_services'],unclear,0,0,,unclear,low,['witness_support_services'],[],not_applicable,not_applicable,0,0,low_impact,neutral,0,0,not_addressed,not_addressed,not_addressed,not_addressed,not_addressed,not_addressed,not_addressed,Diana Becton,yes,unclear,mandatory,"This document establishes administrative procedures for petty cash fund management across District Attorney office locations under Diana Becton's administration. The policy outlines approval processes, allowable expenditures (primarily witness support services like transportation and meals), and prohibited uses. While it demonstrates systematic support for witnesses through reimbursement of travel and meal expenses, the document is purely administrative and provides no insight into prosecutorial ideology or criminal justice policy positions.","[{'quote': 'BART, Bus or Train fare for witnesses', 'relevance': 'Shows administrative support for witness participation', 'margin_type': 'administrative'}, {'quote': 'Meals and/or mileage for witnesses* (Breakfast $5.00; Lunch $7.00; Dinner $11.00)', 'relevance': 'Demonstrates structured witness support with specific reimbursement amounts', 'margin_type': 'administrative'}, {'quote': 'The Petty Cash fund will not be used to reimburse the following expenses: Employee mileage, Employee bridge tolls, Employee parking expenses, Employee meals, Employee travel', 'relevance': 'Shows clear distinction between witness support and employee benefits', 'margin_type': 'administrative'}]"
2020.03.10_Contra Costa County_Announcing the Racial Justice Act.pdf,Contra Costa County,03/10/2020,2020-03-10,2020.0,general_memo,racial_justice,"['case_law_update', 'administrative']",unclear,0,0,,unclear,low,['racial_justice_focus'],[],high_impact,more_lenient,1,0,high_impact,more_lenient,1,0,not_addressed,not_addressed,not_addressed,not_addressed,not_addressed,not_addressed,not_addressed,Diana Becton,no,unclear,informational,"This document is an informational email from the California District Attorneys Association to Diana Becton announcing the introduction of AB 2200, the California Racial Justice Act. The bill would prohibit charging and sentencing decisions based on race, ethnicity, or national origin, effectively overturning the McCleskey Supreme Court ruling. The document is purely informational and does not express any position or advocacy regarding the proposed legislation.","[{'quote': 'Tomorrow, Assembly member Kalra is introducing AB 2200, a bill that would establish the California Racial Justice Act.', 'margin_type': 'informational', 'relevance': 'Identifies the legislative action being reported'}, {'quote': ""the bill, according to the author, is intended to undue the US Supreme Court's McCleskey ruling, thus essentially prohibiting the state from pursuing charges or sentencing based upon race, ethnicity or national origin"", 'margin_type': 'both_extensive_and_intensive', 'relevance': 'Describes the core impact on both charging and sentencing decisions'}]"
2020.03_Contra Costa County_CDAA Legislative Meeting Addendum.pdf,Contra Costa County,03/20/2025,2025-03-20,2025.0,general_memo,administrative,"['case_law_update', 'charging_decisions', 'sentencing', 'juvenile', 'racial_justice']",unclear,0,0,,unclear,low,['AB 2200 (Kalra) CA Racial Justice Act listed as discussion item'],"['Multiple bills related to enhancements, firearms, and traditional law enforcement priorities']",not_applicable,not_applicable,0,0,not_applicable,not_applicable,0,0,not_addressed,not_addressed,not_addressed,not_addressed,not_addressed,not_addressed,not_addressed,Diana Becton,no,unclear,informational,"This is an administrative email from the California District Attorneys Association distributing meeting materials and logistics for a March 2020 legislative meeting. The document provides links to agenda packets covering various bills under consideration, including topics ranging from racial justice to firearms to juvenile justice. The communication is purely logistical and does not express any policy positions or ideological orientation, serving only to coordinate attendance and provide meeting information to district attorneys statewide.","['Below are links to the addendum packet and the main agenda packet. Attached are the corresponding agenda table of contents.', 'AB 2200 (Kalra) CA Racial Justice Act', 'The meeting location is on the 4th floor of 1107 9th St. Sacramento. When you head out of the elevators, follow signs for Boardroom.']"
2020.04.30_Contra Costa County_CDAA Oppose List For Legislative Meeting.pdf,Contra Costa County,04/30/2020,2020-04-30,2020.0,policy_memo,administrative,"['charging_decisions', 'sentencing', 'bail', 'enhancements', 'three_strikes', 'juvenile', 'racial_justice']",clearly_traditional,0,1,-2.0,clearly_traditional,high,[],"['Opposition to bail reform', 'Opposition to enhancement reductions', 'Opposition to resentencing opportunities', 'Opposition to racial justice act retroactivity', 'Opposition to gang enhancement reforms', 'Opposition to juvenile record relief', 'Opposition to special circumstances dismissal authority', 'Alignment with law enforcement organizations against reform groups']",high_impact,more_punitive,0,1,high_impact,more_punitive,0,1,no,no,maximize,strict_enforcement,high_bail,not_addressed,low,Diana Becton,yes,continuation,informational,"This document is an internal CDAA memo coordinating opposition to 28 criminal justice reform bills in 2021, covering bail reform, sentencing reductions, enhancement limitations, and racial justice measures. The memo reveals a traditional prosecutorial ideology through systematic opposition to progressive reforms and strategic coordination with law enforcement organizations against civil rights and reform groups. The comprehensive nature of the opposition, spanning both extensive margin issues (who enters the system) and intensive margin issues (how severely they are treated), demonstrates a clear preference for maintaining tough-on-crime policies across all areas of criminal justice.","[{'quote': 'I put together and attached a list of bills that CDAA is opposing. 28 bills total.', 'margin_type': 'both', 'significance': 'Shows systematic opposition to reform legislation'}, {'quote': 'You will see that CDAA is often at odds with a laundry list of organizations on the other side. It paints a picture of what we are up against.', 'margin_type': 'both', 'significance': 'Reveals adversarial stance toward reform organizations and civil rights groups'}, {'quote': 'I identified which bills are a 2/3 vote, those bills have a better chance of being stopped.', 'margin_type': 'both', 'significance': 'Shows strategic focus on blocking reform legislation'}]"
2020.08.21_Contra Costa County_Weekly Legislative Update.pdf,Contra Costa County,08/21/2020,2020-08-21,2020.0,general_memo,case_law_update,"['racial_justice', 'administrative', 'discovery']",clearly_traditional,0,1,-2.0,clearly_traditional,high,['supports Brady disclosure requirements'],"['opposes peremptory challenge reform', 'opposes Racial Justice Act', 'celebrates death of mass dismissal bill', ""frames racial justice reforms as 'chicanery'"", 'prioritizes prosecutorial tools over reform']",moderate_impact,mixed,0,0,high_impact,more_punitive,0,1,not_addressed,not_addressed,not_addressed,not_addressed,not_addressed,not_addressed,low,Diana Becton,unclear,informational,informational,"This legislative update from the California District Attorneys Association informs prosecutors about key bills in the final week of the 2020 legislative session. The CDAA celebrates their Brady disclosure bill's progress while strongly opposing racial justice reforms including the Racial Justice Act (AB 2542) and peremptory challenge reform (AB 3070). The memo frames these progressive reforms as politically motivated 'chicanery' and requests prosecutors to lobby against them, reflecting a traditional prosecutorial ideology that prioritizes maintaining prosecutorial tools over addressing racial bias in the criminal justice system.","[{'quote': 'Unfortunately, many legislators have used the pandemic as something of a Trojan Horse to advance legislation that has circumvented the normal process of analysis and debate.', 'margin_type': 'general', 'significance': 'Frames progressive reforms negatively as circumventing proper process'}, {'quote': 'The bill is an extreme example of the kind of chicanery that has taken place this legislative session.', 'margin_type': 'intensive_margin', 'significance': ""Characterizes Racial Justice Act as 'chicanery' showing opposition to racial bias reforms""}, {'quote': 'This bill would make many peremptory challenges that are used every day by prosecutors presumptively invalid... The bill is a gate that swings one way with peremptories – against prosecutors.', 'margin_type': 'intensive_margin', 'significance': 'Shows concern about limiting prosecutorial tools in jury selection rather than addressing racial bias'}]"
2020.10.19_Contra Costa County_Racial Justice Act Digest.pdf,Contra Costa County,10/19/2020,2020-10-19,2020.0,general_memo,racial_justice,"['administrative', 'case_law_update']",leans_progressive,1,0,1.0,leans_progressive,medium,"['racial_justice_focus', 'proactive_training_on_racial_justice_issues']",[],high_impact,more_lenient,1,0,high_impact,more_lenient,1,0,not_addressed,not_addressed,not_addressed,not_addressed,not_addressed,not_addressed,high,not_mentioned,unclear,clearly_new_policy,informational,"This document is an informational memo from the California District Attorneys Association announcing the signing of AB 2542, the Racial Justice Act, and establishing resources for prosecutors to understand and implement the new law. The memo takes a proactive, collaborative approach by creating discussion forums and planning training sessions. While primarily administrative, it suggests a constructive engagement with racial justice reforms that will significantly impact both charging decisions and sentencing practices across California prosecutor offices.","[{'quote': 'Governor Newsom signed AB 2542, The Racial Justice Act, into law.', 'relevance': 'Identifies the new racial justice legislation that will impact both extensive and intensive margins'}, {'quote': 'CDAA has established a new Community on Sidebars so prosecutors can discuss questions and/or issues surrounding this new law.', 'relevance': 'Shows proactive engagement with racial justice issues rather than resistance'}, {'quote': 'CDAA is planning a training on the subject and we would appreciate your suggestion of a knowledgeable prosecutor to participate in this training.', 'relevance': 'Demonstrates commitment to education and proper implementation of racial justice reforms'}]"
2020.11.18_Contra Costa County_Racial Justice Act Digest.pdf,Contra Costa County,11/18/2020,2020-11-18,2020.0,training_material,racial_justice,"['administrative', 'case_law_update']",leans_progressive,1,0,1.0,leans_progressive,medium,"['racial justice focus', 'implicit bias training', 'emphasis on avoiding discriminatory conduct', 'proactive compliance training']",[],moderate_impact,more_lenient,1,0,moderate_impact,more_lenient,1,0,not_addressed,not_addressed,not_addressed,not_addressed,not_addressed,not_addressed,high,not_mentioned,unclear,clearly_new_policy,informational,"This document announces a training session for prosecutors on AB 2542 (Racial Justice Act), focusing on bias avoidance and compliance with new racial justice legislation. The training aims to educate prosecutors on identifying and preventing discriminatory conduct, providing remedies for violations, and implementing best practices. While primarily administrative in nature, the document reflects a progressive orientation toward racial justice reform in prosecution, though it stops short of establishing specific policy positions on most prosecutorial practices.","[{'quote': 'This two-hour session will introduce prosecutors to AB 2542, discussing its parameters, the remedies available for violations, best practices for compliance, and the mechanics involved in proving or disproving discriminatory conduct.', 'margin_type': 'both extensive and intensive', 'relevance': 'Shows focus on compliance with racial justice legislation'}, {'quote': 'Answering the Call-Avoiding Bias in Prosecution', 'margin_type': 'both extensive and intensive', 'relevance': 'Title emphasizes bias avoidance as core training objective'}]"
2020.11.23_Contra Costa County_Racial Justice Digest.pdf,Contra Costa County,11/23/2020,2020-11-23,2020.0,training_material,racial_justice,"['administrative', 'case_law_update']",leans_progressive,1,0,1.0,leans_progressive,medium,"['implicit bias training', 'racial justice focus', 'compliance with anti-discrimination legislation']",['training provided through traditional prosecutorial association'],moderate_impact,more_lenient,1,0,moderate_impact,more_lenient,1,0,not_addressed,not_addressed,not_addressed,not_addressed,not_addressed,not_addressed,high,not_mentioned,yes,clearly_new_policy,strong_guidance,"This document is a training announcement from the California District Attorneys Association promoting a webinar on AB 2542, the Racial Justice Act, focused on helping prosecutors avoid bias in their work. The training represents a proactive institutional response to new legislation requiring prosecutors to examine and prevent discriminatory conduct in charging, plea negotiations, and sentencing recommendations. While delivered through traditional prosecutorial channels, the emphasis on racial justice and bias prevention indicates a progressive shift in prosecutorial training priorities. The document suggests offices are adapting to new legal requirements that could significantly impact both charging decisions and case outcomes.","[{'quote': 'This two-hour session will introduce prosecutors to AB 2542, discussing its parameters, the remedies available for violations, best practices for compliance, and the mechanics involved in proving or disproving discriminatory conduct.', 'margin_type': 'both extensive and intensive', 'relevance': 'Shows comprehensive approach to addressing racial bias across all prosecutorial decisions'}, {'quote': 'Answering the Call-Avoiding Bias in Prosecution', 'margin_type': 'both extensive and intensive', 'relevance': 'Title emphasizes proactive stance on eliminating prosecutorial bias'}]"
2020.12.07_Contra Costa County_New Laws Training.pdf,Contra Costa County,12/07/2020,2020-12-07,2020.0,case_guidance,racial_justice,"['discovery', 'juvenile', 'case_law_update']",leans_traditional,0,1,-1.0,leans_traditional,medium,['acknowledgment of Racial Justice Act requirements'],"['seeking juvenile transfer to adult court', 'opposing racial bias discovery', 'emphasizing gang allegations', 'focusing on severity of charges']",moderate_impact,neutral,0,0,high_impact,more_punitive,0,1,not_addressed,no,maximize,not_addressed,not_addressed,supports_transfer,low,Diana Becton,unclear,unclear,informational,"This document is a prosecutor's opposition to a defense discovery motion under California's Racial Justice Act in a juvenile murder case. The prosecutor is seeking to transfer the juvenile defendant to adult court while opposing defense requests for statistical data about racial disparities in transfer decisions. The document demonstrates a traditional prosecutorial approach by emphasizing the severity of gang-related murder charges and taking an adversarial stance against racial bias discovery, though it operates within the framework of acknowledging racial justice legal requirements.","[{'quote': ""The defendant must allege a violation based upon good cause. At this juncture, the defendant has not established good cause to believe there is implicit or explicit bias regarding the prosecution's request to transfer the defendant's matter to adult court."", 'margin_type': 'intensive_margin', 'significance': 'Shows prosecutor opposing racial bias discovery in juvenile transfer decision'}, {'quote': 'Here, the defense has not established good cause and instead speculates about a hopeful violation or bias. The defense cannot accuse the prosecution of bias and then request statistics in the hope the accusation holds water.', 'margin_type': 'intensive_margin', 'significance': 'Demonstrates adversarial stance against racial justice discovery efforts'}, {'quote': 'Based on the evidence, officers believe the shooting was gang-motived and a retaliatory shooting... The following day, Defendant Turner and two accomplices drove to rival gang territory', 'margin_type': 'intensive_margin', 'significance': 'Emphasizes gang allegations to support serious charges and adult transfer'}]"
2020.12.16_Contra Costa County_Signing Up for Racial Justice Act Training.pdf,Contra Costa County,12/16/2020,2020-12-16,2020.0,training_material,racial_justice,"['administrative', 'case_law_update']",leans_progressive,1,0,1.0,leans_progressive,medium,"['racial_justice_focus', 'implicit_bias_training', 'emphasis_on_avoiding_discriminatory_conduct']",[],moderate_impact,more_lenient,1,0,moderate_impact,more_lenient,1,0,not_addressed,not_addressed,not_addressed,not_addressed,not_addressed,not_addressed,high,not_mentioned,unclear,unclear,informational,"This document is a training announcement from the California District Attorneys Association promoting a session on AB 2542 (Racial Justice Act) compliance and avoiding bias in prosecution. The training aims to educate prosecutors on identifying and preventing discriminatory conduct, with practical guidance on compliance and implementation. While this represents engagement with progressive racial justice reforms, it is framed as professional development rather than a policy mandate, suggesting a measured approach to incorporating these principles into prosecutorial practice.","[{'quote': 'Answering the Call--Avoiding Bias in Prosecution', 'relevance': 'Shows focus on addressing prosecutorial bias, relevant to both extensive and intensive margins'}, {'quote': 'This two-hour session will introduce prosecutors to AB 2542, discussing its parameters, the remedies available for violations, best practices for compliance, and the mechanics involved in proving or disproving discriminatory conduct', 'relevance': 'Demonstrates comprehensive approach to racial justice compliance, affecting both charging and sentencing decisions'}, {'quote': ""IT'S (ALMOST) YOUR LAST CHANCE TO REGISTER FOR THE RACIAL JUSTICE ACT TRAINING!"", 'relevance': 'Emphasizes urgency and importance of racial justice training for prosecutors'}]"
2020.12.18_Contra Costa County_Racial Justice Digest.pdf,Contra Costa County,12/18/2020,2020-12-18,2020.0,general_memo,racial_justice,"['case_law_update', 'training_material', 'administrative']",leans_progressive,1,0,1.0,leans_progressive,medium,"['racial_justice_focus', 'implicit_bias_training', 'emphasis_on_avoiding_discriminatory_conduct']","['technical_prosecution_focus', 'evidence_gathering_emphasis']",moderate_impact,more_lenient,1,0,high_impact,more_lenient,1,0,not_addressed,not_addressed,not_addressed,not_addressed,not_addressed,not_addressed,high,not_mentioned,unclear,clearly_new_policy,informational,"This document is primarily a California District Attorneys Association newsletter featuring training on the Racial Justice Act (AB 2542) focused on avoiding bias in prosecution. While the racial justice training indicates progressive reform orientation, the document also contains technical discussions about evidence gathering for serious criminal cases. The emphasis on bias training and discriminatory conduct remedies suggests a shift toward more equitable prosecution practices, though the document is more informational than policy-directive in nature.","[{'quote': 'Answering the Call--Avoiding Bias in Prosecution', 'margin_type': 'both_margins', 'significance': 'Title indicates focus on eliminating prosecutorial bias across all decisions'}, {'quote': 'This two-hour session will introduce prosecutors to AB 2542, discussing its parameters, the remedies available for violations, best practices for compliance, and the mechanics involved in proving or disproving discriminatory conduct.', 'margin_type': 'both_margins', 'significance': 'Shows systematic approach to addressing discriminatory prosecution practices'}, {'quote': 'I have a witness murder case wherein the killer uses a rental car (Jeep Cherokee) to set up and lie-in-wait for the victim.', 'margin_type': 'intensive_margin', 'significance': 'Demonstrates traditional prosecution approach seeking maximum evidence for serious charges'}]"
2020.12.18_Contra Costa County_Sign up for Racial Justice Act Training.pdf,Contra Costa County,12/18/2020,2020-12-18,2020.0,training_material,racial_justice,"['case_law_update', 'administrative']",leans_progressive,1,0,1.0,leans_progressive,medium,"['racial justice focus', 'implicit bias training', 'emphasis on avoiding discriminatory conduct']",[],moderate_impact,more_lenient,1,0,high_impact,more_lenient,1,0,not_addressed,not_addressed,not_addressed,not_addressed,not_addressed,not_addressed,high,not_mentioned,unclear,clearly_new_policy,informational,"This document is a training announcement for California prosecutors on AB 2542, the Racial Justice Act, focusing on avoiding bias in prosecution. The training covers compliance requirements, remedies for violations, and best practices for implementation. While presented as informational training material, it reflects a progressive emphasis on addressing racial bias in prosecutorial decision-making. The document represents part of a statewide effort to educate prosecutors on new racial justice legislation and its practical implications for their work.","[{'quote': 'Answering the Call-Avoiding Bias in Prosecution', 'margin_type': 'both extensive and intensive', 'relevance': 'Title emphasizes proactive approach to addressing prosecutorial bias'}, {'quote': 'This two-hour session will introduce prosecutors to AB 2542, discussing its parameters, the remedies available for violations, best practices for compliance, and the mechanics involved in proving or disproving discriminatory conduct.', 'margin_type': 'both extensive and intensive', 'relevance': 'Shows comprehensive approach to implementing racial justice reforms with focus on compliance and remedies'}, {'quote': ""a panel discussion will address questions and ideas for implementation in the varied settings of California prosecutors' offices"", 'margin_type': 'administrative', 'relevance': 'Indicates statewide effort to implement racial justice training across different prosecutorial contexts'}]"
2020.12.20_Contra Costa County_Email re Racial Justice Act.pdf,Contra Costa County,12/20/2020,2020-12-20,2020.0,general_memo,racial_justice,"['training_material', 'administrative']",clearly_progressive,1,0,2.0,clearly_progressive,high,"['racial justice focus', 'implicit bias training', 'proactive compliance with racial justice legislation', 'collaboration with other progressive DA offices', 'emphasis on culturally competent training']",[],high_impact,more_lenient,1,0,high_impact,more_lenient,1,0,not_addressed,not_addressed,not_addressed,not_addressed,not_addressed,not_addressed,high,not_mentioned,yes,clearly_new_policy,mandatory,"This internal memo discusses the implementation of California's Racial Justice Act (AB 2542), which prohibits racial bias in all stages of criminal prosecution starting in 2021. The prosecutor demonstrates a proactive, progressive approach by seeking training, coordinating with other DA offices, and proposing expanded implicit bias training for law enforcement partners. The document reflects a clear commitment to addressing systemic racial bias in the criminal justice system through education and policy compliance rather than viewing the new requirements as burdensome constraints.","[{'quote': ""The bill prohibits implicit as well as explicit bias based on 'RENO' (race, ethnicity, national origin) in the investigation, charging, prosecution, conviction and sentencing of criminal cases."", 'margin_type': 'both_extensive_and_intensive', 'significance': 'Defines the scope of the new legal requirements affecting all stages of prosecution'}, {'quote': ""Our office has a Committee that is coordinating with other DA's Offices to support prosecutions under the new mandates."", 'margin_type': 'administrative', 'significance': 'Shows proactive, collaborative approach to implementing racial justice reforms'}, {'quote': 'I continue to believe that FJC is particularly well suited to synthesize culturally competent trainers with law enforcement messaging in a safe space for these sensitive but important topics.', 'margin_type': 'extensive', 'significance': 'Demonstrates commitment to addressing racial bias through training and cultural competency'}]"
2020.12.28_Contra Costa County_Avoiding Bias in Prosecution CDAA Course.pdf,Contra Costa County,12/28/2020,2020-12-28,2020.0,training_material,racial_justice,"['administrative', 'case_law_update']",leans_progressive,1,0,1.0,leans_progressive,medium,"['racial justice focus', 'implicit bias training', 'proactive preparation for racial justice legislation']",[],high_impact,more_lenient,1,0,high_impact,more_lenient,1,0,not_addressed,not_addressed,not_addressed,not_addressed,not_addressed,not_addressed,high,Venus D. Johnson (Chief Assistant District Attorney),yes,clearly_new_policy,strong_guidance,"This document is an internal memo from the Contra Costa County DA's office informing attorneys about mandatory training on avoiding bias in prosecution related to the new California Racial Justice Act. The office is taking a proactive approach by providing training, forming committees to develop response strategies, and preparing for the systematic implementation of the new law. The memo reflects a progressive orientation toward racial justice issues, though it is primarily administrative and doesn't reveal broader prosecutorial philosophies.","[{'quote': 'As you know, AB 2542 - The California Racial Justice Act, was signed into law and will become effective January 1, 2021.', 'margin_type': 'both', 'significance': 'Establishes the legal framework that will impact both charging and sentencing decisions'}, {'quote': ""A small committee will be gathering in short order to discuss our office's approach to handling these motions, data collection and analysis, file retention, etc."", 'margin_type': 'both', 'significance': 'Shows proactive, systematic approach to implementing racial justice reforms'}, {'quote': 'We will be working expeditiously to ensure you are prepared to address these motions.', 'margin_type': 'both', 'significance': 'Demonstrates commitment to thorough preparation for racial justice challenges'}]"
2020.12.28_Contra Costa County_Racial Justice Digest.pdf,Contra Costa County,12/28/2020,2020-12-28,2020.0,general_memo,racial_justice,"['administrative', 'case_law_update']",leans_progressive,1,0,1.0,leans_progressive,medium,"['proactive preparation for racial justice legislation', 'collaborative approach to implementation', 'focus on addressing racial bias in prosecution']","['preparing defense strategies against racial bias claims', 'hiring experts to potentially counter statistical evidence']",high_impact,more_lenient,1,0,high_impact,more_lenient,1,0,not_addressed,not_addressed,not_addressed,not_addressed,not_addressed,not_addressed,high,Venus Johnson (Chief Assistant District Attorney),yes,clearly_new_policy,informational,"This document is an internal communication from a Chief Assistant District Attorney seeking guidance from peers on implementing AB 2542 (Racial Justice Act) effective January 1, 2021. The prosecutor's office has formed a committee to address procedural challenges and is considering hiring statistical experts to respond to potential racial bias claims. The tone suggests a professional, collaborative approach to preparing for legislation that could significantly impact both charging decisions and sentencing outcomes based on racial justice considerations.","[{'quote': 'As we all prepare for AB 2542 to become effective on January 1, what if anything is your office doing to assist your attorneys in responding?', 'margin_type': 'both extensive and intensive', 'significance': 'Shows proactive preparation for racial justice legislation affecting prosecutorial decisions'}, {'quote': 'our office formed a small committee to think through some of the procedural steps and challenges we will need to address', 'margin_type': 'administrative', 'significance': 'Indicates systematic, office-wide approach to implementing racial justice reforms'}, {'quote': 'we are looking into data experts and statisticians who we could potentially hire to testify, if the need arises', 'margin_type': 'both extensive and intensive', 'significance': 'Suggests preparation to defend against statistical evidence of racial bias in prosecution'}]"
2020_Contra Costa County_CDAA Legislative Digest .pdf,Contra Costa County,01/01/2020,2020-01-01,2020.0,case_law_update,case_law_update,"['administrative', 'sentencing', 'charging_decisions']",leans_progressive,1,0,1.0,leans_progressive,medium,"['Elimination of administrative fees and costs for defendants', 'Decriminalization of hypodermic needle possession', 'Mandatory implicit bias training for attorneys', 'Expansion of jury pool diversity through tax filer inclusion', 'New peremptory challenge restrictions to address unconscious bias']","['Expansion of contracting fraud penalties for natural disaster repairs', 'New felony provisions for unlicensed contracting', 'Maintained victim restitution requirements']",moderate_impact,more_lenient,1,0,moderate_impact,more_lenient,1,0,not_addressed,unclear,not_addressed,not_addressed,not_addressed,not_addressed,moderate,not_mentioned,unclear,informational,informational,"This document is the 2020 CDAA Legislative Digest, a comprehensive summary of new California laws affecting prosecutors and the criminal justice system. While primarily informational rather than policy-setting, it covers significant legislative changes including the elimination of various administrative fees for defendants, decriminalization of certain drug paraphernalia offenses, expansion of jury pools for greater diversity, and new restrictions on peremptory challenges to address unconscious bias. The legislation summarized reflects a generally progressive direction in criminal justice reform, though the document maintains a neutral, informational tone throughout.","[{'quote': 'AB 1869 eliminates numerous administrative fees, effective July 1, 2021. Fees eliminated in the Government Code include public defender/appointed counsel fees, criminal justice administration fees, county booking fees, and city booking fees.', 'margin_type': 'intensive_margin', 'significance': 'Shows reduction in financial burden on defendants'}, {'quote': 'Repeals B&P 4326, which had contained two misdemeanor crimes. Subdivision (a) was the crime of obtaining a hypodermic needle or syringe by a false or fraudulent representation... Subdivision (b) was the crime of using a hypodermic needle or syringe for a purpose other than that for which it was obtained.', 'margin_type': 'extensive_margin', 'significance': 'Demonstrates decriminalization approach to drug-related offenses'}, {'quote': ""Provides that an 'objectively reasonable person is aware that unconscious bias, in addition to purposeful discrimination, have resulted in the unfair exclusion of potential jurors in the State of California.'"", 'margin_type': 'intensive_margin', 'significance': 'Reflects focus on addressing systemic bias in criminal justice proceedings'}]"
2020_Contra Costa County_Description of the Racial Justice Act.pdf,Contra Costa County,01/01/2020,2020-01-01,2020.0,general_memo,racial_justice,"['case_law_update', 'discovery', 'sentencing', 'charging_decisions']",clearly_progressive,1,0,2.0,clearly_progressive,high,"['comprehensive racial justice legislation implementation', 'statistical evidence allowed to prove systemic bias', 'remedies include charge reduction and sentence vacation', 'addresses both individual bias and systemic disparities', 'broad discovery rights for defendants to access prosecutorial records']","['concerns about lack of prejudice requirement', 'emphasis on costs and burdens to prosecution', 'warnings about potential constitutional challenges', 'concerns about impact on mass shooting and serious crime cases']",high_impact,more_lenient,1,0,high_impact,more_lenient,1,0,not_addressed,unclear,not_addressed,not_addressed,not_addressed,not_addressed,high,Diana Becton,yes,clearly_new_policy,mandatory,"This document describes California's Racial Justice Act of 2020, which prohibits seeking convictions or imposing sentences based on race, ethnicity, or national origin. The Act allows defendants to challenge prosecutorial decisions using statistical evidence of racial disparities and provides remedies including charge reduction, sentence vacation, and new trials. While the memo appears written from a traditional prosecutorial perspective highlighting concerns about costs and constitutional issues, the underlying legislation represents a significant progressive reform addressing systemic racial bias in criminal justice.","[{'quote': ""The defendant was charged with or convicted of a more serious offense than defendants of other races, ethnicities, or national origins who commit similar offenses and are similarly situated, and the evidence establishes that the prosecution more frequently sought or obtained convictions for more serious offenses against people who share the defendant's race, ethnicity or national origin"", 'margin_type': 'extensive_margin'}, {'quote': ""A longer or more severe sentence was imposed on the defendant than was imposed on other similarly situated individuals convicted of the same offense, and longer or more severe sentences were more frequently imposed for that offense on people that share the defendant's race, ethnicity, or national origin"", 'margin_type': 'intensive_margin'}, {'quote': 'Note that there is no requirement that the defendant make any showing of prejudice. That is, the defendant is not required to prove that the alleged bias had any impact whatsoever on the bringing of charges, the trial, the conviction, or sentencing.', 'margin_type': 'both_margins'}]"
2020_Contra Costa County_Kalra Announcement of the Racial Justice Act.pdf,Contra Costa County,01/01/2020,2020-01-01,2020.0,other,racial_justice,"['administrative', 'case_law_update']",clearly_progressive,1,0,2.0,clearly_progressive,high,"['racial justice focus', 'systemic racism acknowledgment', 'criminal justice reform legislation', 'challenging enhanced charges and sentencing']",[],moderate_impact,more_lenient,1,0,high_impact,more_lenient,1,0,not_addressed,not_addressed,reform_oriented,not_addressed,not_addressed,not_addressed,high,not_mentioned,unclear,clearly_new_policy,mandatory,"This document is a political fundraising email from Assemblymember Ash Kalra announcing the passage of the California Racial Justice Act (AB 2542), which he authored. The Act allows individuals in the criminal justice system to challenge racially unfair treatment that results in enhanced charges, convictions, or sentencing. The document reflects a progressive ideological orientation with strong emphasis on addressing systemic racism in criminal justice while maintaining that such reforms don't compromise public safety. This represents a significant policy change that could impact both charging decisions and sentencing outcomes statewide.","[{'quote': 'Anyone in our criminal justice system can now challenge any unfair treatment based on race that leads to enhanced charges, convictions or sentencing.', 'margin_type': 'both extensive and intensive'}, {'quote': ""With my law, California becomes the first state in the nation to truly grapple with systemic racism in our criminal justice system in a way that doesn't undermine public safety."", 'margin_type': 'both extensive and intensive'}, {'quote': 'I am super proud of my bill AB 2542, the California Racial Justice Act, which is now the law of our great state.', 'margin_type': 'administrative'}]"
2020_Contra Costa County_Racial Justice Act Discovery Request in Docket #05-192292-1.pdf,Contra Costa County,01/01/2020,2020-01-01,2020.0,other,discovery,"['racial_justice', 'case_guidance']",unclear,0,0,,unclear,low,[],[],not_applicable,not_applicable,0,0,not_applicable,not_applicable,0,0,not_addressed,not_addressed,not_addressed,not_addressed,not_addressed,not_addressed,not_addressed,not_mentioned,unclear,unclear,informational,"This document contains a defense discovery request in a robbery case seeking extensive prosecutorial policy documents and racial justice data under AB 2542, along with the prosecutor's brief response expressing skepticism about the request's scope. The prosecutor plans to require the defense to file a formal motion rather than comply with the informal request. The document is procedural in nature and does not reveal substantive prosecutorial policy positions or ideological orientation.","[{'quote': 'The defense has not presented any plausible theory as tow why they feel entitled to this material.', 'relevance': ""Shows prosecutor's resistance to broad discovery request"", 'margin_type': 'procedural'}, {'quote': 'I was planning to tell the defense attorney (Yolanda Huang) to file a motion to compel so that a Judge could make any decision.', 'relevance': ""Indicates prosecutor's procedural response strategy"", 'margin_type': 'procedural'}, {'quote': 'Pursuant to Assembly Bill 2452 – California Racial Justice Act of 2020, the Defendants request that you disclose to the following items', 'relevance': 'Shows defense invoking racial justice legislation for discovery', 'margin_type': 'procedural'}]"
2020_Contra Costa County_Racial Justice Act Further Guidance and Updates .pdf,Contra Costa County,01/01/2020,2020-01-01,2020.0,case_guidance,racial_justice,"['discovery', 'case_law_update', 'administrative']",leans_progressive,1,0,1.0,leans_progressive,medium,"['racial justice focus', 'implicit bias awareness', 'prohibition of racially coded language', 'statistical evidence consideration', 'systemic bias recognition']","['emphasis on defending prosecutions', 'focus on procedural compliance rather than substantive reform']",moderate_impact,more_lenient,1,0,high_impact,more_lenient,1,0,not_addressed,not_addressed,not_addressed,not_addressed,not_addressed,not_addressed,high,Venus D. Johnson (Chief Assistant District Attorney),yes,clearly_new_policy,mandatory,"This document provides mandatory guidance to prosecutors on complying with California's Racial Justice Act (AB 2542), which creates new protections against racial bias in criminal proceedings. The memo details prohibited racially coded language, new discovery procedures, and hearing requirements for bias allegations. While primarily defensive in tone, the guidance reflects a progressive approach to racial justice by acknowledging both explicit and implicit bias and accepting statistical evidence of disparate outcomes as legally relevant.","[{'quote': 'The use of racially charged or coded language throughout the entirety of case proceedings is now explicitly prohibited (i.e. - super predictor, thug, ghetto, spade, macho, shyster, illegal immigrants, etc.)', 'margin_type': 'intensive_margin', 'relevance': 'Shows progressive awareness of implicit bias in prosecutorial language'}, {'quote': 'PC 745 creates new code sections regulating language and conduct of judges, attorneys, officers, experts & jurors. It also provides new discovery and hearing rights and creates mandatory remedies for conduct and language violations, as well as remedies for disparate outcomes based on race, ethnicity, or national origin', 'margin_type': 'both_margins', 'relevance': 'Demonstrates systemic approach to addressing racial bias in prosecution'}, {'quote': 'Statistical evidence, aggregate data, expert testimony, etc. are examples of what both sides will likely need to present and rebut during the hearing', 'margin_type': 'intensive_margin', 'relevance': 'Shows acceptance of data-driven approaches to identifying racial disparities'}]"
2020_Contra Costa County_Racial Justice Act Motion to Compel Discovery in People v. Vargas.pdf,Contra Costa County,01/01/2020,2020-01-01,2020.0,case_guidance,discovery,"['racial_justice', 'charging_decisions', 'enhancements']",clearly_traditional,0,1,-2.0,clearly_traditional,high,[],"['refusal to provide racial justice discovery', 'resistance to AB 2542 compliance', 'multiple enhancements on single case', 'strict charging approach']",moderate_impact,more_lenient,1,0,high_impact,more_lenient,1,0,not_addressed,not_addressed,maximize,not_addressed,not_addressed,not_addressed,low,Diane Becton,yes,continuation,mandatory,"This document is a defense motion to compel discovery under California's Racial Justice Act in a robbery case involving multiple Black defendants and white victims. The prosecutor's office refuses to provide requested data on racial disparities in charging and enhancement practices, demonstrating resistance to racial justice reforms. The case illustrates tension between traditional prosecutorial approaches and new legal requirements to examine racial bias in the criminal justice system.","[{'quote': 'AB 2542 Discovery: This is not actually law yet... The request you have made is broad and not factually tailored to our case. At this time I will not be providing any of the requested statistics.', 'margin_type': 'both extensive and intensive', 'significance': ""Shows prosecutor's resistance to racial justice discovery requests""}, {'quote': 'Murgia related discovery: This request is overbroad... I do not have any training materials/ policy statements to provide to you. The only tool/policy used for filing of this case, and others, is the Penal Code.', 'margin_type': 'extensive', 'significance': 'Indicates traditional approach relying solely on statutory requirements without additional policy guidance'}, {'quote': 'Black Adults faced not just greater incidents of arrest, but greater incidents of prosecution with more severe charges in the form of more enhancements than White Adults', 'margin_type': 'intensive', 'significance': 'Defense argument highlighting disparate treatment in enhancement practices'}]"
2020_Contra Costa County_Racial Justice Act Opposition Advice.pdf,Contra Costa County,01/01/2020,2020-01-01,2020.0,general_memo,racial_justice,"['case_guidance', 'case_law_update']",leans_traditional,0,1,-1.0,leans_traditional,medium,[],"['opposition to racial justice reforms', 'seeking strategies to defeat defendant relief motions', 'resistance to post-conviction remedies']",not_applicable,not_applicable,0,0,moderate_impact,more_punitive,0,1,not_addressed,not_addressed,not_addressed,not_addressed,not_addressed,not_addressed,low,not_mentioned,unclear,unclear,informational,This document is an internal communication among prosecutors seeking assistance to oppose a defendant's motion under California's Racial Justice Act (PC 745). A Los Angeles County prosecutor is requesting opposition strategies and written materials from colleagues to fight a motion that would provide relief to a defendant claiming racial bias affected their pandering case. The document reveals prosecutorial resistance to racial justice reforms and collaborative efforts to maintain convictions despite potential racial bias claims.,"[{'quote': 'Defendant filed a Motion for Relief Pursuant to Penal Code Section 745 (The California Racial Justice Act) for one of my 266i PC (Pandering) cases.', 'margin_type': 'intensive_margin', 'significance': 'Shows the context - a defendant seeking relief under racial justice legislation'}, {'quote': 'Does anyone have a written opposition they can send my way? What are courts and DDAs using to oppose these motions?', 'margin_type': 'intensive_margin', 'significance': 'Demonstrates active effort to oppose racial justice relief motions'}, {'quote': 'Looking for any help anyone can send my way... Anything and everything you could send my way would be greatly appreciated.', 'margin_type': 'intensive_margin', 'significance': 'Shows collaborative effort among prosecutors to resist racial justice reforms'}]"
2021.01.06_Contra Costa County_Racial Justice Act Digest.pdf,Contra Costa County,01/06/2021,2021-01-06,2021.0,general_memo,administrative,"['diversion', 'racial_justice', 'discovery', 'case_law_update']",leans_progressive,1,0,1.0,leans_progressive,medium,"['expansion of diversion programs', 'racial justice act implementation', 'focus on alternatives to traditional prosecution', 'elimination of fees in diversion programs']","['emphasis on restitution collection', 'community work service requirements', 'protective orders and firearms prohibitions']",moderate_impact,more_lenient,1,0,low_impact,neutral,0,0,yes,yes,not_addressed,not_addressed,not_addressed,not_addressed,moderate,not_mentioned,unclear,modification,informational,"This document is a digest of communications between California district attorneys discussing various procedural and policy matters. The primary focus is on implementing and expanding misdemeanor diversion programs, with offices sharing approaches that eliminate fees and provide alternatives to traditional prosecution. The document also addresses technical legal issues around electronic communications privacy and mentions ongoing efforts to implement the Racial Justice Act, suggesting a collaborative, moderately progressive approach to criminal justice reform while maintaining traditional accountability measures.","[{'quote': ""Our office has a pre-filing Misd. Diversion Program that has run well since 2015, administered by our office and Pacific Educational Services (PES). We're hoping to keep this in place"", 'margin_type': 'extensive', 'significance': 'Shows commitment to diversion programs that keep defendants out of the system'}, {'quote': 'There will be no fees or administrative costs', 'margin_type': 'extensive', 'significance': 'Indicates progressive approach by removing financial barriers to diversion'}, {'quote': 'I think there has been a suggestion already made for a CDAA sidebar community for the Racial Justice Act', 'margin_type': 'administrative', 'significance': 'Shows engagement with racial justice reforms and collaborative approach to implementation'}]"
2021.01.07_Contra Costa County_Racial Justice Act Digest.pdf,Contra Costa County,01/07/2021,2021-01-07,2021.0,general_memo,racial_justice,"['administrative', 'case_law_update']",neutral,0,0,0.0,neutral,medium,"['racial_justice_focus', 'collaborative_approach_to_implementation']","['defensive_preparation', 'hiring_experts_to_counter_challenges']",high_impact,more_lenient,1,0,high_impact,more_lenient,1,0,not_addressed,not_addressed,not_addressed,not_addressed,not_addressed,not_addressed,moderate,not_mentioned,yes,clearly_new_policy,informational,"This document is an internal communication among California district attorneys discussing preparation for implementing AB 2542, the Racial Justice Act, which became effective January 1, 2021. The Contra Costa County DA's office is taking a systematic approach by forming committees and seeking expert witnesses to respond to anticipated racial bias challenges. The tone is pragmatic and collaborative, focusing on procedural compliance rather than ideological positioning regarding the racial justice reforms.","[{'quote': 'As we all prepare for AB 2542 to become effective on January 1, what if anything is your office doing to assist your attorneys in responding?', 'margin_type': 'both_margins', 'significance': 'Shows proactive preparation for racial justice challenges'}, {'quote': 'our office formed a small committee to think through some of the procedural steps and challenges we will need to address', 'margin_type': 'administrative', 'significance': 'Indicates systematic, office-wide approach to implementation'}, {'quote': 'we are looking into data experts and statisticians who we could potentially hire to testify, if the need arises', 'margin_type': 'both_margins', 'significance': 'Shows defensive preparation to counter racial bias claims with expert testimony'}]"
2021.01.28_Contra Costa County_Racial Justice Digest.pdf,Contra Costa County,01/28/2021,2021-01-28,2021.0,general_memo,racial_justice,"['administrative', 'case_law_update', 'discovery']",leans_progressive,1,0,1.0,leans_progressive,medium,"['robust training curriculum on Unconscious Biases for entire office', 'deep dive into database to analyze demographics of prosecutions', 'hiring outside statistician to evaluate data and reports', 'proactive implementation of Racial Justice Act requirements']","['focus on developing responses and defenses to PC745 petitions', ""concern about law enforcement's ability to gather relevant data""]",moderate_impact,more_lenient,1,0,moderate_impact,more_lenient,1,0,not_addressed,not_addressed,not_addressed,not_addressed,not_addressed,not_addressed,high,not_mentioned,yes,clearly_new_policy,informational,"This document is a communication between prosecutor offices discussing implementation of California's Racial Justice Act (AB 2542/PC745). The Sonoma County DA's office is proactively developing unconscious bias training, analyzing demographic data of their prosecutions, and hiring outside consultants to evaluate potential racial disparities. The discussion also addresses practical challenges in gathering demographic data due to conflicting legal requirements, showing prosecutors grappling with both compliance and genuine reform efforts in response to racial justice legislation.","[{'quote': 'We are working on a robust training curriculum on Unconscious Biases for the entire office, not just attorneys', 'margin_type': 'both_margins', 'significance': 'Shows comprehensive approach to addressing bias in prosecutorial decision-making'}, {'quote': 'Carla and I are embarking on a deep dive into our database to analyze the demographics of our prosecutions, alongside the demographics of the county at large', 'margin_type': 'both_margins', 'significance': 'Indicates systematic review of prosecutorial patterns for potential racial disparities'}, {'quote': 'we are hiring an outside statistician/consultant to evaluate our data and reports', 'margin_type': 'both_margins', 'significance': 'Demonstrates serious commitment to objective analysis of prosecutorial practices'}]"
2021.01.29_Contra Costa County_Dillahunty Request for Discovery.pdf,Contra Costa County,01/29/2021,2021-01-29,2021.0,case_guidance,racial_justice,"['discovery', 'charging_decisions']",clearly_progressive,1,0,2.0,clearly_progressive,high,"['Racial Justice Act implementation', 'Challenge to prosecutorial charging patterns based on racial bias', 'Focus on systemic racial disparities in criminal justice', ""Attorney's observation that minority clients view county as racist""]",[],high_impact,more_lenient,1,0,high_impact,more_lenient,1,0,not_addressed,not_addressed,reform_oriented,not_addressed,not_addressed,not_addressed,high,not_mentioned,unclear,clearly_new_policy,mandatory,"This document is a defense attorney's motion under California's Racial Justice Act seeking discovery of prosecutorial charging data to determine if African-American defendants are disproportionately charged with kidnapping enhancements in robbery cases. The motion represents implementation of progressive criminal justice reform by challenging potentially racially biased charging practices. It seeks to examine whether the DA's office has systematically applied more severe charges to minority defendants compared to similarly situated defendants of other races, which could lead to charge reductions or case dismissals based on racial justice considerations.","[{'quote': 'MANY OF MY MINORITY CLIENTS OVER THAT TIME HAVE REFERRED TO CONTRA COSTA AS A RACIST COUNTY', 'margin_type': 'extensive_margin', 'relevance': 'Establishes context of alleged systemic racial bias in charging decisions'}, {'quote': 'THE CHARGING ISSUE WHICH MIGHT BE SUBJECT TO THE RACIAL JUSTICE ACT DEALS WITH CHARGING KIDNAPPING FOR WHAT IS ESSENTIALLY A ROBBERY WHERE THE MOVEMENT OF VICTIMS WAS WITHIN THE SAME PROPERTY', 'margin_type': 'both_margins', 'relevance': 'Challenges enhancement charging practices that increase severity of charges and potential sentences'}, {'quote': 'HOW MANY CHARGED KIDNAPPING FOR MOVEMENT ON THE SAME PROPERTY AND OF THOSE WHAT WAS THE ETHNIC BREAKDOWN OF THE DEFENDANTS WHEN KIDNAPPING WAS OR WAS NOT CHARGED', 'margin_type': 'extensive_margin', 'relevance': 'Seeks data to prove racial disparities in charging decisions'}]"
2021.01.29_Contra Costa County_Racial Justice Digest.pdf,Contra Costa County,01/29/2021,2021-01-29,2021.0,general_memo,racial_justice,"['discovery', 'case_law_update', 'administrative']",leans_progressive,1,0,1.0,leans_progressive,medium,"['Proactive bias training implementation (three trainings since 2019)', 'Hiring outside experts from Georgetown University for bias training', 'Developing internal committees to address racial justice issues', 'Analyzing demographics of prosecutions against county demographics', 'Considering race-blind charging models', 'Collaborative approach to implementing racial justice reforms']","['Arguing for narrow interpretation of RJA discovery requirements', ""Expressing concern about being 'overburdened' with discovery requests"", 'Requiring specific evidence of bias rather than accepting statistical disparities']",moderate_impact,neutral,0,0,moderate_impact,more_lenient,1,0,not_addressed,not_addressed,not_addressed,not_addressed,not_addressed,not_addressed,high,not_mentioned,yes,clearly_new_policy,informational,"This document captures inter-office communications among California district attorneys discussing implementation of the Racial Justice Act (AB 2542). The prosecutors are sharing strategies for responding to RJA discovery motions while also implementing proactive measures like bias training, demographic analysis, and considering race-blind charging models. The tone reflects a compliance-oriented approach that balances genuine engagement with racial justice concerns against traditional prosecutorial efficiency priorities. The document reveals prosecutors working collaboratively to navigate new legal requirements while maintaining some resistance to broad interpretations of the law's discovery provisions.","[{'quote': 'We have done three bias training since 2019. We brought in an outside expert from Georgetown University. We will continue to train on bias and its impact on the CJ system.', 'margin_type': 'both_margins', 'significance': 'Shows proactive progressive approach to addressing systemic bias'}, {'quote': ""The judge surmised that if all it took for a defendant to receive voluminous discovery was a claim of bias based on general statistical data then the DA's Office would be overburdened with requests and the system would stall out."", 'margin_type': 'intensive_margin', 'significance': 'Reveals traditional prosecutorial concern about limiting scope of racial justice reforms'}, {'quote': 'We are also looking at the benefit of hiring an outside statistician/analyst as well as race-blind charging models.', 'margin_type': 'extensive_margin', 'significance': 'Indicates consideration of progressive charging reform measures'}]"
2021.02.02_Contra Costa County_Insurance Fraud Unit Meeting.pdf,Contra Costa County,02/02/2021,2021-02-02,2021.0,general_memo,administrative,"['racial_justice', 'sentencing', 'diversion']",leans_progressive,1,0,1.0,leans_progressive,low,"['AB2542 - Racial Justice Act discussion', 'AB3234 - Judicial Diversion consideration', 'AB1950 - Probation Length reform']","['Focus on insurance fraud prosecution', 'Consumer protection cases']",low_impact,more_lenient,1,0,low_impact,more_lenient,1,0,unclear,unclear,not_addressed,not_addressed,not_addressed,not_addressed,low,not_mentioned,unclear,unclear,informational,"This is a meeting agenda for Contra Costa County's Insurance Fraud Unit covering administrative updates and recent legislative changes. The agenda includes brief references to progressive criminal justice reforms like the Racial Justice Act and judicial diversion options, but provides no detail on the office's position or implementation approach. The primary focus remains on insurance fraud prosecution and consumer protection cases, with the legislative updates likely included for informational compliance purposes.","['Update on AB2542 - Racial Justice Act', 'Update on AB3234 - Judicial Diversion', 'Update on attorneys handling consumer cases']"
2021.02.04_Contra Costa County_Racial Justice Digest.pdf,Contra Costa County,02/04/2021,2021-02-04,2021.0,general_memo,racial_justice,"['training_material', 'discovery', 'administrative']",leans_progressive,1,0,1.0,leans_progressive,high,"['implicit bias training implementation', 'racial justice focus and RJA compliance', 'consideration of race-blind charging models', ""emphasis on prosecutors as bias 'interrupters'"", 'proactive preparation for racial justice discovery requests']",[],moderate_impact,more_lenient,1,0,moderate_impact,more_lenient,1,0,not_addressed,not_addressed,not_addressed,not_addressed,not_addressed,not_addressed,high,not_mentioned,yes,clearly_new_policy,informational,"This document captures inter-office communication among California district attorneys regarding implementation of the Racial Justice Act (AB 2542). Venus Johnson from Contra Costa County shares resources for implicit bias training and discusses preparation for RJA discovery requests. The communication demonstrates a proactive, reform-oriented approach to addressing racial bias in prosecution, with emphasis on training prosecutors to be 'interrupters' of systemic bias and consideration of race-blind charging models.","[{'quote': ""Professor Henning addresses bias in the system and specifically how prosecutors can play a role in being 'interrupters' and combatting and addressing the bias."", 'margin_type': 'both extensive and intensive', 'significance': 'Shows progressive approach to prosecutorial role in addressing systemic bias'}, {'quote': 'We are also looking at the benefit of hiring an outside statistician/analyst as well as race-blind charging models.', 'margin_type': 'extensive', 'significance': 'Indicates consideration of structural reforms to charging decisions'}, {'quote': 'Our attorneys and inspectors appreciated the training and found it extremely valuable.', 'margin_type': 'both', 'significance': 'Demonstrates office-wide commitment to bias training and racial justice initiatives'}]"
2021.02.05_Contra Costa County_Racial Justice Digest.pdf,Contra Costa County,02/05/2021,2021-02-05,2021.0,general_memo,racial_justice,"['training_material', 'administrative']",clearly_progressive,1,0,2.0,clearly_progressive,high,"['Extensive implicit bias training for prosecutors', 'Collaboration on racial justice initiatives', ""Focus on prosecutors as bias 'interrupters'"", 'Proactive implementation of racial justice reforms', 'Data collection and academic partnerships for bias reduction', 'Best practices to remove racial references from case reviews']",[],moderate_impact,more_lenient,1,0,moderate_impact,more_lenient,1,0,not_addressed,not_addressed,not_addressed,not_addressed,not_addressed,not_addressed,high,"Venus Johnson (Contra Costa), Sheryl Wolcott (San Luis Obispo)",yes,clearly_new_policy,strong_guidance,"This document captures inter-county collaboration among California prosecutors implementing AB 2542 (Racial Justice Act), focusing on implicit bias training, data collection, and best practices to address racial bias in prosecutorial decision-making. The prosecutors are proactively seeking training to become 'interrupters' of systemic bias and implementing concrete practices like removing racial references from case reviews. The collaborative, reform-oriented approach reflects a progressive prosecutorial ideology emphasizing racial justice and bias reduction rather than traditional tough-on-crime priorities.","[{'quote': ""Professor Henning addresses bias in the system and specifically how prosecutors can play a role in being 'interrupters' and combatting and addressing the bias."", 'margin_type': 'both_margins', 'significance': 'Illustrates progressive reframing of prosecutorial role'}, {'quote': 'Look at best practices to remove implied bias moving forward (e.g. Yolo DA has a way to remove references to race in the cases they review for filing.)', 'margin_type': 'extensive_margin', 'significance': 'Shows concrete bias reduction practices in charging decisions'}, {'quote': 'Communicate with the Justice Partners Group (court, defense, prosecution) to talk about what process should be followed to litigate these motions', 'margin_type': 'intensive_margin', 'significance': 'Demonstrates collaborative approach to implementing racial justice reforms'}]"
2021.02.08_Contra Costa County_Dillahunty Motion Racial Justice Act Discovery.pdf,Contra Costa County,02/08/2021,2021-02-08,2021.0,general_memo,racial_justice,"['discovery', 'administrative']",unclear,0,0,,unclear,low,[],[],not_applicable,not_applicable,0,0,not_applicable,not_applicable,0,0,not_addressed,not_addressed,not_addressed,not_addressed,not_addressed,not_addressed,not_addressed,not_mentioned,unclear,unclear,informational,"This is a brief administrative email from a Deputy District Attorney acknowledging receipt of a discovery motion filed under California's Racial Justice Act (PC 745) and indicating that a formal response will be prepared for the March 2, 2021 hearing date. The document is purely procedural and contains no substantive policy content, prosecutorial guidance, or ideological indicators. It represents routine case management communication between opposing counsel rather than any policy statement or directive from the prosecutor's office.","[{'quote': ""I have received Mr. Ashe's written Motion for Discovery pursuant to PC 745/Racial Justice Act."", 'relevance': 'Acknowledges the Racial Justice Act context but provides no substantive policy information', 'margin_type': 'not_applicable'}, {'quote': ""At this time I will begin the process of formally responding to Mr. Ashe's request."", 'relevance': 'Indicates procedural compliance but reveals nothing about prosecutorial approach or ideology', 'margin_type': 'not_applicable'}]"
2021.02.10_Contra Costa County_Racial Justice Digest.pdf,Contra Costa County,02/10/2021,2021-02-10,2021.0,general_memo,racial_justice,"['training_material', 'administrative', 'case_law_update']",clearly_progressive,1,0,2.0,clearly_progressive,high,"['mandatory unconscious bias training for all staff', 'hiring outside consultants to review demographic data for bias', 'interactive training on identifying blind spots in prosecutorial work', 'planning microaggression training', 'implementing practices to remove racial references from case reviews', 'proactive compliance with Racial Justice Act']",[],moderate_impact,more_lenient,1,0,moderate_impact,more_lenient,1,0,not_addressed,not_addressed,not_addressed,not_addressed,not_addressed,not_addressed,high,not_mentioned,yes,clearly_new_policy,mandatory,"This document captures inter-office communications among progressive district attorneys collaborating on implementation of California's Racial Justice Act (AB 2542). The prosecutors are proactively implementing comprehensive bias training, hiring external consultants to audit their demographic data, and sharing best practices to eliminate racial bias in prosecutorial decision-making. The collaborative approach and extensive reform measures demonstrate a clearly progressive prosecutorial ideology focused on racial justice and systemic reform rather than mere legal compliance.","[{'quote': ""We are fortunate to have high quality training available to us though our county's HR department; we have assigned everyone in the office, not just attorneys, to complete a short series of classes on Unconscious Bias in the Workplace."", 'margin_type': 'both_margins', 'significance': 'Shows comprehensive office-wide commitment to addressing bias'}, {'quote': 'Look at best practices to remove implied bias moving forward (e.g. Yolo DA has a way to remove references to race in the cases they review for filing.)', 'margin_type': 'extensive_margin', 'significance': 'Demonstrates concrete steps to reduce bias in charging decisions'}, {'quote': ""We gave her PC745 and asked her to think about how the training might relate to the spirit of the law and help us identify our 'blind spots' as we do our work."", 'margin_type': 'both_margins', 'significance': 'Shows proactive approach to implementing racial justice reforms beyond mere compliance'}]"
2021.02.16_Contra Costa County_Compiling Statistical Data.pdf,Contra Costa County,02/16/2021,2021-02-16,2021.0,general_memo,racial_justice,"['administrative', 'case_law_update']",leans_progressive,1,0,1.0,leans_progressive,medium,"['proactive compliance with racial justice legislation', 'systematic tracking of racial disparities in case outcomes', 'focus on identifying potential bias in prosecutorial decisions']",[],moderate_impact,neutral,0,0,moderate_impact,neutral,0,0,not_addressed,not_addressed,not_addressed,not_addressed,not_addressed,not_addressed,moderate,not_mentioned,yes,clearly_new_policy,informational,"This internal memo from Contra Costa County DA's office discusses implementing data collection systems to comply with AB-2542 (California Racial Justice Act). The office manager is seeking input from other offices on using their case management system to track dispositional factors and racial demographics in case outcomes. The document reflects a proactive, systematic approach to racial justice compliance, suggesting the office is taking equity concerns seriously in its administrative practices.","[{'quote': 'Our office is trying to determine ways in which to use PbK in efforts to compile statistical data that may or not needed relating to motions or requests referencing AB-2542 (California Racial Justice Act)', 'margin_type': 'both extensive and intensive', 'significance': 'Shows proactive approach to racial justice compliance'}, {'quote': 'Due to the voluminous factors that could play a role in the resolution of a charge/case I was wondering if any other office was currently using PbK (or soon planning to use PbK) to compile any dispositional information/factors', 'margin_type': 'intensive', 'significance': 'Indicates comprehensive approach to tracking case resolution factors'}, {'quote': 'I am working through an idea relating to adding in a feature similar to Special Programs on the Sentencing tab to hard code resolution factors', 'margin_type': 'intensive', 'significance': 'Shows systematic approach to tracking sentencing-related data'}]"
2021.02.16_Contra Costa County_Racial Justice Digest.pdf,Contra Costa County,02/16/2021,2021-02-16,2021.0,general_memo,racial_justice,"['administrative', 'case_law_update']",unclear,0,0,,unclear,low,['engagement_with_racial_justice_legislation'],[],not_applicable,not_applicable,0,0,not_applicable,not_applicable,0,0,not_addressed,not_addressed,not_addressed,not_addressed,not_addressed,not_addressed,moderate,not_mentioned,unclear,unclear,informational,"This document is an administrative digest from the California District Attorneys Association regarding AB 2542 (Racial Justice Act) implementation. It contains discussion forum messages between prosecutor offices seeking information about how other jurisdictions are handling compliance with the new racial justice legislation. The document is purely informational and administrative, without substantive policy content or ideological positioning beyond the implicit engagement with racial justice reform requirements.","[""The Orange County DA's Office is also seeking information on how other offices are handling this issue. If you're willing to discuss your current status, please let me know."", 'Alison, I started a new conversation thread that has some more discussion', 'AB 2542 Racial Justice Act Digest for Tuesday February 16, 2021']"
2021.02.17_Contra Costa County_Davis Vanguard Article Research re Racial Justice Act.pdf,Contra Costa County,02/17/2021,2021-02-17,2021.0,other,racial_justice,['administrative'],unclear,0,0,,unclear,low,[],[],not_applicable,not_applicable,0,0,not_applicable,not_applicable,0,0,not_addressed,not_addressed,not_addressed,not_addressed,not_addressed,not_addressed,not_addressed,Ms. Becton,unclear,unclear,not_applicable,"This document is an external media inquiry from Davis Vanguard journalist Kelly Moran to the Contra Costa County DA's office requesting information about how the office is implementing the 2020 Racial Justice Act. The journalist seeks materials, communications, and statements about the law's impact on cases and is requesting an interview with DA staff. This is not a prosecutorial policy document but rather shows external interest in documenting the office's approach to racial justice issues. The document provides no information about the DA office's actual policies or ideological orientation regarding the Racial Justice Act.","['My name is Kelly Moran and I am currently researching an article for the Davis Vanguard covering how district attorneys are handling the 2020 Racial Justice Act.', 'I am hoping to take a look at any and all materials or communications or statements your office has about the implementation of the new law and how it has impacted cases or is expected to impact future cases.', 'My team of interns and I expect the article will cover changes in policy, philosophy, training, etc. made with respect to this new law.']"
2021.02.17_Contra Costa County_Racial Justice Digest.pdf,Contra Costa County,02/17/2021,2021-02-17,2021.0,training_material,racial_justice,"['case_law_update', 'training']",unclear,0,0,,unclear,low,"['racial_justice_focus', 'elimination_of_bias_training']",['hate_crimes_prosecution_focus'],not_applicable,not_applicable,0,0,not_applicable,not_applicable,0,0,not_addressed,not_addressed,not_addressed,not_addressed,not_addressed,not_addressed,moderate,Venus D. Johnson,unclear,unclear,informational,"This document is an administrative communication from the California District Attorneys Association announcing a hate crimes training webinar for March 24, 2021. The training covers hate crimes prosecution, bias recognition, and evidence development, and includes elimination of bias MCLE credit. While distributed through a Racial Justice Act digest, the document is primarily informational and does not contain substantive prosecutorial policy guidance or ideological positions regarding charging or sentencing practices.","[{'quote': 'In the last few years, hate crimes have steadily increased in California and across the country. This course will provide an overview of hate crimes, including the difference between hate incidents and hate crimes, the limitations of the 1st Amendment protections, the various hate crimes charges in California, how to recognize and develop evidence demonstrating bias, and current trends in hate crimes.', 'margin_type': 'not_applicable', 'significance': 'Establishes the training focus on hate crimes prosecution and bias recognition'}, {'quote': 'This seminar is certified for 3 hours of General and I hour of Elimination of Bias MCLE credit.', 'margin_type': 'not_applicable', 'significance': 'Indicates attention to bias elimination training, suggesting some progressive orientation'}]"
2021.02.27_Contra Costa County_Email re Compiling Statistical Data.pdf,Contra Costa County,02/27/2021,2021-02-27,2021.0,general_memo,racial_justice,"['administrative', 'case_law_update']",leans_progressive,1,0,1.0,leans_progressive,medium,"['proactive compliance with racial justice legislation', 'systematic tracking of racial disparities in prosecutorial decisions', 'multi-disciplinary committee approach to racial justice issues']","['focus on compliance rather than reform advocacy', 'technical/administrative approach rather than policy reform']",moderate_impact,neutral,0,0,moderate_impact,neutral,0,0,not_addressed,not_addressed,not_addressed,not_addressed,not_addressed,not_addressed,high,not_mentioned,yes,clearly_new_policy,mandatory,"This document represents inter-office coordination among California prosecutor offices to implement data collection systems in response to AB-2542 (California Racial Justice Act). The offices are establishing comprehensive tracking of charging, disposition, and sentencing decisions across racial/ethnic categories using their case management systems. While primarily administrative and compliance-focused, the proactive and systematic approach to monitoring potential racial disparities suggests a progressive orientation toward racial justice issues in prosecution.","[{'quote': ""In response to AB-2542 the Sonoma County DA's Office formed a multi-disciplinary committee to work in the preparation and standardization of responses to motions and requests."", 'margin_type': 'extensive_and_intensive', 'significance': 'Shows proactive organizational response to racial justice legislation'}, {'quote': 'Filed charge(s) by charge category, severity and statute and then compared across races/ethnicities. Case and charges dispositions and sentencing when compared across races/ethnicities.', 'margin_type': 'extensive_and_intensive', 'significance': 'Demonstrates systematic approach to tracking racial disparities across all prosecutorial decisions'}, {'quote': 'Our office is trying to determine ways in which to use PbK in efforts to compile statistical data that may or may not needed relating to motions or requests referencing AB-2542 (California Racial Justice Act).', 'margin_type': 'extensive_and_intensive', 'significance': 'Shows offices preparing for racial justice challenges to prosecutorial decisions'}]"
2021.03.12_Contra Costa County_CDAA Bill Positions and Letter Templates Examples.pdf,Contra Costa County,03/12/2021,2021-03-12,2021.0,general_memo,administrative,"['enhancements', 'sentencing', 'charging_decisions']",clearly_traditional,0,1,-2.0,clearly_traditional,high,['supports gun violence restraining orders'],"['opposes elimination of sentence enhancements', 'supports differential treatment based on criminal history', 'emphasizes punishment for recidivism', '22 oppose positions vs 32 support positions suggests selective support']",low_impact,mixed,0,0,high_impact,more_punitive,0,1,not_addressed,not_addressed,maximize,not_addressed,not_addressed,not_addressed,not_addressed,Diana Becton mentioned as recipient,no,unclear,informational,"This document is an administrative communication from the California District Attorneys Association (CDAA) coordinating legislative positions and letter templates for prosecutor offices. The CDAA demonstrates a traditional prosecutorial ideology, particularly in opposing SB 136 which would eliminate sentence enhancements for repeat offenders, arguing that criminal history should result in harsher punishment. While supporting some measures like gun violence restraining orders, the overall legislative agenda reflects conventional tough-on-crime priorities focused on maintaining existing punishment mechanisms rather than reform-oriented policies.","[{'quote': 'The underlying premise of SB 136 is that a recalcitrant criminal should be sentenced the same as a first-time offender, despite a lengthy criminal history and a track record of disregard for the law. We reject that premise.', 'margin_type': 'intensive_margin', 'significance': 'Clearly articulates traditional prosecutorial philosophy on repeat offender punishment'}, {'quote': ""These enhancements exist, in part, to allow sentences to appropriately reflect someone's criminal conduct history."", 'margin_type': 'intensive_margin', 'significance': 'Justifies enhancement policies based on criminal history'}, {'quote': 'There are 22 Oppose bills (and an additional few that are Further Study/potential Oppose), 32 Support bills, and three Support If Amended bills.', 'margin_type': 'mixed', 'significance': ""Shows CDAA's selective approach to legislation with significant opposition positions""}]"
2021.03.16_Contra Costa County_Racial Justice Act Digest.pdf,Contra Costa County,03/16/2021,2021-03-16,2021.0,general_memo,case_law_update,"['racial_justice', 'administrative', 'discovery']",unclear,0,0,,unclear,low,"['racial_justice_discussion', 'consultation_with_outside_analysts']","['asset_forfeiture_focus', 'appeal_of_parole_decisions', 'felony_murder_prosecution']",low_impact,not_applicable,0,0,low_impact,not_applicable,0,0,not_addressed,not_addressed,not_addressed,not_addressed,not_addressed,not_addressed,moderate,not_mentioned,no,unclear,informational,"This document is a daily digest from the California District Attorneys Association containing routine case discussions and procedural questions from prosecutors across multiple counties. The content includes mixed prosecutorial activities from Racial Justice Act compliance consulting to asset forfeiture and parole opposition. While it mentions engagement with outside analysts on racial justice data, it primarily reflects standard prosecutorial operations rather than establishing clear ideological direction or policy changes. The document serves an informational function for prosecutor coordination rather than policy guidance.","[{'quote': ""We've continued to consult with an outside agency (UC Berkley Policy Lab), thinking that we may want to have them take a look at our data as was suggested in the December"", 'margin_type': 'extensive_margin', 'relevance': 'Shows engagement with external analysis for racial justice compliance'}, {'quote': 'the commissioners indicated they would recommend parole but also stated the family could appeal the decision to Governor Newsom', 'margin_type': 'intensive_margin', 'relevance': 'Indicates traditional approach to opposing parole releases'}, {'quote': 'We have several cases with looting charges under PC 463 where we will need to prove up that the crime was', 'margin_type': 'extensive_margin', 'relevance': 'Shows active prosecution of property crimes with enhanced penalties'}]"
2021.03.16_Contra Costa County_Racial Justice Digest.pdf,Contra Costa County,03/16/2021,2021-03-16,2021.0,general_memo,racial_justice,"['administrative', 'case_law_update', 'discovery']",mixed,0,0,0.0,mixed,medium,"['racial_justice_focus', 'implicit_bias_analysis']","['defensive_posture', 'resistance_to_proactive_reform']",moderate_impact,neutral,0,0,moderate_impact,neutral,0,0,not_addressed,not_addressed,not_addressed,not_addressed,not_addressed,not_addressed,moderate,not_mentioned,unclear,unclear,informational,"This document is a discussion thread from the California District Attorneys Association about implementing the Racial Justice Act (AB 2542/PC 745). The Sonoma County Chief Deputy DA seeks advice on using outside analysts to examine racial disparities in case outcomes while expressing concerns about public records access and defensive implications. The tone is primarily defensive and reactive, focusing on legal compliance and protecting the office from successful PC 745 motions rather than proactive reform to address racial disparities.","[{'quote': 'We hope the result will be that any racial disparities remain relatively stable, or perhaps narrow.', 'margin_type': 'both', 'significance': 'Reveals defensive posture - hoping to find minimal disparities rather than committing to eliminate them'}, {'quote': 'I know some offices have decided not to do anything proactive, but to simply respond to motions if and when they come in. Perhaps that is the wiser route?', 'margin_type': 'both', 'significance': 'Shows preference for reactive rather than proactive approach to racial justice issues'}, {'quote': ""wouldn't that raw data be (potentially) good evidence for the defense to rely on to establish a prima facia showing under PC 745?"", 'margin_type': 'both', 'significance': 'Primary concern is defensive - preventing data from being used against the office rather than addressing disparities'}]"
2021.03.21_Contra Costa County_CDAA Top Ten Kill BIll List.pdf,Contra Costa County,03/21/2021,2021-03-21,2021.0,general_memo,administrative,"['charging_decisions', 'sentencing', 'enhancements', 'bail', 'racial_justice']",clearly_traditional,0,1,-2.0,clearly_traditional,high,[],"['Opposition to zero bail policies', 'Opposition to limiting gang enhancements', 'Opposition to reducing gun penalties dramatically', 'Opposition to Racial Justice Act retroactivity', 'Opposition to limiting sentence enhancements broadly', 'Opposition to expanding diversion programs', 'Opposition to restricting in-custody informant use']",high_impact,more_punitive,0,1,high_impact,more_punitive,0,1,no,no,maximize,strict_enforcement,high_bail,not_addressed,low,Diana Becton (Contra Costa County),yes,continuation,informational,"This document is an internal communication from the California District Attorneys Association (CDAA) sharing a 'top ten kill list' of legislative bills that prosecutor organizations oppose. The list targets a comprehensive range of progressive criminal justice reforms including bail reform, sentence reduction, racial justice measures, and limitations on prosecutorial tools like gang enhancements and in-custody informants. The document reflects a clearly traditional prosecutorial ideology focused on maintaining punitive approaches and prosecutorial discretion against reform efforts.","[{'quote': 'And here is a top ten bill kill list, as identified by one of our Leg. Committee members', 'margin_type': 'both', 'significance': 'Demonstrates organized opposition to progressive reforms'}, {'quote': 'AB 1509 – repeals 12022.5 (guns) & 12022.7 (GBI); reduces 10-20-life for gun use to 1-2-3 (this is not a typo…you read that correctly)', 'margin_type': 'intensive', 'significance': 'Shows strong opposition to reducing gun enhancement penalties'}, {'quote': 'AB 329 & AB 262 – 0 bail', 'margin_type': 'extensive', 'significance': 'Opposition to bail reform that would reduce barriers to pretrial release'}]"
2021.04.08_Contra Costa County_Linda Fullerton Email.pdf,Contra Costa County,04/08/2021,2021-04-08,2021.0,general_memo,racial_justice,"['discovery', 'case_law_update']",unclear,0,0,,unclear,low,['engagement_with_racial_justice_act'],[],not_applicable,not_applicable,0,0,low_impact,neutral,0,0,not_addressed,not_addressed,not_addressed,not_addressed,not_addressed,not_addressed,unclear,not_mentioned,unclear,unclear,informational,This is a brief procedural email from prosecutor Linda Fullerton regarding case scheduling in the Clark/Goodwin matter. The communication indicates that argument on a Racial Justice Act motion will be continued for additional briefing while a discovery motion will proceed as scheduled. The document is purely administrative and provides no insight into prosecutorial policy positions or ideological orientation beyond acknowledging engagement with racial justice legal issues.,"[{'quote': ""After reading Mr. Maholich's motion, I am gong to ask to continue the argument on the Racial Justice Act for further briefing."", 'relevance': 'Shows engagement with racial justice issues but no substantive position', 'margin_type': 'procedural'}, {'quote': 'The discovery motion will go forward.', 'relevance': 'Indicates procedural decision-making in case management', 'margin_type': 'procedural'}]"
2021.04.14_Contra Costa County_Racial Justice Digest.pdf,Contra Costa County,04/14/2021,2021-04-14,2021.0,other,racial_justice,"['case_law_update', 'administrative']",unclear,0,0,,unclear,low,['engagement with racial justice legislation'],[],not_applicable,not_applicable,0,0,not_applicable,not_applicable,0,0,not_addressed,not_addressed,not_addressed,not_addressed,not_addressed,not_addressed,unclear,Venus D. Johnson,no,unclear,informational,"This document is a California District Attorneys Association forum post where Humboldt County DA Maggie Fleming requests a judicial memo about AB 2542 (Racial Justice Act) from other prosecutors. The document contains no substantive policy content or ideological positions, serving only as an information-seeking communication. It provides no insight into prosecutorial policies or practices regarding the extensive or intensive margins of criminal justice decision-making.","['Does anyone have the Judge Couzens memo on AB 2542?', 'I think there is a January 2021 memo but I cannot locate it.', 'AB 2542 Racial Justice Act Digest for Wednesday April 14, 2021']"
2021.05.05_Contra Costa County_ Inquisitive Prosecutor's Guide.pdf,Contra Costa County,05/05/2021,2021-05-05,2021.0,training_material,racial_justice,"['case_law_update', 'discovery', 'charging_decisions', 'sentencing']",neutral,0,0,0.0,neutral,high,"['Comprehensive analysis of racial justice legislation', 'Detailed guidance on implementing anti-discrimination protections', 'Focus on addressing systemic bias in prosecution and sentencing']","['Analytical rather than advocacy-oriented approach', 'Focuses on legal compliance rather than promoting reform', 'Maintains prosecutorial perspective throughout analysis']",high_impact,more_lenient,1,0,high_impact,more_lenient,1,0,not_addressed,not_addressed,not_addressed,not_addressed,not_addressed,not_addressed,high,not_mentioned,yes,clearly_new_policy,informational,"This comprehensive training document provides legal analysis and implementation guidance for AB 2542 (California Racial Justice Act), which creates new protections against racial discrimination in prosecution and sentencing. The document takes a neutral, analytical approach focused on legal compliance rather than advocacy, covering both existing selective prosecution law and new statutory protections. It addresses significant impacts on both charging decisions (extensive margin) and sentencing practices (intensive margin), providing prosecutors with detailed guidance on navigating the new legal landscape while maintaining a strictly professional, non-ideological tone.","[{'quote': ""This IPG provides an overview of the existing law regarding selective prosecution as well as the new law (Penal Code section 745) and amendments to existing laws (Penal Code sections 1473 and 1473.7) enacted by 'The California Racial Justice Act' (AB 2542)."", 'margin_type': 'both_margins', 'significance': ""Establishes the document's comprehensive coverage of new racial justice protections affecting both charging and sentencing""}, {'quote': 'This IPG is not intended to be a commentary on the merits of the new laws. Rather, it focuses on trying to identify, analyze, and propose possible ways of interpreting those aspects of the law that are vague, ambiguous, undefined, or novel.', 'margin_type': 'both_margins', 'significance': ""Demonstrates the document's neutral, analytical approach rather than advocacy position""}, {'quote': 'When a defendant establishes the elements of discriminatory prosecution, the action must be dismissed even if a serious crime is charged unless the People establish a compelling reason for the selective enforcement.', 'margin_type': 'extensive_margin', 'significance': 'Shows the significant impact on charging decisions and case outcomes when discrimination is proven'}]"
2021.05.11_Contra Costa County_Racial Justice Digest.pdf,Contra Costa County,05/11/2021,2021-05-11,2021.0,general_memo,racial_justice,"['case_law_update', 'administrative']",unclear,0,0,,unclear,low,['engagement_with_racial_justice_legislation'],[],not_applicable,not_applicable,0,0,not_applicable,not_applicable,0,0,not_addressed,not_addressed,not_addressed,not_addressed,not_addressed,not_addressed,moderate,"Maggie Fleming (Humboldt County), Anne Masterson (Sonoma County)",unclear,unclear,informational,"This document is an administrative communication within the California District Attorneys Association where prosecutors from multiple counties (Humboldt, Sonoma, Santa Clara) are sharing information about AB 2542, the Racial Justice Act. The communication shows prosecutor offices actively seeking judicial guidance and coordination materials about implementing this racial justice legislation. While it demonstrates institutional engagement with racial justice issues, the document is purely informational and does not reveal substantive policy positions or ideological orientations of the participating offices.","[{'quote': 'Does anyone have the Judge Couzens memo on AB 2542?', 'relevance': 'Shows active information seeking about Racial Justice Act implementation', 'margin_type': 'administrative'}, {'quote': 'I was just reading the most recent IPG published by Santa Clara Co, May 5, which makes several references to Couzins paper', 'relevance': 'Indicates coordination between DA offices on racial justice legislation guidance', 'margin_type': 'administrative'}]"
2021.05.21_Contra Costa County_Juvenile Racial Justice Opposition Motion.pdf,Contra Costa County,05/21/2021,2021-05-21,2021.0,case_guidance,racial_justice,"['juvenile', 'discovery']",leans_traditional,0,1,-1.0,leans_traditional,medium,[],"['opposition_to_racial_justice_act_motion', 'resistance_to_racial_justice_considerations']",low_impact,not_applicable,0,0,moderate_impact,more_punitive,0,1,not_addressed,not_addressed,not_addressed,not_addressed,not_addressed,not_addressed,low,not_mentioned,unclear,unclear,unclear,"This document is an internal communication about opposing a Racial Justice Act motion in a juvenile case, handled by the gang unit. The opposition to racial justice considerations suggests a more traditional prosecutorial approach that resists reforms aimed at addressing racial disparities in the justice system. While brief and procedural in nature, the document indicates the office's willingness to contest racial justice claims rather than embrace them as part of prosecutorial decision-making.","[{'quote': '**Juvenile** Racial Justice Opposition Motion', 'margin_type': 'intensive_margin', 'relevance': 'Indicates opposition to racial justice considerations in juvenile case'}, {'quote': 'CVRU-GANGS', 'margin_type': 'administrative', 'relevance': 'Shows this involves gang unit prosecution, suggesting serious charges'}]"
2021.05.21_Contra Costa County_Racial Justice Digest.pdf,Contra Costa County,05/21/2021,2021-05-21,2021.0,general_memo,racial_justice,"['case_law_update', 'administrative']",leans_traditional,0,1,-1.0,leans_traditional,medium,[],"['opposition to racial justice act motions', 'seeking strategies to resist racial bias claims', 'focus on maintaining convictions rather than examining potential racial bias']",not_applicable,not_applicable,0,0,moderate_impact,more_punitive,0,1,not_addressed,not_addressed,not_addressed,not_addressed,not_addressed,not_addressed,low,Los Angeles County District Attorney's Office,unclear,unclear,informational,"This document is a digest from a California District Attorneys Association discussion forum where a Los Angeles prosecutor seeks assistance in opposing a Racial Justice Act motion in a pandering case. The prosecutor is requesting written oppositions and strategies from colleagues to counter the defendant's claims of racial bias. The document reflects a traditional prosecutorial approach focused on maintaining convictions rather than examining potential racial bias in the criminal justice system. While limited in scope, it suggests resistance to racial justice reforms among some prosecutors.","[{'quote': 'Defendant filed a Motion for Relief Pursuant to Penal Code Section 745 (The California Racial Justice Act) for one of my 266i PC (Pandering) cases. Wondering if anyone has handled one of these in court yet?', 'margin_type': 'intensive', 'significance': 'Shows prosecutors encountering Racial Justice Act motions in active cases'}, {'quote': 'Does anyone have a written opposition they can send my way? What are courts and DDAs using to oppose these motions?', 'margin_type': 'intensive', 'significance': 'Demonstrates prosecutorial focus on opposing rather than evaluating racial justice claims'}, {'quote': 'Looking for any help anyone can send my way... PC 745 Opposition Advice Needed', 'margin_type': 'intensive', 'significance': 'Indicates systematic effort to resist Racial Justice Act implementation'}]"
2021.05.24_Contra Costa County_Racial Justice Digest.pdf,Contra Costa County,05/24/2021,2021-05-24,2021.0,training_material,administrative,"['case_law_update', 'racial_justice']",unclear,0,0,,unclear,high,[],[],not_applicable,not_applicable,0,0,not_applicable,not_applicable,0,0,not_addressed,not_addressed,not_addressed,not_addressed,not_addressed,not_addressed,not_addressed,not_mentioned,no,unclear,informational,"This document is an administrative announcement from the California District Attorneys Association about a free training symposium on high-tech crimes and digital evidence. The training covers topics like cyber fraud, identity theft, and online exploitation of children, aimed at prosecutors and investigators. While distributed through a Racial Justice Act mailing list, the content is purely informational about professional development opportunities and contains no policy guidance or ideological indicators. The document reflects routine administrative communication rather than substantive prosecutorial policy.","['This 3 ½ day seminar includes daily virtual sessions that will cover Cyber Fraud, ID Theft, Search and Seizure, and Online Exploitation of Children.', 'Digital evidence is now a key component in every criminal case. This seminar will help you stay ahead of the curve with instruction from leading experts in the field.', ""You are subscribed to 'AB 2542 Racial Justice Act' as mlaettner@contracostada.org.""]"
2021.05.27_Contra Costa County_Internal Email re Racial Justice Act Case.pdf,Contra Costa County,05/27/2021,2021-05-27,2021.0,general_memo,racial_justice,"['discovery', 'administrative', 'case_law_update']",unclear,0,0,,unclear,low,['engagement_with_racial_justice_act_motion'],[],not_applicable,not_applicable,0,0,low_impact,neutral,0,0,not_addressed,not_addressed,not_addressed,not_addressed,not_addressed,not_addressed,unclear,not_mentioned,no,unclear,informational,"This is an internal administrative email from a Deputy District Attorney regarding scheduling and court appearance logistics for a case involving a Racial Justice Act motion. The document is purely procedural, focusing on coordinating court dates, discovery deadlines, and departmental assignments. While the case involves a motion under PC 745 (Racial Justice Act), the prosecutor's substantive position on racial justice issues is not revealed, making ideological assessment impossible from this document alone.","[{'quote': ""September 10, 2021 - supplemental briefing on the Racial Justice Act motion, if needed. September 24, 2021- People's reply to supplemental briefing on the Racial Justice Act October 8, 2021 – Hearing on motion to dismiss under PC 745, Racial Justice Act"", 'margin_type': 'intensive_margin', 'relevance': 'Shows the case involves a Racial Justice Act motion that could affect case outcome'}, {'quote': ""Because the Racial Justice Act motion is supposed to be heard 'in the trial department' we would suggest and ask that this case be assigned to a department"", 'margin_type': 'administrative', 'relevance': 'Demonstrates procedural engagement with racial justice issues but no substantive position'}]"
2021.06.02_Contra Costa County_Racial Justice Digest.pdf,Contra Costa County,06/02/2021,2021-06-02,2021.0,training_material,administrative,"['case_law_update', 'racial_justice']",unclear,0,0,,unclear,low,['racial_justice_act_context'],"['prison_crimes_focus', 'prosecution_training']",not_applicable,not_applicable,0,0,low_impact,neutral,0,0,not_addressed,not_addressed,not_addressed,not_addressed,not_addressed,not_addressed,low,not_mentioned,no,unclear,informational,"This document is an administrative announcement for a California District Attorneys Association training seminar on prison crimes prosecution scheduled for June 21, 2021. The seminar covers traditional prosecutorial topics including sentencing, crime scene investigation, and prison-specific crimes, aimed at prosecutors, investigators, and correctional officers. While distributed through a Racial Justice Act digest, the document itself contains no substantive policy content and appears to be routine professional development training. The document provides no insight into prosecutorial ideology or policy orientation beyond standard law enforcement training.","[{'quote': 'This program will offer structured presentations on issues unique to in-prison investigations and prosecutions', 'margin_type': 'intensive', 'relevance': 'Indicates focus on post-conviction enforcement and prison-based prosecutions'}, {'quote': 'Topics covered will include: Sentencing • Crimes Scene Investigation • Miranda in a Custodial Setting • Common Prison Crimes • Investigator & Prosecutor Ethics', 'margin_type': 'intensive', 'relevance': 'Shows traditional prosecution training focus with emphasis on enforcement within correctional settings'}]"
2021.06.06_Contra Costa County_CDAA Truancy Workgroup Meeting Zoom Invite.pdf,Contra Costa County,06/06/2021,2021-06-06,2021.0,general_memo,administrative,['juvenile'],unclear,0,0,,unclear,low,[],[],not_applicable,not_applicable,0,0,not_applicable,not_applicable,0,0,not_addressed,not_addressed,not_addressed,not_addressed,not_addressed,not_addressed,not_addressed,not_mentioned,unclear,unclear,informational,"This document is a brief email invitation for a California District Attorneys Association (CDAA) Truancy Workgroup meeting scheduled for January 6, 2021. The email is purely administrative, providing meeting logistics including a Zoom link and agenda attachment. The document contains no substantive policy content or ideological indicators, serving only as coordination communication between workgroup participants.","['Our CDAA Truancy Workgroup meeting is tomorrow at noon - administrative coordination', ""Please find the zoom link below. I've also attached an agenda here - procedural information"", 'Topic: CDAA Truancy Working Group - meeting subject identification']"
2021.06.15_Contra Costa County_Criminal Justice Forum Outline.pdf,Contra Costa County,06/15/2021,2021-06-15,2021.0,other,racial_justice,"['sentencing', 'enhancements', 'administrative']",clearly_progressive,1,0,2.0,clearly_progressive,high,"['Focus on Racial Justice Act addressing discriminatory impacts', 'Support for gang enhancement reform (AB333)', 'Emphasis on mental health considerations in prosecution', 'Discussion of re-sentencing mechanisms for justice interests', 'Participation in prosecutors alliance', 'Examination of prosecutor-police separation issues', 'Statistical analysis of disparate impacts acceptable']","['Consideration of victim impact in re-sentencing decisions', 'Discussion of public safety concerns with gang enhancement reforms']",moderate_impact,more_lenient,1,0,high_impact,more_lenient,1,0,unclear,yes,reform_oriented,not_addressed,not_addressed,not_addressed,high,Diana Becton,yes,modification,informational,"This document is an outline for a criminal justice reform forum featuring DA Diana Becton, focusing heavily on progressive reform topics including racial justice, gang enhancement reform, mental health considerations, and re-sentencing mechanisms. The forum addresses both legislative reforms (AB333, AB118, Racial Justice Act) and prosecutorial practices, demonstrating a clear progressive orientation toward criminal justice reform. The emphasis on addressing discriminatory impacts, reducing harsh sentencing practices, and examining prosecutor-police relationships reflects a comprehensive reform agenda.","[{'quote': 'What makes it in the interest of justice?', 'margin_type': 'intensive_margin', 'relevance': 'Shows focus on flexible re-sentencing standards'}, {'quote': 'RJA will address racism in convictions, whether by pleas or trials... No need to prove it was on purpose... Disparate impact ok, can use statistics', 'margin_type': 'both_margins', 'relevance': 'Demonstrates commitment to addressing systemic racial bias'}, {'quote': 'describe how does the prosecutors alliance views/treats gang allegations going forward', 'margin_type': 'intensive_margin', 'relevance': 'Indicates reform-oriented approach to gang enhancements'}]"
2021.06.16_Contra Costa County_Email re Couzens Racial Justice Act.pdf,Contra Costa County,06/16/2021,2021-06-16,2021.0,training_material,racial_justice,"['case_law_update', 'procedure_manual', 'sentencing', 'charging_decisions']",clearly_progressive,1,0,2.0,clearly_progressive,high,"['racial justice focus', 'statistical evidence acceptance for bias claims', 'implicit bias recognition', 'remedies for discriminatory practices', 'retroactive application provisions', 'burden shifting to prosecution for race-neutral explanations']",[],high_impact,more_lenient,1,0,high_impact,more_lenient,1,0,not_addressed,not_addressed,reform_oriented,not_addressed,not_addressed,not_addressed,high,not_mentioned,yes,clearly_new_policy,mandatory,"This document is a comprehensive training manual on California's Racial Justice Act of 2020, explaining how the new law prohibits seeking convictions or imposing sentences based on race, ethnicity, or national origin. The Act creates five specific violations including bias by court actors, discriminatory language, disparate charging practices, and sentencing disparities based on defendant or victim race. It represents a major progressive reform by allowing statistical evidence alone to prove discrimination, eliminating the previous requirement to show purposeful intent, and providing extensive remedies including case dismissal, sentence vacation, and resentencing.","[{'quote': 'The state shall not seek or obtain a criminal conviction or seek, obtain, or impose a sentence on the basis of race, ethnicity, or national origin.', 'margin_type': 'both_extensive_and_intensive', 'significance': 'Core prohibition affecting both charging and sentencing decisions'}, {'quote': ""AB 2542 has changed how statistical evidence can serve as the basis for establishing a constitutional violation... AB 2542, however, provides such statistical evidence is sufficient alone to establish a violation so long as it is 'significant' and the defendants in the comparable cases are 'similarly situated.'"", 'margin_type': 'both_extensive_and_intensive', 'significance': 'Fundamental shift from requiring proof of intentional discrimination to accepting statistical disparities'}, {'quote': ""It is the intent of the Legislature to eliminate racial bias from California's criminal justice system because racism in any form or amount, at any stage of a criminal trial, is intolerable, inimical to a fair criminal justice system"", 'margin_type': 'both_extensive_and_intensive', 'significance': 'Strong progressive stance on zero tolerance for racial bias'}]"
2021.06.21_Contra Costa County_Racial Justice Act Prison Crimes Seminar.pdf,Contra Costa County,06/21/2021,2021-06-21,2021.0,training_material,administrative,"['case_law_update', 'racial_justice']",unclear,0,0,,unclear,low,['racial_justice'],['prison_crimes_focus'],not_applicable,not_applicable,0,0,low_impact,neutral,0,0,not_addressed,not_addressed,not_addressed,not_addressed,not_addressed,not_addressed,low,not_mentioned,no,unclear,informational,"This document is an administrative announcement for a California District Attorneys Association training seminar on prosecuting crimes within prison settings, scheduled for June 21, 2021. The seminar covers technical aspects of prison prosecutions including sentencing, crime scene investigation, and ethics. While the Racial Justice Act is mentioned in the subject line, the document itself is purely informational and does not articulate any policy positions or ideological framework regarding prosecutorial practices.","['This program will offer structured presentations on issues unique to in-prison investigations and prosecutions, as well as open discussion on prison topics relevant to prosecutors, investigators and correctional officers.', 'Topics covered will include: Sentencing • Crimes Scene Investigation • Miranda in a Custodial Setting • Common Prison Crimes • Investigator & Prosecutor Ethics', 'AB 2542 Racial Justice Act : Prison Crimes Seminar']"
2021.06.25_Contra Costa County_Racial Justice Act Responding Case Data Request.pdf,Contra Costa County,06/25/2021,2021-06-25,2021.0,general_memo,racial_justice,"['discovery', 'case_law_update', 'administrative']",leans_traditional,0,1,-1.0,leans_traditional,medium,['engagement_with_racial_justice_act'],"['resistance_to_broad_data_disclosure', 'emphasis_on_procedural_barriers', 'seeking_ways_to_limit_compliance']",low_impact,not_applicable,0,0,moderate_impact,neutral,0,0,not_addressed,not_addressed,not_addressed,not_addressed,not_addressed,not_addressed,low,not_mentioned,unclear,unclear,informational,"This document is an email from a Chief Deputy District Attorney seeking guidance on how to respond to the first Racial Justice Act data request received by their office. Rather than focusing on compliance or the substantive goals of racial justice reform, the prosecutor emphasizes procedural objections to the request's scope and seeks advice from other counties on how to limit or formalize the response process. The tone suggests institutional resistance to transparency requirements rather than embracing racial justice reform goals.","[{'quote': 'Their request is overbroad because the requests need to have at least some degree of specificity to the circumstances of the charged offenses and the request must be sustained by plausible justification.', 'margin_type': 'procedural', 'significance': 'Shows resistance to broad transparency requirements'}, {'quote': 'The defendant gives no justifications in support of his request, nor does he give any date ranges for the requested data nor does he narrow his request to similarly situated defendants by the same or similar type of crime.', 'margin_type': 'procedural', 'significance': 'Demonstrates focus on limiting scope of racial justice data disclosure'}, {'quote': 'what are other counties doing with regards to an informal request from defense for data? Are any counties requiring that a formal request be made by the defendant by written motion?', 'margin_type': 'procedural', 'significance': 'Seeks strategies to create additional procedural barriers to data access'}]"
2021.06.25_Contra Costa County_Racial Justice Digest.pdf,Contra Costa County,06/25/2021,2021-06-25,2021.0,general_memo,racial_justice,"['discovery', 'case_law_update', 'administrative']",neutral,0,0,0.0,neutral,medium,['engagement_with_racial_justice_act_compliance'],"['resistance_to_broad_data_disclosure', 'emphasis_on_procedural_barriers']",low_impact,not_applicable,0,0,moderate_impact,neutral,0,0,not_addressed,not_addressed,not_addressed,not_addressed,not_addressed,not_addressed,moderate,Venus D. Johnson,unclear,unclear,informational,"This document is an inter-office communication from the California District Attorneys Association regarding procedural responses to Racial Justice Act data requests. A San Luis Obispo prosecutor seeks guidance from other counties on how to handle defense requests for prosecutorial statistics and policies, particularly emphasizing ways to narrow overly broad requests through procedural requirements. The document reflects a cautious, compliance-focused approach to racial justice transparency requirements rather than proactive reform efforts.","[{'quote': 'Their request is overbroad because the requests need to have at least some degree of specificity to the circumstances of the charged offenses and the request must be sustained by plausible justification.', 'margin_type': 'procedural', 'relevance': 'Shows cautious approach to racial justice data disclosure'}, {'quote': 'We have just received out first informal request for DA office filings and prosecution statistics in accordance with the Racial Justice Act, AB2542. The defense requested broad general statistics with regard to total filings against various ethnicities, our policies on striking strikes when in plea negotiations', 'margin_type': 'intensive_margin', 'relevance': 'Indicates the types of prosecutorial data being requested under racial justice review'}, {'quote': 'what are other counties doing with regards to an informal request from defense for data? Are any counties requiring that a formal request be made by the defendant by written motion?', 'margin_type': 'procedural', 'relevance': 'Shows prosecutor seeking guidance on limiting data access through procedural requirements'}]"
2021.06.26_Contra Costa County_.Fullerton Email re Racial Justice Act Discovery.pdf,Contra Costa County,06/26/2021,2021-06-26,2021.0,general_memo,discovery,['racial_justice'],leans_progressive,1,0,1.0,leans_progressive,low,"['racial_justice_act_motion', 'thorough_discovery_pursuit']",[],not_applicable,not_applicable,0,0,low_impact,more_lenient,1,0,not_addressed,not_addressed,not_addressed,not_addressed,not_addressed,not_addressed,moderate,not_mentioned,no,unclear,informational,"This document is a discovery request from defense attorney Linda Fullerton to prosecutors requesting missing phone data records, forensic reports, and a Vera Institute analysis of charging data. The primary significance is the mention of an upcoming Racial Justice Act motion, which suggests the defense is preparing to challenge prosecutorial practices on racial equity grounds. While procedural in nature, the document indicates scrutiny of prosecutorial charging patterns and potential racial disparities in the office's decision-making.","[{'quote': 'I understand that the Vera Institute produced a report for your office where they did a compilation and analyses of charging data from your ofice. I will need that for the Racial Justice Act motion that I am going to file.', 'margin_type': 'intensive_margin', 'relevance': 'Indicates potential challenge to prosecutorial practices based on racial justice concerns'}, {'quote': 'There are various phone data records we still do not have.', 'margin_type': 'procedural', 'relevance': 'Shows thorough discovery approach that could impact case outcomes'}]"
2021.06.28_Contra Costa County_Racial Justice Digest.pdf,Contra Costa County,06/28/2021,2021-06-28,2021.0,general_memo,racial_justice,"['discovery', 'case_law_update', 'administrative']",unclear,0,0,,unclear,low,"['engagement_with_racial_justice_act', 'willingness_to_provide_racial_data']","['resistance_to_broad_data_requests', 'emphasis_on_procedural_barriers', 'focus_on_limiting_scope_of_requests']",low_impact,not_applicable,0,0,moderate_impact,neutral,0,0,not_addressed,not_addressed,not_addressed,not_addressed,not_addressed,not_addressed,moderate,not_mentioned,unclear,unclear,informational,"This document is a digest of prosecutor discussions about responding to defense requests for racial and ethnic data under California's Racial Justice Act (AB 2542). The communications show prosecutors from multiple counties sharing strategies for handling data requests, with emphasis on limiting the scope of requests through procedural requirements. While the document demonstrates engagement with racial justice issues, the tone suggests a compliance-focused rather than reform-oriented approach to the new law.","[{'quote': 'Their request is overbroad because the requests need to have at least some degree of specificity to the circumstances of the charged offenses and the request must be sustained by plausible justification.', 'margin_type': 'intensive_margin', 'relevance': 'Shows resistance to broad racial justice data requests'}, {'quote': 'We have been in deep discussions for the past 6 months, with internal and external consultants, trying to decide what data to collect, how to collect it, whether it is truly reliable, what to turn over, what to object to, etc.', 'margin_type': 'intensive_margin', 'relevance': 'Indicates careful consideration of racial justice compliance but also potential resistance'}, {'quote': ""Would be helpful to brainstorm with you and I'd be happy to assist in any way I can."", 'margin_type': 'administrative', 'relevance': 'Shows collaborative approach among prosecutors in responding to racial justice requirements'}]"
2021.07.08_Contra Costa County_Racial Justice Digest.pdf,Contra Costa County,07/08/2021,2021-07-08,2021.0,general_memo,racial_justice,"['discovery', 'case_law_update', 'administrative']",neutral,0,0,0.0,neutral,medium,"['compliance_with_racial_justice_legislation', 'data_transparency_discussions']","['strategic_coordination_to_limit_disclosure', 'defensive_posture_toward_racial_justice_claims']",moderate_impact,neutral,0,0,high_impact,more_lenient,1,0,not_addressed,not_addressed,not_addressed,not_addressed,not_addressed,not_addressed,moderate,not_mentioned,unclear,continuation,informational,"This document is an inter-office communication among California district attorneys discussing implementation of AB 2542 (Racial Justice Act), focusing on how to respond to defense requests for prosecutorial data that could support claims of racial bias. The prosecutors are strategically coordinating their responses and discussing what data to disclose versus object to. While complying with the law's requirements, the tone suggests a defensive posture aimed at limiting the Act's impact rather than proactively addressing racial justice concerns.","[{'quote': 'We have been in deep discussions for the past 6 months, with internal and external consultants, trying to decide what data to collect, how to collect it, whether it is truly reliable, what to turn over, what to object to, etc.', 'margin_type': 'intensive_margin', 'relevance': 'Shows strategic approach to limiting data disclosure that could support racial bias claims'}, {'quote': 'I have responded to a couple of motions made under (a)(1) and (a)(3)', 'margin_type': 'intensive_margin', 'relevance': 'Indicates active defense challenges under the Racial Justice Act provisions'}, {'quote': ""Would be helpful to brainstorm with you and I'd be happy to assist in any way I can"", 'margin_type': 'administrative', 'relevance': 'Shows coordination among prosecutor offices to develop unified response strategies'}]"
2021.07.09_Contra Costa County_Email re PC 745(d) Motion.pdf,Contra Costa County,07/09/2021,2021-07-09,2021.0,case_guidance,racial_justice,"['discovery', 'case_law_update', 'administrative']",neutral,0,0,0.0,neutral,medium,"['responding_to_racial_justice_motion', 'compliance_with_discovery_requirements']","['gang_prosecution_context', 'use_of_rap_lyrics_in_prosecution', 'gang_enhancement_pursuit']",not_applicable,not_applicable,0,0,moderate_impact,neutral,0,0,not_addressed,not_addressed,unclear,not_addressed,not_addressed,not_addressed,moderate,Diana Becton,unclear,unclear,mandatory,"This document consists of internal communications regarding the office's response to a racial justice motion challenging the use of rap lyrics against Black defendants in a gang prosecution case. The prosecutor's office is providing required declarations stating they have no formal training materials on using rap music in prosecutions, while defending their use of a defendant's rap lyrics to prove gang enhancements in a murder case. The document reflects procedural compliance with racial justice law requirements rather than proactive policy reform, occurring within the context of traditional gang prosecution practices.","[{'quote': 'defense counsel filed a racial justice act motion, claiming that our office disproportionately uses rap music and rap lyrics against Black defendants', 'margin_type': 'intensive_margin', 'significance': 'Shows the office is facing racial justice challenges regarding prosecutorial practices'}, {'quote': ""This is my one of my old PC 187 cases, where (D) filed a PC 745(a)(2) motion regarding the use of the (D)'s own RAP lyrics in trial to prove the gang enhancement"", 'margin_type': 'intensive_margin', 'significance': 'Demonstrates traditional gang prosecution tactics using rap lyrics for enhancements'}, {'quote': 'I am not aware of any training conducted by the CCCDAO regarding the use of rap music, lyrics, and/or videos in criminal prosecutions', 'margin_type': 'administrative', 'significance': 'Indicates lack of formal policy or training on potentially problematic prosecutorial practices'}]"
2021.07.16_Contra Costa County_CDAA Priority Bills.pdf,Contra Costa County,07/16/2021,2021-07-16,2021.0,general_memo,administrative,"['enhancements', 'sentencing', 'racial_justice', 'case_law_update']",clearly_traditional,0,1,-2.0,clearly_traditional,high,[],"['opposition to enhancement reform', 'opposition to resentencing', 'opposition to racial justice act retroactivity', 'support for gang enhancements', 'opposition to bail reform', 'victim-centered rhetoric', 'tough-on-crime framing', 'opposition to sentence reduction measures']",moderate_impact,more_punitive,0,1,high_impact,more_punitive,0,1,not_addressed,no,maximize,not_addressed,high_bail,not_addressed,low,not_mentioned,yes,continuation,strong_guidance,"This document is a legislative update from the California District Attorneys Association opposing multiple criminal justice reform bills during the 2021 legislative session. CDAA takes strong opposition positions on bills related to trauma-informed sentencing, racial justice act retroactivity, gang enhancement reforms, resentencing provisions, and DA conflict of interest rules. The memo reflects a traditional tough-on-crime prosecutorial ideology that prioritizes maintaining current harsh sentencing practices and opposes reforms aimed at reducing punishment severity or addressing systemic inequities.","[{'quote': 'AB 124 will grant the right to anyone who claims to have suffered any type of trauma in their life, no matter the degree of trauma, to a powerful presumption of receiving no more than the lowest state prison term for their offense', 'margin_type': 'intensive', 'significance': 'Shows opposition to trauma-informed sentencing reforms'}, {'quote': 'If AB333 passes, there will be no viable gang allegation, and gang members who commit serious or violent offenses in our communities will not be held accountable for the full extent of their criminal conduct', 'margin_type': 'intensive', 'significance': 'Demonstrates commitment to maintaining gang enhancements'}, {'quote': 'This bill is dangerous, arbitrary, inconsistent and unconstitutional and we respectfully ask for a NO vote', 'margin_type': 'extensive', 'significance': 'Reflects strong opposition to DA conflict of interest reforms'}]"
2021_Contra Costa County_AB 2542 CA High Tech and Digital Evidence Symposium.pdf,Contra Costa County,01/01/2021,2021-01-01,2021.0,training_material,administrative,"['case_law_update', 'discovery']",unclear,0,0,,unclear,high,[],[],not_applicable,not_applicable,0,0,not_applicable,not_applicable,0,0,not_addressed,not_addressed,not_addressed,not_addressed,not_addressed,not_addressed,not_addressed,not_mentioned,no,unclear,informational,"This document is an administrative announcement from the California District Attorneys Association promoting a free training symposium on high-tech crimes and digital evidence. The training covers technical topics like cyber fraud, identity theft, search and seizure, and online exploitation of children. The document is purely informational and contains no substantive policy content or ideological indicators regarding prosecutorial approach or criminal justice philosophy. It represents routine professional development rather than policy guidance.","['This 3 ½ day seminar includes daily virtual sessions that will cover Cyber Fraud, ID Theft, Search and Seizure, and Online Exploitation of Children.', 'Digital evidence is now a key component in every criminal case. This seminar will help you stay ahead of the curve with instruction from leading experts in the field.', 'Beginner- and advanced-level prosecutors and investigators dealing with high tech cases and digital evidence are encouraged to register.']"
2021_Contra Costa County_Bryant Case Scheduling.pdf,Contra Costa County,01/01/2021,2021-01-01,2021.0,general_memo,racial_justice,"['administrative', 'case_guidance']",unclear,0,0,,unclear,low,['racial_justice_act_proceeding'],[],not_applicable,not_applicable,0,0,low_impact,neutral,0,0,not_addressed,not_addressed,not_addressed,not_addressed,not_addressed,not_addressed,unclear,not_mentioned,no,unclear,informational,"This document is an email from a Deputy Public Defender to the court requesting confirmation that expert witnesses can testify via Zoom at a Racial Justice Act evidentiary hearing. The communication is purely procedural and administrative in nature, focusing on hearing logistics rather than substantive policy positions. While it references a Racial Justice Act proceeding, the document does not provide insight into prosecutorial ideology or policy orientation since it originates from the defense side of the case.","[{'quote': 'I just wanted to confirm with the Court that it will be acceptable for Mr. Bryant to call his expert witnesses via Zoom at the Racial Justice Act evidentiary hearing on Sept. 3, 2021', 'margin_type': 'intensive_margin', 'relevance': 'References Racial Justice Act proceeding which relates to potential sentence modification'}]"
2021_Contra Costa County_California Racial Justice Act Working Group.pdf,Contra Costa County,01/01/2021,2021-01-01,2021.0,general_memo,racial_justice,['administrative'],clearly_progressive,1,0,2.0,clearly_progressive,high,"['racial_justice_focus', 'collaborative_working_group_approach', 'association_with_prosecutors_alliance']",[],moderate_impact,more_lenient,1,0,moderate_impact,more_lenient,1,0,unclear,unclear,not_addressed,not_addressed,not_addressed,not_addressed,high,not_mentioned,unclear,clearly_new_policy,informational,"This email establishes a California Racial Justice Act working group among prosecutors to share resources and best practices for CRJA compliance. The document reflects a clearly progressive prosecutorial approach with high emphasis on racial justice issues. While brief, it indicates a proactive stance toward addressing racial bias in prosecutorial decisions and suggests potential impacts on both charging decisions and sentencing practices through improved compliance with racial justice requirements.","[{'quote': 'The purpose of this group would be to share resources and information, identify issues and trends with implementation, and to exchange ideas and best practices to comply with CRJA', 'margin_type': 'both_margins', 'significance': 'Shows proactive approach to racial justice compliance'}, {'quote': 'California Racial Justice Act (CRJA) working group', 'margin_type': 'both_margins', 'significance': 'Demonstrates focus on addressing racial bias in prosecution'}]"
2021_Contra Costa County_December and January Team Meeting Minutes.pdf,Contra Costa County,01/01/2021,2021-01-01,2021.0,general_memo,case_law_update,"['victim_services', 'administrative', 'racial_justice']",leans_progressive,1,0,1.0,leans_progressive,medium,"['racial_justice_act_implementation', 'victim_protection_procedures', 'person_first_language_emphasis', 'implicit_bias_awareness', 'specialized_victim_services']","['law_enforcement_operations', 'prosecution_focused_case_management', 'conviction_pursuit']",low_impact,neutral,0,0,moderate_impact,more_lenient,1,0,not_addressed,unclear,not_addressed,not_addressed,not_addressed,not_addressed,moderate,not_mentioned,unclear,modification,strong_guidance,"This document consists of meeting minutes from a specialized Human Trafficking and Victim/Witness unit, focusing primarily on case law updates, victim protection procedures, and implementation of the new Racial Justice Act. The content emphasizes victim-centered approaches through specialized testimony procedures and advocate services, while also addressing the need to prevent racial bias in prosecution practices. The document reflects a specialized unit's operational focus rather than broad policy directives, with moderate progressive leanings evident in its attention to bias prevention and victim protection.","[{'quote': ""CDAA Training identified HT and Gang cases as particularly susceptible; recommended 'person first' phrasing and use of quotes when using terms specific to HT / Pimp culture"", 'margin_type': 'intensive_margin', 'significance': 'Shows progressive approach to language and bias prevention'}, {'quote': 'Needs to be part of our filing considerations. Nichelle points out that means we will need to review body cam evidence pre-filing. Affidavits too.', 'margin_type': 'extensive_margin', 'significance': 'Indicates procedural changes to prevent racial bias in charging decisions'}, {'quote': 'Best practice is in-person meetings with victims so we need to explore all options for in-person before using phone contact only', 'margin_type': 'intensive_margin', 'significance': 'Demonstrates victim-centered approach prioritizing personal contact'}]"
2021_Contra Costa County_Internal Emails re RJA Guidance.pdf,Contra Costa County,01/01/2021,2021-01-01,2021.0,case_guidance,racial_justice,"['discovery', 'training_material', 'case_law_update']",clearly_progressive,1,0,2.0,clearly_progressive,high,"['Proactive implementation of Racial Justice Act compliance', 'Partnership with Prosecutors Alliance for progressive training', 'Collaboration on survivor-informed and trauma-informed prosecution practices', 'Engagement with criminal justice reform advocates', 'Emphasis on implicit bias awareness and prevention', 'Data-driven approach to identifying and addressing disparate outcomes']","['Continued focus on prosecution rather than declination', 'Emphasis on victim services units (CVRU & HT)']",moderate_impact,more_lenient,1,0,high_impact,more_lenient,1,0,unclear,unclear,not_addressed,not_addressed,not_addressed,not_addressed,high,Diana Becton,yes,clearly_new_policy,mandatory,"This document consists of internal emails from the Contra Costa County DA's office regarding implementation of California's Racial Justice Act (AB 2542). The emails show the office taking a proactive, collaborative approach to compliance, including forming internal committees, partnering with the progressive Prosecutors Alliance for training, consulting with data experts, and engaging with criminal justice reform advocates. The correspondence demonstrates a clear commitment to eliminating racial bias in prosecution practices and suggests a reform-oriented prosecutorial philosophy under DA Diana Becton's administration.","[{'quote': 'The use of racially charged or coded language throughout the entirety of case proceedings is now explicitly prohibited (i.e. - super predictor, thug, ghetto, spade, macho, shyster, illegal immigrants, etc.). This also includes to use of language that refers to animals or animal attributes (i.e. - gorilla pimp, bottom, coyote, snake, brut, predator, etc.).', 'margin_type': 'intensive_margin', 'significance': 'Demonstrates commitment to eliminating racial bias in prosecution practices'}, {'quote': 'DA Becton expressed interest in the California Racial Justice Act training the Prosecutors Alliance conducted in San Francisco and I wanted to get started on that for Contra Costa.', 'margin_type': 'both_margins', 'significance': 'Shows proactive engagement with progressive prosecution organizations'}, {'quote': 'We are looking to consult and potentially retain a statistician/data expert to review our data, advise us on best practices to collect data, and also potentially testify in court if the need arises.', 'margin_type': 'intensive_margin', 'significance': 'Indicates commitment to data-driven approach to identifying and addressing racial disparities'}]"
2021_Contra Costa County_Racial Justice Act Further Guidance and Updates.pdf,Contra Costa County,01/01/2021,2021-01-01,2021.0,case_guidance,racial_justice,"['discovery', 'case_law_update', 'administrative']",leans_progressive,1,0,1.0,leans_progressive,high,"['Implementation of racial justice legislation', 'Proactive bias training and awareness', 'Systematic documentation of case decisions for accountability', 'Prohibition of racially coded language', 'Focus on implicit and explicit bias prevention']","['Continued prosecution of sexual assault and trafficking cases', 'Concern about maintaining case viability rather than fundamental reform']",moderate_impact,more_lenient,1,0,high_impact,more_lenient,1,0,not_addressed,not_addressed,not_addressed,not_addressed,not_addressed,not_addressed,high,not_mentioned,yes,clearly_new_policy,mandatory,"This document provides guidance to Contra Costa County prosecutors on implementing California's Racial Justice Act (AB 2542), which prohibits racially biased language and conduct in criminal proceedings. The memo establishes mandatory procedures for avoiding bias violations, including specific prohibited language, new documentation requirements for case decisions, and protocols for handling discovery motions related to racial bias claims. The guidance reflects a proactive approach to racial justice compliance while maintaining prosecutorial effectiveness, particularly in sensitive case areas like sexual assault and human trafficking.","[{'quote': 'The use of racially charged or coded language throughout the entirety of case proceedings is now explicitly prohibited (i.e. - super predictor, thug, ghetto, spade, macho, shyster, illegal immigrants, etc.). This also includes to use of language that refers to animals or animal attributes (i.e. - gorilla pimp, bottom _____, coyote, snake, brut, predator, etc.)', 'margin_type': 'intensive_margin', 'significance': 'Shows concrete steps to eliminate biased language in prosecution'}, {'quote': 'we are going to try to capture data moving forward so that at some point in the future we could theoretically go back and more easily explain why cases were negotiated the way they were', 'margin_type': 'both_margins', 'significance': 'Demonstrates accountability measures for prosecutorial decision-making'}, {'quote': 'PC 745 creates new code sections regulating language and conduct of judges, attorneys, officers, experts & jurors. It also provides new discovery and hearing rights and creates mandatory remedies for conduct and language violations', 'margin_type': 'both_margins', 'significance': 'Explains the comprehensive nature of racial justice reforms affecting all aspects of prosecution'}]"
2021_Contra Costa County_Will California See Another Wave (Covid).pdf,Contra Costa County,01/01/2021,2021-01-01,2021.0,other,other,['administrative'],unclear,0,0,,unclear,high,[],[],not_applicable,not_applicable,0,0,not_applicable,not_applicable,0,0,not_addressed,not_addressed,not_addressed,not_addressed,not_addressed,not_addressed,not_addressed,not_mentioned,no,unclear,informational,"This document is a news digest or newsletter containing brief summaries of various news articles covering topics such as COVID-19 updates, political recalls, school board issues, business closures, and entertainment. It appears to be informational content rather than prosecutorial policy guidance. The document contains no prosecutorial ideology, criminal justice policies, or office directives that would indicate any particular prosecutorial orientation or approach to criminal justice matters.","['Early attempt to invoke Racial Justice Act denied by South Bay judge - New law seeks to empower challenges to convictions on claims that racial bias tainted fairness of court proceedings.', 'COVID: Will California see another wave? The U.S. is seeing an overall rise in COVID-19 cases, but the numbers in California look more promising.', ""Parents group seeks to recall all five Mount Diablo school board members - The Mount Diablo Unified School District board recall effort is led by a group of families who are upset the district didn't reopen schools quickly enough.""]"
Contra Costa County_Successful Tests Based on Presumptives.pdf,Contra Costa County,10/05/2021,2021-10-05,2021.0,training_material,charging_decisions,"['case_law_update', 'procedure_manual']",leans_traditional,0,1,-1.0,leans_traditional,medium,"['emphasis_on_evidence_standards', 'professional_prosecutorial_standards']","['focus_on_successful_prosecution', 'drug_prosecution_emphasis', 'ensuring_convictions']",high_impact,more_punitive,0,1,low_impact,not_applicable,0,0,not_addressed,not_addressed,not_addressed,not_addressed,not_addressed,not_addressed,not_addressed,Mark A. Peterson,yes,unclear,strong_guidance,"This document appears to be training material from the Contra Costa County District Attorney's office focusing on drug prosecutions based on presumptive tests. It emphasizes prosecutorial standards and the requirement for sufficient evidence before filing charges, with a clear orientation toward successful conviction outcomes. The document reflects traditional prosecutorial priorities centered on effective drug case prosecution, though the limited text prevents assessment of broader policy positions on alternatives to incarceration or progressive reforms.","[{'quote': 'Prosecutors are held to a higher standard than imposed on other attorneys because of the unique function they perform in representing the interests, and in exercising the sovereign power, of the state.', 'margin_type': 'extensive_margin', 'relevance': 'Establishes prosecutorial responsibility framework'}, {'quote': ""We can't file criminal charges or permit such charges to remain pending in the absence of sufficient admissible evidence to support a conviction."", 'margin_type': 'extensive_margin', 'relevance': 'Core charging standard emphasizing conviction-oriented approach'}, {'quote': 'Successful Prosecution based on Presumptive Tests', 'margin_type': 'extensive_margin', 'relevance': 'Title reveals focus on successful prosecution outcomes'}]"
"2016.06_Del Norte County_Jury Selection, Examination, and Impeachment Semniar.pdf",Del Norte County,06/16/2025,2025-06-16,2025.0,training_material,case_law_update,"['victim_services', 'charging_decisions']",clearly_traditional,0,1,-2.0,clearly_traditional,high,"['Emphasis on believing victims initially', 'Education about victim-blaming myths']","['Focus on conviction maximization through jury manipulation', 'Extensive voir dire strategies to exclude defense-friendly jurors', 'Emphasis on overcoming perceived case weaknesses rather than case screening', 'Traditional victim-centered prosecution approach', 'No mention of diversion, alternatives, or restorative justice', 'Aggressive trial advocacy techniques']",moderate_impact,more_punitive,0,1,high_impact,more_punitive,0,1,not_addressed,not_addressed,not_addressed,not_addressed,not_addressed,not_addressed,low,not_mentioned,unclear,unclear,strong_guidance,"This document is a comprehensive training manual for prosecutors on jury selection techniques in sexual assault cases, produced by the California District Attorneys Association. The materials focus extensively on sophisticated voir dire strategies designed to identify and exclude potentially defense-friendly jurors while educating remaining jurors to accept prosecution theories. While showing some awareness of victim-blaming myths, the overall approach is traditionally prosecutorial, emphasizing conviction maximization through aggressive trial advocacy rather than reform-oriented alternatives. The training reflects a victim-centered but punishment-focused philosophy typical of traditional prosecutorial approaches.","[{'quote': 'ONE mistake in jury selection can deprive you, your victim and the community of a just verdict', 'margin_type': 'intensive', 'significance': 'Emphasizes conviction-focused approach to justice'}, {'quote': 'When investigating rape cases, it is so important to always start out believing the victim UNTIL every witness has been interviewed and all the available evidence has been gathered', 'margin_type': 'extensive', 'significance': 'Shows victim-supportive approach but within traditional prosecution framework'}, {'quote': 'We are called to create this setting and be the vessel for their voice', 'margin_type': 'intensive', 'significance': 'Reflects traditional victim-centered prosecution philosophy'}]"
2018.05_Del Norte County_Responding to Batson-Wheeler Presentation.pdf,Del Norte County,05/18/2025,2025-05-18,2025.0,training_material,case_law_update,"['racial_justice', 'administrative']",neutral,0,0,0.0,neutral,high,"['Acknowledges importance of preventing discriminatory jury selection', 'Recognizes protected classes including sexual orientation, religion, and other characteristics', 'Provides guidance on avoiding racial bias in jury selection']","['Focuses on helping prosecutors defend against discrimination challenges rather than preventing discrimination', 'Provides strategies to justify peremptory challenges', 'Emphasizes procedural compliance over substantive anti-discrimination goals']",not_applicable,not_applicable,0,0,moderate_impact,neutral,0,0,not_addressed,not_addressed,not_addressed,not_addressed,not_addressed,not_addressed,moderate,Tori Verber Salazar mentioned as San Joaquin County DA,unclear,unclear,strong_guidance,"This document is a comprehensive training presentation on responding to Batson/Wheeler challenges during jury selection, covering legal standards, procedural requirements, and strategic guidance for prosecutors. The material focuses on helping prosecutors comply with anti-discrimination laws while defending their peremptory challenges, providing detailed case law analysis and practical tips for trial advocacy. While acknowledging the importance of preventing discriminatory jury selection, the document's primary orientation is toward procedural compliance and effective legal defense rather than promoting broader racial justice reforms.","[{'quote': ""Group Bias: The presumption 'that certain jurors are biased merely because they are members of an identifiable group distinguished on racial, religious, ethnic, or similar grounds'"", 'margin_type': 'intensive_margin', 'relevance': 'Defines the legal concept the training addresses'}, {'quote': ""Don't wait for D; make your own Comp. Analysis argument, or App. Ct. will draw judgment on an artificially short record"", 'margin_type': 'intensive_margin', 'relevance': 'Shows focus on helping prosecutors defend their jury selection decisions'}, {'quote': ""If the trial court truncates the time available or otherwise overly limits voir dire, unfair conclusions might be drawn based on the advocate's perceived failure to follow up or ask sufficient questions"", 'margin_type': 'intensive_margin', 'relevance': 'Emphasizes procedural fairness in jury selection process'}]"
2018.09.26_Del Norte County_Misdemeanor Voir Dire 101 Training.pdf,Del Norte County,09/26/2018,2018-09-26,2018.0,training_material,case_law_update,"['administrative', 'trial_advocacy']",clearly_traditional,0,1,-2.0,clearly_traditional,high,[],"[""Refers to unfavorable jurors as 'weirdos/poison pills'"", 'Emphasizes conviction-focused strategies over fairness', ""Uses derogatory language ('nutjobs') for challenging jurors"", ""Focuses on 'making them care' about minor offenses"", 'Advocates aggressive tactics to remove sympathetic jurors', 'Emphasizes punishment and deterrence importance', 'Tough-on-crime approach to misdemeanors']",not_applicable,not_applicable,0,0,moderate_impact,more_punitive,0,1,not_addressed,not_addressed,not_addressed,not_addressed,not_addressed,not_addressed,not_addressed,not_mentioned,unclear,unclear,strong_guidance,"This is a jury selection training document for misdemeanor prosecutors that focuses on tactical approaches to secure convictions through strategic voir dire. The training emphasizes removing potentially sympathetic jurors, desensitizing panels to minor offenses, and using aggressive questioning techniques to build prosecution-favorable juries. The document reflects a traditional, conviction-oriented prosecutorial philosophy that prioritizes winning cases over ensuring balanced jury selection, with particular emphasis on making jurors 'care' about relatively minor misdemeanor offenses.","[{'quote': 'Need 12 to win, Takes 1 juror to lose • Only chance to weed out the weirdos/poison pills', 'margin_type': 'intensive', 'significance': 'Reveals conviction-focused mentality and derogatory view of potentially sympathetic jurors'}, {'quote': 'Discuss Importance of Enforcing law, regardless of how petty • Punishment/deterrence just as important as restitution', 'margin_type': 'intensive', 'significance': 'Emphasizes punitive approach even for minor misdemeanor offenses'}, {'quote': ""Use Hyperbolic Hypotheticals to Test Jurors' Resolve • Makes it easier to expose possible impairment • E.g. What if the victim was a child molester?"", 'margin_type': 'intensive', 'significance': 'Shows tactical approach to removing jurors who might show mercy or consider context'}]"
2020_Del Norte County_Jury Selection in People v. Wheeler and Baston v. Kentucky.pdf,Del Norte County,01/01/2020,2020-01-01,2020.0,training_material,case_law_update,"['racial_justice', 'procedure_manual']",neutral,0,0,0.0,neutral,high,"['Detailed guidance on preventing racial discrimination in jury selection', 'Emphasis on protecting constitutional rights of defendants', 'Warning about federal habeas corpus implications of discriminatory practices']","['Technical legal guidance focused on prosecutorial success', 'Practical tips for prosecutors to defend their jury selection decisions', 'Emphasis on maintaining convictions on appeal']",moderate_impact,neutral,0,0,low_impact,neutral,0,0,not_addressed,not_addressed,not_addressed,not_addressed,not_addressed,not_addressed,moderate,not_mentioned,unclear,unclear,strong_guidance,"This document is a comprehensive legal training material on Batson-Wheeler jury selection procedures, explaining constitutional requirements to prevent discriminatory exclusion of jurors based on race, ethnicity, religion, or similar characteristics. It provides detailed procedural guidance for prosecutors on how to comply with these requirements, including practical checklists and warnings about federal habeas corpus implications. The document serves primarily as neutral legal education focused on constitutional compliance rather than expressing any particular prosecutorial ideology, though it does emphasize the importance of preventing racial discrimination in jury selection.","[{'quote': 'Peremptory challenges may not be used to systematically exclude jurors because of membership in a cognizable group distinguished by racial, religious, ethnic, or similar characteristics.', 'margin_type': 'procedural', 'relevance': 'Establishes the core legal principle against discriminatory jury selection'}, {'quote': 'Object on the record outside the presence of the jury only if you have a good faith belief the peremptory challenge was for a discriminatory purpose. Otherwise, you will lose credibility with the trial judge.', 'margin_type': 'procedural', 'relevance': 'Shows practical prosecutorial guidance focused on maintaining effectiveness'}, {'quote': ""WARNING: The systematic exclusion of members of a cognizable group is error under both state and federal constitutions, and consequently, the prosecutor's unconstitutional use of peremptory challenges presents a claim cognizable on federal habeas corpus."", 'margin_type': 'procedural', 'relevance': 'Emphasizes legal compliance to avoid case reversals'}]"
Del Norte County_Voir Dire in Domestic Violence Cases.pdf,Del Norte County,09/24/2018,2018-09-24,2018.0,training_material,case_law_update,"['victim_services', 'administrative']",leans_traditional,0,1,-1.0,leans_traditional,medium,[],"['Focus on securing convictions rather than alternatives', 'Strategies to prosecute cases even with uncooperative victims', 'Emphasis on overcoming jury reluctance to convict', 'No discussion of diversion or restorative justice options', 'Victim-centered prosecution approach']",low_impact,not_applicable,0,0,moderate_impact,more_punitive,0,1,not_addressed,not_addressed,not_addressed,not_addressed,not_addressed,not_addressed,not_addressed,not_mentioned,unclear,unclear,strong_guidance,"This training document provides prosecutors with tactical guidance for conducting voir dire in domestic violence cases, focusing on jury selection strategies to secure convictions. The material emphasizes techniques for identifying favorable jurors and addressing common obstacles like uncooperative victims, jury bias, and credibility issues. The approach is traditionally prosecutorial, prioritizing conviction outcomes without consideration of alternative justice approaches or diversion options.","[{'quote': 'Do you think domestic violence cases should be prosecuted even if the victim does not want it prosecuted?', 'margin_type': 'intensive', 'significance': 'Demonstrates commitment to prosecution regardless of victim cooperation'}, {'quote': 'Not all crime victims are happy about coming to court. In fact, some want nothing to do with it.', 'margin_type': 'intensive', 'significance': 'Acknowledges victim reluctance but frames it as obstacle to overcome rather than reason to consider alternatives'}, {'quote': 'Do you think that a person could get on the stand and lie? How do you determine if someone is lying?', 'margin_type': 'intensive', 'significance': 'Prepares jury to potentially disbelieve victim recantation or testimony favorable to defendant'}]"
Del Norte County_Voir Dire Presentation.pdf,Del Norte County,10/14/2021,2021-10-14,2021.0,training_material,case_law_update,"['jury_selection', 'voir_dire', 'sexual_assault', 'victim_advocacy']",clearly_traditional,0,1,-2.0,clearly_traditional,high,"['victim_advocacy', 'addressing_implicit_bias_in_jury_selection']","['conviction_focused_training', 'strategic_jury_exclusion', 'emphasis_on_securing_guilty_verdicts', 'victim_belief_mandate', 'tough_prosecution_techniques']",low_impact,not_applicable,0,0,high_impact,more_punitive,0,1,not_addressed,not_addressed,not_addressed,not_addressed,not_addressed,not_addressed,low,not_mentioned,unclear,unclear,strong_guidance,"This document is a comprehensive training presentation on jury selection techniques for prosecutors, with particular emphasis on sexual assault cases. It provides detailed guidance on identifying and excluding potentially problematic jurors through strategic voir dire questioning and questionnaires. The material reflects a traditional prosecutorial approach focused on securing convictions while advocating for victims, emphasizing the prosecutor's role as the voice for victims and the community in pursuing justice through guilty verdicts.","[{'quote': 'ONE mistake in jury selection can deprive you, your victim and the community of a just verdict', 'margin_type': 'intensive', 'significance': 'Emphasizes conviction-focused approach to justice'}, {'quote': 'When investigating rape cases, it is so important to always start out believing the victim UNTIL Every witness has been interviewed and All the available evidence has been gathered', 'margin_type': 'intensive', 'significance': 'Shows victim-centered prosecution approach'}, {'quote': 'We are called to create this setting and be the vessel for their voice... There can be no justice until those uninjured by crime become as indignant as those who are', 'margin_type': 'intensive', 'significance': 'Reflects traditional victim-advocacy prosecution philosophy'}]"
2020.12.07_El Dorado County_Selected 2021 New Laws-Part 1.docx,El Dorado County,12/07/2020,2020-12-07,2020.0,training_material,case_law_update,"['racial_justice', 'juvenile', 'sentencing', 'administrative']",neutral,0,0,0.0,neutral,high,"['California Racial Justice Act implementation', 'reduced probation periods', 'elimination of criminal fees', 'expanded juvenile protections', 'tiered sex offender registration replacing lifetime registration']","['detailed enforcement guidance', 'focus on proper legal procedures', 'maintaining registration requirements', 'preserving prosecution tools']",moderate_impact,more_lenient,1,0,high_impact,more_lenient,1,0,not_addressed,unclear,not_addressed,not_addressed,not_addressed,not_addressed,moderate,Alameda County District Attorney's Office,no,clearly_new_policy,informational,"This document is an educational training material from the Alameda County DA's Office summarizing new California laws effective January 1, 2021. It covers significant changes including implementation of the Racial Justice Act, reduced probation periods, elimination of various criminal fees, expanded juvenile protections, and reformed sex offender registration. The document maintains a neutral, informational tone focused on legal compliance rather than advocating for particular prosecutorial policies.","[{'quote': ""A violation is established if 'the judge, an attorney in the case, a law enforcement office involved in the case, an expert witness, or the juror exhibited bias or animus towards the defendant because of the defendant's race, ethnicity or a national origin.'"", 'margin_type': 'extensive_margin', 'relevance': 'Shows implementation of racial justice protections in prosecutorial practice'}, {'quote': 'As amended, probation is limited on most misdemeanor crimes to one year... the maximum period for probation for most felony crimes is two years', 'margin_type': 'intensive_margin', 'relevance': 'Demonstrates significant reduction in supervision periods'}, {'quote': 'Many fees that criminal defendants were required to pay have been eliminated... no attorneys fees can be assessed', 'margin_type': 'intensive_margin', 'relevance': 'Shows removal of financial burdens on defendants'}]"
2021.05.05_El Dorado County_IPG-Laws on Discrimination in Prosecution and Sentencing.pdf,El Dorado County,05/05/2021,2021-05-05,2021.0,training_material,racial_justice,"['case_law_update', 'discovery', 'charging_decisions', 'sentencing']",neutral,0,0,0.0,neutral,high,"['Detailed analysis of racial justice legislation', 'Comprehensive guidance on identifying and addressing racial bias in prosecution', ""Focus on protecting defendants' rights under new racial justice protections"", 'Emphasis on proper implementation of anti-discrimination measures']","['Analytical approach focused on limiting scope of new law', 'Emphasis on procedural hurdles and high evidentiary standards', ""Focus on protecting prosecutorial discretion and avoiding 'unduly burdensome requests'"", 'Detailed discussion of ways to challenge defense motions']",high_impact,more_lenient,1,0,high_impact,more_lenient,1,0,not_addressed,not_addressed,not_addressed,not_addressed,not_addressed,not_addressed,high,Santa Clara County District Attorney's Office,unclear,clearly_new_policy,informational,"This document is a comprehensive legal analysis of California's Racial Justice Act (AB 2542) produced by the Santa Clara County DA's Office to guide prosecutors in understanding and implementing the new law. It takes a neutral, technical approach to explaining how the law creates new grounds for challenging prosecutorial decisions based on racial discrimination, covering both charging decisions and sentencing practices. The document focuses extensively on procedural requirements, evidentiary standards, and discovery obligations while maintaining a prosecutorial perspective on protecting legitimate law enforcement interests within the new legal framework.","[{'quote': 'This IPG is not intended to be a commentary on the merits of the new laws. Rather, it focuses on trying to identify, analyze, and propose possible ways of interpreting those aspects of the law that are vague, ambiguous, undefined, or novel.', 'margin_type': 'both', 'significance': ""Establishes the document's neutral analytical approach rather than advocacy position""}, {'quote': 'What must be proven for a violation of Penal Code section 745 to occur? What is a sufficient showing to obtain discovery relevant to a motion alleging a violation of section 745, to obtain an evidentiary hearing when the defense is alleging a violation of section 745, or to prevail on a section 745 motion?', 'margin_type': 'both', 'significance': 'Shows focus on procedural requirements and evidentiary standards for racial justice claims'}, {'quote': ""Would production of the requested materials violate a third party's confidentiality or privacy rights or intrude upon any protected governmental interest?"", 'margin_type': 'both', 'significance': 'Demonstrates concern with protecting prosecutorial interests while complying with new racial justice discovery requirements'}]"
2021_El Dorado County_CDAA Prosecutors Brief-Vol.43-No.4.pdf,El Dorado County,01/01/2021,2021-01-01,2021.0,training_material,diversion,"['case_law_update', 'charging_decisions']",clearly_traditional,0,1,-2.0,clearly_traditional,high,[],"['Opposition to diversion programs for DUI offenses', ""Emphasis on deterrence through 'certainty of punishment'"", 'Strong public safety rhetoric about protecting community from drunk drivers', 'Support for tracking prior convictions for enhanced penalties', 'Advocacy for maintaining tough-on-crime DUI laws from the 1980s']",high_impact,more_punitive,0,1,moderate_impact,more_punitive,0,1,no,no,maximize,not_addressed,not_addressed,not_addressed,not_addressed,Vern Pierson (El Dorado County),unclear,continuation,strong_guidance,"This training article argues that DUI offenses should be excluded from California's new misdemeanor diversion program, contending that Vehicle Code section 23640 creates a specific exception to the general diversion statute. The author takes a traditional tough-on-crime approach, emphasizing deterrence, public safety, and the need to maintain California's progressive DUI penalty structure that depends on tracking prior convictions. The document reflects strong opposition to any policies that would allow DUI defendants to avoid conviction through diversion programs.","[{'quote': ""AB 541 provided '[c]elerity and certainty of punishment.' If courts were to grant diversion for DUI offenses, it would cripple the general and specific deterrent influence of California's DUI laws."", 'margin_type': 'extensive_margin', 'significance': 'Shows opposition to diversion based on deterrence theory'}, {'quote': 'DUI offenses are unlike other misdemeanors with respect to the level of risk they impose on members of the public. The impaired handling of a 3,000-pound deadly weapon, made of metal and traveling at highway speeds, is an offense of substantially greater magnitude than petty theft, vandalism, or public intoxication.', 'margin_type': 'extensive_margin', 'significance': 'Justifies exclusion from diversion programs based on public safety'}, {'quote': 'Judicial diversion may be appropriate for a wide swath of misdemeanor offenses in criminal courts going forward; however, DUI offenses cannot (and should not) be one of them.', 'margin_type': 'extensive_margin', 'significance': 'Clear policy position opposing DUI diversion'}]"
2010.08_Fresno County_Trial Advocacy-How to Pick a Jury _Redacted.pdf,Fresno County,08/10/2025,2025-08-10,2025.0,training_material,case_law_update,"['trial_advocacy', 'jury_selection', 'voir_dire_procedures']",clearly_traditional,0,1,-2.0,clearly_traditional,high,[],"[""Focus on preventing 'wrongful acquittals'"", 'Emphasis on conviction-oriented jury selection', 'Framing jury sympathy for defendants as problematic', 'Prioritizing prosecution success over defendant rights', 'Training prosecutors to overcome jury reluctance to convict']",low_impact,not_applicable,0,0,moderate_impact,more_punitive,0,1,not_addressed,not_addressed,not_addressed,not_addressed,not_addressed,not_addressed,not_addressed,not_mentioned,unclear,unclear,strong_guidance,"This training document provides Fresno County prosecutors with systematic guidance on jury selection techniques designed to prevent acquittals. The material frames acquittals as 'wrong' outcomes and provides detailed checklists and questioning strategies to identify and eliminate jurors who might be sympathetic to defendants or reluctant to convict. The document reflects a traditional prosecutorial ideology focused on maximizing conviction rates through strategic voir dire, with little consideration for defendant rights or the legitimacy of jury nullification.","[{'quote': 'Voir Dire Topics Checklist for Your Trial Notebook: Anticipate Why a Jury Might Wrongly Acquit!', 'margin_type': 'intensive', 'significance': 'Frames acquittals as inherently wrong when prosecutors believe in guilt'}, {'quote': ""CONSIDER USING A CHECKLIST AND ASKING THE QUESTION 'WHY WOULD THE JURY WRONGLY ACQUIT?' TO DETERMINE WHICH TOPICS SHOULD BE EXPLORED DURING VOIR DIRE."", 'margin_type': 'intensive', 'significance': 'Systematizes approach to preventing acquittals through strategic jury selection'}, {'quote': ""So if the jury's job is really this simple, how do they get so confused? As experienced prosecutors know, there is an almost endless variety of ways in which a jury can get misled, sidetracked, or confused."", 'margin_type': 'intensive', 'significance': 'Characterizes jury deliberation favorable to defendants as confusion rather than legitimate decision-making'}]"
2014.05.09_Fresno County_Interpreting 969B Packets.pdf,Fresno County,05/09/2014,2014-05-09,2014.0,training_material,administrative,"['case_guidance', 'discovery']",neutral,0,0,0.0,neutral,high,[],"['enhancement prosecution support', 'detailed guidance on proving prior convictions']",not_applicable,not_applicable,0,0,low_impact,neutral,0,0,not_addressed,not_addressed,not_addressed,not_addressed,not_addressed,not_addressed,not_addressed,not_mentioned,unclear,unclear,informational,"This document is a technical training manual for Fresno County prosecutors on how to interpret and use PC 969b packets - certified prison records from CDCR and FSO. The document provides detailed guidance on reading chronological histories, abstracts of judgment, fingerprint cards, and other prison documentation to prove prior convictions for sentencing purposes. While this facilitates enhancement prosecution, the document is purely procedural and does not reflect any particular ideological orientation toward prosecution policy.","['Foundation for PC 969b Packets - PC 969b- When trying to prove a defendant has a prior conviction and was sentenced to jail or prison time', 'This can be vital to prove a Strike', 'Check for Strikes to determine Time Credit calculations']"
2015.10.29_Fresno County_Secrets to Prosecuting ID Theft_Redacted.pdf,Fresno County,10/29/2015,2015-10-29,2015.0,other,other,[],unclear,0,0,,unclear,low,[],[],not_applicable,not_applicable,0,0,not_applicable,not_applicable,0,0,not_addressed,not_addressed,not_addressed,not_addressed,not_addressed,not_addressed,not_addressed,not_mentioned,unclear,unclear,unclear,"This document appears to be heavily redacted or corrupted, showing only page numbers (1-6), dates (10/29/2015), and scattered formatting symbols. While the filename indicates it should contain training material about prosecuting identity theft cases, no substantive content is visible in the provided text. The document cannot be meaningfully analyzed for prosecutorial ideology or policy positions due to the lack of readable content.",[]
2017.04.27_Fresno County_Human Trafficking_Redacted.pdf,Fresno County,04/27/2017,2017-04-27,2017.0,training_material,case_law_update,"['charging_decisions', 'victim_services', 'enhancements']",mixed,0,0,0.0,mixed,medium,"['Affirmative defense for trafficking victims forced to commit crimes', 'Elimination of mandatory minimum jail terms for prostitution', 'Protection of victim privacy and identity', 'Recognition that children under 18 cannot commit prostitution']","['Emphasis on dramatically increased maximum penalties', 'Detailed focus on enhanced sentences and fines', 'Strong punishment framework for trafficking offenses', 'Connection to other serious crimes like domestic violence and gang activity']",moderate_impact,more_lenient,1,0,high_impact,more_punitive,0,1,unclear,unclear,maximize,not_addressed,not_addressed,not_addressed,not_addressed,not_mentioned,yes,clearly_new_policy,informational,"This training document educates prosecutors about new human trafficking laws and 2017 legal changes, including Proposition 35's dramatic sentence enhancements. While incorporating victim-protective measures like affirmative defenses for trafficked defendants and privacy protections, the document heavily emphasizes the punitive aspects of the new legislation, particularly the substantial increases in maximum penalties. The material reflects a mixed prosecutorial approach that balances victim protection with enhanced enforcement and punishment for trafficking offenses.","[{'quote': 'PC 236.23 (Added) It is an affirmative defense that the defendant was a human trafficking victim, forced to commit the charged crime. This defense does not apply to certain violent felonies, nor to a charge of human trafficking', 'margin_type': 'extensive_margin', 'significance': 'Shows progressive approach to charging trafficking victims'}, {'quote': 'Measure increases Maximum Criminal Penalties For Human Trafficking - Labor trafficking 5 years to 12 years, Sex trafficking of an adult, forced 8 years to 20 years, Sex trafficking of a minor 8 years to life term', 'margin_type': 'intensive_margin', 'significance': 'Demonstrates significant punitive enhancement focus'}, {'quote': 'The misconception is that Human Trafficking is a by-product of crimes such as domestic, sex, or gangs when in fact these crimes are the by-product of the Human trafficking', 'margin_type': 'extensive_margin', 'significance': 'Reframes trafficking as primary crime requiring comprehensive enforcement approach'}]"
2017.05_Fresno County_DEA Drug Slang.pdf,Fresno County,05/17/2025,2025-05-17,2025.0,training_material,other,"['drug_enforcement', 'law_enforcement_reference']",unclear,0,0,,unclear,high,[],[],not_applicable,not_applicable,0,0,not_applicable,not_applicable,0,0,not_addressed,not_addressed,not_addressed,not_addressed,not_addressed,not_addressed,not_addressed,not_mentioned,no,unclear,informational,"This is a DEA intelligence report from May 2017 that serves as a reference guide for law enforcement personnel to identify controlled substances through their street names and slang terminology. The document is purely informational, containing alphabetically organized lists of drug slang terms for various substances including amphetamines, cocaine, heroin, marijuana, and synthetic drugs. It contains no prosecutorial policies, charging guidance, or ideological content, functioning solely as a technical resource tool for drug identification purposes.","[{'quote': 'This Drug Enforcement Administration (DEA) Intelligence Report contains information from a variety of law enforcement and open sources. It is designed as a ready reference for law enforcement personnel who are confronted by many of the hundreds of slang terms used to identify a wide variety of controlled substances, designer drugs, and synthetic compounds.', 'relevance': 'Establishes the purely informational and reference nature of the document', 'margin_type': 'not_applicable'}, {'quote': 'Every effort has been made to ensure the accuracy and completeness of the information presented. However, due to the dynamics of the ever-changing drug scene, subsequent additions, deletions, and corrections are inevitable.', 'relevance': 'Demonstrates the technical, non-policy nature of the content', 'margin_type': 'not_applicable'}]"
2017.11.29_Fresno County_Preliminary Examinations - PC 1050 et. seq (LexisNexis)- Redacted.pdf,Fresno County,11/29/2017,2017-11-29,2017.0,training_material,case_law_update,"['bail', 'administrative']",neutral,0,0,0.0,neutral,high,[],[],not_applicable,not_applicable,0,0,low_impact,neutral,0,0,not_addressed,not_addressed,not_addressed,not_addressed,not_addressed,not_addressed,not_addressed,not_mentioned,no,unclear,informational,"This is a LexisNexis legal reference document explaining California Penal Code Section 859b regarding timing requirements for preliminary examinations. The document provides technical guidance on statutory deadlines, good cause exceptions, bail and O.R. release provisions, and case law interpretations. It serves as a neutral legal resource for understanding procedural requirements rather than advocating for any particular prosecutorial philosophy or policy approach.","[{'quote': 'Both the defendant and the people have the right to a preliminary examination at the earliest possible time', 'relevance': 'Shows neutral procedural focus on rights of both parties', 'margin_type': 'procedural'}, {'quote': 'The prosecution establishes good cause for a continuance beyond the 10-court-day period', 'relevance': 'Demonstrates technical legal guidance rather than policy advocacy', 'margin_type': 'procedural'}, {'quote': 'The magistrate clearly has discretion to continue without good cause during the 10-court-day period', 'relevance': 'Illustrates neutral explanation of judicial discretion and legal procedures', 'margin_type': 'procedural'}]"
2019-2021_Fresno County_CDAA Voir Dire Bias Trainings Report.pdf,Fresno County,,,,training_material,racial_justice,"['case_law_update', 'administrative']",leans_progressive,1,0,1.0,leans_progressive,medium,"['Extensive elimination of bias training', 'Focus on Wheeler/Batson objections', 'Hate crimes training', ""Training titled 'Answering the Call – Avoiding Bias in Prosecution'"", 'AB 3070 training on peremptory challenges reform']","['Officer-Involved Shooting Summit', 'Gang Prosecution Symposium', 'Homicide & Capital Cases training']",moderate_impact,more_lenient,1,0,high_impact,more_lenient,1,0,not_addressed,not_addressed,not_addressed,not_addressed,not_addressed,not_addressed,high,not_mentioned,yes,unclear,unclear,"This document is a training report cataloging bias elimination and voir dire training sessions conducted for Fresno County prosecutors from 2019-2021. The report shows substantial investment in training prosecutors on fair jury selection practices, elimination of bias, and compliance with legal requirements like Wheeler/Batson objections and AB 3070. The high number of registrants and frequency of bias-related trainings suggests an office-wide emphasis on addressing discriminatory practices in prosecution, though traditional prosecution topics are also covered.","['Answering the Call – Avoiding Bias in Prosecution (Elim. of Bias, 1 hour, 557 registrants)', 'AB 3070 Juries: Peremptory Challenges (Elim. of Bias, 2 hours, 394 registrants)', 'Wheeler/Batson Objections (Elim. of Bias, 1 hour, 91 registrants)']"
2020.02.04_Fresno County_OIS after AB 392_Redacted.pdf,Fresno County,02/04/2020,2020-02-04,2020.0,training_material,case_law_update,"['charging_decisions', 'administrative']",neutral,0,0,0.0,neutral,high,"['Recognition that individuals with disabilities are more likely to experience police force', 'Emphasis on de-escalation tactics and tactical repositioning', ""Higher standard requiring 'necessary' rather than just 'reasonable' force""]","['Presentation of justified shooting cases without criticism', 'Focus on officer protection and self-defense rights', 'Emphasis on quick judgment situations officers face']",high_impact,more_punitive,0,1,low_impact,not_applicable,0,0,not_addressed,not_addressed,not_addressed,not_addressed,not_addressed,not_addressed,low,not_mentioned,yes,clearly_new_policy,informational,"This training document from the Fresno County DA's Office educates prosecutors on AB 392's changes to police use of force standards, effective January 2020. The law raises the bar from 'reasonable' to 'necessary' force and adds specific protections for individuals with disabilities and those in mental health crises. The document maintains a neutral, educational tone while explaining how these changes may affect the prosecution of officer-involved shootings, using case examples to illustrate the new legal standards.","[{'quote': ""Intent of the Legislature is that peace officers use deadly force only when 'necessary' in defense of human life."", 'margin_type': 'extensive', 'significance': 'Shows the raised legal standard that could lead to more prosecutions'}, {'quote': 'Individuals with physical, mental health, developmental, or intellectual disabilities are significantly more likely to experience greater levels of physical force during police interactions', 'margin_type': 'extensive', 'significance': 'Acknowledges vulnerable populations in use of force analysis'}, {'quote': 'A peace officer shall not use deadly force against a person based on the danger that person poses to themselves, if an objectively reasonable officer would believe the person does not pose an imminent threat', 'margin_type': 'extensive', 'significance': 'Restricts use of force in suicide situations, potentially leading to more prosecutions'}]"
2020.03.10_Fresno County_Media and Ethics_Redacted.pdf,Fresno County,03/10/2020,2020-03-10,2020.0,training_material,administrative,"['discovery', 'case_law_update']",neutral,0,0,0.0,neutral,high,"[""Emphasis on serving 'all the People' including defendant and family"", ""Strong Brady disclosure requirements - 'Turn it all over'"", 'Prohibition against charging based on race, religion, gender, economic class', 'Requirement to remedy wrongful convictions']","[""Emphasis on victim rights including Marsy's Law"", 'Focus on conviction standards and evidence sufficiency', 'Professional conduct and law enforcement cooperation protocols']",moderate_impact,neutral,0,0,low_impact,neutral,0,0,not_addressed,not_addressed,not_addressed,not_addressed,not_addressed,not_addressed,moderate,not_mentioned,yes,unclear,mandatory,"This document is a standard prosecutorial training manual covering media relations and ethical obligations for new prosecutors in Fresno County. It emphasizes fundamental due process requirements including Brady disclosure, prohibitions against discriminatory charging, and professional conduct standards. The content reflects mainstream prosecutorial ethics focused on constitutional compliance and fair trial procedures rather than indicating particular ideological orientation toward punishment or reform. The training establishes baseline professional standards expected in any prosecutor's office operating within constitutional bounds.","[{'quote': ""The prosecutor speaks not solely for the victim, or the police, or those who support them, but for all the People. That body of 'The People' includes the defendant and his family and those who care about him."", 'margin_type': 'extensive_margin', 'significance': 'Emphasizes balanced representation rather than victim-only focus'}, {'quote': 'It is improper, and a violation of the law, if any or all of the following factors are the only reasons for charging: Race, religion, nationality, gender, occupation, economic class, or political association', 'margin_type': 'extensive_margin', 'significance': 'Explicitly prohibits discriminatory charging practices'}, {'quote': 'Turn it all over... Then fight about its admissibility in Court', 'margin_type': 'intensive_margin', 'significance': 'Emphasizes broad discovery disclosure beyond minimum requirements'}]"
2021.06.03_Fresno County_Firearms in Court_Redacted.pdf,Fresno County,06/03/2021,2021-06-03,2021.0,training_material,case_law_update,['administrative'],unclear,0,0,,unclear,low,[],[],not_applicable,not_applicable,0,0,not_applicable,not_applicable,0,0,not_addressed,not_addressed,not_addressed,not_addressed,not_addressed,not_addressed,not_addressed,not_mentioned,unclear,unclear,informational,"This document appears to be announcement materials for a continuing legal education training session titled 'Welcome to the Gun Show: Firearms in Court' held on June 3, 2021 via Zoom. The training was designed to provide general MCLE credit and appears to focus on educating prosecutors about firearms-related evidence or procedures in court proceedings. The available text is too limited to determine specific policy positions or ideological orientations.","['Welcome to the Gun Show: Firearms in Court', 'MCLE 1 hour* general credit', 'common types or rirearms']"
2021.10.04_Fresno County_Death of the Misdemeanor_Redacted.pdf,Fresno County,10/04/2021,2021-10-04,2021.0,training_material,diversion,"['case_law_update', 'administrative']",mixed,0,0,0.0,mixed,medium,"['Extensive coverage of diversion program expansion', 'Discussion of AB 3234 as response to George Floyd tragedy and systemic racism', 'Reduction in probation terms through AB 1950', 'Pre-plea diversion options that avoid convictions']","[""Title 'Death of the Misdemeanor' suggests concern about loss of prosecutorial tools"", 'Discussion of when prosecutors should object to diversion', 'Focus on exclusions and limitations of diversion programs', 'Apparent resistance to some diversion applications']",high_impact,more_lenient,1,0,moderate_impact,more_lenient,1,0,unclear,unclear,not_addressed,not_addressed,not_addressed,not_addressed,moderate,not_mentioned,yes,modification,informational,"This training document educates prosecutors about the evolution and expansion of diversion programs, particularly focusing on AB 3234 which allows judges to grant diversion for most misdemeanors over prosecutorial objection. While framed as educational material about legal changes, the title 'Death of the Misdemeanor' suggests institutional concern about the erosion of traditional prosecutorial tools. The document covers various diversion programs, their exclusions, and provides guidance on when prosecutors might object, reflecting an office adapting to a more diversion-oriented legal landscape while maintaining some prosecutorial discretion.","[{'quote': ""Tells news outlets: in light of the George Floyd tragedy, 'fairness in the criminal system is front and center, causing more and more institutions across the United States to take the time to reflect on how their policies have contributed to systemic racism and increased racial disparities'"", 'margin_type': 'extensive', 'relevance': 'Shows the racial justice framing behind AB 3234 diversion expansion'}, {'quote': ""The Judge has discretion in almost all misdemeanors ('May' not 'Shall') Over the People's Objection"", 'margin_type': 'extensive', 'relevance': 'Demonstrates significant shift in prosecutorial control over charging decisions'}, {'quote': 'Death of the Misdemeanor', 'margin_type': 'extensive', 'relevance': 'Title suggests concern about the erosion of traditional misdemeanor prosecution tools'}]"
2021.10.04_Fresno County_Law of Homicide_Redacted.pdf,Fresno County,10/04/2021,2021-10-04,2021.0,other,other,[],unclear,0,0,,unclear,low,[],[],not_applicable,not_applicable,0,0,not_applicable,not_applicable,0,0,not_addressed,not_addressed,not_addressed,not_addressed,not_addressed,not_addressed,not_addressed,not_mentioned,unclear,unclear,unclear,"This document appears to be heavily redacted or contains only page headers and numbering from what is titled as a document about the law of homicide from Fresno County dated October 4, 2021. No substantive policy content is visible for analysis. The document shows page numbers 1-8, 12, 14-15, suggesting content has been removed or redacted. Without access to the actual policy text, no meaningful assessment of prosecutorial ideology or policy orientation can be made.",[]
Fresno County_Compassion Fatigue_Redacted.pdf,Fresno County,10/15/2021,2021-10-15,2021.0,training_material,administrative,"['victim_services', 'case_law_update']",leans_progressive,1,0,1.0,leans_progressive,medium,"['Recognition of secondary trauma in prosecution work', 'Emphasis on maintaining compassion and avoiding jadedness', 'Focus on work-life balance and mental health', 'Acknowledgment that prosecutors can become overly punitive when jaded']","['Maintains focus on prosecutorial obligations and duties', 'Does not explicitly critique traditional prosecution methods']",low_impact,neutral,0,0,moderate_impact,more_lenient,1,0,not_addressed,not_addressed,not_addressed,not_addressed,not_addressed,not_addressed,not_addressed,not_mentioned,yes,unclear,informational,"This training document addresses compassion fatigue among Fresno County prosecutors, focusing on the secondary trauma that can result from working with crime victims and the gradual loss of empathy over time. While much of the specific content is redacted, the document structure suggests it covers the risks of becoming jaded as a prosecutor and strategies for maintaining perspective and work-life balance. The document reflects a more humanistic approach to prosecution that recognizes the importance of maintaining compassion and avoiding the overly punitive decision-making that can result from burnout and jadedness.","[{'quote': 'Compassion fatigue is characterized by a gradual lessening of compassion over time', 'margin_type': 'intensive_margin', 'relevance': 'Identifies the core problem that could lead to overly harsh prosecutorial decisions'}, {'quote': 'WHAT HAPPENS WHEN WE ARE JADED', 'margin_type': 'intensive_margin', 'relevance': 'Suggests the document addresses how jadedness affects prosecutorial decision-making'}, {'quote': 'KEEP PERSPECTIVE AND MANAGE EXPECTATIONS', 'margin_type': 'intensive_margin', 'relevance': 'Emphasizes the importance of balanced, thoughtful prosecution rather than reflexive responses'}]"
Fresno County_Courtroom Therapy Dogs and How to Use Them_Redacted.pdf,Fresno County,10/15/2021,2021-10-15,2021.0,training_material,case_law_update,"['victim_services', 'procedure_manual']",leans_progressive,1,0,1.0,leans_progressive,medium,"['victim-centered accommodations', 'trauma-informed practices', 'witness support services', 'reducing anxiety during testimony']","['focus on successful prosecution', 'ensuring testimony can be obtained', 'maintaining court proceedings']",not_applicable,not_applicable,0,0,low_impact,more_lenient,1,0,not_addressed,not_addressed,not_addressed,not_addressed,not_addressed,not_addressed,not_addressed,not_mentioned,yes,informational,informational,"This document is a training material explaining the legal framework and procedures for using therapy dogs in courtrooms to assist witnesses during testimony, particularly child witnesses in serious felony cases. It reviews the People v. Chenault case and explains Penal Code Section 868.4, which codifies the use of therapy dogs while ensuring defendant rights are protected. The document reflects a trauma-informed approach to prosecution that seeks to support witnesses while maintaining fair court proceedings. This represents a procedural accommodation rather than a fundamental shift in prosecutorial philosophy regarding charging or sentencing.","[{'quote': 'facts justifying the dog may reduce anxiety or otherwise be helpful while testifying', 'margin_type': 'intensive_margin', 'relevance': 'Shows focus on reducing witness trauma during proceedings'}, {'quote': 'The court shall take appropriate measures to make sure the dog is unobtrusive and non-disruptive as possible', 'margin_type': 'intensive_margin', 'relevance': 'Demonstrates balance between witness support and defendant rights'}, {'quote': ""The use of the therapy dog was not inherently prejudicial. Did not violate a defendant's right to a fair trial and confront witnesses"", 'margin_type': 'intensive_margin', 'relevance': 'Emphasizes maintaining fair proceedings while providing witness support'}]"
Fresno County_DRE Matrix and CHP 202.pdf,Fresno County,10/15/2021,2021-10-15,2021.0,training_material,administrative,['case_guidance'],unclear,0,0,,unclear,low,[],[],not_applicable,not_applicable,0,0,not_applicable,not_applicable,0,0,not_addressed,not_addressed,not_addressed,not_addressed,not_addressed,not_addressed,not_addressed,not_mentioned,unclear,unclear,informational,"This document is a technical reference matrix and form for Drug Recognition Expert (DRE) evaluations used by California Highway Patrol and other law enforcement. It provides detailed charts of physical and behavioral indicators associated with different categories of drugs, along with standardized testing procedures and documentation forms. The document is purely administrative and technical in nature, serving as a training and reference tool for identifying drug impairment rather than establishing any prosecutorial policies or ideological positions.","['DRUG CATEGORY MATRIX - CNS DEPRESSANTS, INHALANTS, CNS STIMULANTS, DISSOCIATIVE ANESTHETICS, CANNABIS, HALLUCINOGENS, NARCOTIC ANALGESIC', 'THE ABOVE INDICATORS ARE THOSE MOST CONSISTENT WITH THE CATEGORY, KEEP IN MIND THAT THERE MAY BE VARIATIONS DUE TO INDIVIDUAL REACTION, DOSE TAKEN AND DRUG INTERACTIONS', 'TO BE COMPLETED BY DRE TRAINED PERSONNEL']"
Fresno County_Driving Under the Influence_Redacted.pdf,Fresno County,10/15/2021,2021-10-15,2021.0,training_material,case_law_update,"['charging_decisions', 'administrative']",leans_traditional,0,1,-1.0,leans_traditional,medium,[],"['emphasis on law enforcement techniques', 'focus on conviction strategies', 'detailed drug impairment evidence', 'no mention of diversion or alternatives']",low_impact,neutral,0,0,moderate_impact,neutral,0,0,not_addressed,not_addressed,not_addressed,not_addressed,not_addressed,not_addressed,not_addressed,not_mentioned,yes,unclear,strong_guidance,"This document is a training material for Fresno County prosecutors on DUI cases, particularly focusing on cannabis/marijuana impairment. It provides technical guidance on charges, evidence standards, and case law updates to help prosecutors build stronger DUI cases. The document emphasizes public safety concerns and effective law enforcement techniques, reflecting a traditional prosecutorial approach focused on conviction strategies rather than alternative approaches to impaired driving cases.","[{'quote': ""Driving under the influence of cannabis is an important public safety concern. Drug impaired driving endangers those both inside and outside the driver's vehicle."", 'margin_type': 'intensive', 'significance': 'Emphasizes public safety rationale for aggressive DUI prosecution'}, {'quote': 'there is no minimum safe threshold blood concentration below which a driver can be considered to have been unaffected while driving following recent cannabis use', 'margin_type': 'intensive', 'significance': 'Supports prosecution even at low THC levels'}, {'quote': 'Mixing alcohol and marijuana may dramatically produce effects greater than either drug on its own', 'margin_type': 'intensive', 'significance': 'Provides basis for enhanced prosecution of combination cases'}]"
Fresno County_DUI Prosecution_Redacted.pdf,Fresno County,10/15/2021,2021-10-15,2021.0,training_material,case_law_update,"['charging_decisions', 'procedure_manual']",leans_traditional,0,1,-1.0,leans_traditional,medium,[],"['Detailed guidance on overcoming necessity defenses', 'Emphasis on conviction-oriented case preparation', 'Focus on maximizing evidence for prosecution', 'No mention of diversion or alternative programs', 'Aggressive approach to related charges like driving on suspended license']",low_impact,neutral,0,0,moderate_impact,more_punitive,0,1,not_addressed,not_addressed,not_addressed,not_addressed,not_addressed,not_addressed,not_addressed,not_mentioned,yes,unclear,strong_guidance,"This document is a training material for Fresno County prosecutors handling DUI cases, providing detailed guidance on charges, evidence standards, and case preparation techniques. The document emphasizes conviction-oriented strategies, including detailed instruction on overcoming common defenses like necessity and maximizing the use of physical evidence and expert testimony. The focus is entirely on technical legal procedures for securing convictions, with no discussion of diversion programs or alternative approaches, reflecting a traditional prosecutorial stance on DUI enforcement.","[{'quote': 'Public policy and common sense compel the conclusion that this legal, reasonable and viable alternative [...] eviscerates the necessity defense here tendered.', 'margin_type': 'intensive', 'significance': 'Shows aggressive approach to defeating common defenses'}, {'quote': 'The fact that the suspension is based upon a prior conviction for driving under the influence is an element of the offense. This means no bifurcation.', 'margin_type': 'intensive', 'significance': 'Demonstrates commitment to pursuing enhanced charges and related offenses'}, {'quote': 'Shift the narrative', 'margin_type': 'intensive', 'significance': 'Indicates strategic approach to framing cases for maximum prosecutorial advantage'}]"
Fresno County_Gangs Handout_Redacted.pdf,Fresno County,10/15/2021,2021-10-15,2021.0,training_material,enhancements,"['charging_decisions', 'case_law_update']",clearly_traditional,0,1,-2.0,clearly_traditional,high,[],"['enhancement maximization', 'detailed gang prosecution training', 'focus on criminal organization structure', 'emphasis on identifying gang membership for prosecution purposes']",high_impact,more_punitive,0,1,high_impact,more_punitive,0,1,not_addressed,not_addressed,maximize,not_addressed,not_addressed,not_addressed,not_addressed,not_mentioned,yes,unclear,strong_guidance,"This document is a training handout that educates prosecutors on gang identification and structure, specifically focusing on Penal Code Section 186.22 gang enhancements. It provides detailed information on legal definitions of gangs and gang membership, as well as specific intelligence about Norteno gang structure and Hells Angels symbols. The material is designed to help prosecutors identify cases where gang enhancements can be applied, reflecting a traditional tough-on-crime approach that prioritizes maximum use of sentence enhancement tools. The document contains no discussion of alternatives to prosecution or mitigating factors, focusing exclusively on law enforcement and prosecutorial strategies.","[{'quote': ""A gang is defined by Penal Code Section 186.22 as 'a group of three or more people, whether formal or informal, having a common name, sign or symbol. Whose members individually or collectively engage in, or have engaged in, a pattern of criminal activity'"", 'margin_type': 'extensive_margin', 'relevance': 'Provides legal framework for identifying cases eligible for gang enhancements'}, {'quote': 'A person who actively participates in a criminal street gang. A person who has knowledge that its members engage in, or have engaged in, a pattern of criminal gang activity. And willfully promotes, furthers, or assists in any criminal conduct by its members.', 'margin_type': 'extensive_margin', 'relevance': 'Defines criteria for gang membership that triggers enhanced prosecution'}, {'quote': 'Nuestra Familia controls the norteno street gang activity from Bakersfield all the way up to the Oregon border', 'margin_type': 'intensive_margin', 'relevance': 'Provides intelligence to support organized crime enhancements and conspiracy charges'}]"
Fresno County_Handling Firearms in the Courtroom_Redacted.pdf,Fresno County,10/15/2021,2021-10-15,2021.0,procedure_manual,administrative,['case_guidance'],unclear,0,0,,unclear,low,[],[],not_applicable,not_applicable,0,0,not_applicable,not_applicable,0,0,not_addressed,not_addressed,not_addressed,not_addressed,not_addressed,not_addressed,not_addressed,not_mentioned,unclear,unclear,mandatory,"This document outlines Fresno County Superior Court's local rules for handling dangerous, large, or bulky exhibits, with specific focus on firearms in courtrooms. It establishes mandatory safety protocols including judicial permission requirements, security measures for firearms, and procedures for evidence storage and return. The document is purely administrative and procedural, addressing courtroom safety and evidence management rather than prosecutorial policy or ideology.","['Permission from the judge assigned to the hearing or trial must be obtained before a party may bring dangerous, large or bulky exhibits into the courthouse.', 'All firearms are secured by a nylon tie or trigger guard, and have been examined by the bailiff to determine that they have been rendered inoperable', 'When a dangerous, large or bulky exhibit that has been marked and identified or received in evidence poses a security, storage or safety problem, on recommendation of the Clerk of the court, the court may order that all or a portion of it be returned to the party that offered it.']"
Fresno County_How to Run a Grand Jury_Redacted.pdf,Fresno County,10/15/2021,2021-10-15,2021.0,training_material,charging_decisions,['administrative'],unclear,0,0,,unclear,low,[],[],moderate_impact,neutral,0,0,not_applicable,not_applicable,0,0,not_addressed,not_addressed,not_addressed,not_addressed,not_addressed,not_addressed,not_addressed,not_mentioned,unclear,unclear,informational,"This document appears to be internal training material on grand jury procedures for Fresno County prosecutors. It covers standard procedural topics including authority to charge by indictment, empanelment processes, hearing procedures, and deliberation protocols. The document is primarily administrative and procedural in nature, providing guidance on how to conduct grand jury proceedings rather than establishing policy positions or ideological direction for prosecutorial decision-making.","[{'quote': 'What Felony Cases can a Grand Jury hear?', 'margin_type': 'extensive', 'relevance': 'Relates to scope of charging decisions through grand jury process'}, {'quote': 'Grand Jurors Can Ask Questions', 'margin_type': 'extensive', 'relevance': 'Indicates procedural aspect of grand jury charging process'}]"
Fresno County_Implied Consent Advisement_Redacted.pdf,Fresno County,10/15/2021,2021-10-15,2021.0,training_material,case_law_update,"['charging_decisions', 'discovery']",leans_traditional,0,1,-1.0,leans_traditional,medium,[],"['Aggressive prosecution-oriented legal strategies', 'Detailed guidance on overcoming defense challenges', 'Emphasis on securing convictions through evidence admission', ""Tone suggesting defense attorneys are trying 'everything' to suppress evidence""]",moderate_impact,more_punitive,0,1,low_impact,not_applicable,0,0,not_addressed,not_addressed,not_addressed,not_addressed,not_addressed,not_addressed,not_addressed,not_mentioned,yes,unclear,strong_guidance,"This training document from the Fresno County DA's Office provides prosecutors with detailed legal strategies for defending warrantless blood draws in DUI cases against Fourth Amendment challenges. It analyzes recent case law on implied consent, search incident to arrest, and voluntary consent exceptions to warrant requirements. The document takes a prosecution-friendly approach, offering tactical advice on distinguishing unfavorable cases and emphasizing legal theories that support evidence admission. The tone and content reflect traditional prosecutorial priorities focused on securing convictions rather than protecting civil liberties.","[{'quote': ""So in People v. Harris (2015) 234 Cal.App.4th 671 the officer read the consequences and Defense said coercion and in Baby they didn't and Defense says coercion. (Do you see how defense is trying everything?)"", 'margin_type': 'extensive_margin', 'significance': 'Reveals adversarial tone toward defense strategies and civil liberties protections'}, {'quote': 'Thankfully the California court of appeals has already reviewed Birchfield in People v. Gutierrez (2018) 27 Cal.App.5th 1155', 'margin_type': 'extensive_margin', 'significance': 'Shows relief that court decisions favor prosecution position on warrantless searches'}, {'quote': 'Now I am going to go way into the facts- because you may need to DISTINGUISH your case from Ling, that is say your facts are different.', 'margin_type': 'extensive_margin', 'significance': 'Provides tactical guidance to prosecutors on avoiding unfavorable precedents'}]"
Fresno County_Misdemeanor Team Speedy Trial Rights_Redacted.pdf,Fresno County,10/15/2021,2021-10-15,2021.0,training_material,case_law_update,"['administrative', 'discovery']",leans_traditional,0,1,-1.0,leans_traditional,medium,[],"['detailed guidance on avoiding case dismissals', 'emphasis on prosecutorial success in maintaining cases', 'focus on procedural compliance to ensure prosecution proceeds']",moderate_impact,more_punitive,0,1,low_impact,neutral,0,0,not_addressed,not_addressed,not_addressed,not_addressed,not_addressed,not_addressed,not_addressed,not_mentioned,yes,unclear,strong_guidance,"This document is a training material for Fresno County prosecutors on speedy trial rights in misdemeanor cases, focusing on procedural requirements and strategies to avoid case dismissals. It provides detailed guidance on establishing 'good cause' for trial delays, particularly regarding witness unavailability, and includes case law analysis. The document's primary purpose is to help prosecutors maintain cases in the system by properly complying with speedy trial requirements and avoiding dismissals that would terminate prosecutions.","[{'quote': 'Dismissal is required only if a defendant is not brought to trial within statutory time limits without good cause.', 'margin_type': 'extensive_margin', 'significance': 'Shows focus on avoiding dismissals that would remove defendants from the system'}, {'quote': 'The court found that the prosecutor had done their due diligence by having the officer served and this established good cause to continue the case... and that this did not violate the defendants speedy trial rights and therefore dismissal by the court was not appropriate.', 'margin_type': 'extensive_margin', 'significance': 'Demonstrates successful prosecutorial strategy to maintain cases in the system'}, {'quote': 'In misdemeanor cases, the only remedy following dismissal on statutory speedy trial grounds is appeal... because no recharging is allowed after one dismissal.', 'margin_type': 'extensive_margin', 'significance': 'Emphasizes the high stakes for prosecutors in avoiding dismissals'}]"
Fresno County_Prosecuting a Juvenile as an Adult _Redacted.pdf,Fresno County,10/15/2021,2021-10-15,2021.0,training_material,juvenile,"['case_law_update', 'sentencing', 'charging_decisions']",leans_progressive,1,0,1.0,leans_progressive,medium,"['Extensive coverage of youth-protective legal developments', 'Detailed explanation of reduced sentences through PC 3051', 'Emphasis on rehabilitation potential and brain development differences', 'Coverage of restrictions on juvenile transfers to adult court']","['Neutral presentation of transfer procedures', 'Coverage of serious 707(b) offenses eligible for transfer', 'Procedural focus on how to prosecute juveniles as adults']",high_impact,neutral,0,0,high_impact,more_lenient,1,0,not_addressed,unclear,not_addressed,not_addressed,not_addressed,case_by_case,not_addressed,not_mentioned,unclear,unclear,informational,"This training document educates prosecutors on the legal framework for transferring juveniles to adult court, with extensive coverage of recent California reforms that have restricted such transfers and reduced sentences for youth offenders. The material emphasizes recent legal developments including youthful offender parole hearings (PC 3051) and Supreme Court decisions limiting harsh sentences for juveniles. While maintaining an educational tone, the document's focus on youth-protective legal changes suggests an office adapting to more rehabilitative approaches to juvenile justice, though it stops short of explicitly advocating for particular prosecutorial strategies.","[{'quote': ""Life without parole is only an appropriate punishment for 'the rare juvenile offender whose crime reflects irreparable corruption.'"", 'margin_type': 'intensive_margin', 'significance': 'Emphasizes the high bar for severe juvenile sentences'}, {'quote': ""The Legislature recognizes that youthfulness both lessens a juvenile's moral culpability and enhances the prospect that, as a youth matures into an adult and neurological development occurs, these individuals can become contributing members of society."", 'margin_type': 'intensive_margin', 'significance': 'Highlights rehabilitative philosophy underlying recent reforms'}, {'quote': ""the board, in reviewing a prisoner's suitability for parole pursuant to Section 3041.5, shall give great weight to the diminished culpability of juveniles as compared to adults, the hallmark features of youth, and any subsequent growth and increased maturity"", 'margin_type': 'intensive_margin', 'significance': 'Shows concrete policy requiring consideration of youth factors in parole decisions'}]"
Fresno County_Row 86- Misdemeanor Domestic Violence Training_Redacted.pdf,Fresno County,10/15/2021,2021-10-15,2021.0,training_material,charging_decisions,"['sentencing', 'victim_services', 'case_law_update']",clearly_traditional,0,1,-2.0,clearly_traditional,high,['Acknowledges victim autonomy in contempt situations'],"['Emphasis on aggressive charging standards', 'Detailed enhancement maximization strategies', 'Focus on overcoming victim non-cooperation', 'Mandatory minimum sentencing emphasis', 'Extensive use of criminal protective orders', 'Re-filing dismissed cases when possible', 'Using prior convictions as evidence']",high_impact,more_punitive,0,1,high_impact,more_punitive,0,1,not_addressed,no,maximize,not_addressed,not_addressed,not_addressed,not_addressed,not_mentioned,yes,unclear,strong_guidance,"This training document provides comprehensive guidance to Fresno County prosecutors on handling misdemeanor domestic violence cases, with detailed instructions on charging decisions, sentencing enhancements, and case prosecution strategies. The material emphasizes aggressive prosecution tactics, including specific criteria for escalating charges to felonies, maximizing sentence enhancements, and pursuing cases even when victims are uncooperative. The overall approach reflects a traditional, punishment-focused prosecutorial philosophy that prioritizes conviction and deterrence over alternative approaches to domestic violence intervention.","[{'quote': 'Minimum 36 months of probation, Criminal Protective Order, Minimum of book and release, Minimum $500 fine, Successful completion of BTP', 'margin_type': 'intensive', 'significance': 'Shows mandatory minimum punitive requirements'}, {'quote': 'Case was dismissed as a result of the failure to appear by the victim... Case must be re-filed within 6 months of the original dismissal', 'margin_type': 'extensive', 'significance': ""Demonstrates commitment to prosecution even when victims don't cooperate""}, {'quote': 'Up to 10 year CPO, 10 year California gun ban per PC 29805, Prior for PC 273.5(f)(1) for 7 years', 'margin_type': 'intensive', 'significance': 'Illustrates focus on maximizing long-term punitive consequences'}]"
2020.02.11_Glenn County_DS ltr to ACLU re Brady Issues discovered by Victim Witness.pdf,Glenn County,02/11/2020,2020-02-11,2020.0,policy_memo,discovery,"['victim_services', 'administrative']",neutral,0,0,0.0,neutral,high,"['Emphasis on constitutional due process rights', 'Commitment to not convicting innocent people', 'Proactive disclosure of exculpatory evidence']","['Focus on proper prosecution procedures', 'Emphasis on avoiding case dismissals', 'Traditional law enforcement cooperation']",moderate_impact,neutral,0,0,low_impact,neutral,0,0,not_addressed,not_addressed,not_addressed,not_addressed,not_addressed,not_addressed,not_addressed,Dwayne Stewart,yes,continuation,mandatory,"This document is an internal memo from Glenn County DA Dwayne Stewart establishing Brady disclosure procedures for the Victim Witness team. It was prompted by a specific incident where victim witness advocates properly identified potentially exculpatory evidence, allowing for better charging decisions. The memo emphasizes constitutional compliance, due process rights, and the importance of not convicting innocent people, while providing detailed procedures for identifying and disclosing Brady material. The document reflects standard prosecutorial ethics and legal obligations rather than ideological positioning.","[{'quote': 'Brady says that the prosecution has no interest in convicting innocent people and therefore anything favorable to the defense which could show the defendant is innocent or which could serve to reduce his punishment must be turned over to the defense', 'margin_type': 'extensive_margin', 'relevance': 'Shows commitment to avoiding wrongful convictions'}, {'quote': 'We are now in a position to make a better charging decision, fulfill our Brady obligations, and able to promptly disclose this pertinent information to the defense', 'margin_type': 'extensive_margin', 'relevance': 'Demonstrates how Brady compliance affects charging decisions'}, {'quote': 'failure to follow Brady procedures can lead to dismissals of cases, personal discipline and even criminal prosecution for failure to disclose potentially exculpatory information', 'margin_type': 'administrative', 'relevance': 'Emphasizes consequences of non-compliance'}]"
2021.06.08_Imperial County_Internal Email re Felony Plea Request.pdf,Imperial County,06/08/2021,2021-06-08,2021.0,procedure_manual,sentencing,"['three_strikes', 'administrative']",leans_traditional,0,1,-1.0,leans_traditional,high,[],"['mandatory approval for lenient pleas', 'institutional barriers to charge reductions', 'presumption toward maintaining harsh penalties', 'bureaucratic controls on prosecutorial discretion toward leniency']",low_impact,not_applicable,0,0,high_impact,more_punitive,0,1,not_addressed,not_addressed,not_addressed,strict_enforcement,not_addressed,not_addressed,not_addressed,Heather (supervisor mentioned),yes,continuation,mandatory,"This internal email establishes a mandatory approval process for prosecutors seeking to offer lenient plea deals, specifically requiring supervisory permission to strike prior convictions, reduce strike offenses, or reduce felonies to misdemeanors. The policy creates institutional barriers to prosecutorial leniency by requiring detailed justification and approval for mercy while imposing no similar requirements for harsh plea offers. This reflects a traditional prosecutorial approach that presumes toward punishment and creates friction against discretionary leniency in plea negotiations.","[{'quote': 'if you want to strike a prior strike, reduce a strike offense, or reduce a case under 17b, you must get approval', 'margin_type': 'intensive', 'significance': 'Establishes mandatory approval requirement specifically for lenient plea actions'}, {'quote': ""All fields must be filled in, including what you are requesting, the defendant's record, the facts of the case, and the reason for the request"", 'margin_type': 'intensive', 'significance': 'Creates bureaucratic burden and documentation requirements for lenient plea offers'}]"
2016_Inyo County_CDAA Professionalism Manual re Jury Selection.pdf,Inyo County,01/01/2016,2016-01-01,2016.0,training_material,case_law_update,"['administrative', 'racial_justice']",neutral,0,0,0.0,neutral,high,"['Emphasis on preventing discriminatory jury selection', 'Detailed guidance on protecting cognizable groups from exclusion', 'Requirements to share certain investigative information with defense', 'Focus on fair and impartial jury selection']","['Standard prosecutorial training material format', 'Focus on legal compliance rather than reform', 'Emphasis on effective prosecution within existing legal framework']",low_impact,neutral,0,0,moderate_impact,neutral,0,0,not_addressed,not_addressed,not_addressed,not_addressed,not_addressed,not_addressed,moderate,not_mentioned,yes,continuation,mandatory,"This document is a comprehensive training manual on proper jury selection procedures for prosecutors, focusing heavily on compliance with Batson/Wheeler requirements to prevent discriminatory exclusion of jurors based on race, gender, religion, and other protected characteristics. It provides detailed legal guidance on voir dire conduct, peremptory challenges, and post-trial jury contact. The document emphasizes professional standards and constitutional compliance rather than advancing any particular prosecutorial philosophy, serving as a neutral legal reference for ensuring fair jury selection practices.","[{'quote': 'The prosecutor should not strike jurors based on any criteria rendered impermissible by the constitution, statutes, applicable rules of the jurisdiction, or these standards, including race, sex, religion, national origin, disability, sexual orientation or gender identity.', 'margin_type': 'intensive_margin', 'relevance': 'Demonstrates commitment to anti-discrimination in jury selection'}, {'quote': 'If the prosecutor uses record searches that are unavailable to the defense, such as criminal record databases, the prosecutor should share the results with defense counsel or seek a judicial protective order.', 'margin_type': 'intensive_margin', 'relevance': 'Shows fairness requirements in trial preparation'}, {'quote': 'A prosecutor who learns reasonably reliable information that there was a problem with jury deliberations or conduct that could support an attack on a judgment of conviction... should promptly report that information to the appropriate judicial officer and, unless the court orders otherwise, defense counsel.', 'margin_type': 'intensive_margin', 'relevance': 'Emphasizes duty to ensure fair trials even post-conviction'}]"
2018.08.27_Inyo County_Letter to Board of Parole Hearing.pdf,Inyo County,08/27/2018,2018-08-27,2018.0,other,other,"['sentencing', 'case_guidance']",clearly_traditional,0,1,-2.0,clearly_traditional,high,[],"['Strong opposition to parole release', 'Emphasis on public safety over rehabilitation', 'Focus on dangerousness and risk assessment', 'Use of family criminal history as relevant factor', 'Dismissal of youth as mitigating factor']",not_applicable,not_applicable,0,0,high_impact,more_punitive,0,1,not_addressed,no,not_addressed,not_addressed,not_addressed,not_addressed,not_addressed,Thomas L. Hardy,unclear,unclear,informational,"This document is a parole opposition letter from Inyo County DA Thomas Hardy arguing against the release of Jeffrey Barrus. The DA emphasizes the inmate's continued dangerousness based on psychiatric assessments, dismisses his youth at the time of offense as a mitigating factor, and cites his family's subsequent criminal behavior in Montana. The letter reflects a traditional prosecutorial approach prioritizing public safety and incapacitation over rehabilitation, demonstrating strong opposition to release despite the completion of the sentence phase.","[{'quote': ""The inmate's master file, especially the Comprehensive Risk Assessment prepared by S. Hoyt, Psy.D., indicate the inmate remains at high risk for violence should he be released."", 'margin_type': 'intensive', 'significance': 'Demonstrates focus on risk assessment and public safety concerns'}, {'quote': 'It is true that the inmate was youthful at the time of the original offense, but his psychiatric condition has, if anything, deteriorated while he has been in custody and he appears to be more dangerous now than he was at the time of the commitment offense.', 'margin_type': 'intensive', 'significance': 'Shows dismissal of youth as mitigating factor and emphasis on current dangerousness'}, {'quote': 'cannot be controlled so as to provide any level of protection to the public', 'margin_type': 'intensive', 'significance': 'Reflects prioritization of public safety over rehabilitation potential'}]"
2019.02.05_Inyo County_Bias Training.pdf,Inyo County,02/05/2019,2019-02-05,2019.0,training_material,racial_justice,"['administrative', 'case_law_update']",leans_progressive,1,0,1.0,leans_progressive,high,"['implicit bias training', 'focus on wrongful convictions', 'acknowledgment of structural bias in criminal justice system', 'emphasis on avoiding presumption of guilt', 'discussion of racial bias in policing and jury decisions', ""self-reflection and devil's advocate approaches""]","['acknowledgment that most cases end in conviction', ""discussion of crime victims' perspectives""]",moderate_impact,more_lenient,1,0,moderate_impact,more_lenient,1,0,not_addressed,not_addressed,not_addressed,not_addressed,not_addressed,not_addressed,high,not_mentioned,yes,unclear,strong_guidance,"This is a comprehensive bias training document for prosecutors that addresses implicit bias, structural racism, and wrongful convictions in the criminal justice system. The training emphasizes the need for prosecutors to recognize their own biases, avoid tunnel vision and confirmation bias, and implement 'cavernous thinking' approaches including devil's advocate analysis and internal review processes. The document reflects a progressive prosecutorial philosophy that prioritizes accuracy and fairness over conviction rates, with particular attention to racial bias and the acknowledgment that innocent people are sometimes convicted.","[{'quote': ""We potentially 'are at the beginning of an exciting new period of American criminal justice, one directly related to the acknowledgement that we convict innocent people.'"", 'relevance': 'extensive_margin', 'explanation': 'Indicates progressive orientation toward criminal justice reform and accuracy over conviction rates'}, {'quote': 'CULTURE THAT MAY REINFORCE THAT DEFENDANTS ARE ALL GUILTY... PRESUMPTION OF GUILT', 'relevance': 'extensive_margin', 'explanation': 'Directly challenges traditional prosecutorial culture and emphasizes presumption of innocence'}, {'quote': 'The law demands that you return a just verdict, based solely on the evidence... Our system of justice is counting on you to render a fair decision based on the evidence, not on biases.', 'relevance': 'intensive_margin', 'explanation': 'Emphasizes fairness and evidence-based decision making over bias-driven outcomes'}]"
2021.02.01 Inyo County_Training re AB3070.pdf,Inyo County,,,,training_material,case_law_update,"['racial_justice', 'administrative']",leans_traditional,0,1,-1.0,leans_traditional,high,"['acknowledgment of racial bias in jury selection', 'training on implicit bias issues']","[""resistance to reform ('woke' person comment)"", 'framing burden shift as anti-prosecution', 'emphasis on maintaining prosecutorial advantages', 'dismissive tone toward racial justice concerns']",moderate_impact,more_lenient,1,0,moderate_impact,more_lenient,1,0,not_addressed,not_addressed,not_addressed,not_addressed,not_addressed,not_addressed,low,not_mentioned,yes,clearly_new_policy,mandatory,"This training document instructs Inyo County prosecutors on complying with AB 3070, which restricts peremptory challenges that may be based on race or related factors. While covering the legal requirements, the training takes a resistant tone toward the reform, using dismissive language and framing it as an anti-prosecution burden. The focus is on maintaining prosecutorial advantages within the new constraints rather than embracing the racial justice goals of the legislation.","[{'quote': 'Now no purposeful discrimination is required; & if an objectively reasonable (woke) person would view the challenge as based in part on race, etc.', 'margin_type': 'extensive_margin', 'significance': 'Shows dismissive attitude toward racial justice reform'}, {'quote': ""THE PROSECUTION'S BURDEN HAS CLEARLY SHIFTED... The new trial/appellate standards of review, while anti-prosecution, are still legal esoteria"", 'margin_type': 'extensive_margin', 'significance': 'Frames racial justice reform as anti-prosecution obstacle'}, {'quote': 'LEARNING TO LIVE WITH AB 3070 (AS OPPOSED TO NO PEREMPTORIES AT ALL)', 'margin_type': 'extensive_margin', 'significance': 'Suggests grudging acceptance rather than embracing reform goals'}]"
2021.12.17_Inyo County_Board of Parole Hearings Letter.pdf,Inyo County,12/17/2021,2021-12-17,2021.0,other,other,['parole_opposition'],leans_traditional,0,1,-1.0,leans_traditional,medium,[],"['opposition_to_parole', 'emphasis_on_public_safety_risk', 'continued_incarceration_advocacy']",not_applicable,not_applicable,0,0,moderate_impact,more_punitive,0,1,not_addressed,no,not_addressed,not_addressed,not_addressed,not_addressed,not_addressed,THOMAS L. HARDY,unclear,continuation,not_applicable,"This document is a letter from Inyo County District Attorney Thomas L. Hardy to the Board of Parole Hearings opposing parole for Jeffrey Chip Barrus. The DA argues that the inmate continues to represent a high risk for violence and remains severely mentally ill, justifying continued incarceration. The letter reflects a traditional prosecutorial approach that prioritizes public safety concerns over rehabilitation or reintegration, though its limited scope as a single parole opposition prevents broader policy assessment.","[{'quote': 'The undersigned respectfully objects to a grant of parole to the above-referenced individual.', 'margin_type': 'intensive', 'significance': 'Direct statement of opposition to release'}, {'quote': 'it appears from the most recent Comprehensive Risk Assessment that the inmate represents a high risk for violence and remains severely mentally ill', 'margin_type': 'intensive', 'significance': 'Justification for continued incarceration based on risk factors'}, {'quote': 'He should not be considered for a grant of parole.', 'margin_type': 'intensive', 'significance': 'Categorical opposition to parole consideration'}]"
2021_Inyo County_Peoples' Opposition to Motion to Reduce Bail.pdf,Inyo County,01/01/2021,2021-01-01,2021.0,other,bail,"['case_guidance', 'charging_decisions']",clearly_traditional,0,1,-2.0,clearly_traditional,high,[],"['Advocates for extremely high bail ($1,000,000)', 'Emphasizes public safety concerns and defendant dangerousness', 'Focuses heavily on violent nature of alleged crime', 'Opposes release even with conditions', 'Uses tough-on-crime framing about risk to community']",not_applicable,not_applicable,0,0,high_impact,more_punitive,0,1,not_addressed,no,not_addressed,not_addressed,high_bail,not_addressed,not_addressed,Thomas L. Hardy,unclear,unclear,not_applicable,"This document is a prosecutor's opposition to a defendant's motion to reduce bail in a murder case. The DA argues for maintaining $1,000,000 bail, emphasizing the defendant's alleged dangerousness and flight risk. The document reflects a traditional prosecutorial approach that prioritizes public safety concerns over bail reform considerations, using the violent nature of the alleged crime to justify continued high-bail detention.","[{'quote': 'In this case, the risk of BOTH harm to others and of flight is manifest. The Defendant is alleged to have shot and killed an unarmed, mostly naked man in a remove portion of the desert.', 'margin_type': 'intensive', 'significance': 'Emphasizes dangerousness to justify high bail'}, {'quote': 'His actions, as supported by evidence at the preliminary examination, show that he is a violent person who poses a risk to anyone with whom he comes into contact.', 'margin_type': 'intensive', 'significance': 'Characterizes defendant as inherently dangerous'}, {'quote': 'The People urged that...bail remain set in the amount of $1,000,000.00.', 'margin_type': 'intensive', 'significance': 'Advocates for maintaining extremely high bail amount'}]"
Inyo County_Berstein Article re Batson-Wheeler.pdf,Inyo County,08/09/2021,2021-08-09,2021.0,training_material,racial_justice,"['case_law_update', 'charging_decisions']",mixed,0,0,0.0,mixed,medium,"['Focus on preventing racial discrimination in jury selection', 'Acknowledgment of racial bias concerns in the justice system', 'Recognition that comparative juror analysis can reveal discriminatory patterns']","['Primary concern is avoiding conviction reversals rather than preventing discrimination per se', ""Framing Batson violations as a 'nightmare' for prosecutors"", 'Focus on strategic considerations to maintain convictions', 'Emphasis on protecting prosecutorial wins rather than ensuring fairness']",moderate_impact,neutral,0,0,high_impact,neutral,0,0,not_addressed,not_addressed,not_addressed,not_addressed,not_addressed,not_addressed,moderate,not_mentioned,unclear,unclear,strong_guidance,"This training document provides prosecutors with detailed guidance on avoiding Batson/Wheeler violations during jury selection to prevent conviction reversals. While it addresses racial justice concerns in jury selection, the document is primarily framed as strategic advice to protect prosecutorial wins rather than principled guidance on preventing discrimination. The author acknowledges constitutional duties regarding racial bias but emphasizes tactical considerations and record-making to survive appellate review. The document reflects a defensive approach to racial justice issues in prosecution.","[{'quote': 'The Batson/Wheeler Nightmare: Being Reversed Because of Racial Bias', 'margin_type': 'intensive_margin', 'significance': 'Frames racial discrimination concerns primarily as a strategic problem for prosecutors rather than a justice issue'}, {'quote': 'Prosecutors have a duty to uphold both the U.S. and California Constitutions, which includes not using racial stereotypes while exercising peremptory challenges. But they also must be mindful of the perception of racial discrimination, and do everything possible to have the record reflect that they are free of such bias.', 'margin_type': 'intensive_margin', 'significance': 'Acknowledges constitutional duty but emphasizes appearance management over substantive reform'}, {'quote': 'Obviously, you do not want to suffer a similar fate. How can you avoid it?', 'margin_type': 'intensive_margin', 'significance': 'Reveals primary motivation is avoiding consequences rather than preventing discrimination'}]"
Inyo County_Jury Trial Reference Material.pdf,Inyo County,08/09/2021,2021-08-09,2021.0,training_material,case_law_update,"['discovery', 'administrative']",neutral,0,0,0.0,neutral,high,"['Detailed guidance on preventing discriminatory jury selection', 'Emphasis on protecting against racial bias in peremptory challenges', 'Recognition of unconscious bias in jury selection']","[""Emphasis on evaluating 'totality of all available evidence' rather than automatic charge rejection"", 'Focus on admissibility standards and constitutional requirements', 'Procedural compliance rather than substantive reform']",moderate_impact,neutral,0,0,low_impact,neutral,0,0,not_addressed,not_addressed,not_addressed,not_addressed,not_addressed,not_addressed,moderate,not_mentioned,yes,unclear,strong_guidance,"This document provides training material on eyewitness identification procedures and jury selection law, particularly focusing on Batson-Wheeler protections against discriminatory jury selection. It instructs prosecutors to carefully evaluate cases with identification issues but maintains prosecutorial discretion to file charges even when procedures are flawed. The document is primarily procedural and compliance-focused, reflecting standard legal requirements rather than a clear ideological stance, though it does emphasize protections against racial bias in jury selection.","[{'quote': ""While failure to comply with the standards of Penal Code section 859.7 in cases where identification is an issue should be closely examined, such failure shall not necessarily result in an 'automatic' rejection of charges."", 'margin_type': 'extensive_margin', 'relevance': 'Shows prosecutorial discretion in charging decisions despite procedural violations'}, {'quote': 'Attorneys should evaluate the totality of all available evidence, including all other admissible evidence supporting the identification.', 'margin_type': 'extensive_margin', 'relevance': 'Emphasizes comprehensive case evaluation rather than rigid rules'}, {'quote': 'The objectively reasonable person standard includes an awareness of unconscious bias, both implicit and institutional.', 'margin_type': 'intensive_margin', 'relevance': 'Shows recognition of bias issues in jury selection procedures'}]"
2016.03.29_Kern County_Internal Memo re U Visa and T Visa Certifier.pdf,Kern County,03/29/2016,2016-03-29,2016.0,policy_memo,victim_services,"['administrative', 'case_guidance']",leans_progressive,1,0,1.0,leans_progressive,medium,"['Victim-centered approach that facilitates immigration relief', 'Willingness to certify even when no criminal case has been filed', 'Structured process to help immigrant crime victims', 'Brady disclosure requirements showing transparency']","['Emphasis on victim cooperation and assistance in prosecution', 'Procedural focus on law enforcement objectives']",low_impact,neutral,0,0,not_applicable,not_applicable,0,0,not_addressed,not_addressed,not_addressed,not_addressed,not_addressed,not_addressed,not_addressed,not_mentioned,yes,modification,mandatory,"This internal memo establishes standardized procedures for processing U and T visa certifications for immigrant crime victims in Kern County. The policy designates the Family Violence Unit supervisor as the certifier and creates a structured 90-day review process with expedited 14-day processing for removal cases. Notably, the office will certify visas even when no criminal case has been filed, demonstrating a victim-centered approach that prioritizes immigrant victim welfare alongside traditional prosecutorial cooperation objectives.","[{'quote': 'If a criminal case has not been filed or submitted to this office, the prosecutor may still complete the certification as long as the victim meets the aforementioned criteria.', 'margin_type': 'extensive_margin', 'relevance': 'Shows willingness to help victims even without prosecution'}, {'quote': ""The District Attorney's Office does not grant or guarantee a U Visa or any other immigration status by signing a U Visa Certification."", 'margin_type': 'administrative', 'relevance': 'Clarifies office role and limitations in immigration process'}, {'quote': 'The supervisor must process the certification within 90 days of the request or within 14 days if the individual is in removal proceedings.', 'margin_type': 'administrative', 'relevance': 'Shows commitment to timely processing with urgency for deportation cases'}]"
2021.02.04_Kern County_Misdemeanor Diversion Program Pamphlet.pdf,Kern County,02/04/2021,2021-02-04,2021.0,diversion_protocol,diversion,"['charging_decisions', 'case_guidance']",leans_progressive,1,0,1.0,leans_progressive,medium,"['Formal diversion program for misdemeanors', 'Educational/rehabilitative approach through classes', 'Case dismissal upon successful completion', 'Focus on skill-building (anger management, life skills, substance education)', 'Victim impact education component']","['Requires guilty plea before diversion', 'Excludes violent offenses and crimes against officers', 'District Attorney retains full discretion over eligibility', 'Significant fees required ($300-500)', 'Strict completion requirements with termination for non-compliance']",high_impact,more_lenient,1,0,low_impact,neutral,0,0,yes,yes,not_addressed,not_addressed,not_addressed,not_addressed,not_addressed,not_mentioned,yes,unclear,mandatory,"This document establishes Kern County's Misdemeanor Diversion Program, which allows eligible defendants to avoid conviction through completion of educational classes and a 12-month compliance period. The program reflects a moderately progressive approach by offering rehabilitation-focused alternatives to traditional prosecution, while maintaining prosecutorial discretion and excluding violent offenses. The policy primarily impacts the extensive margin by providing a formal pathway for case dismissal, though it requires significant fees and strict compliance with program requirements.","[{'quote': 'The District Attorney will determine if the Defendant is eligible for the Program and which class(es) he/she must attend.', 'margin_type': 'extensive', 'significance': 'Shows prosecutorial discretion in diversion decisions'}, {'quote': ""If the defendant completes the program, pays the class fee(s) and does not commit any new law violations within 12 months from the date the defendant entered his/her plea, the defendant's case will be submitted to the Court with a recommendation to have his/her case dismissed."", 'margin_type': 'extensive', 'significance': 'Demonstrates the lenient outcome of case dismissal for successful completion'}, {'quote': 'The District Attorney will object to the diversion of the following offenses: PC 148 (resisting, delaying or obstructing an officer), PC 422 (criminal threats), PC 245 (assault with a deadly weapon)', 'margin_type': 'extensive', 'significance': 'Shows traditional approach by excluding crimes against officers and violent offenses'}]"
Kern County_DA Policies_Completely Redacted.pdf,Kern County,,,,other,other,[],unclear,0,0,,unclear,low,[],[],not_applicable,not_applicable,0,0,not_applicable,not_applicable,0,0,not_addressed,not_addressed,not_addressed,not_addressed,not_addressed,not_addressed,not_addressed,not_mentioned,unclear,unclear,unclear,"This document from Kern County DA's office has been completely redacted, with all substantive content replaced by repeated claims of attorney work product privilege and prosecutorial discretion. No actual policy content, guidance, or ideological indicators are visible in the document. The redaction makes any analysis of prosecutorial approach or policy orientation impossible.","['Attorney Work Product; Prosecutorial Discretion - This phrase is repeated throughout the entire document as a redaction marker, providing no substantive policy content (not applicable to extensive/intensive margin classification)']"
Kings County_List of Attorneys.pdf,Kings County,08/24/2021,2021-08-24,2021.0,other,administrative,['personnel'],unclear,0,0,,unclear,high,[],[],not_applicable,not_applicable,0,0,not_applicable,not_applicable,0,0,not_addressed,not_addressed,not_addressed,not_addressed,not_addressed,not_addressed,not_addressed,not_mentioned,no,unclear,informational,"This document is an administrative attorney roster for Kings County listing names, roles, ID numbers, and active status of various legal professionals including Deputy District Attorneys, Defense Attorneys, and Judges. It serves as a directory or database export with no policy content, ideological positions, or prosecutorial guidance. The document appears to be used for case management, attorney identification, or administrative tracking purposes within the county's legal system.","['This document contains no substantive quotes as it consists entirely of attorney names, titles, and ID numbers', 'No policy-relevant text is present in this administrative roster', ""The document format is: 'Last name, First name [Title] [ID Number] [Status]'""]"
2016_Lake County_Policy & Procedure Manual.pdf,Lake County,01/01/2016,2016-01-01,2016.0,procedure_manual,administrative,"['charging_decisions', 'sentencing', 'juvenile', 'enhancements']",clearly_traditional,0,1,-2.0,clearly_traditional,high,"['consideration of factual innocence claims', 'victim consultation before dismissals']","['mandatory adult filing for juvenile murder/firearm cases', 'strict Three Strikes enforcement', 'presumption against dismissing firearm enhancements', ""prosecution of police officer victims 'to fullest extent possible'"", 'tough DUI filing guidelines', 'rejection of automatic dismissals for deportable defendants']",moderate_impact,more_punitive,0,1,high_impact,more_punitive,0,1,not_addressed,not_addressed,maximize,strict_enforcement,not_addressed,supports_transfer,not_addressed,not_mentioned,yes,unclear,mandatory,"This 2016 Lake County District Attorney Policy and Procedure Manual establishes comprehensive operational guidelines emphasizing traditional prosecutorial approaches. The manual mandates strict charging standards, automatic adult court filing for serious juvenile offenses, aggressive enforcement of sentence enhancements, and presumptions against dismissing cases or striking prior convictions. While containing standard ethical and procedural protections, the overall framework prioritizes public safety through punitive prosecution and incarceration over alternative approaches.","[{'quote': 'In all cases where the law permits the minor to be charged with murder, attempted murder, or any felony where the juvenile personally used a firearm during the commission of the crime, this office will directly file charges in adult court.', 'margin_type': 'intensive_margin', 'significance': 'Demonstrates mandatory punitive approach to juvenile cases'}, {'quote': 'Once filed, an allegation under section 12022.53 supported by sufficient evidence will not be dismissed simply to resolve a case... the presumption will be in favor of the enhanced sentences called for by the statute.', 'margin_type': 'intensive_margin', 'significance': 'Shows strict enforcement of firearm enhancements'}, {'quote': ""When a police officer is a victim of a crime it is the policy of the District Attorney's office to prosecute it to the fullest extent possible."", 'margin_type': 'both', 'significance': 'Illustrates traditional law-and-order priorities'}]"
.10.21_LA County_Trauma Informed Lawyering MCLE Flyer.pdf,Los Angeles County,,,,training_material,victim_services,['administrative'],leans_progressive,1,0,1.0,leans_progressive,medium,"['trauma-informed practices', 'focus on reducing re-traumatization', 'emphasis on victim engagement rather than just conviction outcomes']",[],moderate_impact,more_lenient,1,0,moderate_impact,more_lenient,1,0,not_addressed,not_addressed,not_addressed,not_addressed,not_addressed,not_addressed,not_addressed,not_mentioned,unclear,unclear,informational,"This document is a training announcement for Los Angeles County prosecutors on trauma-informed lawyering practices. The training focuses on learning practices that reduce re-traumatization of victims while improving legal outcomes and increasing victim engagement. While limited in scope as a training flyer, it suggests a progressive orientation toward victim services that goes beyond traditional prosecution models by emphasizing therapeutic and collaborative approaches. The training represents an investment in practices that could influence both charging decisions and case handling throughout the prosecutorial process.","[{'quote': 'Learn trauma-informed practices', 'relevance': 'Indicates progressive approach to victim services and prosecutorial practice', 'margin_type': 'both extensive and intensive'}, {'quote': 'Reduce re-traumatization', 'relevance': 'Shows concern for victim welfare beyond traditional prosecution goals', 'margin_type': 'intensive margin'}, {'quote': 'Increase victim engagement', 'relevance': 'Suggests collaborative rather than purely prosecutorial approach to cases', 'margin_type': 'extensive margin'}]"
2011.07.19_LA County_Reporting State Bar Investigations.pdf,Los Angeles County,07/19/2011,2011-07-19,2011.0,policy_memo,administrative,"['discovery', 'case_law_update']",neutral,0,0,0.0,neutral,high,[],[],not_applicable,not_applicable,0,0,not_applicable,not_applicable,0,0,not_addressed,not_addressed,not_addressed,not_addressed,not_addressed,not_addressed,not_addressed,Jacquelyn Lacey (Chief Deputy District Attorney),yes,unclear,mandatory,This administrative memorandum establishes mandatory procedures for deputy district attorneys to report State Bar investigations and misconduct findings to their supervisors and the District Attorney Professional Responsibility Committee. The policy ensures compliance with legal self-reporting requirements under Business and Professions Code § 6068 and facilitates the office's ability to provide legal representation to deputies facing State Bar proceedings. The document is purely procedural and does not reflect any particular prosecutorial ideology or substantive criminal justice policy positions.,"['Prosecutors have a duty to self-report to the State Bar any alleged misconduct that, in whole or in part, caused reversal of a conviction and to self-report the imposition of any judicial sanction against the attorney', 'Therefore, a deputy district attorney is required to immediately inform his head deputy when he: (1) Self-reports a finding of misconduct pursuant to Business and Professions Code § 6068(o)(3) and (7); or (2) Receives any communication from the State Bar Office of Chief Trial Counsel regarding allegations of misconduct', ""Failure to comply with this requirement may result in a delay in seeking Board approval to pay for counsel and may impact a deputy's ability to respond to any State Bar investigation in a timely manner""]"
2012.01.31_Los Angeles County_Brady Outline (Brady and the Prudent Prosecutor).pdf,Los Angeles County,01/31/2012,2012-01-31,2012.0,training_material,discovery,"['case_law_update', 'administrative']",leans_progressive,1,0,1.0,leans_progressive,medium,"[""Emphasis on 'prudent prosecutor' erring on side of disclosure"", ""Warning that California statute requires disclosure of 'any exculpatory evidence' beyond federal requirements"", ""Advocacy for transparency and public trials over 'prosecutor's private deliberations'"", 'Comprehensive guidance on protecting defendant rights']","['Maintains prosecutorial discretion in disclosure decisions', ""Notes that defendants cannot 'search through' government files"", 'Preserves work product privilege protections']",low_impact,neutral,0,0,moderate_impact,more_lenient,1,0,not_addressed,not_addressed,not_addressed,not_addressed,not_addressed,not_addressed,not_addressed,not_mentioned,yes,continuation,strong_guidance,"This comprehensive training document provides Los Angeles County prosecutors with detailed guidance on Brady disclosure obligations, emphasizing compliance with both federal constitutional requirements and California's more expansive statutory discovery rules. The document consistently advocates for erring on the side of disclosure when materiality is uncertain, reflecting a defendant-protective approach to discovery obligations. While primarily focused on legal compliance rather than policy reform, the emphasis on transparency and comprehensive disclosure suggests a prosecutorial philosophy that prioritizes fairness and justice-seeking over purely adversarial approaches.","[{'quote': ""Because, the 'significance of an item of evidence can seldom be predicted accurately until the entire record is complete, the prudent prosecutor will resolve doubtful questions in favor of disclosure.'"", 'margin_type': 'intensive_margin', 'relevance': 'Shows defendant-protective orientation in disclosure decisions'}, {'quote': 'This means, naturally, that a prosecutor anxious about tacking too close to the wind will disclose a favorable piece of evidence. Making such a disclosure justifies the trust placed in prosecutors as individuals seeking justice.', 'margin_type': 'intensive_margin', 'relevance': 'Emphasizes justice-seeking over conviction-seeking mentality'}, {'quote': 'When in doubt, the best policy is always to err on the side of disclosure.', 'margin_type': 'intensive_margin', 'relevance': 'Clear directive favoring defendant protections when uncertain'}]"
2012.10.15_LA County_Personnel Policies Memo-Reporting State Bar Investigations.pdf,Los Angeles County,10/15/2012,2012-10-15,2012.0,policy_memo,administrative,"['discovery', 'case_law_update']",neutral,0,0,0.0,neutral,high,[],[],not_applicable,not_applicable,0,0,not_applicable,not_applicable,0,0,not_addressed,not_addressed,not_addressed,not_addressed,not_addressed,not_addressed,not_addressed,Jacquelyn Lacey (Chief Deputy District Attorney),yes,modification,mandatory,"This administrative memo establishes mandatory procedures for Los Angeles County prosecutors to follow when facing State Bar investigations for alleged professional misconduct. It outlines reporting requirements, self-disclosure obligations, and the process for obtaining county-funded legal representation through the Professional Responsibility Committee. The document is purely procedural and administrative, focusing on compliance with professional responsibility rules rather than substantive prosecutorial policy or ideology.","['DDAs are required to immediately inform their direct supervisor in writing if they are notified by the State Bar that they are the subject of an inquiry or investigation.', 'Prosecutors have a duty to self-report to the State Bar any alleged misconduct that, in whole or in part, caused reversal of a conviction.', ""Failure to comply with this requirement may result in a delay in seeking Board of Supervisors' approval to pay for the cost of hiring counsel and may impact a DDA's ability to respond to any State Bar investigation in a timely manner.""]"
2012.12.15_Los Angeles County_Closing Argument Handout.pdf,Los Angeles County,12/15/2012,2012-12-15,2012.0,training_material,case_law_update,"['administrative', 'discovery']",neutral,0,0,0.0,neutral,high,"['emphasis on preventing wrongful convictions', 'focus on ethical conduct', 'acknowledgment of prosecutorial error']","['vigorous advocacy encouraged', 'wide latitude for prosecutors', 'focus on conviction integrity']",low_impact,neutral,0,0,moderate_impact,neutral,0,0,not_addressed,not_addressed,not_addressed,not_addressed,not_addressed,not_addressed,not_addressed,not_mentioned,yes,continuation,strong_guidance,"This document is a comprehensive training guide for Los Angeles County prosecutors on ethical argument standards during opening statements and closing arguments. It provides detailed case law guidance on what constitutes proper versus improper prosecutorial conduct, with extensive examples of misconduct that can lead to reversals, mistrials, or State Bar discipline. The document emphasizes vigorous but ethical advocacy, focusing on preventing prosecutorial error that could undermine convictions while maintaining professional standards. It serves as both a legal reference and practical training tool to reduce appellate reversals due to prosecutorial misconduct.","[{'quote': 'According to a recent study, from 1997 to 2009, in approximately 4,000 criminal appeals in California, the defendant accused the prosecutor of committing misconduct... In 444 [63%] of the 707 cases, the error committed by the prosecutor was an improper opening statement or closing argument.', 'margin_type': 'intensive_margin', 'relevance': 'Establishes the practical importance of proper trial conduct'}, {'quote': '[A prosecutor] may prosecute with earnestness and vigor -- indeed, he should do so. But, while he may strike hard blows, he is not at liberty to strike foul ones. It is as much his duty to refrain from improper methods calculated to produce a wrongful conviction as it is to use every legitimate means to bring about a just one.', 'margin_type': 'intensive_margin', 'relevance': 'Defines the balanced approach between vigorous prosecution and ethical constraints'}, {'quote': 'Do not anticipate that the appellate court finding of harmless error will excuse the underlying ethical misconduct.', 'margin_type': 'intensive_margin', 'relevance': 'Emphasizes accountability for prosecutorial conduct regardless of case outcomes'}]"
2013.01.02_Los Angeles County_Immunity Outline.pdf,Los Angeles County,01/02/2013,2013-01-02,2013.0,training_material,case_law_update,"['administrative', 'discovery']",neutral,0,0,0.0,neutral,high,[],[],low_impact,neutral,0,0,low_impact,neutral,0,0,not_addressed,not_addressed,not_addressed,not_addressed,not_addressed,not_addressed,not_addressed,not_mentioned,yes,unclear,informational,"This is a legal training document that provides Los Angeles County prosecutors with comprehensive guidance on prosecutorial immunity doctrine, explaining when they have absolute versus qualified immunity from civil lawsuits. The document is purely instructional, focusing on legal precedents and practical advice for avoiding liability rather than advocating for any particular prosecutorial approach. While it acknowledges criticism of prosecutorial immunity from reform advocates, it maintains an objective, educational tone throughout.","[{'quote': 'A prosecutor who always complies with his or her legal and ethical obligations has little to fear from later legal challenges.', 'relevance': ""Establishes the document's focus on legal compliance rather than policy direction"", 'margin_type': 'not_applicable'}, {'quote': 'Absolute immunity is permitted to insure that prosecutors are not chilled from challenging illegal conduct for fear of being sued.', 'relevance': 'Explains the legal rationale for prosecutorial immunity without taking a position on its merits', 'margin_type': 'not_applicable'}, {'quote': 'Always insure that your acts are those that a reasonable prosecutor, aware of the facts as presented at that time, would have taken.', 'relevance': 'Provides practical guidance focused on legal standards rather than prosecutorial philosophy', 'margin_type': 'not_applicable'}]"
2014_Los Angeles County_Wheeler Outline.pdf,Los Angeles County,01/01/2014,2014-01-01,2014.0,training_material,case_law_update,"['racial_justice', 'administrative']",leans_progressive,1,0,1.0,leans_progressive,medium,"['Extensive training on preventing racial discrimination in jury selection', 'Detailed guidance on avoiding bias against protected groups including sexual orientation, age, and disability', ""Emphasis on ensuring 'representative cross-section of the community'"", ""Warning against 'group bias' and stereotyping"", 'Comprehensive coverage of cognizable groups beyond just race']","['Training is framed as legal compliance rather than social justice', 'Includes guidance on legitimate reasons to exclude jurors', 'Maintains prosecutorial prerogatives within legal bounds']",low_impact,neutral,0,0,moderate_impact,more_lenient,1,0,not_addressed,not_addressed,not_addressed,not_addressed,not_addressed,not_addressed,moderate,Los Angeles County District Attorney,yes,continuation,strong_guidance,"This is a comprehensive training document on Wheeler/Batson jury selection law, providing Los Angeles County prosecutors with detailed guidance on avoiding discriminatory peremptory challenges. The document emphasizes legal compliance with anti-discrimination requirements while maintaining prosecutorial effectiveness within constitutional bounds. While primarily focused on legal procedure rather than policy reform, the extensive coverage of protected groups and emphasis on representative juries suggests a commitment to fair trial procedures that aligns with progressive prosecutorial values.","[{'quote': 'the use of peremptory challenges to remove prospective jurors on the sole ground of group bias violates the right to trial by a jury drawn from a representative cross-section of the community', 'margin_type': 'intensive_margin', 'relevance': 'Establishes the fundamental principle against discriminatory jury selection'}, {'quote': 'Never exercise peremptory challenges based on race, color, religion, sex, national origin, sexual orientation or similar grounds', 'margin_type': 'intensive_margin', 'relevance': 'Direct mandate against discriminatory practices'}, {'quote': ""The purpose of eliminating 'group bias' from jury selection is 'to achieve an overall impartiality by allowing the interaction of the diverse beliefs and values the jurors bring from their group experiences'"", 'margin_type': 'intensive_margin', 'relevance': 'Shows commitment to diversity and fair representation in jury composition'}]"
2015.01 - 2022.04_LA County_Training Flyers (Combined).pdf,Los Angeles County,,,,training_material,case_law_update,"['victim_services', 'administrative', 'discovery']",mixed,0,0,0.0,mixed,medium,"['trauma-informed practices', 'survivor-centered approach', 'vicarious trauma awareness', 'implicit bias training']","['victim-focused prosecution training', 'enhancement prosecution techniques', 'exclusion of defense attorneys from trainings', 'focus on conviction strategies']",low_impact,neutral,0,0,low_impact,neutral,0,0,not_addressed,not_addressed,not_addressed,not_addressed,not_addressed,not_addressed,low,Jackie Lacey,yes,continuation,informational,"This document contains training flyers from the Los Angeles County District Attorney's Office spanning 2015-2022 under Jackie Lacey's administration. The materials focus primarily on technical legal education including DNA evidence, cell phone evidence, witness examination, and case law updates. While some progressive elements appear in trauma-informed training and victim services, the overall approach reflects traditional prosecutorial training with emphasis on conviction techniques and exclusion of defense perspectives from educational sessions.","[{'quote': 'This seminar is open to prosecutors and peace officers only. Retired prosecutors and peace officers may attend. Individuals who represent criminal defendants or represent plaintiffs suing law enforcement may not attend.', 'margin_type': 'administrative', 'significance': 'Shows traditional prosecutorial approach by excluding defense perspectives from training'}, {'quote': 'This training will provide participants with an in-depth understanding of how to support survivors of domestic violence through a trauma-informed, survivor-centered approach.', 'margin_type': 'intensive_margin', 'significance': 'Demonstrates progressive victim-centered and trauma-informed approaches'}, {'quote': 'This training seeks to bring awareness of the existence of vicarious trauma and compassion fatigue among prosecutors.', 'margin_type': 'administrative', 'significance': 'Shows progressive awareness of prosecutor wellbeing and secondary trauma'}]"
2015.01.10_LA County_Saturday Seminar-A Prosecutor's Story Flyer.pdf,Los Angeles County,01/10/2015,2015-01-10,2015.0,training_material,case_law_update,"['administrative', 'discovery']",neutral,0,0,0.0,neutral,medium,['elimination of bias training credit'],"['exclusive access for prosecutors and peace officers only', 'exclusion of defense attorneys and plaintiff representatives']",low_impact,neutral,0,0,low_impact,neutral,0,0,not_addressed,not_addressed,not_addressed,not_addressed,not_addressed,not_addressed,low,not_mentioned,yes,unclear,informational,"This document is a training seminar announcement for Los Angeles County prosecutors focusing on legal education rather than policy directives. The seminar covers Wheeler/Batson jury selection law and a historical corruption investigation case study. While it includes bias elimination training credit, the overall orientation appears neutral with some traditional prosecutorial elements, particularly in its exclusive access policy for law enforcement personnel. The document does not address substantive prosecutorial policies regarding charging, sentencing, or criminal justice reform.","[{'quote': 'Audience: This seminar is open to prosecutors and peace officers only. Retired prosecutors and peace officers may attend. Individuals who represent criminal defendants or represent plaintiffs suing law enforcement may not attend.', 'relevance': 'Illustrates traditional prosecutorial approach of maintaining clear boundaries between prosecution and defense', 'margin_type': 'administrative'}, {'quote': 'MCLE – 2 Hours Ethics; 1 Hour Elimination of Bias', 'relevance': 'Shows some attention to bias issues, which could indicate progressive awareness', 'margin_type': 'administrative'}, {'quote': 'At the conclusion, the operation was one of the most successful undercover investigations in FBI history, resulting in the indictment of 103 judges, court clerks, defense attorneys, prosecutors and police officers.', 'relevance': 'Emphasizes law enforcement success and anti-corruption efforts', 'margin_type': 'administrative'}]"
2015.02.21_LA County_Saturday Seminar-Firearm Forensics Flyer.pdf,Los Angeles County,02/21/2015,2015-02-21,2015.0,training_material,case_law_update,"['administrative', 'firearms_evidence']",leans_traditional,0,1,-1.0,leans_traditional,medium,[],"['focus on maximizing conviction potential', 'emphasis on proving cases rather than alternatives', 'partnership with law enforcement training']",low_impact,neutral,0,0,moderate_impact,more_punitive,0,1,not_addressed,not_addressed,not_addressed,not_addressed,not_addressed,not_addressed,not_addressed,not_mentioned,yes,continuation,strong_guidance,"This document announces a training seminar for Los Angeles County prosecutors focused on improving their ability to present firearms evidence in court. The seminar features expert instruction on forensic evidence and courtroom presentation techniques, along with a legislative update. While primarily administrative, the document reflects a traditional prosecutorial approach emphasizing conviction-oriented training rather than alternative approaches to firearms cases. The training aims to enhance prosecutors' effectiveness in securing convictions through better evidence presentation.","[{'quote': 'He will give an overview and explanation of the many types of firearms evidence that can be obtained from a crime scene and used to prove our cases.', 'margin_type': 'intensive', 'relevance': 'Shows focus on strengthening prosecution capabilities'}, {'quote': 'He will debunk some myths about Shooting dynamics and will detail how to get the most out of courtroom presentation of firearms evidence.', 'margin_type': 'intensive', 'relevance': 'Emphasizes maximizing prosecutorial effectiveness in court'}, {'quote': 'the seminar should provide some useful and interesting information for the next time you present firearms evidence', 'margin_type': 'intensive', 'relevance': 'Assumes continued aggressive prosecution of firearms cases'}]"
2015.02.26_LA County_General Office Memorandum 15-021.pdf,Los Angeles County,02/26/2015,2015-02-26,2015.0,general_memo,administrative,"['death_penalty', 'charging_decisions']",neutral,0,0,0.0,neutral,medium,['Recognition that office exercises discretion by not filing valid special circumstances'],"['Maintains special circumstances committee structure', 'Focuses on tracking potential death penalty cases']",moderate_impact,neutral,0,0,low_impact,neutral,0,0,not_addressed,not_addressed,not_addressed,not_addressed,not_addressed,not_addressed,not_addressed,not_mentioned,yes,modification,mandatory,"This administrative memorandum establishes a new requirement for prosecutors to document cases where valid special circumstances could have been filed but weren't, creating an 'eligible/unfiled' tracking system. The policy is part of ongoing efforts to standardize and improve data tracking for special circumstance cases over the past two years. While the memo acknowledges prosecutorial discretion in charging decisions, it focuses on administrative oversight rather than providing guidance on when such discretion should be exercised. The primary goal appears to be improving case management and statistical accuracy rather than implementing substantive policy changes.","[{'quote': 'The purpose of this new memorandum is to allow the Chair of the Special Circumstances Committee to track murder cases that the office exercised discretion by not filing a valid special circumstance allegation.', 'margin_type': 'extensive_margin', 'relevance': 'Shows office acknowledges and tracks discretionary charging decisions'}, {'quote': 'an abridged version of the special circumstance penalty evaluation memorandum is required whenever an otherwise valid special circumstance is not alleged at the filing stage', 'margin_type': 'extensive_margin', 'relevance': 'Demonstrates systematic approach to documenting charging discretion'}, {'quote': 'Over the past two years, numerous modifications have been made to PIMS to standardize the preparation of special circumstance penalty evaluation and case disposition memoranda', 'margin_type': 'administrative', 'relevance': 'Indicates ongoing effort to systematize death penalty case handling'}]"
2015.02.26_LA County_Special Circumstance Memo.pdf,Los Angeles County,02/26/2015,2015-02-26,2015.0,policy_memo,administrative,"['death_penalty', 'charging_decisions']",neutral,0,0,0.0,neutral,medium,['Recognition that office exercises discretion by not filing valid special circumstances'],"['Maintains special circumstances tracking system', 'Emphasizes oversight and standardization of death penalty cases']",moderate_impact,neutral,0,0,low_impact,neutral,0,0,not_addressed,not_addressed,not_addressed,not_addressed,not_addressed,not_addressed,not_addressed,not_mentioned,yes,modification,mandatory,"This administrative memo establishes a new requirement for prosecutors to file documentation when they choose not to pursue valid special circumstance allegations in murder cases. The policy creates a tracking system to monitor prosecutorial discretion in death penalty-eligible cases, requiring brief memoranda to be submitted to the Special Circumstances Committee within 30 days of filing. While the memo acknowledges prosecutorial discretion in charging decisions, its primary focus is on administrative standardization and oversight rather than substantive policy changes regarding when special circumstances should or should not be filed.","[{'quote': 'The purpose of this new memorandum is to allow the Chair of the Special Circumstances Committee to track murder cases that the office exercised discretion by not filing a valid special circumstance allegation.', 'margin_type': 'extensive_margin', 'relevance': 'Shows office acknowledges and tracks discretionary charging decisions'}, {'quote': 'an abridged version of the special circumstance penalty evaluation memorandum is required whenever an otherwise valid special circumstance is not alleged at the filing stage', 'margin_type': 'extensive_margin', 'relevance': 'Demonstrates systematic approach to documenting charging discretion'}, {'quote': 'Over the past two years, numerous modifications have been made to PIMS to standardize the preparation of special circumstance penalty evaluation and case disposition memoranda', 'margin_type': 'administrative', 'relevance': 'Shows ongoing effort to systematize death penalty case handling'}]"
2015.03.04_LA County_General Office Memorandum 15-022.pdf,Los Angeles County,03/04/2015,2015-03-04,2015.0,general_memo,administrative,"['training_material', 'case_law_update']",unclear,0,0,,unclear,high,[],[],not_applicable,not_applicable,0,0,not_applicable,not_applicable,0,0,not_addressed,not_addressed,not_addressed,not_addressed,not_addressed,not_addressed,not_addressed,not_mentioned,yes,continuation,mandatory,"This is a routine administrative memorandum announcing mandatory after-hours duty training for Los Angeles County prosecutors, scheduled for March 31, 2015. The training covers technical topics including search warrant law updates and after-hours procedures, with attendance required based on alphabetical name divisions. The document is purely procedural and contains no substantive policy content or ideological indicators regarding prosecutorial philosophy or criminal justice approach.","['Any deputy currently performing After-Hours duty and whose last name begins with A to L, must attend this training to continue their service.', 'The topics and speakers include: Search Warrant Law -- Update... After-Hours Procedures and Immunity Update', 'Any Deputy District Attorney (DDA) III or DDA IV not currently doing After-Hours duty who would like to be added to the duty roster needs to attend this session.']"
2015.04.02_LA County_General Office Memorandum 15-030.pdf,Los Angeles County,04/02/2015,2015-04-02,2015.0,general_memo,case_law_update,"['charging_decisions', 'administrative']",neutral,0,0,0.0,neutral,high,[],"['insistence on defendant waiver of statute of limitations', 'guidance on maintaining prosecutorial options']",moderate_impact,neutral,0,0,low_impact,neutral,0,0,not_addressed,not_addressed,not_addressed,not_addressed,not_addressed,not_addressed,not_addressed,not_mentioned,yes,continuation,strong_guidance,"This memorandum provides technical legal guidance to Los Angeles County prosecutors on statute of limitations issues arising from Proposition 47's reclassification of certain felonies to misdemeanors. The memo explains when cases remain viable for prosecution despite the shortened one-year limitation period for misdemeanors, focusing on timing of original charges and conduct relationships. While procedurally thorough, the document is ideologically neutral, emphasizing legal compliance rather than prosecutorial philosophy or policy preferences.","[{'quote': 'deputies should always insist that a defendant enter a knowing waiver of the statute of limitations before pleading guilty or no contest to a time-barred offense', 'margin_type': 'intensive_margin', 'significance': 'Shows traditional prosecutorial approach of ensuring maximum legal protections for the state'}, {'quote': 'When no charges have been brought within one year of the commission of the criminal conduct at issue, misdemeanor charges for drug possession offenses and theft-related conduct are barred by the statute of limitations', 'margin_type': 'extensive_margin', 'significance': 'Neutral statement of legal limitations on charging decisions'}, {'quote': 'The continuing viability of cases affected by Prop 47 will, in some cases, largely depend on two issues: whether more than a year elapsed between the date the offense was committed and the date criminal charges were originally filed', 'margin_type': 'extensive_margin', 'significance': 'Technical guidance on case viability without ideological framing'}]"
"2015.04.14_LA County_Prop 47, Supplement 5 Memo.pdf",Los Angeles County,04/14/2015,2015-04-14,2015.0,policy_memo,case_law_update,"['sentencing', 'charging_decisions']",clearly_traditional,0,1,-2.0,clearly_traditional,high,[],"['resistance to sentence reductions', 'emphasis on maintaining prosecutorial advantage', 'strategic use of legal procedures to prevent leniency', 'focus on preserving harsh sentences', 'treating plea agreements as tools to maximize punishment']",moderate_impact,more_punitive,0,1,high_impact,more_punitive,0,1,not_addressed,no,not_addressed,not_addressed,not_addressed,not_addressed,not_addressed,not_mentioned,yes,continuation,strong_guidance,This memo instructs Los Angeles County prosecutors on how to prevent defendants from benefiting from Proposition 47 sentence reductions by strategically moving to vacate plea agreements. The guidance focuses on maintaining the prosecution's 'benefit of bargain' and provides tactical advice on when to reinstate previously dismissed charges to preserve harsher felony sentences. The document reflects a traditional prosecutorial approach that prioritizes maintaining punitive outcomes over allowing defendants to benefit from criminal justice reform measures. The memo demonstrates institutional resistance to the lenient effects of Proposition 47 through procedural maneuvering designed to preserve harsh sentences.,"[{'quote': 'GOM 14-099 advised deputies that we may move to rescind a plea agreement if a defendant who pled guilty to a felony seeks a misdemeanor sentence, pursuant to Proposition 47 (Prop 47), that deprives us of the benefit of our bargain.', 'margin_type': 'intensive_margin', 'significance': ""Establishes the office's resistance to allowing Proposition 47 sentence reductions""}, {'quote': 'Defendant seeks to gain relief from the sentence imposed but otherwise leave the plea bargain intact. This is bounty in excess of that to which he is entitled.', 'margin_type': 'intensive_margin', 'significance': ""Reveals the office's view that defendants should not benefit from criminal justice reforms""}, {'quote': 'There is no point in rescinding a plea agreement and reinstating the original charges unless at least one non-reducible felony offense would be reinstated.', 'margin_type': 'extensive_margin', 'significance': 'Shows strategic thinking about reinstating more serious charges to maintain prosecutorial advantage'}]"
"2015.04.16_LA County_Prop 47, Supplement 6 Memo.pdf",Los Angeles County,04/16/2015,2015-04-16,2015.0,case_guidance,case_law_update,"['charging_decisions', 'enhancements']",clearly_traditional,0,1,-2.0,clearly_traditional,high,[],"['Actively resisting voter-approved criminal justice reform (Prop 47)', 'Providing prosecutors with tools to maintain maximum charges', 'Emphasizing punishment over rehabilitation', 'Creating template briefs to fight charge reductions']",high_impact,more_punitive,0,1,high_impact,more_punitive,0,1,not_addressed,no,maximize,not_addressed,not_addressed,not_addressed,not_addressed,John K. Spillane mentioned as Chief Deputy District Attorney,yes,continuation,strong_guidance,This memo instructs prosecutors on how to maintain felony charges for access card fraud (PC 484e) despite Proposition 47's general reclassification of theft offenses to misdemeanors. The LA County DA's office provides detailed legal arguments and a template brief to help prosecutors argue that these charges should remain felonies. This represents a clear effort to resist the voter-approved criminal justice reform and maintain maximum punishment for these offenses. The document reflects a traditional prosecutorial approach focused on maintaining harsh penalties rather than embracing reform.,"[{'quote': 'The purpose of this GOM is to discuss various arguments in support of our Office position that Prop 47 and section 490.2 did not affect section 484e and, additionally, to provide a template brief for the benefit of deputies who may encounter this issue.', 'margin_type': 'extensive_margin', 'significance': 'Shows office actively working to maintain felony charges despite reform'}, {'quote': ""To further assist deputies with this issue, the Office has prepared a template brief entitled: 'Motion to Retain Felony Status of Penal Code § 484e(d) Charge(s); Points and Authorities.'"", 'margin_type': 'intensive_margin', 'significance': 'Demonstrates systematic effort to maintain maximum penalties'}, {'quote': 'The language and history of Prop 47 do not disclose any intent on the part of voters to relax consumer protection laws.', 'margin_type': 'extensive_margin', 'significance': 'Frames resistance to reform as protecting consumers rather than opposing rehabilitation'}]"
2015.04.18_LA County_Saturday Seminar-Jury Selection Flyer.pdf,Los Angeles County,04/18/2015,2015-04-18,2015.0,training_material,administrative,['case_law_update'],leans_traditional,0,1,-1.0,leans_traditional,medium,[],"['emphasis on winning cases', 'strategic jury selection to maximize prosecution advantage', 'focus on conviction success']",low_impact,not_applicable,0,0,moderate_impact,more_punitive,0,1,not_addressed,not_addressed,not_addressed,not_addressed,not_addressed,not_addressed,not_addressed,Bureau Director Sergio A. Gonzalez,unclear,unclear,informational,"This document is a training announcement for Los Angeles County prosecutors about jury selection strategies, featuring a prominent trial consultant. The seminar emphasizes 'winning your case' through strategic jury selection techniques and identifying favorable jurors. While limited in scope, the framing suggests a traditional prosecutorial approach focused on conviction success rather than broader justice reform priorities. The training appears designed to improve prosecution trial outcomes through tactical advantages in jury selection.","[{'quote': 'Winning Your Case in Jury Selection', 'margin_type': 'intensive', 'relevance': 'Emphasizes prosecution success and winning rather than fairness or justice'}, {'quote': 'He will have many insights into asking the right questions and paying attention to the non-verbal cues to identify the right and wrong jurors for your case', 'margin_type': 'intensive', 'relevance': 'Focuses on strategic advantage in jury selection to benefit prosecution outcomes'}]"
"2015.04.20_LA County_Prop 47, Supplement 7 Memo.pdf",Los Angeles County,04/20/2015,2015-04-20,2015.0,policy_memo,enhancements,"['case_law_update', 'sentencing']",clearly_traditional,0,1,-2.0,clearly_traditional,high,[],"['enhancement maximization', 'resistance to sentence reduction opportunities', 'emphasis on deterrence through punishment', 'providing template briefs to oppose defendant motions']",not_applicable,not_applicable,0,0,high_impact,more_punitive,0,1,not_addressed,not_addressed,maximize,not_addressed,not_addressed,not_addressed,not_addressed,not_mentioned,yes,continuation,strong_guidance,"This memo instructs LA County prosecutors to maintain prison prior enhancements under PC 667.5(b) even when the underlying offenses have been reduced to misdemeanors under Proposition 47. The office provides legal arguments and template briefs to oppose defendant motions for relief, emphasizing that the deterrent purpose of enhancements remains valid regardless of offense reclassification. The document reflects a traditional prosecutorial approach that prioritizes maintaining punishment over embracing criminal justice reform opportunities.","[{'quote': 'The Office believes that these offenses do qualify under section 667.5(b), as this particular sentencing enhancement is intended to increase the punishment for offenders undeterred by prison, irrespective of whether the commitment offense is reduced to a misdemeanor.', 'margin_type': 'intensive', 'significance': 'Shows commitment to maintaining punitive enhancements despite reform'}, {'quote': 'While Prop 47 may deem the prior criminal conduct to be a misdemeanor, nothing about the offender has changed: he or she is alleged to have committed a new felony offense within five years of a previous offense', 'margin_type': 'intensive', 'significance': 'Reveals traditional ideology emphasizing offender culpability over legal reform'}, {'quote': ""the Office has prepared a template brief entitled, 'Opposition to Motion to Strike Prison Priors Reduced to Misdemeanors under Proposition 47'"", 'margin_type': 'intensive', 'significance': 'Demonstrates proactive effort to resist sentence reductions and maintain punishment'}]"
2015.04.28_Los Angeles County_Established Body Worn Procedures (Office of the Chief Police).pdf,Los Angeles County,04/28/2015,2015-04-28,2015.0,procedure_manual,administrative,"['evidence_collection', 'police_procedures', 'accountability']",mixed,0,0,0.0,mixed,medium,"['promote accountability', 'assist in resolving complaints against officers including false allegations', 'officer evaluation and training']","['collect evidence for criminal prosecutions', 'deter criminal activity', 'comprehensive recording requirements for enforcement activities']",moderate_impact,more_punitive,0,1,low_impact,neutral,0,0,not_addressed,not_addressed,not_addressed,not_addressed,not_addressed,not_addressed,not_addressed,not_mentioned,yes,clearly_new_policy,mandatory,"This Los Angeles Police Department special order establishes comprehensive mandatory procedures for body-worn video camera use by officers. The policy serves dual purposes of collecting evidence for criminal prosecutions while promoting police accountability and protecting officers from false allegations. The document creates extensive recording requirements for all police-public interactions and establishes detailed protocols for equipment management, video review, and supervisor responsibilities. While primarily administrative in nature, the policy could facilitate more successful prosecutions through enhanced evidence collection.","[{'quote': 'The Department has adopted the use of BWV by uniformed personnel to: • Collect evidence for use in criminal investigations and prosecutions; • Deter criminal activity and uncooperative behavior during police-public interactions', 'margin_type': 'extensive_margin', 'relevance': 'Shows focus on evidence collection and crime deterrence'}, {'quote': 'Officers shall activate their BWV devices prior to initiating any investigative or enforcement activity involving a member of the public', 'margin_type': 'extensive_margin', 'relevance': 'Demonstrates comprehensive evidence collection mandate'}, {'quote': '• Promote accountability; • Assist in resolving complaints against officers including false allegations by members of the public', 'margin_type': 'administrative', 'relevance': 'Shows accountability and officer protection objectives'}]"
2015.06.03_LA County_Saturday Seminar-Conviction Review Flyer.pdf,Los Angeles County,06/03/2015,2015-06-03,2015.0,training_material,case_law_update,['administrative'],unclear,0,0,,unclear,high,[],[],not_applicable,not_applicable,0,0,not_applicable,not_applicable,0,0,not_addressed,not_addressed,not_addressed,not_addressed,not_addressed,not_addressed,not_addressed,not_mentioned,unclear,unclear,informational,"This is a brief administrative memorandum from the Los Angeles County District Attorney's Office dated June 3, 2015, announcing a Saturday seminar scheduled for June 13, 2015. The document serves purely an informational function, notifying all employees about the upcoming training event. It contains no substantive prosecutorial policy content, ideological framing, or guidance that would indicate the office's approach to criminal justice issues or prosecutorial decision-making.","[""Subject: Saturday Seminar Flyer for June 13, 2015 - This indicates the document's purely administrative nature"", 'To: All Employees - Shows this is office-wide communication but without substantive policy content']"
2015.06.12_LA County_New County Bail Procedures Memo.pdf,Los Angeles County,06/12/2015,2015-06-12,2015.0,general_memo,administrative,['bail'],neutral,0,0,0.0,neutral,high,[],[],not_applicable,not_applicable,0,0,not_applicable,not_applicable,0,0,not_addressed,not_addressed,not_addressed,not_addressed,not_addressed,not_addressed,not_addressed,not_mentioned,yes,clearly_new_policy,mandatory,"This is a purely administrative memorandum informing all district attorney personnel of new Superior Court procedures requiring all bail forfeiture motions to be filed and heard at a centralized location starting July 1, 2015. The memo provides logistical instructions for forwarding requests to the Extradition Services Section and clarifies that existing policies remain in effect. The document contains no substantive prosecutorial policy positions or ideological content, serving only as an operational directive to ensure compliance with new court procedures.","[{'quote': ""Effective July 1, 2015, the Superior Court has informed us that 'all bail forfeiture motions for the extension of time or tolling must be filed and scheduled for hearing at the Clara Shortridge Foltz Criminal Justice Center (CJC).'"", 'relevance': 'Shows this is a court-mandated procedural change, not a prosecutorial policy decision', 'margin_type': 'administrative'}, {'quote': 'After July 1, bail forfeiture motions for the extension or time or tolling should not be heard in any courthouse other than the designated court at CJC.', 'relevance': 'Demonstrates the mandatory nature of the procedural change', 'margin_type': 'administrative'}]"
2015.10.19_LA County_General Office Memorandum 15-093.pdf,Los Angeles County,10/19/2015,2015-10-19,2015.0,general_memo,administrative,['training_material'],unclear,0,0,,unclear,high,[],[],not_applicable,not_applicable,0,0,not_applicable,not_applicable,0,0,not_addressed,not_addressed,not_addressed,not_addressed,not_addressed,not_addressed,not_addressed,John K. Spillane mentioned as Chief Deputy District Attorney,yes,unclear,informational,"This document is a routine administrative memorandum from the LA County District Attorney's office announcing training sessions for transitioning from legacy Lexis legal research software to Lexis Advance. The memo provides scheduling details for both in-person and online training sessions and includes a comprehensive course catalog covering various legal research functions. The document is purely administrative and contains no prosecutorial policy content or ideological indicators, serving only to facilitate office operations and staff training on legal research tools.","['By the end of this year, LexisNexis will be transitioning from Lexis.com to Lexis Advance - administrative transition announcement', 'This is a class designed to provide ISAB customers with a working knowledge of the Lexis® service - training description', 'Course Geared for: Attorneys, Legal Assistants, Paralegals, Clerks, etc. (i.e. all interested users) - broad office training initiative']"
2015.11.14_Los Angeles County_Police Use of Force Issues Presentation.pdf,Los Angeles County,11/14/2015,2015-11-14,2015.0,training_material,case_law_update,"['administrative', 'charging_decisions']",leans_traditional,0,1,-1.0,leans_traditional,medium,"['emphasis on injury reduction philosophy', 'support for non-lethal weapons to reduce harm']","['strong defense of police use of force', 'emphasis on officer safety and split-second decision making', 'skepticism toward video evidence that might implicate officers', 'framing that suggests resistance justifies force']",moderate_impact,more_lenient,1,0,low_impact,not_applicable,0,0,not_addressed,not_addressed,not_addressed,not_addressed,not_addressed,not_addressed,not_addressed,not_mentioned,yes,unclear,strong_guidance,"This training document for Los Angeles County prosecutors focuses on police use of force cases, emphasizing the limitations of video evidence and the complexity of officer decision-making under stress. The presentation takes a notably pro-law enforcement stance, encouraging prosecutors to consider officer perspectives and the 'objectively reasonable' standard when evaluating potential charges. While it promotes non-lethal weapons for harm reduction, the overall framework suggests prosecutors should be understanding rather than critical of police use of force, potentially leading to more lenient charging decisions in officer-involved cases.","[{'quote': ""If suspects did not resist, fight or run . . . There wouldn't be much force used. There wouldn't be police shootings Officers would not get murdered."", 'margin_type': 'extensive_margin', 'significance': 'Reflects traditional law enforcement perspective that places primary responsibility on suspects'}, {'quote': ""Videos are not 'the ultimate truth.' Investigators and adjudicators must determine what the officer perceived at the time and apply the totality of the circumstances along with policy, training and the law to determine whether or not the officer's perceptions and actions were objectively reasonable."", 'margin_type': 'extensive_margin', 'significance': 'Emphasizes deference to officer perspective in charging decisions'}, {'quote': 'The most reasonable force is the type that gets the job done and results in the least injury to officers and suspects.', 'margin_type': 'extensive_margin', 'significance': 'Shows some progressive concern for harm reduction while maintaining law enforcement priorities'}]"
2015.11.17_Los Angeles County_Early Parole Notifications and PRA Correspondence.pdf,Los Angeles County,11/17/2015,2015-11-17,2015.0,general_memo,administrative,"['sentencing', 'victim_services']",leans_traditional,0,1,-1.0,leans_traditional,medium,['victim_services_contact'],"['systematic_opposition_to_early_release', 'preference_for_longer_sentences', 'emphasis_on_objecting_to_parole']",not_applicable,not_applicable,0,0,moderate_impact,more_punitive,0,1,not_addressed,no,not_addressed,strict_enforcement,not_addressed,not_addressed,not_addressed,not_mentioned,yes,clearly_new_policy,mandatory,"This administrative memo establishes mandatory procedures for Los Angeles County DA personnel to systematically oppose court-ordered early parole releases for second-strike inmates serving sentences for non-violent offenses. The document creates a formal process requiring immediate notification to the Parole Division and preparation of objection letters within 30 days, while also mandating victim notification. The memo reflects resistance to federal court-ordered sentence reductions and prioritizes keeping inmates incarcerated for longer periods, demonstrating a traditional prosecutorial approach to sentencing and parole decisions.","[{'quote': ""the BPH requests a written letter from the District Attorney's Office in each case where the District Attorney's Office objects to Early Parole at 50% of the inmate's sentence"", 'margin_type': 'intensive', 'significance': 'Shows systematic approach to opposing early release'}, {'quote': 'This requires an evaluation by the Parole Division and preparation of a letter in each case where our Office objects to early release', 'margin_type': 'intensive', 'significance': 'Indicates presumption of objection to early releases'}, {'quote': 'It is necessary to immediately contact the Head Deputy of the Parole Division upon receipt of any correspondence from the BPH or the CDCR regarding Early Parole of Second Strike Inmates so that appropriate action can be taken', 'margin_type': 'intensive', 'significance': 'Demonstrates urgency in opposing court-ordered sentence reductions'}]"
2015.12.09_LA County_General Office Memorandum 15-116.pdf,Los Angeles County,12/09/2015,2015-12-09,2015.0,general_memo,administrative,"['training_material', 'discovery']",unclear,0,0,,unclear,low,['Brady compliance training'],"['preliminary hearing training', 'professionalism emphasis']",not_applicable,not_applicable,0,0,not_applicable,not_applicable,0,0,not_addressed,not_addressed,not_addressed,not_addressed,not_addressed,not_addressed,not_addressed,not_mentioned,unclear,unclear,informational,"This is a routine administrative memorandum announcing a one-day training program for winter law clerks scheduled for January 4, 2016. The training covers standard prosecutorial topics including professionalism, criminal court processes, Brady compliance, and preliminary hearing procedures. The document is purely logistical in nature and provides no insight into prosecutorial policy positions or ideological orientation of the Los Angeles County District Attorney's Office.","['The morning session will include training on: Professionalism, The Criminal Court Process, Motions, Discovery, Brady compliance, Social Media and Confidentiality', 'The afternoon session will be open ONLY to certified law clerks who will be conducting preliminary hearings during their winter clerkship', 'Law clerks who are not registered in advance will not be admitted']"
2015.12.29_LA County_Special Directive 15-03.pdf,Los Angeles County,12/29/2015,2015-12-29,2015.0,charging_standard,charging_decisions,['administrative'],leans_progressive,1,0,1.0,leans_progressive,medium,"['Presumptive reduction of charges from misdemeanor to infraction for first-time offenders', 'Systematic policy to reduce criminalization of driving without a license', 'Focus on proportional charging based on offense history']","['Maintains misdemeanor charges for repeat offenders', 'Preserves prosecutorial discretion to charge as misdemeanor when circumstances justify']",high_impact,more_lenient,1,0,not_applicable,not_applicable,0,0,unclear,yes,not_addressed,not_addressed,not_addressed,not_addressed,not_addressed,John K. Spillane mentioned as Chief Deputy District Attorney,yes,clearly_new_policy,mandatory,"This directive establishes a new uniform policy for Los Angeles County DA's office regarding Vehicle Code § 12500(a) (driving without a license) violations, creating a presumption that first-time offenses should be handled as infractions rather than misdemeanors. The policy aims to reduce the criminalization of first-time driving without license violations while maintaining misdemeanor prosecution for repeat offenders or cases involving concurrent crimes. This represents a systematic approach to proportional charging that reduces the severity of consequences for first-time offenders while preserving prosecutorial tools for more serious cases.","[{'quote': 'Violations of Vehicle Code § 12500(a) where the defendant does not have any prior convictions for violations of Vehicle Code § 12500(a) or Vehicle Code § 14601 et seq.; and Violations of Vehicle Code § 12500(a) where the defendant is not concurrently charged with another misdemeanor or felony offense.', 'margin_type': 'extensive', 'significance': 'Establishes clear criteria for presumptive infraction handling'}, {'quote': ""The Los Angeles County District Attorney's Office (LADA) has adopted a uniform policy concerning the prosecution of first-time Vehicle Code § 12500(a) offenses."", 'margin_type': 'extensive', 'significance': 'Indicates systematic office-wide approach to reducing charges'}, {'quote': 'The above policy regarding first-time Vehicle Code § 12500(a) offenses is presumptive. If circumstances exist that appear to justify a misdemeanor charge, a law enforcement officer may issue a citation as a misdemeanor and submit the offense to LADA for charge evaluation.', 'margin_type': 'extensive', 'significance': 'Shows flexibility while maintaining presumption toward leniency'}]"
2015.12.31_LA County_Jurors Not Dismissed on Basis of Age or Disability Memo.pdf,Los Angeles County,12/31/2015,2015-12-31,2015.0,policy_memo,case_law_update,"['administrative', 'procedural_guidance']",neutral,0,0,0.0,neutral,high,['protection of disabled and elderly jurors from discrimination'],['reminder that rules apply to defense as well as prosecution'],moderate_impact,neutral,0,0,moderate_impact,neutral,0,0,not_addressed,not_addressed,not_addressed,not_addressed,not_addressed,not_addressed,not_addressed,John K. Spillane mentioned as Chief Deputy District Attorney,yes,clearly_new_policy,mandatory,"This administrative memo informs all deputy district attorneys of a legal change effective January 1, 2016, prohibiting the use of peremptory challenges to dismiss jurors based on age or disability. The document is purely procedural, explaining new legal requirements under amended Code of Civil Procedure section 231.5 and referencing relevant case law. The memo emphasizes that these rules apply equally to both prosecution and defense, reflecting mandatory compliance with statutory changes rather than any particular prosecutorial policy orientation.","[{'quote': 'Effective January 1, Code of Civil Procedure section 231.5, has been amended to prohibit employing a preemptory challenge to dismiss a juror on the basis of any category found in Government Code section 11135, subdivision (a).', 'margin_type': 'procedural', 'relevance': 'Shows this is a legally mandated change, not prosecutorial discretion'}, {'quote': 'When challenged it is improper to offer either age or disability as a ground for dismissal.', 'margin_type': 'procedural', 'relevance': 'Direct instruction on required compliance with new legal standard'}, {'quote': 'Deputies are reminded that these rules apply to the defense as well as the prosecution.', 'margin_type': 'procedural', 'relevance': 'Emphasizes equal application and procedural nature of the change'}]"
2015.12.31_LA County_Misdemeanor Military Pretrial Diversion Program Memo.pdf,Los Angeles County,12/31/2015,2015-12-31,2015.0,diversion_protocol,diversion,"['victim_services', 'case_guidance']",mixed,0,0,0.0,mixed,high,"['Implementation of therapeutic diversion program for veterans', 'Recognition of trauma and mental health issues as factors', 'Utilization of existing military support resources', 'Acknowledgment that charges can be dismissed and deemed never to have occurred']","['Emphasis on prosecutorial objections and maintaining prosecution authority', 'Explicit instruction to object to domestic violence diversions except in unusual cases', 'Strong focus on victim rights and public safety', 'Requirement for deputies to actively monitor and move for termination of diversion', 'Emphasis on criminal history review and violation enforcement']",moderate_impact,mixed,0,0,low_impact,not_applicable,0,0,yes,yes,not_addressed,not_addressed,not_addressed,not_addressed,not_addressed,not_mentioned,yes,clearly_new_policy,mandatory,"This memorandum implements California's new military pretrial diversion program for veterans charged with misdemeanors who suffer from service-related trauma or substance abuse. While the policy creates a pathway for therapeutic diversion, it emphasizes prosecutorial oversight, victim protection, and public safety concerns. The document instructs deputies to actively object when defendants are ineligible or unsuitable, particularly for domestic violence cases, and requires vigilant monitoring for violations that would terminate diversion.","[{'quote': ""While the court has the authority to offer a military pretrial diversion program to a defendant over the prosecutor's objections, it is the obligation of the District Attorney's Office to ensure that the rights of victims and the interests of public safety are maintained."", 'margin_type': 'extensive_margin', 'significance': 'Shows tension between implementing diversion and maintaining traditional prosecutorial priorities'}, {'quote': 'Except in unusual cases in which a Head Deputy or Deputy-in-Charge approves a deviation from this policy, deputies are to object to diversion on domestic violence offenses because of the inherently serious nature of such crimes.', 'margin_type': 'extensive_margin', 'significance': 'Demonstrates traditional tough-on-crime approach for certain offense categories'}, {'quote': 'Deputies who become aware of a violation of the terms imposed by the court at any time during the period of pretrial diversion are expected to notify the court and move for termination of diversion and reinstatement of criminal proceedings.', 'margin_type': 'extensive_margin', 'significance': 'Emphasizes active monitoring and enforcement rather than supportive approach to diversion participants'}]"
2015_Los Angeles County_Civil Justice for Victims of Crime in CA (Natl Crime Victim Bar Assoc).pdf,Los Angeles County,01/01/2015,2015-01-01,2015.0,training_material,victim_services,"['civil_litigation', 'restitution', 'victim_compensation']",neutral,0,0,0.0,neutral,high,"['victim_empowerment', 'comprehensive_victim_services', 'focus_on_victim_control_and_agency']","['victim_rights_emphasis', 'accountability_focus', 'crime_prevention_through_civil_liability']",not_applicable,not_applicable,0,0,low_impact,neutral,0,0,not_addressed,not_addressed,not_addressed,not_addressed,not_addressed,not_addressed,not_addressed,not_mentioned,unclear,unclear,informational,"This document is an educational guide published by the National Crime Victim Bar Association that explains civil litigation options available to crime victims in California. It provides comprehensive information about the differences between civil and criminal justice systems, types of civil lawsuits, statutes of limitations, and practical guidance for finding attorneys. The document emphasizes victim empowerment through civil remedies while remaining neutral on prosecutorial policy approaches, serving as an informational resource rather than a policy directive.","[{'quote': 'Every crime victim has the right to file a civil lawsuit seeking financial compensation from the perpetrator or from other parties whose unreasonable conduct gave rise to conditions which allowed the crime to occur.', 'relevance': ""Establishes the document's focus on victim empowerment and comprehensive remedies"", 'margin_type': 'not_applicable'}, {'quote': 'In a civil suit than in a criminal case because they are a party to the civil case, cannot be excluded from the courtroom, and have final approval of settlement proposals.', 'relevance': 'Emphasizes victim control and agency in civil proceedings', 'margin_type': 'not_applicable'}, {'quote': ""Crime victims' civil suits have resulted in increased security protection in public places, better oversight and supervision of daycare facilities, and countless other improvements."", 'relevance': 'Highlights crime prevention benefits of civil litigation', 'margin_type': 'not_applicable'}]"
2016.01.20_Los Angeles County_Email re US DOJ - VNS - Investigative Case.pdf,Los Angeles County,01/20/2016,2016-01-20,2016.0,other,victim_services,"['case_law_update', 'administrative']",leans_traditional,0,1,-1.0,leans_traditional,medium,"['comprehensive victim rights information', 'victim-centered services']","['strong emphasis on victim rights and restitution', 'victim-centered approach without mention of defendant rights or alternatives', 'focus on prosecution rather than diversion or alternatives']",not_applicable,not_applicable,0,0,low_impact,neutral,0,0,not_addressed,not_addressed,not_addressed,not_addressed,not_addressed,not_addressed,not_addressed,not_mentioned,yes,unclear,informational,"This document is a federal victim notification letter for a child pornography case, providing comprehensive information about victim rights under federal law and available services. It reflects a traditional victim-centered prosecutorial approach, emphasizing restitution rights and victim services throughout the criminal process. The document is procedural and informational, focusing on victim empowerment within the existing criminal justice framework rather than proposing any alternative approaches to prosecution or punishment.","[{'quote': 'Many victims are retaining a lawyer to help them get restitution (reimbursement from the defendant) each time an offender possesses their image. Many lawyers do not charge in advance.', 'margin_type': 'intensive_margin', 'relevance': 'Shows focus on maximizing victim compensation and restitution'}, {'quote': ""Additionally, please be aware that most criminal cases are resolved by a plea agreement between the United States Attorney's Office and the defendant."", 'margin_type': 'intensive_margin', 'relevance': 'Neutral acknowledgment of plea bargaining as standard practice'}, {'quote': 'The right to full and timely restitution as provided in law; The right to proceedings free from unreasonable delay', 'margin_type': 'intensive_margin', 'relevance': 'Emphasizes victim rights in the prosecution process'}]"
2016.03.25_LA County_Special Directive-Consideration of Immigration Consequences.pdf,Los Angeles County,03/25/2016,2016-03-25,2016.0,policy_memo,charging_decisions,"['sentencing', 'case_law_update']",leans_progressive,1,0,1.0,leans_progressive,high,"['Consideration of collateral consequences beyond criminal penalties', 'Focus on proportionality and avoiding disproportionate punishment', 'Allowance for policy deviations based on individual circumstances', 'Recognition that collateral consequences can be more severe than the conviction itself']","['Maintains that charging policies remain unaffected', 'Requires supervisor approval for any deviations', 'Emphasizes this is only one factor among many']",moderate_impact,more_lenient,1,0,high_impact,more_lenient,1,0,unclear,unclear,not_addressed,not_addressed,not_addressed,not_addressed,low,John K. Spillane (Chief Deputy),yes,clearly_new_policy,mandatory,"This directive implements a new state law requiring LA County prosecutors to consider adverse immigration consequences during plea negotiations as one factor in reaching just resolutions. The policy represents a shift toward more individualized justice by allowing deviations from standard policies when immigration consequences would be disproportionately harsh. While maintaining prosecutorial structure through required supervisor approval, it removes previous prohibitions on considering immigration status and acknowledges that collateral consequences can sometimes exceed the severity of the underlying criminal penalty.","[{'quote': ""Collateral consequences can, in some cases, have a greater adverse impact on a defendant than the conviction alone. When collateral consequences will have so great an adverse impact on a defendant that the resulting 'punishment' will be disproportionate to the punishment other defendants would receive for the same crime, a departure from policy may be warranted."", 'margin_type': 'intensive_margin'}, {'quote': 'deputies shall consider the avoidance of adverse immigration consequences as one factor in reaching a just resolution of a case at all times when engaged in the plea negotiation process', 'margin_type': 'intensive_margin'}, {'quote': 'It is office policy that the immigration status of a defendant is not to be considered a mitigating or aggravating factor at sentencing. [This sentence is hereby stricken]', 'margin_type': 'intensive_margin'}]"
2016.05.13_LA County_Mental Health Liaison Position Memo.pdf,Los Angeles County,05/13/2016,2016-05-13,2016.0,general_memo,administrative,"['diversion', 'mental_health']",leans_progressive,1,0,1.0,leans_progressive,medium,"['Creation of dedicated mental health diversion position', 'Collaboration with Office of Diversion and Reentry', 'Commitment to comprehensive mental health diversion plan', 'Focus on treatment and services as alternatives to jail']","['Emphasis on preserving public safety', 'Attention to rights of crime victims']",moderate_impact,more_lenient,1,0,low_impact,not_applicable,0,0,yes,yes,not_addressed,not_addressed,not_addressed,not_addressed,not_addressed,Jackie Lacey,yes,clearly_new_policy,informational,"This memorandum announces the creation of a new Mental Health Liaison position within the Los Angeles County District Attorney's Office, effective May 2016. The position is designed to facilitate mental health diversion through collaboration with various county agencies and stakeholders. While maintaining emphasis on public safety and victim rights, the document reflects a progressive approach to criminal justice by institutionalizing diversion efforts and prioritizing treatment over incarceration for mentally ill offenders. This represents a structural policy change rather than just procedural guidance.","[{'quote': 'The Mental Health Liaison will help effectuate appropriate mental health diversion through collaboration with other County stakeholders', 'margin_type': 'extensive_margin', 'relevance': 'Directly addresses diversion from criminal justice system'}, {'quote': 'expand and implement treatment and services to safely divert mentally ill offenders from the jail, while preserving public safety and the rights of crime victims', 'margin_type': 'extensive_margin', 'relevance': 'Shows balance between progressive diversion goals and traditional prosecutorial concerns'}, {'quote': 'The creation of this new position reflects a continued commitment to implementing a comprehensive mental health diversion plan', 'margin_type': 'extensive_margin', 'relevance': 'Indicates institutional commitment to diversion as ongoing policy priority'}]"
2016.05.13_LA County_Special Directive-Misdemeanor Diversion Develop. for Disabled Deft.pdf,Los Angeles County,05/13/2016,2016-05-13,2016.0,diversion_protocol,diversion,"['charging_decisions', 'victim_services', 'procedure_manual']",leans_progressive,1,0,1.0,leans_progressive,medium,"['Formal diversion program for vulnerable population', 'Treatment and habilitation focus over punishment', 'Eligibility regardless of criminal history', 'Dismissal of charges upon successful completion', 'Recognition of developmental disabilities as mitigating factor']","['Mandatory objection to diversion for domestic violence, child abuse, elder abuse, sexual assault', 'Strong emphasis on victim rights and public safety', 'Required protective orders and supervision conditions', ""Prosecutor obligation to 'ensure that the rights of victims and the interests of public safety are maintained'"", 'Detailed oversight and violation procedures']",high_impact,more_lenient,1,0,moderate_impact,mixed,0,0,yes,yes,not_addressed,not_addressed,not_addressed,not_addressed,not_addressed,John K. Spillane (Chief Deputy District Attorney),yes,clearly_new_policy,mandatory,"This directive establishes a comprehensive diversion program for developmentally disabled defendants charged with misdemeanors, allowing charges to be dismissed upon successful completion of treatment programs. The policy reflects a progressive approach by creating alternatives to conviction regardless of criminal history, while maintaining traditional prosecutorial priorities by excluding serious offenses like domestic violence and sexual assault from diversion eligibility. The directive provides detailed procedures for prosecutors to evaluate suitability while emphasizing victim rights and public safety concerns. Overall, it represents a balanced policy that expands rehabilitative options for a vulnerable population while preserving prosecutorial discretion for serious cases.","[{'quote': ""A developmentally disabled defendant may be eligible for diversion irrespective of the defendant's criminal history or the nature of the pending charge."", 'margin_type': 'extensive', 'significance': 'Shows expansive eligibility criteria for diversion'}, {'quote': 'deputies are to object to diversion on cases involving domestic violence, child abuse, elder abuse, or sexual assault because of the inherently serious nature of such crimes', 'margin_type': 'extensive', 'significance': 'Demonstrates traditional prosecutorial priorities for serious offenses'}, {'quote': ""it is the obligation of the District Attorney's Office to ensure that the rights of victims and the interests of public safety are maintained, objecting on the record when a defendant is deemed an unsuitable candidate for the program"", 'margin_type': 'extensive', 'significance': 'Emphasizes traditional victim-centered and public safety concerns'}]"
2016.07.19_LA County_Special Directive 16-11.pdf,Los Angeles County,07/19/2016,2016-07-19,2016.0,policy_memo,victim_services,"['administrative', 'discovery']",leans_progressive,1,0,1.0,leans_progressive,medium,"['Establishes presumption of victim helpfulness to facilitate U visa certification', 'Creates systematic process to assist immigrant crime victims', 'Emphasizes victim services and support through Bureau of Victim Services involvement', 'Implements expedited processing for victims in removal proceedings']","['Maintains ability to revoke certification if victim becomes uncooperative', 'Requires victim cooperation with prosecution as condition for certification']",low_impact,neutral,0,0,not_applicable,not_applicable,0,0,not_addressed,not_addressed,not_addressed,not_addressed,not_addressed,not_addressed,low,not_mentioned,yes,modification,mandatory,"This directive establishes comprehensive procedures for processing U visa certifications for immigrant crime victims in Los Angeles County. The policy creates a victim-supportive framework with a presumption of helpfulness while maintaining prosecutorial interests through cooperation requirements. It demonstrates a progressive approach to victim services by systematically facilitating immigration relief for crime victims, though it preserves traditional prosecutorial leverage by requiring ongoing cooperation and allowing certification revocation.","[{'quote': 'For purposes of determining helpfulness, there is a rebuttable presumption that a victim is helpful, has been helpful, or is likely to be helpful to the detection, investigation, or prosecution of that qualifying criminal activity if the victim has not refused or failed to provide information and assistance reasonably requested by law enforcement.', 'margin_type': 'extensive_margin', 'significance': 'Establishes victim-friendly presumption for certification'}, {'quote': ""If the petitioning victim subsequently fails to provide assistance or otherwise becomes uncooperative, the handling deputy shall prepare a supplemental memorandum... The Director must then notify the USCIS of the victim's failure to cooperate"", 'margin_type': 'extensive_margin', 'significance': 'Maintains prosecutorial leverage through cooperation requirements'}, {'quote': ""A request for U visa certification by a victim or the victim's representative during the pendency of the case is considered discoverable pursuant to our constitutional and statutory obligations."", 'margin_type': 'neutral', 'significance': 'Ensures transparency in certification process'}]"
2016.07.19_LA County_Special Directive-U Visa Certification - Revised.pdf,Los Angeles County,07/19/2016,2016-07-19,2016.0,policy_memo,victim_services,"['administrative', 'discovery']",leans_progressive,1,0,1.0,leans_progressive,medium,"['Creates systematic support for immigrant crime victims', 'Establishes rebuttable presumption of victim helpfulness', 'Prioritizes victim cooperation over strict enforcement', 'Includes comprehensive victim services coordination']","['Maintains focus on prosecution assistance', 'Requires victim cooperation for certification', 'Includes mechanisms to revoke support if victims become uncooperative']",moderate_impact,more_lenient,1,0,low_impact,neutral,0,0,not_addressed,not_addressed,not_addressed,not_addressed,not_addressed,not_addressed,moderate,not_mentioned,yes,modification,mandatory,"This directive establishes comprehensive procedures for Los Angeles County DA's Office certification of U visas for immigrant crime victims. The policy creates a systematic framework that presumes victim helpfulness unless they refuse to cooperate, facilitating immigration relief for victims of qualifying crimes. While primarily administrative, the directive reflects a progressive approach to immigrant victim services by streamlining certification processes, though it maintains traditional prosecutorial expectations of victim cooperation throughout proceedings.","[{'quote': 'there is a rebuttable presumption that a victim is helpful, has been helpful, or is likely to be helpful to the detection, investigation, or prosecution of that qualifying criminal activity if the victim has not refused or failed to provide information and assistance reasonably requested by law enforcement', 'margin_type': 'extensive_margin', 'significance': 'Creates favorable presumption for immigrant victims seeking cooperation-based immigration relief'}, {'quote': ""A request for U visa certification by a victim or the victim's representative during the pendency of the case is considered discoverable pursuant to our constitutional and statutory obligations"", 'margin_type': 'administrative', 'significance': 'Demonstrates transparency requirements and constitutional compliance'}, {'quote': ""If the petitioning victim subsequently fails to provide assistance or otherwise becomes uncooperative, the handling deputy shall prepare a supplemental memorandum... The Director must then notify the USCIS of the victim's failure to cooperate"", 'margin_type': 'extensive_margin', 'significance': 'Shows traditional prosecutorial expectation of continued victim cooperation'}]"
2016.11.04_LA County_Peremptory Challenges in Misdemeanor Jury Trials Memo.pdf,Los Angeles County,11/04/2016,2016-11-04,2016.0,general_memo,administrative,"['case_law_update', 'racial_justice']",leans_progressive,1,0,1.0,leans_progressive,medium,"['emphasis on anti-discrimination in jury selection', 'detailed explanation of protected categories', 'alignment with non-discrimination law']","['procedural compliance focus', 'neutral tone regarding law enforcement']",low_impact,neutral,0,0,moderate_impact,neutral,0,0,not_addressed,not_addressed,not_addressed,not_addressed,not_addressed,not_addressed,moderate,John K. Spillane (Chief Deputy),yes,modification,informational,"This administrative memo informs DA personnel about statutory changes reducing peremptory challenges in misdemeanor jury trials from 10 to 6 per side, effective January 1, 2017. The memo also emphasizes expanded anti-discrimination protections in jury selection, detailing numerous protected categories and aligning jury selection practices with broader non-discrimination law. While primarily procedural, the detailed attention to bias prevention and civil rights alignment suggests a moderate progressive orientation toward racial justice and fair trial procedures.","[{'quote': 'a party may not use a peremptory challenge to remove a prospective juror on the basis of an assumption that the prospective juror is biased merely because of his or her perceived race, national origin, ethnic group identification, religion, age, sex, pregnancy, gender identity, gender expression, sexual orientation, color, genetic information, mental disability, physical disability, or similar grounds', 'margin_type': 'intensive_margin', 'relevance': 'Shows attention to anti-discrimination and bias concerns in trial proceedings'}, {'quote': ""the express purpose of the recent amendment to Section 231.5 was to 'align[] existing non-discrimination law with jury selection law'"", 'margin_type': 'intensive_margin', 'relevance': 'Demonstrates alignment with broader civil rights and anti-discrimination principles'}]"
2016.11.09_LA County_General Office Memorandum 16-099.pdf,Los Angeles County,11/09/2016,2016-11-09,2016.0,general_memo,case_law_update,"['charging_decisions', 'sentencing', 'administrative']",neutral,0,0,0.0,neutral,high,"['Implements voter-mandated decriminalization', 'Establishes presumption in favor of defendants for resentencing', 'Emphasizes drug education and counseling over incarceration for juveniles', 'Requires clear and convincing evidence standard for prosecutors to object to petitions']","['Maintains felony charges for repeat offenders and those with serious priors', 'Preserves enhanced penalties for sales to minors', 'Continues prosecution of unlicensed marijuana businesses', 'Maintains public safety exception for resentencing denials']",high_impact,more_lenient,1,0,high_impact,more_lenient,1,0,yes,yes,selective,not_addressed,not_addressed,not_addressed,not_addressed,not_mentioned,yes,clearly_new_policy,mandatory,"This memorandum provides implementation guidance for Proposition 64, California's Adult Use of Marijuana Act, which decriminalized many marijuana offenses. The memo establishes mandatory procedures for transferring reduced cases to city prosecutors, processing resentencing petitions with a presumption favoring defendants, and applying new penalty structures that emphasize education and community service over incarceration, particularly for juveniles. While resulting in more lenient treatment, the changes reflect voter-mandated legal requirements rather than prosecutorial policy choices.","[{'quote': 'The new law creates a presumption that a defendant satisfies the requirements of Health and Safety Code § 11361.8 when he or she submits their petition or application, unless the prosecution can prove otherwise by clear and convincing evidence.', 'margin_type': 'intensive_margin', 'significance': 'Establishes burden on prosecution to oppose resentencing'}, {'quote': ""As a result, pending felony cases where all the charges have been reduced to misdemeanors will be transferred to the appropriate city prosecutor's office unless the Office regularly handles the misdemeanors for that area."", 'margin_type': 'extensive_margin', 'significance': 'Reduces DA office caseload through mandatory transfers'}, {'quote': 'The new law requires drug education, counseling, and community service in lieu of fines or custody time for juvenile offenders.', 'margin_type': 'intensive_margin', 'significance': 'Emphasizes rehabilitation over punishment for juveniles'}]"
2016.11.09_LA County_Special Directive 16-12.pdf,Los Angeles County,11/09/2016,2016-11-09,2016.0,policy_memo,juvenile,"['charging_decisions', 'sentencing', 'case_law_update']",neutral,0,0,0.0,neutral,medium,"['Earlier parole eligibility for non-violent felons', 'Elimination of direct filing for juveniles', 'Consideration of rehabilitation potential in transfer decisions']","['Continued emphasis on filing enhancements', 'Maintains juvenile transfer mechanism', 'Consideration of victim impact in transfer decisions', 'Emphasis on criminal sophistication and gravity of offense']",high_impact,neutral,0,0,moderate_impact,more_lenient,1,0,not_addressed,unclear,maximize,not_addressed,not_addressed,case_by_case,not_addressed,not_mentioned,yes,clearly_new_policy,mandatory,"This directive implements California Proposition 57's requirements by eliminating direct filing of juvenile cases in adult court and establishing new parole eligibility rules for non-violent felons. While juveniles must now start in juvenile court, the office maintains the ability to seek transfers through judicial motions with internal approval processes. The document represents compliance with voter-mandated reforms while preserving prosecutorial discretion and traditional charging practices where legally permissible.","[{'quote': 'deputies are directed to continue to abide by all provisions in the Legal Policies Manual relevant to the handling and settlement of felony cases', 'margin_type': 'intensive_margin', 'significance': 'Maintains traditional approach to enhancements despite parole changes'}, {'quote': 'Effective immediately, only juvenile offices may consider filing charges in cases in which a minor is accused of a crime', 'margin_type': 'extensive_margin', 'significance': 'Eliminates direct adult filing for juveniles'}, {'quote': 'The approval of the Head Deputy of the Juvenile Division is required to authorize a Motion to Transfer', 'margin_type': 'extensive_margin', 'significance': 'Maintains prosecutorial control over juvenile transfers through internal approval process'}]"
2016.11.29_LA County_Special Directive 16-15.pdf,Los Angeles County,11/29/2016,2016-11-29,2016.0,policy_memo,juvenile,"['charging_decisions', 'case_law_update', 'administrative']",leans_progressive,1,0,1.0,leans_progressive,medium,"['Proactively offers juveniles opportunity to move from adult to juvenile court', 'Implements Proposition 57 in a way that maximizes juvenile access to transfer hearings', 'Focuses on rehabilitation potential as a key factor in transfer decisions']","['Deputies instructed to oppose transfer hearings in certain circumstances', 'Maintains option to appeal juvenile court decisions denying transfer to adult court', 'Preserves prosecutorial discretion to seek adult prosecution']",high_impact,more_lenient,1,0,low_impact,not_applicable,0,0,not_addressed,unclear,not_addressed,not_addressed,not_addressed,case_by_case,not_addressed,not_mentioned,yes,clearly_new_policy,mandatory,"This directive implements Proposition 57 by establishing procedures for juveniles previously charged directly in adult court to request transfer hearings to move their cases to juvenile court. The policy takes a generally accommodating approach by proactively offering these hearings to eligible defendants, while maintaining prosecutorial discretion to oppose transfers in certain circumstances and appeal adverse decisions. The directive represents a significant procedural change that could result in more juveniles being prosecuted in the juvenile system rather than adult court, reflecting the rehabilitative focus of Proposition 57.","[{'quote': 'It shall be the policy of the LADA that a defendant who was a minor on the date of the alleged offense and is the subject of a directly filed case in which jeopardy has not yet attached will be provided an opportunity to have the juvenile court determine whether he or she should be transferred to a court of criminal jurisdiction (adult court).', 'margin_type': 'extensive_margin', 'significance': 'Shows proactive approach to offering juveniles pathway out of adult court'}, {'quote': ""Deputies should oppose a juvenile defendant's request for a transfer hearing in cases in which the trial in adult court has occurred, the defendant was convicted, and he or she is awaiting sentencing, or in which the trial has begun."", 'margin_type': 'extensive_margin', 'significance': ""Demonstrates limits on the office's accommodating approach""}, {'quote': ""whether the minor can be rehabilitated prior to the expiration of the juvenile court's jurisdiction"", 'margin_type': 'extensive_margin', 'significance': 'Highlights rehabilitation as key consideration in transfer decisions'}]"
2016.11_Los Angeles County_Prosecutotial Misconduct in Habeas Powerpoint.pdf,Los Angeles County,11/16/2025,2025-11-16,2025.0,training_material,discovery,"['case_law_update', 'prosecutorial_misconduct']",leans_progressive,1,0,1.0,leans_progressive,medium,"['Emphasis on comprehensive Brady disclosure', 'When in doubt, disclose directive', 'Focus on preventing prosecutorial misconduct', 'Acknowledgment that duty continues even after conviction']","['Mention of safety concerns as potential limitation on disclosure', 'Reference to potential privileges that might limit disclosure']",low_impact,neutral,0,0,moderate_impact,more_lenient,1,0,not_addressed,not_addressed,not_addressed,not_addressed,not_addressed,not_addressed,not_addressed,not_mentioned,yes,unclear,strong_guidance,"This training document instructs Los Angeles County prosecutors on preventing prosecutorial misconduct in habeas corpus cases, with primary focus on Brady disclosure obligations. The material emphasizes comprehensive disclosure practices and adopts a 'when in doubt, disclose' approach that prioritizes legal compliance and fairness over prosecutorial advantage. While the document is procedural in nature, its emphasis on extensive disclosure requirements and ongoing post-conviction duties reflects a progressive orientation toward defendant rights and prosecutorial accountability.","[{'quote': 'When in doubt…. Disclose', 'margin_type': 'intensive_margin', 'relevance': 'Shows progressive approach prioritizing defendant rights over prosecutorial advantage'}, {'quote': 'DISCLOSE and DOCUMENT', 'margin_type': 'intensive_margin', 'relevance': 'Emphasizes comprehensive compliance with Brady obligations'}, {'quote': 'Duty continues even after conviction', 'margin_type': 'intensive_margin', 'relevance': 'Demonstrates commitment to ongoing fairness beyond initial prosecution'}]"
2016.12.22_LA County_Reduction of Misdemeanor Cases (Penal Code Sect 18.5(b)) Memo.pdf,Los Angeles County,12/22/2016,2016-12-22,2016.0,policy_memo,sentencing,"['case_law_update', 'administrative']",neutral,0,0,0.0,neutral,high,"['facilitates sentence reductions', 'provides clear process for defendants to obtain relief']","['strictly limits relief to statutory authorization', 'instructs deputies to oppose broader applications', 'maintains prosecutorial opposition to unauthorized relief']",not_applicable,not_applicable,0,0,moderate_impact,more_lenient,1,0,not_addressed,not_addressed,not_addressed,not_addressed,not_addressed,not_addressed,not_addressed,not_mentioned,yes,clearly_new_policy,mandatory,"This administrative memo implements new Penal Code section 18.5(b) allowing defendants to reduce 365-day misdemeanor sentences to 364 days to avoid federal immigration consequences. The memo provides procedural guidance for prosecutors while strictly limiting relief to only what is statutorily authorized. It reflects neutral implementation of a legislative mandate rather than prosecutorial policy preference, facilitating sentence reductions while maintaining traditional limits on relief.","[{'quote': 'Deputies should oppose applications seeking relief other than that expressly authorized in Penal Code section 18.5(b).', 'margin_type': 'intensive', 'significance': 'Shows traditional prosecutorial approach of strictly limiting relief to statutory authorization'}, {'quote': ""effective January 1, 2017, new Penal Code section 18.5, subdivision (b), will permit a court, on the defendant's application, to modify a 365-day misdemeanor sentence to a 364-day sentence"", 'margin_type': 'intensive', 'significance': 'Explains the lenient sentence reduction mechanism being implemented'}, {'quote': 'many defendants facing unexpected consequences because of a prior 365-day sentence may apply for this relief', 'margin_type': 'intensive', 'significance': 'Acknowledges the practical benefit to defendants while remaining neutral in tone'}]"
2017.01.04_LA County_General Office Memorandum 17-001.pdf,Los Angeles County,01/04/2017,2017-01-04,2017.0,general_memo,administrative,['training_material'],unclear,0,0,,unclear,high,[],[],not_applicable,not_applicable,0,0,not_applicable,not_applicable,0,0,not_addressed,not_addressed,not_addressed,not_addressed,not_addressed,not_addressed,not_addressed,not_mentioned,unclear,unclear,mandatory,"This is a routine administrative memorandum announcing mandatory training for winter semester law clerks in Los Angeles County. The document focuses entirely on logistical details including date, time, location, registration requirements, and curriculum topics. While the training covers substantively important areas like Brady compliance and preliminary hearings, the memo provides no insight into the prosecutorial philosophy or policy positions that will be taught during the training sessions.","['The Training Division is pleased to announce a mandatory half-day training for all winter semester law clerks', 'The morning session will include training on: Professionalism, The Criminal Court Process, Motions, Discovery, Brady compliance, Social Media and Confidentiality', 'Law clerks who are not registered in advance will not be admitted']"
